Arquivo,Parágrafo,Número do parágrafo,Pergunta
adenovirus_guia_1txt_guiavsa2023.txt,"Indivíduos que apresentaram PICS após a covid-19 representam um desafio ainda maior para o manejo das condições pós-covid (CDC, 2024c). ` MANEJO CLÍNICO Para a maioria dos pacientes com condições pós-covid, o objetivo do tratamento é melhorar a função e a qualidade de vida.",432,What is the name of the group that presents PICS?
adenovirus_guia_1txt_guiavsa2023.txt,"De forma ideal, os profissionais de saúde devem trabalhar de forma integrada e multidisciplinar para adequar um plano de cuidados completo e individualizado.",433,What is the purpose of a sade plan?
adenovirus_guia_1txt_guiavsa2023.txt,"Para isso, deve-se considerar os sinais e sintomas apresentados, as comorbidades associadas, a saúde mental e os aspectos sociais envolvidos (Brasil, 2023j).",434,What are the three main aspects of social life?
adenovirus_guia_1txt_guiavsa2023.txt,"Sugere-se que a avaliação e o manejo inicial de pessoas com condições pós-covid sejam realizados no âmbito da Atenção Primária à Saúde (APS), pois a maioria dos pacientes se recupera por meio da abordagem integral e abrangente do caso, com ênfase no cuidado longitudinal.",435,What is the name of the APS?
adenovirus_guia_1txt_guiavsa2023.txt,"Entretanto, a integração com serviços multidisciplinares, de reabilitação ou de atenção especializada é recomendada para alguns casos, a depender da complexidade, visando otimizar os recursos disponíveis na Rede de Atenção à Saúde e potencializar a resolução de problemas mais complexos.",436,What is a good way to integrate with other services?
adenovirus_guia_1txt_guiavsa2023.txt,"É necessário realizar avaliação clínica individualizada na APS para um compartilhamento do cuidado assertivo e seguro, com base nos fluxos de referência e contrarreferência, conforme protocolos da regulação local, bem como da disponibilidade de recursos disponíveis em cada município ou região (Brasil, 2022k). ` DADOS SOBRE CONDIÇÕES PÓS-COVID Apesar de haver muita informação disponível na literatura, o entendimento científico sobre o assunto ainda é limitado e precisa progredir, especialmente quando se trata da compreensão da fisiopatologia e da frequência das condições pós-covid.",437,What is the APS's purpose?
adenovirus_guia_1txt_guiavsa2023.txt,"Os estudos publicados sobre a prevalência das condições pós-covid são muito diferentes entre si, variando a depender da abordagem utilizada ou da população estudada.",438,What is the main difference between the estudos published?
adenovirus_guia_1txt_guiavsa2023.txt,Os resultados mostraram que a prevalência desses sintomas variou significativamente ao longo do tempo.,440,What is the most important factor in determining the prevalence of sintomas?
adenovirus_guia_1txt_guiavsa2023.txt,"Das referências triadas, 3 estudos atenderam aos critérios de inclusão.",442,What is the name of the study that focuses on inclusion?
adenovirus_guia_1txt_guiavsa2023.txt,"O estudo de Laskovski et al. (2023) considerou como condições pós-covid os seguintes sinais e sintomas: perda de memória, melancolia, anosmia, dor no corpo, ageusia, dor de cabeça, tosse e limitações funcionais.",443,What did Laskovski and others consider as condiçes pós-covid?
adenovirus_guia_1txt_guiavsa2023.txt,"Visconti et al. (2022) avaliou as condições de saúde pós-covid a partir da presença de dispneia, fadiga, mialgia, fraqueza muscular, artralgia, ansiedade, dor no peito, dor de cabeça e tosse.",444,What was the name of the group that avaliou as condiçes de sade pós-covid?
adenovirus_guia_1txt_guiavsa2023.txt,"Para Nakayama et al. (2022), as condições foram classificadas em musculares, hematológicas, dermatológicas, renais, neuropsiquiátricas e sequelas pulmonares.",445,What is the classification of musculares?
adenovirus_guia_1txt_guiavsa2023.txt,"Dois estudos apresentaram uma incidência geral das condições pós-covid e, em ambos, mais de 40% da amostra investigada apresentou alguma condição (Laskovski et al., 2023; Visconti et al., 2022).",446,What percentage of the amostra investigada apresentou alguma condiço?
adenovirus_guia_1txt_guiavsa2023.txt,Obesidade e ser do sexo feminino foram considerados como principais fatores de risco.,447,What are the two main factors that cause risk?
adenovirus_guia_1txt_guiavsa2023.txt,"Os sintomas mais comumente descritos para caracterizar as condições pós-covid foram dispneia, fadiga e tosse.",448,What are the sintomas most comumente descritos para caracterizar as condiçes pós-covid?
adenovirus_guia_1txt_guiavsa2023.txt,"Ressalta-se que pesquisas científicas e inquéritos de base populacional estão sendo desenvolvidos e financiadas pelo MS em parceria com outras instituições e universidades no Brasil, a fim de entender melhor a gama de sinais e sintomas, os fatores de risco, bem como a frequência e a duração das condições pós-covid.",449,What is the main reason for the increase in the number of scientists in Brazil?
adenovirus_guia_1txt_guiavsa2023.txt,"No cenário atual, em que a covid-19 já não é mais uma Emergência de Saúde Pública de Importância Internacional (Espii) e tornou-se um problema de saúde estabelecido, devido à contínua circulação do SARS-CoV-2 no Brasil e no mundo, o MS segue acompanhando ativamente as evidências científicas relacionadas à doença.",450,What is the covid-19?
adenovirus_guia_1txt_guiavsa2023.txt,Isso inclui desde a transmissão e fase aguda até o acompanhamento das condições pós-covid.,451,What does the aguda include?
adenovirus_guia_1txt_guiavsa2023.txt,"GUIA DE VIGILÂNCIA INTEGRADA DA COVID-19, INFLUENZA E OUTROS ` MEDIDAS DE PREVENÇÃO E CONTROLE A melhor maneira de prevenir as ""condições pós-covid"" é proteger-se de contrair a infecção pelo SARS-CoV-2.",452,What is the name of the virus that is infected by SARS-CoV-2?
adenovirus_guia_1txt_guiavsa2023.txt,"As medidas não farmacológicas (higiene adequada das mãos, etiqueta respiratória, ventilação adequada de ambientes, evitar contato com casos positivos e uso de máscara em situações específicas) (Brasil, 2023f) ainda são importantes ferramentas para evitar a doença.",453,What are the medidas no farmacológicas?
adenovirus_guia_1txt_guiavsa2023.txt,Indivíduos não vacinados contra a covid-19 e que são infectados pelo SARS-CoV-2 podem apresentar maior risco de desenvolver condições pós-covid em comparação com aqueles que receberam a vacina.,454,What is the risk of SARS-CoV-2 being infected?
adenovirus_guia_1txt_guiavsa2023.txt,"Portanto é crucial fortalecer as estratégias e as ações de vacinação contra a covid-19, incluindo as doses de reforço.",455,What is the importance of portanto?
adenovirus_guia_1txt_guiavsa2023.txt,"A vacina está disponível no SUS para todas as pessoas com mais de 6 meses de idade (Brasil, 2024). 2.11 SÍNDROME INFLAMATÓRIA MULTISSISTÊMICA ASSOCIADA À COVID-19 2.11.1 SÍNDROME INFLAMATÓRIA MULTISSISTÊMICA PEDIÁTRICA (SIM-P) A SIM-P associada à covid-19 é uma complicação associada à doença que pode ocorrer em crianças e adolescentes (idade de 0 a 19 anos).",456,What is the name of the vacina?
adenovirus_guia_1txt_guiavsa2023.txt,"É caracterizada por uma resposta inflamatória tardia e exacerbada, geralmente de 4 a 6 semanas após o contato com o vírus.",457,What is the symptom of inflammation?
adenovirus_guia_1txt_guiavsa2023.txt,A temporalidade entre a exposição ao SARS-CoV-2 e o desenvolvimento da SIM-P ainda não está clara (Brasil 2022c).,458,What is the time difference between the SARS-CoV-2 and the SIM-P?
adenovirus_guia_1txt_guiavsa2023.txt,"A SIM-P é uma condição rara, porém grave, e a maioria dos casos necessita de internação em UTI e pode evoluir para óbito.",459,What is the SIM-P?
adenovirus_guia_1txt_guiavsa2023.txt,"A apresentação clínica é heterogênea, e os sintomas reportados na literatura incluem: febre alta e persistente, cefaleia, náuseas, vômitos, dor abdominal, rash cutâneo, conjuntivite não purulenta, disfunções cardíacas, hipotensão arterial e choque, além de elevação dos marcadores de atividade inflamatória.",460,What are some of the sintomas reported in literatura?
adenovirus_guia_1txt_guiavsa2023.txt,"Os casos mais graves podem apresentar choque com necessidade de suporte hemodinâmico e, algumas vezes, podem evoluir para óbito.",461,What is the cause of choque?
adenovirus_guia_1txt_guiavsa2023.txt,"Os sintomas respiratórios nem sempre estão presentes (Brasil, 2021d).",462,What is the current state of respiration?
adenovirus_guia_1txt_guiavsa2023.txt,"Desde 13 de maio de 2022, a SIM-P integrou a Lista Nacional de Notificação Compulsória de doenças, agravos e eventos de saúde pública, nos serviços de saúde públicos e privados em todo o território nacional, por meio da Portaria GM/MS n.º 1.102 (Brasil, 2022e). ` DEFINIÇÕES DE CASO Indivíduos de 0 a 19 anos que apresentaram, na admissão hospitalar ou durante a evolução clínica: febre elevada com aumento dos parâmetros das provas de atividade inflamatória (velocidade de hemossedimentação – VHS, proteína C Reativa – PCR, ou outros) associados a 2 ou mais sinais ou sintomas sugestivos de SIM-P: alterações de pele ou mucosas (conjuntivite bilateral não purulenta, rash cutâneo ou edema de mãos e pés); e/ou sintomas gastrointestinais (dor abdominal, vômito, diarreia); e/ou sinais de hipotensão ou choque; e/ou sinais clínicos de miocardite ou insuficiência cardíaca (taquicardia, precórdio hiperdinâmico, ritmo de galope, estertores pulmonares, edema de membros inferiores, turgência jugular, hepatoesplenomegalia); e/ou sintomas neurológicos (cefaleia, letargia, estado mental alterado).",463,What is the definition of a sintomas sugestivos?
adenovirus_guia_1txt_guiavsa2023.txt,"A suspeita de SIM-P é reforçada quando o hemograma completo apresenta neutrofilia, linfopenia e/ou plaquetopenia (Brasil, 2022c).",464,What is the suspeita of SIM-P?
adenovirus_guia_1txt_guiavsa2023.txt,"Caso suspeito que apresentou (Brasil, 2022c): Febre elevada (>38oC) e persistente (>3 dias).",465,What is the temperature of the feces?
adenovirus_guia_1txt_guiavsa2023.txt,"Marcadores de inflamação elevados (VHS, PCR ou procalcitonina, entre outros).",466,What are some examples of elevated inflammation?
adenovirus_guia_1txt_guiavsa2023.txt,Pelo menos 2 dos seguintes sinais e/ou sintomas: 1.,467,What is the number of sinais?
adenovirus_guia_1txt_guiavsa2023.txt,"Conjuntivite não purulenta ou lesão cutânea bilateral ou sinais de inflamação mucocutânea (oral, mãos ou pés). 2.",468,What is the definition of conjuntivite?
adenovirus_guia_1txt_guiavsa2023.txt,"Manifestações gastrointestinais agudas (diarreia, vômito ou dor abdominal). 3.",469,What are the three Manifestaçes gastrointestinais agudas?
adenovirus_guia_1txt_guiavsa2023.txt,"Manifestações de disfunção miocárdica, pericardite, valvulite ou anormalidades coronarianas confirmadas pelo ecocardiograma ou elevação de troponina, ou N-terminal do peptídeo natriurético tipo B (NT-proBNP); 5.",471,What are some of the symptoms of disfunction?
adenovirus_guia_1txt_guiavsa2023.txt,"Evidência de coagulopatia (por TP, TTPa ou D-dímero elevados); Evidência da covid-19 por RT-PCR, teste antigênico ou sorologia IgM e/ou IgG reagente ou história de contato com caso confirmado de covid-19 nos últimos 60 dias.",472,What is the name of the test that confirms the presence of covid-19?
adenovirus_guia_1txt_guiavsa2023.txt,"Afastadas quaisquer outras causas de origem infecciosa e inflamatória, incluindo sepse bacteriana, síndromes de choque estafilocócico ou estreptocócico.",473,What are some of the causes of infection?
adenovirus_guia_1txt_guiavsa2023.txt,Comentários adicionais: • Podem ser incluídas crianças e adolescentes que preencherem os critérios completos ou parciais para a síndrome de Kawasaki ou síndrome do choque tóxico. • Os profissionais de saúde devem considerar a possibilidade de SIM-P em qualquer morte pediátrica característica com evidência de infecção por SARS-CoV-2.,474,What are the adolescentes that preencherem os critérios completos?
adenovirus_guia_1txt_guiavsa2023.txt,ATUALIZAÇÃO: deve-se considerar a temporalidade de 60 dias a partir do contato com o vírus até a data do início dos sintomas de SIM-P para confirmação do caso.,475,What is the time limit for a SIM-P contato?
adenovirus_guia_1txt_guiavsa2023.txt,"GUIA DE VIGILÂNCIA INTEGRADA DA COVID-19, INFLUENZA E OUTROS Figura 8.",476,What is the name of the book that was published in the year 19?
adenovirus_guia_1txt_guiavsa2023.txt,"Definição de caso confirmado de SIM-P associada à covid-19 Febre (≥38ºC) Indivíduos ≤19 anos persistente (≥3 dias) 2 ou + sinais e • Conjuntivite não purulenta bilateral ou sinais de inflamação muco-cutânea ou erupção cutânea (oral, mãos e pés); • Hipotensão ou choque; • Manifestações de disfunção miocárdica, pericardite, valvulite ou anormalidades coronárias; • Evidência de coagulopatia; • Manifestações gastrointestinais agudas.",477,What is the name of the SIM-P?
adenovirus_guia_1txt_guiavsa2023.txt,"Marcadores de Evidência de covid-19 ou Afastadas outras Fonte: Brasil, 2021d.",478,What is the name of the Brazilian artist who is a covid-19 observer?
adenovirus_guia_1txt_guiavsa2023.txt,"Por ter uma apresentação clínica bastante variável, o grau de suspeição diagnóstica na SIM-P deve ser alto, visando à prevenção da evolução para complicações graves, como o choque cardiogênico e as alterações coronarianas (Son; Fredman, 2023).",479,What is the grau of suspeiço diagnóstica na SIM-P?
adenovirus_guia_1txt_guiavsa2023.txt,"SIM-P LEVE Crianças e adolescentes com febre por período igual ou maior que 3 dias, sinais vitais normais e exame físico tranquilizador, apenas leve envolvimento gastrointestinal e cardíaco e resolução ainda na fase aguda (Son; Fredman, 2023).",480,What is the name of the program that is offered to adolescents and young people?
adenovirus_guia_1txt_guiavsa2023.txt,"SIM-P MODERADA A GRAVE Crianças e adolescentes com sintomas e sinais de envolvimento mucocutâneo, gastrointestinal, menos comumente choque ou disfunção miocárdica, e que apresentaram resolução intra-hospitalar são considerados casos moderados.",481,What is the definition of a moderado?
adenovirus_guia_1txt_guiavsa2023.txt,"Aqueles com comprometimento respiratório, choque, envolvimento gastrointestinal mais grave, mucocutâneo e cardíaco (disfunção ventricular esquerda; alterações coronarianas, como dilatações e/ou aneurismas; arritmias; elevação do proBNP e/ou troponina) e que apresentaram sequelas após a alta hospitalar são considerados casos graves. moderados a graves (Son; Fredman, 2023). 2.11.2 SÍNDROME INFLAMATÓRIA MULTISSISTÊMICA EM ADULTO (SIM-A) A SIM-A é definida como uma complicação inflamatória posterior ao quadro de infecção viral e pode ser potencialmente fatal, com acometimento multissistêmico associado a disfunções orgânicas.",482,What is the SIM-A?
adenovirus_guia_1txt_guiavsa2023.txt,"A SIM-A é caracterizada por um amplo espectro de sinais e sintomas, incluindo alterações cardiovasculares, gastrointestinais, dermatológicas e neurológicas.",483,What is the SIM-A characterized by?
adenovirus_guia_1txt_guiavsa2023.txt,"Diferentemente da covid-19 grave, a SIM-A possui acometimento sistêmico extrapulmonar e ausência de problemas respiratórios graves.",484,What is the SIM-A's main purpose?
adenovirus_guia_1txt_guiavsa2023.txt,"Os dados de SIM-A são escassos, mas a literatura tem apontado que adultos com a síndrome apresentam maior risco de envolvimento cardíaco e fenômenos tromboembólicos que crianças, além de sintomas gastrointestinais (Brasil, 2022l).",485,What is the risk of envolvimento cardaco?
adenovirus_guia_1txt_guiavsa2023.txt,"Desde 13 de maio de 2022, a SIM-A integrou a Lista Nacional de Notificação Compulsória de doenças, agravos e eventos de saúde pública, nos serviços de saúde públicos e privados em todo o território nacional, por meio da Portaria GM/MS n.º 1.102 (Brasil, 2022e). ` DEFINIÇÕES DE CASO CASO SUSPEITO DE SIM-A Indivíduos adultos (com 20 anos ou mais), fora da faixa etária preconizada pela OMS para definição de SIM-P, com critérios para internação hospitalar ou com doença resultante em óbito, que teve confirmação de covid-19 ou contato próximo com um caso de covid-19 nas últimas 12 semanas e que atenda aos seguintes critérios: Febre por 3 dias ou mais.",486,What is the definition of SIM-P?
adenovirus_guia_1txt_guiavsa2023.txt,Alterações de 2 ou mais dos sistemas: 1.,487,What are the options of 2 or more systems?
adenovirus_guia_1txt_guiavsa2023.txt,"Dermatológico/mucocutâneo: rash cutâneo, erupção cutânea, eritema ou descamação dos lábios/ boca/faringe, conjuntivite não exsudativa bilateral, eritema/edema das mãos e pés. 2.",488,What is a rash cutâneo?
adenovirus_guia_1txt_guiavsa2023.txt,"Gastrointestinal: dor abdominal, vômitos, diarreia. 3.",489,What is the name of the gastrointestinal system?
adenovirus_guia_1txt_guiavsa2023.txt,"Neurológico: estado mental alterado, dor de cabeça, fraqueza, parestesias, letargia.",490,What is the term for a mental altrado?
adenovirus_guia_1txt_guiavsa2023.txt,"GUIA DE VIGILÂNCIA INTEGRADA DA COVID-19, INFLUENZA E OUTROS 5.",491,What is the name of the project?
adenovirus_guia_1txt_guiavsa2023.txt,"Cardiovascular: sinais clínicos de miocardite, pericardite e/ou insuficiência cardíaca (taquicardia, precórdio hiperdinâmico, ritmo de galope, estertores pulmonares, edema de membros inferiores, turgência jugular e/ou hepatoesplenomegalia).",492,What are the three types of insuficiência cardaca?
adenovirus_guia_1txt_guiavsa2023.txt,"Evidência laboratorial de inflamação, incluindo qualquer um dos seguintes: aumento de PCR, VHS ou ferritina.",493,What is an example of a laboratorial inflamaço?
adenovirus_guia_1txt_guiavsa2023.txt,"Definição de caso suspeito de SIM-A Febre ≥3 dias 2 ou mais dos sistemas • Dermatológico/mucocutâneo: rash cutâneo, erupção cutânea, eritema ou descamação dos lábios/boca/faringe, conjuntivite não exsudativa bilateral, eritema/edema das mãos e pés; • Gastrointestinal: dor abdominal, vômitos, diarreia; • Hemodinâmico: choque/hipotensão; • Neurológico: estado mental alterado, dor de cabeça, fraqueza, parestesias, letargia; • Cardiovascular: sinais clínicos de miocardite, pericardite e/ou insuficiência cardíaca (taquicardia, precórdio hiperdinâmico, ritmo de galope, estertores pulmonares, edema de membros inferiores, turgência jugular e/ou hepatoesplenomegalia).",494,What is the definition of a case of rash cutâneo?
adenovirus_guia_1txt_guiavsa2023.txt,"Evidência laboratorial de inflamação: Aumento de PCR, VHS ou ferritina Fonte: Brasil, 2022l.",495,"What is the name of the PCR, VHS, or ferritina?"
adenovirus_guia_1txt_guiavsa2023.txt,"CASO CONFIRMADO PARA SIM-A • Caso suspeito que apresentou hospitalização por mais de 24 horas e pelo menos 2 dos seguintes sinais de doença ativa (Brasil, 2022l): » brain natriuretic peptide (BNP) ou N-terminal brain natriuretic peptide (NT-proBNP) ou troponina elevados; » hemograma evidenciando neutrofilia, linfopenia e/ou plaquetopenia (<150.000); » evidência de envolvimento cardíaco pelo ecocardiograma ou por ressonância magnética cardíaca; » eletrocardiograma evidenciando alterações sugestivas de miocardite e/ou pericardite; » rash cutâneo e/ou conjuntivite não purulenta.",496,What is the name of the peptide that causes a patient to be hospitalized?
adenovirus_guia_1txt_guiavsa2023.txt,"Caso suspeito que preenche critérios parciais de caso confirmado, sem outro diagnóstico que justifique o quadro clínico (Brasil, 2022l).",497,What is the reason for the quadro clnico?
adenovirus_guia_1txt_guiavsa2023.txt,"CASO DESCARTADO DE SIM-A clínico (exemplos: sepse bacteriana, síndrome do choque tóxico estafilococo ou estreptococo, doenças autoimunes, outras doenças virais, entre outros) (Brasil, 2022l). ` EXAMES ESPECÍFICOS PARA DETECÇÃO DE COVID-19 NOS CASOS SUSPEITOS DE SIM-P E SIM-A Em muitos casos, os indivíduos com SIM-P apresentam RT-qPCR ou teste de antígeno para SARS-CoV-2 não detectável, e a evidência de covid-19 é documentada pela presença de anticorpos na investigação sorológica, o que corrobora a hipótese de uma condição tardia.",498,What is the name of the clnico CASO DESCARTADO DE SIM-A?
adenovirus_guia_1txt_guiavsa2023.txt,"Preconiza-se para os casos suspeitos de SIM-P a coleta de amostras para a realização da RT-qPCR para SARS-CoV-2, caso o exame não tenha sido realizado em momento anterior, bem como amostras de sangue/soro para a realização da sorologia quantitativa para covid-19 IgG e IgM.",499,What is the purpose of the RT-qPCR?
adenovirus_guia_1txt_guiavsa2023.txt,"A coleta da sorologia quantitativa é recomendada para todos os casos suspeitos, que ainda não receberam a vacina contra a covid-19.",500,What is the recommended coleta?
adenovirus_guia_1txt_guiavsa2023.txt,"Para aqueles que foram vacinados, tendo em vista a resposta imunológica com produção de anticorpos nesses indivíduos, deve-se levar em consideração o status vacinal para interpretação do resultado da sorologia.",501,What is the status of vacinados?
adenovirus_guia_1txt_guiavsa2023.txt,"Para os casos de SIM-P e SIM-A que receberam a vacina de RNA mensageiro (Pfizer) ou vacina de vetor viral (AstraZeneca ou Janssen), está indicada a realização da sorologia antinucleocapsídeo (anti-NP), pois as vacinas de RNA mensageiro ou vetor viral induzem resposta imunológica associada à proteína Spike (proteína S), e um resultado positivo da sorologia anti-NP para indivíduos que SARS-CoV-2, já que as referidas vacinas não aumentam a produção da proteína do nucleocapsídeo.",502,What is the name of the drug that is used to treat a viral infection?
adenovirus_guia_1txt_guiavsa2023.txt,"Para os indivíduos que receberam qualquer dose de vacina de vírus inativado (Coronavac), devem-se considerar outros aspectos para encerramento do caso, como: vínculo epidemiológico e história prévia de quadro compatível com covid-19.",503,What are some aspects of coronavac?
adenovirus_guia_1txt_guiavsa2023.txt,"Dessa forma, a investigação no âmbito da vigilância é de extrema importância nesses casos (Brasil, 2021d).",504,What is the impact of the investigation on the case?
adenovirus_guia_1txt_guiavsa2023.txt,"GUIA DE VIGILÂNCIA INTEGRADA DA COVID-19, INFLUENZA E OUTROS 2.11.3 VIGILÂNCIA EPIDEMIOLÓGICA DA SIM-P E SIM-A ` NOTIFICAÇÃO E REGISTRO A notificação individual tanto da SIM-P quanto da SIM-A deve ser realizada de forma universal, ou seja, sintomas sugestivos da síndrome, conforme a definição de caso suspeito, por meio do preenchimento do formulário on-line, para SIM-P e SIM-A, respectivamente: https://redcap.link/simpcovid e https:// redcap.link/sima_covid.",505,What is the name of the GUIA DE VIGILNCIA INTEGRADA DA COVID-19?
adenovirus_guia_1txt_guiavsa2023.txt,"Na impossibilidade de notificação da SIM-P e SIM-A pela unidade de saúde notificadora diretamente no formulário on-line, este deverá ser impresso, preenchido e enviado ao serviço de vigilância epidemiológica da região ou da SMS de referência.",506,What is the cost of notificating a SIM-P or SIM-A?
adenovirus_guia_1txt_guiavsa2023.txt,"Por se tratar de doenças de notificação compulsória, a partir da identificação dos casos suspeitos, a notificação no formulário, ou o repasse das informações, ao serviço de vigilância epidemiológica de referência para digitação do caso deverá ser realizada em até 24 horas (Brasil, 2022e).",508,What is the name of the service that can be used to notific a compulsory case?
adenovirus_guia_1txt_guiavsa2023.txt,A notificação individual da SIM-P e SIM-A pelo serviço de saúde inclui a realização periódica de busca ativa de indivíduos hospitalizados que preencham a definição de caso suspeito.,509,What is the name of the service that allows you to make a busca ativa?
adenovirus_guia_1txt_guiavsa2023.txt,"As informações de coleta de exames, investigação clínico-laboratorial e acompanhamento das atualizações acerca dos casos que deverão ser repassadas ao serviço de vigilância também deverão ser incluídas na notificação, e não somente o registro dela.",510,What information is included in a notificaço?
adenovirus_guia_1txt_guiavsa2023.txt,"Cabem às unidades notificantes revisar periodicamente os registros de saúde disponíveis para identificação de dados referentes à evolução do caso e incluir, se necessário, novos resultados laboratoriais, tratamento instituído, informações sobre alta hospitalar ou óbito, transferência de hospital, entre outros.",511,What are some of the things that are included in the registries?
adenovirus_guia_1txt_guiavsa2023.txt,Os novos dados revisados deverão ser informados ao serviço de vigilância de referência.,512,What do novos dados revisados devero ser informados to?
adenovirus_guia_1txt_guiavsa2023.txt,"Por se tratar de doenças recentes e com amplo espectro clínico, além de uma gama de diagnósticos diferenciais a serem considerados, sugere-se que os casos notificados sejam investigados e discutidos pela vigilância em conjunto com a equipe de saúde que prestou assistência a esse indivíduo.",513,What is the reason for the different types of cases notificados?
