Arquivo,Parágrafo,Número do parágrafo,Pergunta
hantavirose_manual_1.txt,Figura 4 - Efeito Bumerangue I Ilustração cedida por Constâncio de Carvalho Neto. colônia.,515,What is the name of the figure?
hantavirose_manual_1.txt,"Mas, também digamos que essa intervenção tenha sido mal planejada e/ou mal executada, de forma errada ou incompleta, de tal sorte que o objetivo de controle pela eliminação da maioria dos ratos ali existentes não seja atingido.",516,What is the objetivo de controle pela eliminaço da maioria dos ratos ali existentes?
hantavirose_manual_1.txt,"Digamos então que apenas quatro dos 10 ratos existentes tenham sido eliminados, restando seis adultos sobreviventes.",517,What are the 10 ratos that have been eliminated?
hantavirose_manual_1.txt,"A partir desse instante, começará a haver uma “sobra” de alimento, representada pelas porções dos quatro ratos eliminados.",518,What is the name of the food that is represented by the number of ratos eliminated?
hantavirose_manual_1.txt,"Esse será o sinal de partida que desencadeará uma série de mecanismos biológicos inversos aos que vinham limitando o crescimento excessivo da colônia, com o objetivo de preservar a espécie.",519,What is the sinal of partida?
hantavirose_manual_1.txt,"As fêmeas entrarão em cio que será fértil e prolífero, os recém-nascidos não serão canibalizados, desenvolvendo- se normalmente.",520,"Os recém-nascidos no sero canibalizados, desenvolvendo- se normalmente."
hantavirose_manual_1.txt,FUNASA - dezembro/2002 - pág. 74 Figura 5 - Efeito Bumerangue II Ilustração cedida por Constâncio de Carvalho Neto.,521,What is the name of the figure?
hantavirose_manual_1.txt,"Voltando ao nosso exemplo, suponha então que 20 filhotes tenham nascido em função desse novo fenômeno.",522,What is the name of the fenômeno?
hantavirose_manual_1.txt,"Após o desmame, e durante curto prazo de tempo, esses filhotes vão desenvolver-se às custas daquelas quatro porções de alimento que estavam sobrando.",523,What do filhotes do to their custas?
hantavirose_manual_1.txt,"Todavia, essa situação não pode perdurar por muito tempo, pois as necessidades alimentares de cada um desses 20 filhotes crescem à medida que eles tornam-se maiores.",524,What is the main reason that the food needs of the population increase?
hantavirose_manual_1.txt,"Chega um determinado momento onde, para garantir sua sobrevivência, esses filhotes entram em disputa física pela posse definitiva de uma das quatro vagas disponíveis com direito a alimento.",525,What is the time of the dispute?
hantavirose_manual_1.txt,Apenas os quatro filhotes melhores dotados fisicamente vencerão essa competição.,526,What is the name of the company that makes the most money?
hantavirose_manual_1.txt,A colônia então estará refeita com 10 membros: os seis adultos originais mais os quatro filhotes vencedores.,527,What is the age of the colônia?
hantavirose_manual_1.txt,"A partir desse instante, os 16 filhotes de nosso exemplo que não conseguiram as vagas disponíveis, passarão a representar uma séria ameaçaà colônia, pois disputarão o restrito alimento disponível no território.",528,What is the name of the food that is not available on the território?
hantavirose_manual_1.txt,"Como instinto de auto- defesa, a colônia, unida, parte para tentar eliminar esse novo risco atacando aqueles filhotes.",529,What is the risk of a car being attacked by filhotes?
hantavirose_manual_1.txt,"Estes, menores em tamanho e força, não poderão sustentar luta pela posse do território e, sob risco de serem mortos, fogem do território onde nasceram e vão localizar-se em áreas vizinhas e contíguas, onde formarão novas colônias.",530,What is the risk of mortos?
hantavirose_manual_1.txt,"Se algum tempo depois voltarmos a essa área, encontrar-se-ão, para surpresa, não mais os 10 ratos que nos preocupavam tanto, mas 26 deles (10 da colônia original e mais os novos 16 distribuídos em colônias vizinhas, igualmente reguladas pela disponibilidade de alimento).",531,What is the number of ratos that are not in the original area?
hantavirose_manual_1.txt,Figura 6 - Efeito Bumerangue III Ilustração cedida por Constâncio de Carvalho Neto.,532,What is the name of the figure?
hantavirose_manual_1.txt,FUNASA - dezembro/2002 - pág. 75 O efeito bumerangue é um fenômeno biológico bem mais freqüente e comum do que se imagina e seus fundamentos devem ser evitados a todo custo.,533,What is the name of the biologico that is more freqüente?
hantavirose_manual_1.txt,"Em outras palavras, a intervenção humana em áreas infestadas por roedores tem, necessariamente, que ser decisiva, completa, abrangente e continuada.",534,What is the need for human intervention in a palavra?
hantavirose_manual_1.txt,Uma intervenção errônea pode causar efeitos desastrosos e somente conduzirão a situações futuras de difícil e onerosa solução. 4.3 Técnicas de controle 4.3.1.,535,What can cause efeitos desastrosos?
hantavirose_manual_1.txt,"As armadilhas Empregadas desde que o homem tornou-se caçador, as armadilhas são as mais engenhosas e variadas quanto são seus inventores.",537,What are the armadilhas that are the most engenhosas and variadas?
hantavirose_manual_1.txt,Há uma infinidade literalmente ilimitada de tipos e conceitos.,538,What is the limit of the number of ideas and concepts?
hantavirose_manual_1.txt,Há aquelas que capturam os roedores vivos (incruentas) e há as que produzem sua morte no ato de captura (cruentas).,539,What is the name of the animal that has been capturated?
hantavirose_manual_1.txt,"Dentre estas últimas, a mais difundida em todo o mundo é a popular ratoeira “quebra-costas” cujas origens remontam a épocas medievais.",540,What is the popular ratoeira?
hantavirose_manual_1.txt,"Foto 56 - Ratoeira quebra-costas Um sistema de mola espiral preso a uma forte haste retangular e um sensível mecanismo de disparo, captura e artefato.",541,What is the system of mola espiral preso?
hantavirose_manual_1.txt,"De ótimos resultados contra camundongos, esse tipo de ratoeira tem resultados apenas razoáveis quando empregadas contra a ratazana ou contra o rato de telhado, devido à neofobia que caracteriza estas duas espécies.",542,What is the result of ratoeira?
hantavirose_manual_1.txt,"Os melhores resultados, quando do emprego de ratoeiras no combate aos roedores, são obtidos quando: 1.",543,What are the melhores resultados?
hantavirose_manual_1.txt,Empregam-se muitas ratoeiras de uma só vez ao invés de poucas ratoeiras muitas vezes; 2.,544,How many times do you empregam-se muitas ratoeiras?
hantavirose_manual_1.txt,"Dispõem-se os artefatos ao longo das trilhas dos roedores, previamente localizadas, perpendicular a uma superfície vertical; 3.",545,What are the artefatos?
hantavirose_manual_1.txt,"Elas são mantidas sem tocar, na mesma posição durante pelo menos uma semana; 4.",546,What is the possiblity of the tocar?
hantavirose_manual_1.txt,"Lavamos cuidadosamente com água, sabão e escova, as ratoeiras que foram bem-sucedidas (cid:0)(cid:16)às vezes é preciso expô-las à vassoura de fogo (equipamento específico utilizado para desinfestação mecânica de determinado local).",547,What is the name of the equipment used to desinfest a mecânica?
hantavirose_manual_1.txt,"O objetivo é tentar eliminar completamente os resquícios da urina eventualmente deixada pelo roedor em agonia sobre o artefato que o capturou, possivelmente contendo algum feromônio específico para perigo, capaz de alertar os demais roedores da colônia, inviabilizando por completo novas capturas.",548,O objetivo é tentar eliminar completamente os resqucios da urina?
hantavirose_manual_1.txt,"Outro tipo de armadilha cruenta que tem sido utilizada modernamente, é a armadilha colante.",549,What is the armadilha colante?
hantavirose_manual_1.txt,"Sobre uma placa de dimensões variadas, é aplicado um filme de cola especial que mantém-se pegajosa durante algumas semanas, mesmo FUNASA - dezembro/2002 - pág. 76 exposta ao ambiente.",550,What is the name of the film that is used to show cola?
hantavirose_manual_1.txt,Essas placas devem ser dispostas necessariamente ao longo dos trajetos e trilhas dos roedores infestantes para que possam capturar um deles assim que tocadas.,551,What do the placas need to be long to be able to be used?
hantavirose_manual_1.txt,"Apresentam bons resultados contra os M. musculus, animais sabidamente curiosos (neofilia) e nem tanto contra as espécies sinantrópicas comensais maiores, reconhecidamente desconfiadas (neofobia).",552,What is the name of the musculus that is sabidly curiosos?
hantavirose_manual_1.txt,"Tem sido criticada de forma crescente por entidades ambientalistas e protetoras de animais em todo o mundo, devido à agonia lenta e dolorosa que provocam nos animais capturados.",553,What is the name of the group that criticizes the tem?
hantavirose_manual_1.txt,"Estes, no afã de escapar, chegam inclusive a amputar o membro que estiver colado à armadilha.",554,What is the name of the armadilha?
hantavirose_manual_1.txt,Foto 57 - Diversos tipos de armadilhas: 1) Ratoeira de madeira; 2) Chauvancy; 3) Shermann; 4) Quebra-costas Fotos cedidas por Alzira Paiva de Almeida.,555,What is the name of the photo taken by Alzira Paiva?
hantavirose_manual_1.txt,"Para fins de diferentes estudos sobre os roedores, são empregadas armadilhas incruentas, geralmente do tipo gaiola, capazes de capturá-los sem lhes causar maiores danos físicos.",556,What is a common theme in estudos about roedores?
hantavirose_manual_1.txt,Na maioria das vezes seu mecanismo de disparo é acionado por uma isca que possa interessar à espécie.,557,What is the mechanism of disparo?
hantavirose_manual_1.txt,"Como o animal capturado fica exposto à observação dos demais membros da colônia, seus resultados são baixos, situando-se em torno de 10% a 20 % das armadilhas colocadas numa dada área.",558,What percentage of armadilhas colocadas are in the dada área?
hantavirose_manual_1.txt,Foto 58 - Gaiola para captura de roedores Foto cedida por Minekazu Matsuo.,559,What is the name of the photographer who took the photo?
hantavirose_manual_1.txt,FUNASA - dezembro/2002 - pág. 77 4.3.1.2.,560,What is the name of the pág. 77?
hantavirose_manual_1.txt,"O ultra-som Os roedores em geral estão capacitados a ouvir (e a produzir) sons de freqüência altíssima, entre 10 e 20.000 hertz; os homens não.",561,What is the freqüencia of ultra-som?
hantavirose_manual_1.txt,"Partindo desse princípio, surgiram os dispositivos ultra-sônicos para combate aos roedores sinantrópicos que, se empregados numa dada área infestada onde houvesse a presença também de pessoas, só afetariam os roedores.",562,What do roedores sinantrópicos afetariam?
hantavirose_manual_1.txt,"Estes, fortemente incomodados com os agudíssimos sons produzidos pelos dispositivos, buscariam outras áreas para estabelecer suas colônias, abandonando aquelas onde o ultra-som estaria sendo empregado.",563,What is the name of the agudssimos that are produced on the internet?
hantavirose_manual_1.txt,"É, portanto, um dispositivo destinado apenas a afugentar os roedores e não destinado a eliminá-los, como tem sido apregoado.",564,What is a portanto?
hantavirose_manual_1.txt,"Esses dispositivos ultra-sônicos exibem resultados em certos tipos de áreas e sob certas condições, ainda que limitados em alcance.",565,What are ultra-sônicos?
hantavirose_manual_1.txt,"Todavia, apresentam alguns problemas como a formação de “áreas de sombra” atrás de objetos sólidos onde, em não havendo o som agudo produzido pelo aparelho, permitem aos roedores uma confortável permanência.",566,What are some of the problems that arise with the form of sombra?
hantavirose_manual_1.txt,Outro problema é que os roedores da área rapidamente acostumam-se ao incômodo dos sons agudos e ali prosseguem vivendo normalmente. 4.3.1.3.,567,What is the problem with acoumodo?
hantavirose_manual_1.txt,"Os aparelhos eletromagnéticos Constituídos basicamente por um solenóide (uma bobina que gira em torno de um ímã), esses dispositivos elétricos ao serem acionados, geram um campo de forças eletromagnéticas de dimensões limitadas no aparelho.",568,What are the solenoids?
hantavirose_manual_1.txt,"Conectado a um cano de metal e este introduzido 3/4 de seu comprimento verticalmente no solo, o aparelho produz um campo eletromagnético concêntrico ao nível do piso e nas primeiras camadas do solo, capaz de provocar distúrbios variados no sistema nervoso central dos animais que adentrem a esse campo.",569,What is the name of the campo?
hantavirose_manual_1.txt,"Roedores (e qualquer outro animal), sob ação desse campo, sentirão tonturas, náuseas e mal-estar; dessa forma, serão afugentados daquela área.",570,What are the characteristics of a roedor?
hantavirose_manual_1.txt,Novamente um aparelho destinado a afugentar os roedores e não para induzir sua eliminação.,571,What is the name of the roedores?
hantavirose_manual_1.txt,Os aparelhos eletromagnéticos são eficazes dentro de seu raio de ação (cerca de quatro metros de raio).,572,What is the name of the metros that make up the raio?
hantavirose_manual_1.txt,"Contudo, são limitados por seu próprio raio e demandam acurada e constante manutenção.",573,What is the limit of the demand?
hantavirose_manual_1.txt,"Além disso, afetarão igualmente aos seres humanos e animais domésticos que permaneçam em contato com o campo. 4.3.2.",574,What is the name of the camp?
hantavirose_manual_1.txt,"O controle biológico Ao longo da história, algumas tentativas de controle biológico dos roedores já foram feitas.",575,What is the name of the controle biológico?
hantavirose_manual_1.txt,"Uma segunda tentativa foi feita com a Salmonella enteritides (de Gartner), com resultados igualmente desastrosos em virtude de sua inespecificidade, causando surtos enormes de salmoneloses entre os seres humanos.",577,What was the result of the first attempt to contaminate the human body with Salmonella enteritides?
hantavirose_manual_1.txt,"Em 1907 o imunologista japonês Shibayana já dava o alarme sobre esse risco, mas foi apenas a partir de 1936 que os países começaram a proibir o emprego de salmonelas como raticidas.",578,What was the alarming alarm of Shibayana?
hantavirose_manual_1.txt,"Recentemente, a partir de certas experiências cubanas, determinadas cepas atenuadas de salmonelas têm sido associadas à warfarina no combate aos roedores.",579,What is the name of the salmonelas that are associated with warfarina?
hantavirose_manual_1.txt,"Segundo parecer da OPAS/HCP/HCV/V5/28/15/1125/98 de 30/11/1998 relativo ao uso de Rodenticida Biológico, “...presume-se que todas as cepas de Salmonella sorotipo enteritidis são patógenas ao homem....",580,What is the name of the bacteria that is a parasite?
hantavirose_manual_1.txt,A tomada de decisão deve levar em conta que há outras alternativas como raticidas anticoagulantes de segunda geração.,581,What is the alternative to raticidas anticoagulantes?
hantavirose_manual_1.txt,"Além disso, o controle de roedores não é eficaz somente mediante o uso de raticidas, desde que se mantenham as condições propícias para a sua instalação e reprodução”.",582,What is the control of roedores?
hantavirose_manual_1.txt,"Tem sido estudada a esterilização como método alternativo no combate aos roedores, por meio de utilização de quimioesterilizantes ou radiações.",583,What is the alternative to the esterilizaço?
hantavirose_manual_1.txt,"A esterilização dos roedores machos foi abandonada porque as fêmeas em cio, na maioria das espécies, acasalam com mais de um macho, o que evita a consangüinidade, garantindo a variação do patrimônio genético para a prole.",584,What did the machos do that was abandoned?
hantavirose_manual_1.txt,"Desta forma, suas chances de acasalar com um macho não esterilizado é grande.",585,What are the chances of acasalar with a macho no esterilizado?
hantavirose_manual_1.txt,"As substâncias quimioesterilizantes já estudadas para as fêmeas, além de produzirem resultados extremamente variados (e portanto não confiáveis como método), têm seu sabor facilmente detectável pelos roedores que passam a evitar as iscas às quais essas substâncias tenham sido adicionadas.",586,What is the result of the substâncias that are studied?
hantavirose_manual_1.txt,FUNASA - dezembro/2002 - pág. 78 Foto 59 - “ O gato e o rato” Foto cedida por Minekazu Matsuo.,587,What was the title of the photo taken by Minekazu Matsuo?
hantavirose_manual_1.txt,"É inevitável que ao se pensar em controle biológico aplicado a ratos, pense-se em gatos.",588,What is the gatos?
hantavirose_manual_1.txt,"Atávicos inimigos, essas habilidades notáveis que os tornaram os predadores naturais mais importantes dos ratos e camundongos.",589,What are the habilidades notáveis that tornaram os predadores naturais most important?
hantavirose_manual_1.txt,"Animais de hábitos igualmente noturnos, os gatos localizam com facilidade os roedores (graçasà visão noturna de que são dotados e seu faro apurado), aproximam-se de forma sorrateira e, pelo bote final certeiro capturam sua presa e matam-na para dela se alimentar.",590,What is the name of the animal that accompanies the gatos?
hantavirose_manual_1.txt,"Todavia, ainda que os gatos conservem seu instinto caçador e possam se constituir assim num forte elemento de pressão sobre uma população de roedores de uma dada área, é fato que tornaram-se mais indolentes e menos dispostos a tais práticas, já que são alimentados à fartura pelos humanos.",591,What is the main reason for the increase in indolentes and less dispostos?
hantavirose_manual_1.txt,"Na prática, apenas os gatos rueiros ainda conservam seus instintos plenos e os exercitam constantemente.",592,What do gatos rueiros do?
hantavirose_manual_1.txt,"Todavia, utilizá-los de forma maciça como método de controle da população murina, é medida arriscada em virtude do próprio potencial de transmissão zoonótica que os felinos domésticos possuem, ou seja, eles são capazes de transmitir doenças à espécie humana como a raiva e a toxoplasmose. 4.3.3.",593,What is the main purpose of the todavia?
hantavirose_manual_1.txt,"O controle químico (raticidas) Já na antigüidade, os lavradores da região do Mediterrâneo sabiam que plantando uma cebola típica dessa região(Scilla maritima) entremeada na lavoura, obtinha-se bons resultados no controle dos roedores que atacavam a plantação.",594,What is the effect of the plantation?
hantavirose_manual_1.txt,"A cilirosida é um componente fortemente tóxico produzido por essa cebola, que originou a cila vermelha, um dos primeiros raticidas químicos empregados deliberadamente pelo homem para combater os ratos.",595,What is the origin of the cilirosida?
hantavirose_manual_1.txt,"Desde então, várias substâncias foram testadas, com resultados variáveis, no combate planejado contra os roedores que eventualmente representem problema ao homem.",596,What was the result of the test?
hantavirose_manual_1.txt,"O controle químicoé praticado através de substâncias naturais ou sintéticas, capazes de provocar a morte dos roedores que as ingerirem.",597,What is the controle qumico praticado através of substâncias naturais or sintéticas?
hantavirose_manual_1.txt,"São chamadas genericamente de raticidas em nosso país, ainda que o termo correto devesse ser rodenticidas.",598,What is the term correto?
hantavirose_manual_1.txt,"Os raticidas podem ser divididos, quanto à rapidez de sua ação, em agudos (provocam a morte dentro das primeiras 24 horas após sua ingestão) e crônicos (a morte ocorre após as primeiras 24 horas de sua ingestão). 4.3.3.1.",599,What is the difference between raticidas and crônicos?
hantavirose_manual_1.txt,Os raticidas agudos que atuam bloqueando o sistema nervoso central do animal afetado.,600,What is the system of nervoso central do animal afetado?
hantavirose_manual_1.txt,"São compostos inespecíficos e a maioria não possue antídoto; o tratamento de intoxicações acidentais, tanto no ser humano como em outros animais, era complicado ou sem sucesso.",601,What is the treatment of acidentais?
hantavirose_manual_1.txt,"São bons exemplos desse grupo a estricnina, o arsênico, o antu (alfa-naftil-til-uréia), o sulfato de tálio, o fosfeto de zinco, o monofluoracetato de sódio (1.080) e a fluoracetamida (1.081).",602,What are some examples of the group a estricnina?
hantavirose_manual_1.txt,"No Brasil, os raticidas agudos foram proibidos, o último deles em 1982, em virtude principalmente dos incontáveis acidentes fatais com humanos ocorridos em todo o território nacional.",603,What was the last time raticidas agudos were proibidos?
hantavirose_manual_1.txt,FUNASA - dezembro/2002 - pág. 79 Foto 60 - Raticidas líquidos (uso proibido no Brasil) Foto cedida por Nyrad Menzen.,604,What was the name of the photo taken by Nyrad Menzen?
hantavirose_manual_1.txt,"Foto 61 - Inseticida de uso agrícola utilizado indevidamente como raticida agudo, popularmente conhecido como “Chumbinho” Foto cedida por Neide Ortêncio Garcia.",605,What is the name of the photo taken by Neide Ortêncio Garcia?
hantavirose_manual_1.txt,"Alternativamente, foram utilizadas substâncias fumigantes no controle de roedores, como o monóxido de carbono, o bissulfeto de carbono, a cloropicrina, o brometo de metila, o fosfeto de alumínio, etc.",606,What are some other substâncias fumigantes?
hantavirose_manual_1.txt,"Os raticidas crônicos Durante a II Guerra Mundial pesquisadores norte-americanos da Universidade de Wisconsin em busca de uma solução para o problema de transmissão de doenças por roedores nas trincheiras, desenvolveram, a partir da casca de uma árvore africana denominada cumaru (Haba tonka), um composto com ação anticoagulante ao qual denominaram warfarina, chamado no Brasil de cumafeno.",608,What is the name of the compost that contains warfarina?
hantavirose_manual_1.txt,Esse composto foi o primeiro de uma série de substâncias correlatas que acabaram FUNASA - dezembro/2002 - pág. 80 constituindo o grupo dos hidroxicumarínicos e têm sido amplamente utilizados como rodenticidas com enorme sucesso.,609,What was the first substância that acabaram FUNASA?
hantavirose_manual_1.txt,"Um pouco mais tarde, foi sintetizado um segundo grupo de anticoagulantes, os derivados da indandiona (ou indandiônicos).",610,What was the name of the group of anticoagulantes?
hantavirose_manual_1.txt,"Com o advento dos raticidas anticoagulantes, foi aberta uma nova e promissora era no combate massivo aos roedores, até então impossível de ser praticado.",611,What was the effect of the anticoagulant?
hantavirose_manual_1.txt,"Em função dos notáveis resultados proporcionados por esses novos raticidas, de sua relativa segurança de uso e, principalmente, pela existência de antídoto confiável (a Vitamina K injetável), os raticidas anticoagulantes dominam amplamente o cenário até nossos dias.",612,What is the main benefit of anticoagulants?
hantavirose_manual_1.txt,"Os raticidas anticoagulantes agem por inibição da síntese de protrombina, um dos fatores essenciais no mecanismo da coagulação sanguínea; dessa forma o sangue do roedor não coagula mais e sua morte ocorre em decorrência de hemorragias internas (pulmonares e/ou mesenteriais).",613,What is the reason why raticidas anticoagulantes age?
hantavirose_manual_1.txt,"Além disso, esses compostos têm uma ação danosa sobre a parede dos vasos capilares, proporcionando o início das hemorragias.",614,What do the compostos do?
hantavirose_manual_1.txt,"Os indandiônicos: - A pindona foi o primeiro composto desse grupo (1963) e exibe boa ação contra roedores na concentração de 0,025% em iscas.",615,What was the first compost of the group?
hantavirose_manual_1.txt,"Pertencem também a esse grupo a isovaleril indandiona, a difacinona e a clorofacinona, esta última comercializada no Brasil em iscas prontas a 0,005%.",616,What is the newest isovaleril indandiona?
hantavirose_manual_1.txt,"Sua DL (doseletal para 50% dos animais testados) é de 2,1 mg/kg para ratos, sendo portanto um composto bastante ativo contra roedores (vide item 4.6).",617,What is the dose of DL for 50% of animais testados?
hantavirose_manual_1.txt,"Os hidroxicumarínicos: - Os hidroxicumarínicos são divididos em dois subgrupos, segundo sua forma de ação: os de dose múltipla e os de dose única. a) hidroxicumarínicos de dose múltipla (ou de primeira geração) Nesse subgrupo estão os compostos que não apresentam resultado após uma única ingestão (nem que seja de grandes proporções), uma vez que seu efeito é cumulativo, sendo necessária a ingestão de sucessivas doses.",618,"Os hidroxicumarnicos so divididos em dois subgrupos, segundo sua forma de aço: os de dose mltipla e os de dose nica?"
hantavirose_manual_1.txt,"O que pode parecer um fator limitante é, na verdade, um fator de segurança contra intoxicações acidentais com outros animais e mesmo com seres humanos, uma dos principais razões do enorme sucesso desses compostos em campanhas de saúde pública.",619,What is the main reason for a limitante fator?
hantavirose_manual_1.txt,"O efeito dessas substâncias nos roedores é retardado, ocorrendo o óbito num prazo médio variável entre dois e cinco dias após a ingestão da dose letal, o que impede que os demais membros da colônia percebam o que os está eliminando, principal fator do sucesso desses compostos.",620,"O efeito dessas substâncias nos roedores é retardado, ocorrendo o óbito num prazo médio variável between dois e cinco di"
