Arquivo,Parágrafo,Número do parágrafo,Pergunta
adenovirus_guia_1txt_guiavsa2023.txt,"Nesse caso, deve-se descrever no campo de observações que o paciente evoluiu para cura, porém continua hospitalizado em decorrência de outras complicações, descrevendo conforme cada situação (Brasil, 2023k). de diagnóstico laboratorial, considera-se como indicador de qualidade dos casos e/ou óbitos por Srag quando 70% de todos os casos e/ou óbitos notificados no Sivep-Gripe tenham resultado de diagnóstico pela técnica padrão-ouro, que é o RT-PCR em tempo real, como base para a classificação final do caso e/ou óbito (Brasil, 2023k).",727,What is the RT-PCR used for?
adenovirus_guia_1txt_guiavsa2023.txt,"Para que as informações se tornem efetivamente úteis, é imprescindível que sejam realizadas análises regulares de qualidade das bases de dados, em que podem ser avaliadas a completitude, a inconsistência, a duplicidade, entre outras informações.",728,What is the importance of regular updates of information?
adenovirus_guia_1txt_guiavsa2023.txt,"Alguns escores podem ser utilizados para a classificação do grau de completitude, que podem variar conforme cada autor.",729,What can be used to classify a grau of completeitude?
adenovirus_guia_1txt_guiavsa2023.txt,"Porém pode-se, em geral, considerar que dados de completitude acima de 90% são considerados excelentes; de 70% a 89%, regular; e abaixo de 70%, ruim (Correia LOS, Padrilha BM; Vasconcelos SML, 2014). 3.7 MEDIDAS DE PREVENÇÃO E CONTROLE 3.7.1 VACINAÇÃO VACINA INFLUENZA TRIVALENTE – FRAGMENTADA, INATIVADA prioritários.",730,What is the percentage of completeness considered to be?
adenovirus_guia_1txt_guiavsa2023.txt,Deve ser administrada antes da exposição ao vírus e é capaz de promover imunidade efetiva e segura durante o período de circulação sazonal dele.,731,What is the purpose of the vaccination program?
adenovirus_guia_1txt_guiavsa2023.txt,"A composição e a concentração de antígenos hemaglutinina (HA) são atualizadas a cada ano, em de forma predominante nos Hemisférios Norte e Sul.",732,What is the composiço e a concentraço de antgenos hemaglutinina?
adenovirus_guia_1txt_guiavsa2023.txt,"A estratégia de vacinação no País tem como objetivo reduzir as complicações, as internações e para complicações da doença.",733,What is the goal of the estratégia of vacinaço no Pas?
adenovirus_guia_1txt_guiavsa2023.txt,"A cobertura vacinal a ser alcançada deve ser igual ou maior que 90% para os seguintes grupos prioritários: crianças, gestantes, puérperas, idosos com 60 anos e mais, povos indígenas, professores e trabalhadores da saúde.",734,What is the cobertura vacinal?
adenovirus_guia_1txt_guiavsa2023.txt,"Para os demais, serão considerados os dados de doses administradas durante a campanha (Brasil, 2023k).",735,What are doses administradas during a campanha?
adenovirus_guia_1txt_guiavsa2023.txt,A vacina influenza utilizada no Brasil é a trivalente.,736,What is the trivalent influenza vaccine?
adenovirus_guia_1txt_guiavsa2023.txt,"Anualmente, são adquiridas e distribuídas mais de 80 milhões de doses aos estados, ao Distrito Federal e aos municípios. • Crianças na faixa etária de 6 meses a menores de 6 anos de idade (5 anos, 11 meses e 29 dias). • Gestantes. • Puérperas até 45 dias após o parto. • Indivíduos com 60 anos ou mais de idade. • Trabalhador da saúde. • Professores das escolas públicas e privadas. • Povos indígenas a partir de 6 meses de idade. • Indivíduos com doenças crônicas não transmissíveis e outras condições clínicas especiais, independentemente da idade. • Adolescentes e jovens de 12 a 21 anos de idade sob medidas socioeducativas. • População privada de liberdade e funcionários do sistema prisional. • Forças de segurança e salvamento. • Profissionais das Forças Armadas. • Pessoas com deficiência permanente. • Caminhoneiros. • Trabalhadores de transporte coletivo rodoviário para passageiros urbanos e de longo curso. • Trabalhadores portuários (Brasil, 2023k).",737,What is the number of doses distributed to the Brazilian population?
adenovirus_guia_1txt_guiavsa2023.txt,"Recomenda-se para crianças de 6 meses a 8 anos, 11 meses e 29 dias, que receberão a vacina pela primeira vez, administrar 2 doses, conforme as normas do Programa Nacional de Imunizações (PNI).",738,What is the first dose of vacina?
adenovirus_guia_1txt_guiavsa2023.txt,"Nos anos subsequentes, apenas 1 dose.",739,What is the dose of anos subsequentes?
adenovirus_guia_1txt_guiavsa2023.txt,"A detecção de anticorpos protetores se dá entre 2 a 3 semanas após a vacinação e apresenta, geralmente, duração de 6 a 12 meses. os postos de vacinação e nos Centros de Referência para Imunobiológicos Especiais (Crie).",740,What is the duration of the detecço of anticorpos protetores?
adenovirus_guia_1txt_guiavsa2023.txt,"Nesses casos, mantém-se a necessidade de prescrição médica, que deverá ser apresentada no ato da vacinação.",741,What is the need for a médica?
adenovirus_guia_1txt_guiavsa2023.txt,A indicação da vacina influenza sazonal para esse grupo está destacada no Quadro 15.,742,What is the name of the group that is affected by influenza?
adenovirus_guia_1txt_guiavsa2023.txt,"GUIA DE VIGILÂNCIA INTEGRADA DA COVID-19, INFLUENZA E OUTROS Quadro 15.",743,What is the name of the quadro 15?
adenovirus_guia_1txt_guiavsa2023.txt,Categorias de risco clínico e indicações para vacinação contra a influenza sazonal Doença respiratória crônica • Asma em uso de corticoide inalatório ou sistêmico (moderada ou grave). • Doença pulmonar obstrutiva crônica (Dpoc). • Bronquiectasia. • Fibrose cística. • Doenças intersticiais do pulmão. • Displasia broncopulmonar. • Hipertensão arterial pulmonar. • Crianças com doença pulmonar crônica da prematuridade.,744,What is the name of the sazonal influenza vaccine?
adenovirus_guia_1txt_guiavsa2023.txt,Doença cardíaca crônica • Doença cardíaca congênita. • Hipertensão arterial sistêmica com comorbidade. • Doença cardíaca isquêmica. • Insuficiência cardíaca.,745,What is the name of the card that is a congênita?
adenovirus_guia_1txt_guiavsa2023.txt,"Doença renal crônica • Doença renal nos estágios 3, 4 e 5. • Síndrome nefrótica. • Paciente em diálise.",746,What is the name of the syndrome?
adenovirus_guia_1txt_guiavsa2023.txt,Doença hepática crônica • Atresia biliar. • Hepatites crônicas. • Cirrose.,747,What is the name of the hepatites crônicas?
adenovirus_guia_1txt_guiavsa2023.txt,"Doença neurológica crônica • Condições em que a função respiratória pode estar comprometida pela doença neurológica. • Considerar as necessidades clínicas individuais dos pacientes incluindo: acidente vascular cerebral, indivíduos com paralisia cerebral, esclerose múltipla, e condições similares. • Doenças hereditárias e degenerativas do sistema nervoso ou muscular. • Deficiência neurológica grave.",748,What is the definition of a neurologica grave?
adenovirus_guia_1txt_guiavsa2023.txt,Diabetes • Diabetes mellitus tipo I e tipo II em uso de medicamentos.,749,What is the name of the disease?
adenovirus_guia_1txt_guiavsa2023.txt,Imunossupressão • Imunodeficiência congênita ou adquirida. • Imunossupressão por doenças ou medicamentos.,750,What is the term for imunodeficiência congênita or adquirida?
adenovirus_guia_1txt_guiavsa2023.txt,Transplantados • Órgãos sólidos. • Medula óssea.,752,What is the name of the transplant?
adenovirus_guia_1txt_guiavsa2023.txt,"Portadores de trissomias • Síndrome de Down, Síndrome de Klinefelter, Síndrome de Warkany, dentre outras trissomias.",753,What are the names of the trissomias?
adenovirus_guia_1txt_guiavsa2023.txt,"Fonte: adaptado de Uyeki et al., 2019. a.",754,What is the name of the book that Uyeki wrote?
adenovirus_guia_1txt_guiavsa2023.txt,"Doenças febris agudas, moderadas ou graves: recomenda-se adiar a vacinação até a resolução do quadro, com o intuito de não se atribuir à vacina as manifestações da doença. b.",755,What is the intuito of no se atribuir à vacina as manifestaçes da doença?
adenovirus_guia_1txt_guiavsa2023.txt,"História de alergia a ovo: i. pessoas que após a ingestão de ovo apresentaram apenas urticária: administrar a vacina influenza, sem a necessidade de cuidados especiais; ii. pessoas que após a ingestão de ovo apresentaram quaisquer outros sinais de anafilaxia (angioedema, desconforto respiratório ou vômitos repetidos): a vacina pode ser administrada, desde que em ambiente adequado para tratar manifestações alérgicas graves (atendimento de urgência e emergência).",756,What is the symptom of anafilaxia?
adenovirus_guia_1txt_guiavsa2023.txt,"A vacinação deve ser aplicada sob supervisão médica, preferencialmente. c.",757,What is the preferred method of vacination?
adenovirus_guia_1txt_guiavsa2023.txt,"Em caso de ocorrência de síndrome de Guillain-Barré (SGB) no período de até 30 dias após o recebimento de dose anterior, recomenda-se realizar avaliação médica criteriosa sobre benefício e risco da vacina antes da administração de uma nova dose (Brasil, 2023k). a.",758,What is the beneficio and risk of vacina?
adenovirus_guia_1txt_guiavsa2023.txt,Menores de 6 meses de idade. b.,759,How many meses of idade do you have?
adenovirus_guia_1txt_guiavsa2023.txt,"Indivíduos que, após vacinação anterior, apresentaram hipersensibilidade imediata (reação anafilática). 3.7.2 MEDIDAS NÃO FARMACOLÓGICAS PRECAUÇÕES-PADRÃO A implementação da precaução-padrão constitui a principal medida de prevenção da transmissão entre pacientes e profissionais de saúde e deve ser adotada no cuidado de todos os pacientes, independentemente dos fatores de risco ou da doença de base.",760,What is the main medida of prevention of transmissible disease?
adenovirus_guia_1txt_guiavsa2023.txt,"A precaução-padrão compreende: • Higienização das mãos antes e depois do contato com o paciente. • Uso de equipamentos de proteção individual (EPIs) – avental e luvas – ao contato com sangue e secreções. • Uso de óculos e máscara, se houver risco de respingos. • Descarte adequado de resíduos, segundo o regulamento técnico para o gerenciamento de resíduos de serviços de saúde da Agência Nacional de Vigilância Sanitária (Anvisa) (Brasil, 2023k).",761,What is the precauço-padro compreende?
adenovirus_guia_1txt_guiavsa2023.txt,"GUIA DE VIGILÂNCIA INTEGRADA DA COVID-19, INFLUENZA E OUTROS Além da precaução-padrão, devem ser implantadas as precauções para gotículas, que devem ser utilizadas para pacientes com suspeita ou confirmação de infecção por influenza.",762,What is the name of the drug that is used to treat influenza?
adenovirus_guia_1txt_guiavsa2023.txt,"As gotículas respiratórias, que têm cerca de >5 μm de tamanho, provocadas por tosse, espirro ou fala, não se propagam por mais de 1 metro da fonte e relacionam-se à transmissão de contato da gotícula com mucosa ou conjuntiva da boca ou nariz de indivíduo susceptível.",763,What is the smallest of the gotculas respiratórias?
adenovirus_guia_1txt_guiavsa2023.txt,"Recomenda-se: • Usar máscara cirúrgica ao entrar no quarto, a menos de 1 metro do paciente – substituí-la a cada contato com o paciente. • Higienizar as mãos antes e depois de cada contato com o paciente (água e sabão ou álcool em gel). • Colocar máscara cirúrgica no paciente durante o transporte. • Limitar procedimentos indutores de aerossóis. • Usar dispositivos de sucção fechados. • Manter paciente, preferencialmente, em quarto privativo por 7 dias após o início dos sintomas ou até por 24 horas após o desaparecimento da febre e dos sintomas respiratórios. • Quando em enfermaria, respeitar a distância mínima de 1 metro entre os leitos durante o tratamento com fosfato de oseltamivir (Brasil, 2023k).",764,How much time should a patient spend in a quart?
adenovirus_guia_1txt_guiavsa2023.txt,"No caso de procedimentos que gerem aerossóis – partículas <5 μm, que podem ficar suspensas no ar por longos períodos (exemplo: intubação, sucção) –, recomenda-se: • Usar EPI – avental e luvas, óculos e máscara (respirador) tipo N95, PFF2 ou equivalente devem ser utilizados pelo profissional de saúde durante o procedimento de assistência ao paciente. • Manter paciente, preferencialmente, em quarto privativo ou, quando não disponível, isolamento de coorte.",765,What is the best way to treat a patient?
adenovirus_guia_1txt_guiavsa2023.txt,"Embora a covid-19 e a influenza sejam doenças para as quais se implementam medidas de precaução semelhantes, não se devem colocar na mesma coorte pacientes com covid-19 e pacientes com influenza, para evitar a disseminação das diferentes doenças entre os pacientes. • Usar máscara (respirador) tipo N95, PFF2 ou equivalente – deve ser utilizada pelo profissional de saúde ao entrar no quarto. • Colocar máscara cirúrgica no paciente durante o transporte (Brasil, 2023k). • Remoção de sujidades com água e sabão ou detergente. • Limpeza com solução de hipoclorito de sódio em pisos e superfícies dos banheiros. • Fricção de outras superfícies e objetos com álcool a 70%. • Uso de EPIs adequados. • Descarte adequado de resíduos, segundo o regulamento técnico para o gerenciamento de resíduos de serviços de saúde da Agência Nacional de Vigilância Sanitária (Anvisa) (Brasil, 2023k).",766,What is the name of the drug that is used to treat influenza?
adenovirus_guia_1txt_guiavsa2023.txt,"Não há indicação de quimioprofilaxia para a comunidade, exceto nas indicações citadas anteriormente.",767,What is the name of the ad hoc group that has a quimioprofilaxia?
adenovirus_guia_1txt_guiavsa2023.txt,"Alunos, professores e demais funcionários que adoecerem devem permanecer em afastamento temporário na suspeita clínica de influenza, podendo ser liberado o retorno à escola se clinicamente estável, sem uso de antitérmico e sem febre por 24 horas.",768,What is the status of the student who is adoecerem?
adenovirus_guia_1txt_guiavsa2023.txt,"Ao retornar à escola, devem-se manter cuidados de etiqueta respiratória durante sintomas respiratórios. medida de prevenção e controle de infecção (Brasil, 2023k).",769,What is the etiqueta respiratória?
adenovirus_guia_1txt_guiavsa2023.txt,"CUIDADOS ADICIONAIS COM GESTANTES, PUÉRPERAS E CRIANÇAS PARA EVITAR INFECÇÕES SECUNDÁRIAS (PNEUMONIA) E A TRANSMISSÃO DA DOENÇA • Gestante: buscar o serviço de saúde caso apresente sintomas de síndrome gripal; na internação para o trabalho de parto, priorizar o isolamento se a gestante estiver com sintomas de influenza. • Puérpera: após o nascimento do bebê, se a mãe estiver doente, deve ser orientada a usar máscara e higienizar as mãos imediatamente após tocar nariz, boca e sempre que for amamentar ou prestar cuidados ao recém-nascido. • Criança: em caso de recém-nascidos, priorizar o seu isolamento junto com a mãe (não utilizar berçários).",770,What is the name of the service that is used to transport people?
adenovirus_guia_1txt_guiavsa2023.txt,"Os profissionais e as mães devem higienizar as mãos e os utensílios do bebê (mamadeiras, termômetros).",771,What do profissionais do?
adenovirus_guia_1txt_guiavsa2023.txt,"Para mais informações, consultar as orientações vigentes para tratamento e manejo da influenza.",772,What is the main reason for visiting a vigente website for influenza information?
adenovirus_guia_1txt_guiavsa2023.txt,"Condutas frente a surtos e eventos: a influenza pode se disseminar rapidamente entre as populações, especialmente as que vivem em ambientes restritos ou fechados, podendo causar morbidade considerável e interrupção das atividades diárias, por isso é importante que, diante de situações de surto ou epidemia, sejam adotadas medidas específicas para interrupção (Brasil, 2023k). • Vacinar anualmente todos os residentes e funcionários. • Realizar coleta de amostra para diagnóstico de influenza em caso suspeito, até que haja no mínimo 2 casos confirmados. • Realizar busca ativa diária até pelo menos 1 semana após a identificação do último caso. • Realizar quimioprofilaxia nos casos elegíveis, de acordo com as orientações vigentes para tratamento e manejo da influenza.",773,What is the most important thing to do to prevent influenza?
adenovirus_guia_1txt_guiavsa2023.txt,"GUIA DE VIGILÂNCIA INTEGRADA DA COVID-19, INFLUENZA E OUTROS • Implementar medidas de prevenção – precaução-padrão e precaução de gotículas e aerossóis – para todos os residentes e internados com suspeita ou confirmação de influenza por 7 dias após o início dos sintomas ou até por 24 horas após o desaparecimento da febre sem uso de antitérmico e sintomas respiratórios. • Isolamento em quarto privativo ou, quando não disponível, isolamento de coorte (pessoas com sintomas compatíveis). • Evitar visitas.",774,What is the name of the program that implements a preventative measure for influenza?
adenovirus_guia_1txt_guiavsa2023.txt,"Caso ocorram, usar EPI de acordo com a situação (Brasil, 2023k). • Vacinar anualmente a população privada de liberdade (carcerária). • Não há indicação de quimioprofilaxia para a população carcerária em caso de surto, por esta não se tratar de população de risco de complicação para influenza. • O caso suspeito ou confirmado, se possível, deverá ser mantido em cela individual. • Evitar trânsito de profissionais entre alas com e sem doentes. • Realizar coleta de amostra para diagnóstico de influenza em caso suspeito até que haja no mínimo 2 casos confirmados. • Realizar busca ativa diária até pelo menos 1 semana após a identificação do último caso. • Devem ser orientados à prática das seguintes medidas preventivas: » cobrir o nariz e a boca com lenço, ao tossir ou espirrar, e descartar o lenço no lixo após uso; » lavar as mãos com água e sabão após tossir ou espirrar; » no caso de não haver disponibilidade de água e sabão, usar álcool em gel; » evitar tocar olhos, nariz ou boca (Brasil, 2023k). • Residentes sintomáticos devem ser mantidos, na medida do possível, em seus quartos.",775,What is the best way to prevent influenza?
adenovirus_guia_1txt_guiavsa2023.txt,"Caso circulem, devem usar máscara cirúrgica. • Limitar aglomeração, considerando a possibilidade de servir refeição no quarto. • Restringir movimentação dos profissionais que atuam em áreas onde há doentes para áreas não atingidas pelo surto. • Evitar novas admissões ou transferência de sintomáticos (Brasil, 2023k). 3.8 CLASSIFICAÇÃO INTERNACIONAL DE DOENÇAS (CID-10) CID 10 – J11.",776,What is the criterion for a cirrgica?
adenovirus_guia_1txt_guiavsa2023.txt,"Influenza (gripe) devida a vírus não identificado. (OVR) DE IMPORTÂNCIA EM diferentes patógenos, como o vírus influenza, SARS-CoV-2, o vírus sincicial respiratório (VSR), rinovírus, adenovírus, parainfluenza (1, 2, 3 e 4), metapneumovírus, outros coronavírus, entre outros.",777,What is the name of the virus that is not identified?
adenovirus_guia_1txt_guiavsa2023.txt,"Por esses sinais e sintomas respiratórios similares, e pelo fato de que esses vírus podem circular ao mesmo tempo, a confirmação da identificação etiológica se baseia em diagnóstico laboratorial (Brasil, 2023k).",778,What is the name of the vrus that can be circular?
adenovirus_guia_1txt_guiavsa2023.txt,"A identificação de outros vírus respiratórios, portanto, é realizada por meio de diagnóstico diferencial para influenza e SARS-CoV-2.",779,What is the name of the virus that is identified by a different diagnostico?
adenovirus_guia_1txt_guiavsa2023.txt,"Dessa forma, a detecção de OVR ocorre de maneira amostral e por conveniência, a depender da disponibilidade de insumos disponíveis nas unidades federadas ou nos municípios para esses agentes etiológicos (Brasil, 2023k).",780,What is the detecço de OVR?
adenovirus_guia_1txt_guiavsa2023.txt,"Em neonatos e crianças pequenas, a primo-infecção pode causar bronquiolite grave.",782,What is bronquiolite grave?
adenovirus_guia_1txt_guiavsa2023.txt,"Em crianças mais velhas e adultos sem comorbidades, infecções de repetição no trato respiratório superior são algumas semanas (WHO, 2023i).",783,What is the name of the comorbid comorbid?
adenovirus_guia_1txt_guiavsa2023.txt,"Além do impacto no sistema de saúde devido às infecções pediátricas, o VSR vem cada vez mais sendo reconhecido como um importante patógeno em adultos mais velhos, com a infecção levando a um aumento nas taxas de hospitalização em idosos acima de 65 anos ou mais, e ao aumento da taxa de mortalidade em idosos mais fragilizados, similar às taxas observadas para a infecção por influenza (WHO, 2023i).",784,What is the impact of the VSR on the system of sade?
adenovirus_guia_1txt_guiavsa2023.txt,"No Brasil, o padrão de sazonalidade varia entre as regiões, sendo mais marcado naquelas com estações climáticas bem definidas, ocorrendo com maior frequência nos meses mais frios, em locais de clima temperado.",785,What is the Brazilian climate?
adenovirus_guia_1txt_guiavsa2023.txt,"Por isso, espera-se um aumento de casos no outono e no inverno, mas pode haver circulação em outros períodos do ano, devido às diferenças geográficas e climáticas do País (Brasil, 2023m).",786,What is the tempo of the weather in Brazil?
adenovirus_guia_1txt_guiavsa2023.txt,"GUIA DE VIGILÂNCIA INTEGRADA DA COVID-19, INFLUENZA E OUTROS ` DESCRIÇÃO Infecção viral aguda do trato respiratório inferior, afetando todas as faixas etárias. ` AGENTE ETIOLÓGICO O VSR é um RNA vírus, não segmentado, envelopado, pertencente ao gênero Orthopneumovírus, à família Pneumoviridae e à ordem Mononegavirales.",787,What is the name of the virus that causes it to be infected?
adenovirus_guia_1txt_guiavsa2023.txt,"Existem 2 subtipos principais de VSR em humanos: A e B (WHO, 2023i). ` RESERVATÓRIO Os humanos são reservatórios do VSR, e não se sabe de reservatório em animais. ` MODO DE TRANSMISSÃO O VSR pode ser transmitido quando: • A pessoa infectada tosse ou espirra. • As gotículas/partículas expelidas quando a pessoa infectada tosse ou espirra entram em contato com os olhos, o nariz ou a boca de outra pessoa. • A pessoa tem contato direto com o vírus, por exemplo, ao beijar o rosto de uma criança infectada com VSR. • A pessoa toca um objeto ou superfície contendo o vírus, e leva a mão ao rosto antes de fazer higienização adequada (CDC, 2023d).",788,What is the MODO DE TRANSMISSO?
adenovirus_guia_1txt_guiavsa2023.txt,"Entende-se que o VSR pode sobreviver nas mãos de uma pessoa infectada ou que entrou em contato com o vírus por menos de 1 hora; no entanto, o VSR pode estar presente em superfícies duras e não porosas por cerca de 24 horas (Sociedade Brasileira de Pediatria, 2017). ` PERÍODO DE INCUBAÇÃO O período de incubação do VSR é de 4 a 5 dias (Sociedade Brasileira de Pediatria, 2017). ` PERÍODO DE TRANSMISSIBILIDADE O VSR replica-se em nasofaringe e o período de excreção viral pode variar de 2 a 8 dias.",789,What is the duration of incubation of a VSR?
adenovirus_guia_1txt_guiavsa2023.txt,"Em recém-nascidos, lactentes jovens e pacientes imunocomprometidos, o vírus pode continuar sendo excretado por períodos mais prolongados, de até 3 a 4 semanas (Sociedade Brasileira de Pediatria 2017; CDC, 2023d). ` SUSCETIBILIDADE E IMUNIDADE A susceptibilidade é universal.",790,What is the susceptibilidad universal?
adenovirus_guia_1txt_guiavsa2023.txt,"Quase todas as crianças terão sido infectadas pelo VSR até o 2º ano de vida (CDC, 2023e). ` MANIFESTAÇÕES CLÍNICAS A infecção por VSR pode variar desde forma leves, assintomáticas, até formas graves com comprometimento do estado geral e insuficiência respiratória (Sociedade Brasileira de Pediatria, 2017).",791,What is the name of the virus that can cause it to spread?
adenovirus_guia_1txt_guiavsa2023.txt,"Entre os sintomas da infecção pelo VSR, os mais comuns são: obstrução nasal, coriza hialina, tosse, febre, recusa alimentar e irritabilidade.",792,What are some common sintomas of the VSR?
adenovirus_guia_1txt_guiavsa2023.txt,"É importante ficar atento a outros sinais de alerta, como febre alta, tosse persistente, dificuldade para respirar, chiado no peito, cianose, gemência, retração torácica, apneia, hipoatividade e prostração (Brasil, 2023m).",793,What is one of the signs of alertness?
adenovirus_guia_1txt_guiavsa2023.txt,"Normalmente, os sintomas aparecem em fases e não todos ao mesmo tempo.",794,What is the normal tempo of sintomas?
adenovirus_guia_1txt_guiavsa2023.txt,"Em neonatos, os únicos sintomas podem ser irritabilidade, hipoatividade e dificuldade para respirar (CDC, 2023e). ` FATORES DE RISCO Fatores de risco para agravamento por VSR em crianças incluem: • Lactentes com menos de 6 meses de idade. • Prematuridade. • Crianças com doença pulmonar crônica da prematuridade. • Crianças cardiopatas, com presença de malformações cardíacas. • Crianças com displasia broncopulmonar (DBP).",795,What are the risks of agravamento by VSR?
adenovirus_guia_1txt_guiavsa2023.txt,A prematuridade é um dos principais fatores de risco para hospitalização por VSR.,796,What is the risk of hospitalization for VSR?
