Arquivo,Parágrafo,Número do parágrafo,Pergunta
tuberculose_protocolo_1.txt,"Yu, H.-Y. et al. clinical management of tuberculous meningitis: experiences of 42 cases and literature review.",379,What is the name of the study that was conducted to determine the clinical management of TB meningitis?
tuberculose_protocolo_1.txt,"Neurological Sciences, v. 35, n. 2, p. 303–305, 2014. 1.",380,What is the title of the journal Neurological Sciences?
tuberculose_protocolo_1.txt,"Introdução casos, em pessoas com bacilos sensíveis aos medicamentos antituberculose (antiTB), desde que obedecidos os princípios básicos do tratamento.",381,What is the name of the drug that is used to treat TB?
tuberculose_protocolo_1.txt,"Para o sucesso do tratamento da tuberculose, é fundamental que o profissional de saúde acolha o usuário no serviço de saúde, desde o diagnóstico até a alta. a abordagem humanizada e o estabelecimento de vínculo entre profissional de saúde e usuário, com escuta de saberes, dúvidas, angústias e a identificação de vulnerabilidades, auxiliam tanto no diagnóstico como na adesão ao tratamento. o paciente deve ser orientado, de forma clara, quanto às características clínicas da tb e do tratamento ao qual será submetido. informações referentes aos medicamentos, consequências do uso irregular, eventos adversos, controle de contatos e duração do tratamento devem ser fornecidas desde o primeiro contato com o paciente. 2.",382,What is the main difference between a doctor and a patient?
tuberculose_protocolo_1.txt,"Bases Bacteriológicas e Farmacológicas para que o tratamento da tuberculose seja efetivo, devemos considerar algumas seu metabolismo e à atuação dos medicamentos. os medicamentos antitb, em geral, interferem no sistema enzimático do bacilo ou bloqueiam a síntese de algum metabólito essencial para o seu crescimento (Figura 9). os fármacos só atuam quando há atividade metabólica, ou seja, bacilos em estado de latência não são atingidos pelos medicamentos, mas são destruídos pelo sistema imunológico (FisHMan, 1998; taRantino, 2008). 901-QS c/anilicixomA )orref 428-AP 7485DZA .4102 .la ,DI :etnoF modulado pela concentração do gás no ambiente em que ele se encontra. na lesão pulmonar cavitária, existem condições ideais para a intensa atividade metabólica e para o crescimento bacilar rápido, como boa oferta de oxigênio, pH neutro e a presença de substâncias nutritivas. pelas condições ideais, nas lesões cavitárias formam-se grandes populações bacilares, com frequência variável, de subpopulações de bacilos com mutações (quadro 16). se o esquema terapêutico é equivocado, realizado de maneira irregular, com doses inadequadas ou interrompido precocemente, cepas resistentes aos medicamentos podem ser selecionadas, caracterizando a resistência adquirida (couRa, 2013).",383,What is the name of the bacteriological system that is used to treat tuberculose?
tuberculose_protocolo_1.txt,"QUADRO 16 – proporção de bacilos com mutações genéticas e resistência aos principais medi- Rifampicina (R) rpoB 1:107-8 Isoniazida (H) katG, inhA, ahpC, glf 1:105-6 Etambutol (E) embA, embB, embC 1:105-6 Estreptomicina (S) rpsL, rrs, gidB 1:105-6 Etionamida (Et) inhA, mabA, fabG1,ethA 1:103-6 Pirazinamida (Z) pncA 1:102-4 Fluoroquinolonas gyrA 1:107-8 Fonte: Adaptado de DONALD PR; VAN HELDEN PD, 2011. a lesão caseosa fechada (granulomas) apresenta pH neutro ou ácido e baixa concentração de oxigênio. nesses locais, o crescimento bacilar é intermitente. no interior dos macrófagos, onde a concentração de oxigênio é baixa, o pH é ácido e, com a ação dos mecanismos de defesa celulares, a multiplicação bacilar é lenta. esses bacilos de crescimento lento ou intermitente são denominados latentes ou persistentes, responsáveis pelas recidivas da doença. por conta da existência dessas populações bacilares, o tratamento da tb deve ser feito por tempo prolongado (couRa, 2013). a atuação dos medicamentos antitb difere conforme o metabolismo bacilar. na população intramacrofágica, agem os fármacos que melhor se difundem no meio intracelular e em pH ácido: rifampicina, pirazinamida e etambutol. nas lesões caseosas fechadas, o fármaco mais efetivo é a rifampicina, sendo a ação da isoniazida mais lenta e demorada. na lesão cavitária, a rifampicina, isoniazida e estreptomicina são muito efetivas e atuam em pH neutro (couRa, 2013) (quadro 17).",384,What is the name of the bacterilos that are mutaçes genéticas and resistência?
tuberculose_protocolo_1.txt,QUADRO 17 – características do M. tuberculosis e o local de atuação dos medicamentos antitb. pH ácido.,385,What is the name of the quadrup 17?
tuberculose_protocolo_1.txt,Crescimento lento Ação enzimática celular. (macrófagos) Isoniazida Baixa oferta de oxigênio.,386,What is the name of the Isoniazida Baixa offer?
tuberculose_protocolo_1.txt,"Lesão caseosa (necrose tecidual, (fechada) acúmulo de CO2 e ácido lático).",387,What is the name of the caseosa?
tuberculose_protocolo_1.txt,Cavidade pulmonar Crescimento geométrico Boa oferta de oxigênio.,388,What is the name of the pulmonar?
tuberculose_protocolo_1.txt,"Fonte: Adaptado de COURA, 2013. 3.",389,What is the name of the font?
tuberculose_protocolo_1.txt,"A Escolha do Melhor Esquema de Tratamento levando-se em consideração o comportamento metabólico e a localização do bacilo, o esquema terapêutico antitb, para ser mais efetivo, deve atender a três grandes objetivos: ter atividade bactericida precoce; ser capaz de prevenir a emergência de bacilos resistentes; e ter atividade esterilizante. a atividade bactericida precoce é a capacidade de matar a maior quantidade de bacilos, o mais rapidamente possível, sendo medida pela velocidade com que são mortos. essa tratamento (segundo mês) (couRa, 2013). em geral, após duas a três semanas de tratamento com esquema antitb que contenha fármacos com atividade bactericida precoce, ocorre significativa diminuição da capacidade de transmissão de bacilos pelos indivíduos doentes. os medicamentos com maior atividade bactericida precoce são a isoniazida, estreptomicina e rifampicina (WHo 2004). características desejáveis: rápida melhora clínica, redução das chances de óbito, bacilos resistentes.",390,What is the main goal of the antitb?
tuberculose_protocolo_1.txt,"Medicamentos, em ordem de importância: isoniazida, rifampicina, fluoroquinolonas (lfx > Mfx), injetáveis, linezolida, bedaquilina (não disponível no brasil), delamanid (não disponível no brasil) e etionamida. para a prevenção da seleção de bacilos resistentes e a efetiva cura da doença, é necessária a sobre os bacilos sensíveis e nas diversas populações de bacilos naturalmente resistentes, uma vez que bacilos resistentes a um medicamento podem ser sensíveis a outro. a atividade esterilizante é a capacidade de eliminar todos os bacilos presentes no indivíduo, seja nas cavidades pulmonares, no interior das lesões caseosas fechadas ou no interior dos macrófagos, e é definida pela proporção de recidivas que ocorrem após o término do tratamento (couRa, 2013). característica desejável: evitar a possibilidade de recidivas; Medicamentos, em ordem de importância: rifampicina, pirazinamida, fluoroquinolonas (Mfx > lfx), linezolida, clofazimina, bedaquilina (não disponível no brasil) e delamanid (não disponível no brasil). os medicamentos antitb de primeira linha, associados, possuem as propriedades relacionadas anteriormente para o sucesso terapêutico e a cura da doença. os medicamentos com maior atividade bactericida precoce são: isoniazida, estreptomicina e rifampicina. a isoniazida e a rifampicina são ativas em todas as populações bacilares sensíveis, quer intracavitárias, no interior dos granulomas ou dos macrófagos. a estreptomicina é mais ativa contra os bacilos de multiplicação mais rápida, no interior das cavidades. a pirazinamida age nas populações que se encontram no interior das lesões caseosas fechadas e dos macrófagos, cujo meio é ácido. os medicamentos com maior poder esterilizante são: rifampicina e pirazinamida. o para prevenir a emergência de bacilos resistentes (oMs,2006) (quadro 18).",391,What is the atividade of eliminating bacilos resistentes?
tuberculose_protocolo_1.txt,"QUADRO 18 – atividade dos diferentes medicamentos antitb Isoniazida Rifampicina PAS1 FQN1 Injetáveis PAS1 Delamanid FQN1 Fonte: Adaptado CAMINERO; VAN DEUN; FUJIWARA, 2013. 1FQN – Fluoroquinolonas; PAS – Ácido paraminossalicílico. 4.",392,What is the name of the drug that is used to treat a specific disease?
tuberculose_protocolo_1.txt,"QUADRO 19 – esquemas de tratamento da tuberculose e local de manejo clínico preferencial Caso novo1 e Retratamento2 (recidiva após cura e reingresso Atenção Primária após abandono) Tuberculose meningoencefálica Hospital e, posteriormente, e osteoarticular Atenção Secundária3 Toxicidade, intolerância ou Esquemas Especiais Referência Secundária3 falência terapêutica4 resistência e Resistência Referência Terciária3 Fonte: CGPNCT/SVS/MS. 1Caso novo ou virgem de tratamento (VT): paciente nunca submetido ao tratamento antiTB ou realização de tratamento por menos de 30 dias. 2Retratamento: paciente que já fez o tratamento antiTB por mais de 30 dias e que necessite de novo tratamento após abandono ou por recidiva (após a cura ou tratamento completo). 3Recomendado TDO compartilhado com a Atenção Primária. 4Falência terapêutica: paciente que apresenta persistência de baciloscopia de escarro positiva ao final do tratamento; paciente que inicialmente apresentava baciloscopia fortemente positiva (++ ou +++) e mantém essa positividade até o quarto mês de tratamento; e pacientes com baciloscopia inicialmente positiva, seguida de negativação e nova positividade, por dois meses consecutivos, a partir do quarto mês de tratamento. 4.1.",394,What is the stipulation for the treatment of tuberculosis?
tuberculose_protocolo_1.txt,"ESQUEMA BáSiCO (EB) 4.1.1.Esquema Básico para o tratamento de adultos e adolescentes (≥ 10 anos de idade): 2RHZE/4RH indicações: casos novos de tuberculose ou retratamento (recidiva e reingresso após abandono que apresentem doença ativa) em adultos e adolescentes (≥ 10 anos de idade); todas as apresentações clínicas (pulmonares e extrapulmonares) (quadro 20), exceto a forma meningoencefálica e ostearticular.",395,What is the name of the ESQUEMA Básico?
tuberculose_protocolo_1.txt,"QUADRO 20 – Esquema Básico para o tratamento da TB em adultos e adolescentes (≥ 10 anos de idade) ESQUEMA FAIXAS DE PESO UNIDADE/DOSE DURAÇãO 20 a 35 Kg 2 comprimidos 150/75/400/275 mg 36 a 50 Kg 3 comprimidos 2 meses (comprimidos (fase intensiva) 51 a 70 Kg 4 comprimidos combinadas) Acima de 70 Kg 5 comprimidos 1 comp 300/150 mg ou 20 a 35 Kg 2 comp 150/75 mg 1 comp 300/150 mg + 1 comp de 150/75 mg 300/150 mg1 36 a 50 Kg ou 3 comp 150/75 mg 4 meses ou 150/75 mg (fase de (comprimidos 51 a 70 Kg 2 comp 300/150 mg ou manutenção) em doses fixas 4 comp 150/75 mg combinadas) 2 comp 300/150 mg + 1 comp de 150/75 Acima de 70 Kg mg ou 5 comp 150/75 mg Fonte: (RATIONAL PHARMACEUTICAL MANAGEMENT PLUS, 2005; WHO, 2003).",396,What is the name of the drug used to treat TB?
tuberculose_protocolo_1.txt,R – Rifampicina; H – isoniazida; Z – Pirazinamina; E – Etambutol. 1A apresentação 300/150 mg em comprimido deverá ser adotada assim que disponível. 4.1.2.,397,What is the meaning of isoniazida?
tuberculose_protocolo_1.txt,Esquema Básico para tratamento da TB meningoencefálica e osteoarticular em adultos e adolescentes (≥ 10 anos de idade): 2RHZE/10RH indicações: casos novos e retratamento (recidiva e reingresso após abandono) que apresentem doença ativa meningoencefálica e óssea em adultos e adolescentes (≥ 10 anos de idade) (quadro 21).,398,What is the esquema Básico for treatment of TB?
tuberculose_protocolo_1.txt,"QUADRO 21 – esquema básico para o tratamento da tb meningoencefálica e osteoarticular em adultos e adolescentes (≥ 10 anos de idade) ESQUEMA FAIXAS DE PESO UNIDADE/DOSE DURAÇãO 20 a 35 Kg 2 comprimidos 150/75/400/275 mg 36 a 50 Kg 3 comprimidos 2 meses (comprimidos (fase intensiva) 51 a 70 Kg 4 comprimidos combinadas) Acima de 70 Kg 5 comprimidos 1 comp 300/150 mg ou 20 a 35 Kg 2 comp 150/75 mg 1 comp 300/150 mg + 1 comp de 300/150 mg1 ou 36 a 50 Kg 150/75 mg ou 3 comp 150/75 mg 10 meses 150/75 mg (fase de (comprimidos 2 comp 300/150 mg ou manutenção) 51 a 70 Kg em doses fixas 4 comp 150/75 mg combinadas) 2 comp 300/150 mg + 1 comp de Acima de 70 Kg 150/75 mg ou 5 comp 150/75 mg Fonte: (RATIONAL PHARMACEUTICAL MANAGEMENT PLUS, 2005; WHO, 2003).",399,What is the QUADRO 21?
tuberculose_protocolo_1.txt,"R – Rifampicina; H- Isoniazida; Z – Pirazinamina; E – Etambutol. 1A apresestação 300/150 mg em comprimido deverá ser adotada assim que disponível. observações: e quaisquer outras apresentações clínicas, utilizar o esquema para tb meningoence- fálica ou osteoarticular. quando tb osteoarticular de baixa complexidade, pode-se tratar por 6 meses, a critério clínico. associar corticosteroide: prednisona (1 a 2 mg/kg/dia) por quatro semanas ou, nos casos graves de tb meningoencefálica, dexametasona injetável (0,3 a 0,4 mg/kg/dia), por quatro a oito semanas, com redução gradual da dose nas quatro semanas subsequentes.",400,What is the name of the drug that is used to treat osteoarticular?
tuberculose_protocolo_1.txt,"Para evitar sequelas, recomenda-se aos pacientes que a fisioterapia, em casos de tuberculose meningoencefálica, seja iniciada o mais cedo possível. 4.1.3.",401,What is the most common cause of a sequela?
tuberculose_protocolo_1.txt,"Esquema Básico para crianças (< 10 anos de idade): 2RHZ/4RH indicações: casos novos e de retratamento (recidiva e reingresso após abandono) que apresentem doença ativa em crianças (< 10 anos de idade), de todas as formas de tuberculose pulmonar e extrapulmonar (quadro 22), exceto a forma meningoencefálica e osteoarticular.",402,What is the name of the criança?
tuberculose_protocolo_1.txt,"QUADRO 22 – esquema básico para o tratamento da tb em crianças (< 10 anos de idade) FASES DO ≥21Kg ≥26Kg ≥31Kg ≥36Kg ≥40Kg FÁRMACOS até 20Kg ≥45Kg TRATAMENTO a 25Kg a 30Kg a 35Kg a 39Kg a 44Kg Mg/Kg/dia Mg/dia Mg/dia Mg/dia Mg/dia Mg/dia Mg/dia Rifampicina 15 (10-20) 300 450 500 600 600 600 2RHZ Isoniazida 10 (7-15) 200 300 300 300 300 300 Pirazinamida 35 (30-40) 750 1.000 1.000 1.500 1.500 2.000 Rifampicina 15 (10-20) 300 450 500 600 600 600 4RH Isoniazida 10 (7-15) 200 300 300 300 300 300 Fonte: Adaptado da OMS, 2014. fármacos ao esquema de tratamento da tuberculose em crianças (ver capítulo esquemas de tratamento para tuberculose). nesses casos, recomendamos que o seguimento ocorra em no sistema de informação de tratamentos especiais de tuberculose (site-tb). crianças com tb, infectadas pelo HiV ou desnutridas, deverão receber suplementação de piridoxina – vitamina b6 (5 a 10 mg/dia) (WHo, 2014). 4.1.4.",403,What is the esquema básico for tb em crianças?
tuberculose_protocolo_1.txt,"Esquema Básico para tratamento da TB meningoencefálica e osteoarticular para crianças (< 10 anos de idade): 2RHZ/10RH indicações: casos novos e de retratamento (recidiva e reingresso após abandono que apresen- tem doença ativa) de crianças (< 10 anos de idade), com tb meningoencefálica ou osteoarticular. no tratamento da tb meningoencefálica, em crianças, utiliza-se o esquema básico com prolongamento da fase de manutenção para 10 meses, ou seja, o tempo total de tratamento será de 12 meses (WHo, 2014). de modo semelhante, o tratamento da tb osteoarticular deve ser feito por 12 meses. no entanto, casos de baixa complexidade podem ser tratados por 6 meses, a critério clínico (WHo, 2014). no quadro 23 encontra-se o esquema de tratamento para tuberculose meningoencefálica em crianças.",404,What is the esquema básico for treatment of TB meningoencefálica e osteoarticular?
tuberculose_protocolo_1.txt,"QUADRO 23 – esquema básico para o tratamento da tuberculose meningoencefálica e osteo- articular em crianças (< 10 anos de idade) FASES DO ≥21Kg ≥26Kg ≥31Kg ≥36Kg ≥40Kg FÁRMACOS até 20kg ≥45Kg TRATAMENTO a 25kg a 30kg a 35kg a 39kg a 44kg Mg/kg/dia Mg/dia Mg/dia Mg/dia Mg/dia Mg/dia Mg/dia Rifampicina 15 (10-20) 300 450 500 600 600 600 2RHZ Isoniazida 10 (7-15) 200 300 300 300 300 300 Pirazinamida 35 (30-40) 750 1.000 1.000 1.500 1.500 2.000 Rifampicina 15 (10-20) 300 450 500 600 600 600 10RH Isoniazida 10 (7-15) 200 300 300 300 300 300 Fonte: Adaptado da OMS, 2014. observações: quaisquer outras apresentações clínicas, utilizar o esquema para tb meningoencefálica ou osteoarticular. associar corticosteroide: prednisona (1 a 2 mg/kg/dia) por quatro semanas ou, nos casos graves de tuberculose meningoencefálica, dexametasona injetável (0,3 a 0,4 mg/kg/dia), por quatro a oito semanas, com redução gradual da dose nas quatro semanas subsequentes.",405,What is the esquema básico for treatment of TB?
tuberculose_protocolo_1.txt,"Para evitar sequelas, recomenda-se aos pacientes que a fisioterapia, em casos de tuberculose meningoencefálica, seja iniciada o mais cedo possível. | edúaS 4.2. consideRações sobRe o tRataMento Em todos os esquemas de tratamento, os medicamentos deverão ser ingeridos diariamente e de uma única vez. considerações: o tratamento das formas extrapulmonares tem a duração de seis meses, exceto as formas meningoencefálica e osteoarticular. o tratamento da tb em pVHiV tem a duração de seis meses, independentemente da fase de evolução da infecção viral (ver capítulo esquemas de tratamento para a tuberculose). em casos individualizados, independentemente da presença de outras morbidades, quando a tb apresentar evolução clínica não satisfatória, o tratamento poderá ser prolongado na sua segunda fase, de quatro para sete meses.",406,What is the duration of the treatment for TB?
tuberculose_protocolo_1.txt,"Modalidades de tRataMento o tratamento será realizado em regime ambulatorial, preferencialmente em regime de tratamento diretamente observado (tdo) (ver capítulo adesão). a hospitalização é recomendada nos seguintes casos: tb meningoencefálica; intolerância aos medicamentos antitb incontrolável em ambulatório; estado geral que não permita tratamento em ambulatório; intercorrências clínicas e/ou cirúrgicas relacionadas ou não à tb que necessitem de tratamento e/ou procedimento em unidade hospitalar; e maior possibilidade de abandono, especialmente se for um caso de retratamento, falência ou multirresistência. o período de internação deve ser reduzido ao mínimo possível, limitando-se ao tempo suficiente para atender às razões que determinaram sua indicação.",408,What is the preferred method of treatment for ambulatory patients?
tuberculose_protocolo_1.txt,"Gestação a vulnerabilidade apresentada pela mulher nessa fase, agravada pela doença, torna a tuberculose na gestação um desafio para os serviços de saúde.",409,What is the vulnerabilidade apresentada pela mulher nessa fase?
tuberculose_protocolo_1.txt,"O tratamento da TB, além de importante para a condição da gestante, diminui o risco de transmissão ao feto, ao recém- nato e aos que coabitam na mesma residência. o esquema básico pode ser administrado nas doses habituais para gestantes e, dado risco de toxicidade neurológica ao feto atribuído à isoniazida, recomenda-se o uso de piridoxina (50mg/dia).",410,What is the risk of toxicity to the feto attributed to isoniazida?
tuberculose_protocolo_1.txt,Hepatopatias pelas interações medicamentosas e o uso de doses acima das preconizadas.,413,What is the use of doses acima das preconizadas?
tuberculose_protocolo_1.txt,"É importante considerar o peso do paciente no momento da prescrição do medicamento, durante todo o tratamento, visando a evitar dose excessiva. em pequeno percentual dos pacientes, observa-se, nos dois primeiros meses de tratamento, elevação assintomática dos níveis séricos das enzimas hepáticas, sem qualquer manifestação clínica e sem necessidade de interrupção ou alteração do esquema terapêutico, seguida de normalização espontânea. cinco vezes o valor normal em pacientes sem sintomas digestivos, três vezes o valor normal, acompanhado de sintomas dispépticos, ou logo que a icterícia se manifeste.",414,What is the most important factor to consider when prescribing a medicament?
tuberculose_protocolo_1.txt,"É recomendado e laboratorial, além da adequação do tratamento, caso seja necessário. após a interrupção do tratamento, se houver redução dos níveis séricos das enzimas hepáticas e resolução dos sintomas, indica-se a reintrodução do esquema básico da seguinte maneira: rifampicina + etambutol, seguida pela isoniazida, e por último a pirazinamida, com intervalo de três a sete dias entre elas. a reintrodução de cada medicamento deverá ser precedida da análise da função hepática. o tempo de tratamento será considerado a partir da data em que foi possível retomar o esquema terapêutico completo. se a dosagem das enzimas hepáticas não reduzir para menos de três vezes o limite superior da normalidade, em quatro semanas ou em casos graves de tuberculose, disfunção hepática e/ou cirrose prévia, iniciar esquema alternativo (quadro 24). deve ser avaliada, individualmente, a necessidade de realização de prova de função hepática antes do início do esquema básico em alcoolistas, pois as mesmas podem estar alteradas. hepatopatias, por apresentarem maior risco de hepatotoxicidade, recomenda-se realização de do esquema especial.",415,What is the tempo of treatment considered?
tuberculose_protocolo_1.txt,"QUADRO 24 – condutas frente a hepatopatias PACIENTES COM 9 RELfx* DOENÇA HEPÁTICA TGO / TGP > 5 x LSN(*) ou sem cirrose 5 Cm E Lfx / 7 E Lfx* PRÉVIA: hepatite 3 viral aguda; TGO / TGP < 5 x LSN(*) Esquema Básico (viral, autoimune, criptogênica); com cirrose 5 Cm E Lfx / 7 E Lfx* hepatopatia alcoólica; 3 esteatose hepática.",416,What is the name of the virus that is hepatopatias?
tuberculose_protocolo_1.txt,"TGO / TGP ≥ 5 x lSN(*) Interromper o Reintrodução: (sem sintomas) tratamento. (RE → RE+H → REHZ) TGO / TGP ≥ 3 x lSN(*) hepática (cada 3 a 7 ou Início de Esquema PACIENTES SEM (com sintomas, incluindo dias) até normalização Especial (ver quadro 33) DOENÇA HEPÁTICA a presença de icterícia) PRÉVIA: com hepatotoxicidade casos graves de tb ou hepática (cada 3 a 7 ao esquema básico. dias) até normalização 5 Cm E Lfx / 7 E Lfx* Se após 4 semanas Níveis de TGO / TGP ≥ 3 x lsn(*) TGO / TGP ≥ 3 x LSN(*) Fonte: Adaptado de BRASIl, 2011.",417,What is the hepatotoxicity of hepatica?
tuberculose_protocolo_1.txt,"TGO – Transaminase glutâmico-oxalacética; TGP – Transaminase glutâmico-pirúvica; LSN – Limite superior da normalidade; R – Rifampicina; E – Etambutol; Lfx – Levofloxacino; Cm – Capreomicina; H – Isoniazida; Z – Pirazinamina. *O primeiro número indica o tempo de tratamento (em meses), o segundo número indica a quantidade de dias du- rante a semana.",418,What is the first nmero indica a tempo de tratamento?
tuberculose_protocolo_1.txt,"Quando não há descrição, consideram-se sete dias na semana. (*) Limite superior da normalidade. observações: As fluoroquinolonas induzem à resistência microbiana em curto período, por isso recomenda-se fortemente o tratamento diretamente observado. utilização prévia da estreptomicina. 4.4.3.",419,What is the limit of normality?
tuberculose_protocolo_1.txt,"Nefropatias (clearance) antes de iniciar o esquema terapêutico, para que sejam ajustadas as doses dos medicamentos que apresentam eliminação renal (quadro 25). sanguínea nos rins. ajuda a detectar e a diagnosticar disfunção renal e/ou diminuição do fluxo sanguíneo renal.",420,What is the name of the drug that is used to treat renal disease?
