Arquivo,Parágrafo,Número do parágrafo,Pergunta
adenovirus_guia_1txt_guiavsa2023.txt,"Reforça-se que, para encerrar o monitoramento de contatos, é necessário preencher o campo “Resultado do monitoramento para o contato”, campo de caráter obrigatório entre o 1º e o 14º dia, selecionando uma das opções disponíveis no sistema (Brasil,2022a). ` OBSERVAÇÃO Em situação de surto, para as pessoas assintomáticas com resultado de teste negativo, ao preencher a opção “Descartado” no campo “Evolução do caso”, para o encerramento, orienta-se selecionar a opção “Cancelado”.",219,"What is the need to preencher a campo ""Resultado do monitoramento para o contato""?"
adenovirus_guia_1txt_guiavsa2023.txt,"A notificação não aparecerá na busca no sistema, porém, ao fazer o download do banco, a ficha de notificação é visualizada pelo notificante. 2.5.3 SURTO DE SÍNDROME GRIPAL (SG) SUSPEITO PARA COVID-19 EM AMBIENTES FECHADOS/RESTRITOS É considerado como surto de SG suspeito para covid-19 a ocorrência de pelo menos 3 casos de SG em ambientes fechados/restritos, com intervalo de até 7 dias entre as datas de início de sintomas dos casos e vínculo epidemiológico estabelecido.",220,What is the name of the surto?
adenovirus_guia_1txt_guiavsa2023.txt,"São considerados, para este fim, como ambientes fechados/restritos: • Instituições de longa permanência (ILPs), por exemplo: asilos e clínicas de repouso. • Unidades prisionais ou correcionais. • Bases militares. • Um mesmo setor de um serviço de saúde, por exemplo: UTI, enfermaria, entre outros. • A mesma turma em uma creche ou escola. • População albergada. • Dormitórios coletivos. • Uma mesma unidade ou setor de uma instituição/empresa ou correlatos (exceto serviços de saúde).",221,What are the ambientes considered fechados/restritos?
adenovirus_guia_1txt_guiavsa2023.txt,"A partir da ocorrência do aumento de casos de SG em ambientes fechados/restritos, 100% dos casos devem ser testados para covid-19.",222,What is the ocorrência of casos de SG?
adenovirus_guia_1txt_guiavsa2023.txt,"A testagem pode ser realizada por RT-qPCR ou TR-Ag, a depender da disponibilidade local.",223,What testagem can be performed by RT-qPCR or TR-Ag?
adenovirus_guia_1txt_guiavsa2023.txt,"GUIA DE VIGILÂNCIA INTEGRADA DA COVID-19, INFLUENZA E OUTROS A partir do resultado da testagem realizada para os casos de SG suspeitos de covid-19, a confirmação de 3 casos de SG para covid-19 é definida como surto de covid-19.",224,What is the name of the test that was performed for the covid-19?
adenovirus_guia_1txt_guiavsa2023.txt,"Na identificação de surto de covid-19 em ambientes fechados/restritos, recomenda-se a intensificação das medidas de prevenção e controle não farmacológicas, como isolamento dos casos confirmados e uso de máscaras faciais, higienização das mãos e etiqueta respiratória, conforme descrito no item 6 – “Medidas de prevenção e controle não farmacológicas para vírus respiratórios” (inserir link para o capítulo de medidas de prevenção e controle) deste documento.",225,What is the recommended intensification of medidas of prevenço e controle no farmacológicas?
adenovirus_guia_1txt_guiavsa2023.txt,"Na suspeita inicial de SG para covid-19, todos os casos, individualmente, devem ser notificados no sistema e-SUS Notifica.",226,What is the name of the system that can be used to notific a case?
adenovirus_guia_1txt_guiavsa2023.txt,"Se o resultado for negativo para covid-19, os casos suspeitos devem ser encerrados como “caso descartado"" no e-SUS Notifica.",227,What is the result of negative for covid-19?
adenovirus_guia_1txt_guiavsa2023.txt,"Se o resultado for positivo para covid-19, o caso deve ser encerrado no e-SUS Notifica como “caso confirmado” por critério laboratorial.",228,What is the result of covid-19?
adenovirus_guia_1txt_guiavsa2023.txt,"Os surtos de covid-19 devem ser comunicados à vigilância epidemiológica em até 24 horas, conforme fluxos já estabelecidos e conforme Portaria de Doenças de Notificação Compulsória (BRASIL, 2022e).",229,What is the name of the project that will be used to inform the public about the outbreaks?
adenovirus_guia_1txt_guiavsa2023.txt,"Ressalta-se que o surto deve ser notificado no Módulo de Surto do Sistema de Informação de Agravos de Notificação (Sinan NET), assinalando o CID J06, no campo Código do Agravo/Doença da Ficha de Investigação de Surto, com a observação de se tratar de um surto de covid-19.",230,What is the CID J06?
adenovirus_guia_1txt_guiavsa2023.txt,"Nessa ficha, os casos são notificados de forma agregada.",231,What is the name of the case that is notificated in agregada?
adenovirus_guia_1txt_guiavsa2023.txt,"Contudo, conforme já mencionado, notificação individual também é requerida no e-SUS Notifica.",232,What is the name of the individual notificado?
adenovirus_guia_1txt_guiavsa2023.txt,"Para efeito operacional, diante da ocorrência de surtos de SG, apenas os casos que preencham a de transmissão.",233,What is the ocorrência of surtos de SG?
adenovirus_guia_1txt_guiavsa2023.txt,"A inclusão dos demais casos identificados posteriormente não será necessária, mesmo que possuam vínculo epidemiológico.",234,What is the reason for the inclusion of demais cases?
adenovirus_guia_1txt_guiavsa2023.txt,"IMPORTANTE: em algumas situações de surto, pode-se considerar a coleta de um número maior de amostras para pesquisa laboratorial de outros vírus respiratórios.",235,What is the importance of a coleta in a surto?
adenovirus_guia_1txt_guiavsa2023.txt,"A necessidade deverá ser discutida e acordada entre as equipes da vigilância epidemiológica e laboratorial local (unidade federada e/ou município), para que não ocorra prejuízo nas informações ou mesmo impacto na resposta da rede. ` ENCERRAMENTO DO SURTO Considera-se como encerrado o surto de covid-19 quando decorridos 10 dias após a data de início de sinais e/ou sintomas (caso confirmado sintomático) ou após a data da coleta do exame (caso confirmado assintomático) do último caso, sem a presença e/ou aparecimento de um novo caso nesse período. 2.6 MEDIDAS DE PREVENÇÃO E CONTROLE 2.6.1 VACINAÇÃO As vacinas contra a covid-19 tiveram grande impacto na redução da morbimortalidade da doença, evitando milhares de óbitos e internações no Brasil, desde a sua introdução em janeiro de 2021 (Brasil, 2020q).",236,What is the need to discuss the need for a surto?
adenovirus_guia_1txt_guiavsa2023.txt,"A despeito da elevada eficácia e efetividade das vacinas contra a covid-19 monovalentes, em particular para prevenção de casos graves e óbitos, foi observada uma queda importante da proteção com as diferentes vacinas com o tempo após a vacinação, principalmente nas faixas etárias de idosos, sendo essa queda mais proeminente com a variante Ômicron.",237,What is the eficacia of vacinas?
adenovirus_guia_1txt_guiavsa2023.txt,"Visando à recuperação da resposta protetora da vacinação, foi recomendada a administração de doses de reforços nas diferentes faixas etárias. e formas graves da covid-19, inclusive para a variante Ômicron.",238,What is the variante micron?
adenovirus_guia_1txt_guiavsa2023.txt,"Ainda, observou-se aumento de proteção com um segundo reforço em indivíduos acima de 60 anos de idade, em que a efetividade de uma quarta dose em relação à terceira foi de 55% para doença sintomática, 68% para hospitalização por covid-19 e 74% para o óbito.",239,What was the quarta dose of covid-19?
adenovirus_guia_1txt_guiavsa2023.txt,"Para a população de trabalhadores da saúde, foi observada uma eficácia de 43% para prevenção de doença sintomática com a quarta dose da vacina (Brasil, 2023e).",240,What is the effect of vacina on the population?
adenovirus_guia_1txt_guiavsa2023.txt,"A vacinação foi recomendada, também, para crianças a partir de 6 meses de idade, com 3 doses da Pfizer (tampa vinho) para crianças de até 4 anos de idade.",242,What is the recommended dose of tampa vinho?
adenovirus_guia_1txt_guiavsa2023.txt,"O PNI recomendou, ainda, a administração de uma dose de reforço na população entre 3 e 4 anos, para as crianças que começaram o esquema vacinal com a CoronaVac; 5 a 11 anos; 12 a 39 anos de idade; e 2 doses de reforço na população de 40 anos ou mais e na população de trabalhadores da saúde, independentemente da faixa etária (Brasil, 2023e). da administração das doses de reforço monovalente, há que se considerar que evoluções no cenário epidemiológico podem impactar no benefício esperado com as diferentes estratégias de vacinação.",243,What is the reforço monovalent dose?
adenovirus_guia_1txt_guiavsa2023.txt,"Nesse contexto, é importante mencionar que uma parcela significativa da população já teve contato prévio com a covid-19 e que há evidências na literatura que a infecção prévia aliada a pelo menos 2 doses de vacinas monovalentes traz elevada proteção para formas graves da covid-19, incluindo a variante Ômicron e as subvariantes BA.1 e BA.2.",244,What is the significance of a parcel of a populaço?
adenovirus_guia_1txt_guiavsa2023.txt,"Para a doença sintomática, no entanto, as maiores taxas de proteção foram observadas com 3 doses da vacina mais infecção prévia pela covid-19 (Link-Gelles et al., 2022).",245,What was the main taxas of proteço observed com 3 doses of vacina?
adenovirus_guia_1txt_guiavsa2023.txt,A avaliação do calendário para vacinas contra a covid-19 e a necessidade de novas ações foi priorizada e discutida amplamente pelo PNI em 2023.,246,What was the prioritization of the calendário for vacinas?
adenovirus_guia_1txt_guiavsa2023.txt,"O principal objetivo da vacinação é a redução da morbimortalidade causada pela doença, assim como a proteção da força de trabalho para manutenção do funcionamento dos serviços de saúde e serviços essenciais.",247,What is the main goal of vacination?
adenovirus_guia_1txt_guiavsa2023.txt,"Considerando dados epidemiológicos e científicos, atualização de vacinas de acordo com o surgimento de variantes, GUIA DE VIGILÂNCIA INTEGRADA DA COVID-19, INFLUENZA E OUTROS aprovações regulatórias e disponibilidade de imunizantes, novas recomendações sobre doses de reforço e público elegível foram necessárias.",248,What is the main reason for the need for imunizations?
adenovirus_guia_1txt_guiavsa2023.txt,"Diante disso, a vacina bivalente contra a covid-19 Comirnaty (Pfizer/Biontech) foi adaptada às variantes Ômicron BA.1 e BA.4/BA.5, sendo composta por 2 sequências de RNA mensageiro (RNAm) – uma de 15 mcg com codificação para a proteína Spike da Ômicron (BA.1 ou BA.4/5) e outra de 15 mcg com codificação para a proteína Spike original. a vacina bivalente diferente da vacina monovalente (Brasil, 2023e).",249,What is the name of the vacina bivalente?
adenovirus_guia_1txt_guiavsa2023.txt,A autorização para uso emergencial dessa vacina pela Anvisa foi embasada em dados pré-clínicos e clínicos em que as vacinas bivalentes foram utilizadas como dose de reforço.,250,What is the name of the vacina that was approved by Anvisa?
adenovirus_guia_1txt_guiavsa2023.txt,Os resultados mostraram subvariantes em comparação com as vacinas monovalentes atualmente disponíveis.,251,What subvariantes do resultados mostraram em comparaço com as vacinas monovalentes atualmente disponveis?
adenovirus_guia_1txt_guiavsa2023.txt,Adiciona-se a isso sendo usada como reforço.,252,What is the name of the reforço?
adenovirus_guia_1txt_guiavsa2023.txt,"A mesma autorização já foi concedida pelo Food and Drug Administration (FDA) e pela European Medicines Agency (EMA), agências regulatórias de saúde dos Estados Unidos e da União Europeia, assim como outras agências regulatórias no mundo. com 12 anos de idade ou mais.",253,What is the age of the drug?
adenovirus_guia_1txt_guiavsa2023.txt,"Em 2023, a vacina bivalente foi recomendada para toda a população a partir de 18 anos de idade ou mais, e para imunocomprometidos a partir de 12 anos de idade, como dose de reforço, com o intervalo mínimo de 4 meses a partir da última dose monovalente recebida, condicionadas ao recebimento prévio de pelo menos 2 doses de vacinas monovalentes a covid-19 (Brasil, 2023c).",254,What is the current recommended dose of vacina bivalente?
adenovirus_guia_1txt_guiavsa2023.txt,"Desde o início de 2024, conforme recomendado pelo Grupo Consultivo Estratégico de Especialistas em Imunização (SAGE), da Organização Mundial da Saúde, o Brasil está recomendando a vacina periódica contra a covid-19 para o grupo de maior risco, composto por gestantes e puérperas, trabalhadores da saúde, imunocomprometidos e idosos (60 anos ou mais).",255,What is the brasilian group's recommendation for a vacina periódica?
adenovirus_guia_1txt_guiavsa2023.txt,"Além disso, o Programa Nacional de Imunizações (PNI) adaptou a recomendação da OMS e incluiu grupos com maior vulnerabilidade na realidade brasileira na indicação de vacinação periódica: indígenas, ribeirinhos, quilombolas, pessoas vivendo em instituições de longa permanência (e seus trabalhadores), pessoas com deficiência permanente, pessoas com comorbidades, pessoas privadas de liberdade (≥18 anos), adolescentes e jovens cumprindo medidas socioeducativas e pessoas em situação de rua (Brasil, 2024).",256,What group of people did PNI include in its recomendaço?
adenovirus_guia_1txt_guiavsa2023.txt,"Considerando ainda que a infecção pelo SARS-CoV-2 é uma importante causa de infecção respiratória grave e de morte em crianças menores de 5 anos, principalmente entre os menores de 1 ano de idade, decidiu-se pela inclusão da vacinação contra a covid-19 no Calendário Nacional de Vacinação infantil (Brasil, 2024).",257,What is the reason for the infecço pelo SARS-CoV-2?
adenovirus_guia_1txt_guiavsa2023.txt,"Em maio de 2024, o PNI atualizou a operacionalização da vacinação contra a covid-19 por meio da inclusão da vacina atualizada para a variante XBB 1.5 da fabricante Moderna, após a aprovação do registro definitivo pela Anvisa.",258,What was the name of the product that was apposed to the PNI?
adenovirus_guia_1txt_guiavsa2023.txt,"A vacina está indicada para a prevenção da covid-19 em crianças a partir de 6 meses de idade e em adultos (Brasil, 2024b).",259,What is the vacina indicada for?
adenovirus_guia_1txt_guiavsa2023.txt,"Ressalta-se ainda que as recomendações em relação à vacinação contra a covid-19 são dinâmicas e poderão ser modificadas a depender da mudança do cenário epidemiológico, do surgimento de novas variantes, da disponibilidade de novas vacinas e de aprovações regulatórias por parte da Anvisa. 2.6.2 MEDIDAS NÃO FARMACOLÓGICAS Para redução da transmissibilidade de vírus respiratórios, além da vacinação, o MS continua reforçando a importância da adoção do conjunto de medidas não farmacológicas de prevenção e controle, que devem ser utilizadas de forma integrada e incluem: isolamento dos casos confirmados de covid-19; uso de máscaras; etiqueta respiratória; higienização das mãos com álcool 70% ou água e sabão; ventilação, limpeza e desinfecção adequada de ambientes (Brasil, 2023f; Brasil, 2023g). no item 6 deste documento – “Medida de prevenção e controle não farmacológicas para vírus respiratórios” –, uma vez que são medidas aplicadas para qualquer vírus respiratório de importância em saúde pública.",260,What is the definition of a medida?
adenovirus_guia_1txt_guiavsa2023.txt,"No entanto, as orientações acerca do isolamento e da quarentena para covid-19 estão descritas a seguir, em função da especificidade do SARS-CoV-2. ` ISOLAMENTO E QUARENTENA PARA COVID-19 evitar a disseminação de doenças contagiosas, como a covid-19.",261,What isolamento and quarentena are described as?
adenovirus_guia_1txt_guiavsa2023.txt,"O isolamento é a separação de indivíduos infectados dos não infectados durante o período de transmissibilidade da doença, quando é possível transmitir o patógeno em condições de infectar outra pessoa.",262,What is the isolamento?
adenovirus_guia_1txt_guiavsa2023.txt,"A quarentena é uma medida contagiosa durante o período em que elas podem ficar doentes (Brasil, 2022f).",263,What is the name of the medida contagiosa during the perodo?
adenovirus_guia_1txt_guiavsa2023.txt,"ORIENTAÇÕES PARA ISOLAMENTO DE CASOS DE COVID-19 • Para indivíduos com quadro de SG leve com confirmação para covid-19 por qualquer um dos critérios (laboratorial ou clínico-epidemiológico) ou que ainda não coletaram amostra biológica para investigação etiológica devem (Quadro 3 – resumo): » iniciar o isolamento respiratório domiciliar imediatamente, o qual poderá ser sus- penso ao final do 7º dia completo do início dos sintomas, se estiver afebril, sem o uso de medicamentos antitérmicos, há pelo menos 24 horas e com remissão dos sintomas respiratórios, sem a necessidade de realizar novo teste de biologia molecular ou TR-Ag.",264,What is the earliest you can do a isolamento respiratório?
adenovirus_guia_1txt_guiavsa2023.txt,"Nesse caso, devem ser mantidas as medidas adicionais (disponíveis no Quadro 4), incluindo o uso de máscaras até o 10º dia completo do início dos sintomas; GUIA DE VIGILÂNCIA INTEGRADA DA COVID-19, INFLUENZA E OUTROS » caso o indivíduo tenha acesso à testagem em serviço de saúde, o isolamento respira- tório domiciliar pode ser reduzido e suspenso ao final do 5º dia completo do início dos não reagente para TR-Ag realizado no 5º dia completo do início dos sintomas, desde que permaneça afebril, sem o uso de medicamentos antitérmicos há pelo menos 24 horas E com remissão dos sintomas respiratórios.",265,What is the final dose of the isolamento respira- tório domiciliar?
adenovirus_guia_1txt_guiavsa2023.txt,"Importante ressaltar que devem ser mantidas as medidas adicionais (disponíveis no Quadro 4), incluindo o uso de máscaras até o 10º dia completo; » caso o indivíduo permaneça sem melhora dos sintomas respiratórios ou tiver febre no 7º dia completo após o início dos sintomas, OU se apresentar novo exame positivo para SARS CoV-2 realizado a partir do 5º dia completo do início dos sintomas, deve ser mantido o isolamento respiratório domiciliar até o 10º dia completo.",266,What is the condition for which OU must pass a positive exam?
adenovirus_guia_1txt_guiavsa2023.txt,"Ademais, caso o indivíduo não consiga usar máscara quando estiver próximo a outras pessoas, o isolamento deve ser de 10 dias completos após o início dos sintomas.",267,What is the cost of a 10 day isolamento?
adenovirus_guia_1txt_guiavsa2023.txt,"Dia 0 é o dia do início dos sintomas, e o dia 1 é o primeiro dia completo após o início dos sintomas (24 horas), e assim sucessivamente.",268,What is the first dia of a complete day?
adenovirus_guia_1txt_guiavsa2023.txt,"Quadro-resumo para recomendações para isolamento em pacientes imunocompetentes com síndrome gripal por covid-19 (quadros não graves) PACIENTES IMUNOCOMPETENTES COM SG POR COVID-19 (QUADROS LEVES) Tempo do 5 DIAS COMPLETOS 7 DIAS COMPLETOS 10 DIAS COMPLETOS Condição Ao 5º dia completo*, se o Ao 7º dia completo*, Ao 10º dia completo, 24 horas. antitérmicos há pelo antitérmicos há pelo menos 24 horas. menos 24 horas.",269,What is the syndrome gripal por covid-19?
adenovirus_guia_1txt_guiavsa2023.txt,Teste Com testagem no 5º dia com Não é necessário testar Não é necessário testar RT-qPCR ou TR-Ag. para suspender o para suspender o isolamento. isolamento.,270,What is the test that is required to test?
adenovirus_guia_1txt_guiavsa2023.txt,PACIENTES IMUNOCOMPETENTES COM SG POR COVID-19 (QUADROS LEVES) Tempo do 5 DIAS COMPLETOS 7 DIAS COMPLETOS 10 DIAS COMPLETOS NÃO DETECTADO/ DETECTADO/ REAGENTE NÃO do isolamento isolamento após 7 dias completos no 10º dia completo isolamento após 5 dias até o 10º dia e manter as medidas do início dos sintomas completos completo do adicionais até o 10º dia e manter as medidas as medidas sintomas. sintomas**. controle***. até o 10º dia sintomas**.,271,What is the name of the systme that is used to describe the systme?
adenovirus_guia_1txt_guiavsa2023.txt,"Fonte: Brasil, 2022f. *Dia completo: o dia 0 é o dia do início dos sintomas, e o dia 1 é o primeiro dia completo (24 horas) após o início dos sintomas, e assim sucessivamente. **Medidas adicionais a serem adotadas até o 10º dia completo do início dos sintomas nos casos de término de isolamento a partir do 5º dia: • Usar máscara bem ajustada ao rosto, preferencialmente cirúrgica ou PFF2/N95, em casa ou em público. • Evitar contato com pessoas imunocomprometidas ou que apresentem fatores de risco para agravamento da covid-19, como também locais com aglomerações de pessoas, como transporte público ou onde não seja possível manter o distanciamento físico. • Evitar frequentar locais onde não possa ser usada a máscara durante todo o tempo, como restaurantes e bares. • Evitar comer próximo a outras pessoas tanto em casa como no trabalho. • Evitar viajar durante o período.",272,What is the first dia of the incio of sintomas?
adenovirus_guia_1txt_guiavsa2023.txt,"Atenção: • Caso esses indivíduos não consigam usar máscara quando estiverem próximos a outras pessoas, o isolamento deve ser de 10 dias completos após o início dos sintomas. • O autoteste rápido de antígeno não é recomendado para fins de redução do período de isolamento.",273,What is the smallest amount of time that a person can use the autoteste rápido de antgeno?
adenovirus_guia_1txt_guiavsa2023.txt,"Medidas adicionais a serem adotadas até o 10º dia completo do início dos sintomas/data da coleta nos casos de suspensão do isolamento a partir do 5º dia completo para casos leves/assintomáticos • Usar máscara bem ajustada ao rosto, preferencialmente cirúrgica ou PFF2/N95, em casa ou em público. • Evitar contato com pessoas imunocomprometidas ou que apresentem fatores de risco para agravamento da covid-19, como também locais com aglomerações de pessoas, como transporte público ou onde não seja possível manter o distanciamento físico. • Evitar frequentar locais onde não possa ser usada a máscara durante todo o tempo, como restaurantes e bares. • Evitar comer próximo a outras pessoas, tanto em casa quanto no trabalho. • Evitar viajar durante o período.",274,What is the recommended time to eat out?
adenovirus_guia_1txt_guiavsa2023.txt,"GUIA DE VIGILÂNCIA INTEGRADA DA COVID-19, INFLUENZA E OUTROS • Para indivíduos assintomáticos confirmados laboratorialmente para covid-19 (resultado detectável pelo método RT-qPCR ou teste rápido para detecção de antígeno para SARS-CoV-2): » iniciar o isolamento respiratório domiciliar imediatamente, o qual poderá ser sus- penso no 7º dia completo após a data da coleta da amostra, sem a necessidade de realizar novo teste, desde que permaneçam assintomáticos durante todo o período.",275,What is the name of the test that can be performed to confirm the isolamento respiratório?
adenovirus_guia_1txt_guiavsa2023.txt,"Nesse caso, devem ser mantidas as medidas adicionais até o 10º dia completo da coleta da amostra, descritas no Quadro 4; » caso o indivíduo tenha acesso à testagem, o isolamento respiratório domiciliar pode ser reduzido e suspenso no 5º dia completo a contar da data da primeira coleta, desde para teste de biologia molecular ou não reagente para TR-Ag realizado no 5º dia completo a contar da data da primeira coleta.",276,What isolamento respiratório domiciliar can be reduzido and suspenso no 5o dia completo a contar da primeira coleta?
