Arquivo,Parágrafo,Número do parágrafo,Pergunta
hantavirose_manual_1.txt,"Desta forma, a supervisão das etapas deve gerar relatórios específicos (diários) e gerais (mensais), replanejamento das ações.",820,"What is the definition of a ""mensais""?"
hantavirose_manual_1.txt,São importantes indicadores: • Aumento/redução do número de solicitações ou denúncias; • Consumo de raticida; • Freqüência de repasses necessários numa determinada área; • Número de intervenções de prevenção realizadas; • % da população atingida nas atividades de educação em saúde; • Aumento ou redução de notificações/ocorrências de agravos à saúde transmitidos por roedores e vetores.,821,What are the important indicators of agrarian agravation?
hantavirose_manual_1.txt,Foto 71 - Reunião técnico-operacional envolvendo a população nos resultados obtidos de um programa de Foto cedida por Nyrad Menzen.,822,What is the name of the program that envolved a populaço?
hantavirose_manual_1.txt,É importante a supervisão do trabalho de campo e realização sistemática de reuniões com as equipes técnico- operacionais e o envolvimento da população visando avaliar os resultados e eventuais ajustes que se fizerem necessários.,823,What is the importance of the trabalho de campo?
hantavirose_manual_1.txt,FUNASA - dezembro/2002 - pág. 100 Capítulo 6 controle .,824,What is the name of the captulo that is used to control the FUNASA?
hantavirose_manual_1.txt,"Este treinamento exigirá do instrutor a utilização de uma dinâmica, criativa, participativa para que haja melhor compreensão do conteúdo e dos objetivos do programa de controle de roedores, para que os objetivos do programa sejam alcançados. identificação dos vestígios e tipo de infestação de roedores.",825,What is the requirement of a dinâmica?
hantavirose_manual_1.txt,"Será necessário o reconhecimento dos sinais mais evidentes como trilhas, alimentos danificados, tocas, fezes, odor de urina, bem como a identificação da espécie infestante, se possível.",826,What is a sinais that is evident?
hantavirose_manual_1.txt,Devem ser previstas atividades de campo para assimilação e a apropriação das atividades práticas.,827,What are the atividades práticas?
hantavirose_manual_1.txt,"Os participantes do curso, por sua vez, necessitam de momento para discussão em pequenos grupos e em plenárias, discutindo e trocando suas experiências e seus conhecimentos empíricos relativos a roedores em sua comunidade.",828,What do participants do curso need to discuss in a group?
hantavirose_manual_1.txt,"Foto 72 - Atividade prática de orientação para população e tratamento, realizada por agente de zoonoses Foto cedida por Minekazu Matsuo.",829,What is the name of the project that is done by a zoonoses agent?
hantavirose_manual_1.txt,"Estudos de casos, debates, trabalhos em grupo, utilização de material áudio visual adequado, visitas a campo, inspeção de locais infestados, entrevistas a moradores de áreas problema, preenchimento de fichas de atividades de controle de roedores, atividades de inspeção e cadastramento, são algumas das possíveis formas de apresentação do conteúdo teórico.",830,What are some of the possible forms of apresentaço do contedo teórico?
hantavirose_manual_1.txt,O referido treinamento deverá constar de: 6.1.,831,What is the referido treinamento?
hantavirose_manual_1.txt,"Noções básicas sobre a biologia e comportamento dos roedores, hábitat, 6.1.2.",832,What are the básicas about a biologia and comportamento dos roedores?
hantavirose_manual_1.txt,"Noções sobre medidas preventivas no controle de roedores, tais como: • Remoção de entulhos residenciais; • Acondicionamento e destino adequado do lixo; • Limpeza e manutenção de galerias de águas pluviais e esgotos; • Limpeza local e remoção de resíduos alimentares de feiras livres, mercados municipais e congêneres; • Manutenção e limpeza de praças, terrenos baldios, logradouros públicos e mercados municipais; • Armazenamento adequado de cereais e gêneros alimentícios.",833,What are some of the preventive measures?
hantavirose_manual_1.txt,FUNASA - dezembro/2002 - pág. 101 Foto 73 - Limpeza de áreas externas para evitar a instalação de roedores no local Foto cedida por Edmar Chaperman. 6.1.3.,834,What is the name of the photo taken by Edmar Chaperman?
hantavirose_manual_1.txt,"Etapas para implantação de um programa de controle na comunidade • Visita às autoridades locais, visando à sensibilização para o problema; • Medidas cautelares devem ser tomadas para que a população, tanto urbana quanto rural, não seja surpreendida durante o levantamento da situação e nas atividades de controle de roedores; • A primeira etapa de um programa de controle deverá ser iniciada com ampla divulgação pelos meios de etapas do programa.",835,What is the first step of a programa de controle?
hantavirose_manual_1.txt,"Rádio, televisão, jornais, “folders” ou folhetos, carros de som, poderão dar início ao trabalho de mobilização e sensibilização da população para o problema roedor e medidas a serem acionadas; • Ações educativas na comunidade a fim de esclarecê-la quanto aos agravos à saúde pela transmissão de várias doenças causadas pelos roedores, além de mordeduras em pessoas; • Prejuízos econômicos gerados pelos roedores tais como o alto consumo de rações animais, contaminação de alimentos por fezes, urina, saliva e pêlos, roeduras de cabos e fios elétricos, danificando os equipamentos e podendo causar incêndios; • Necessidade de se realizar o levantamento e posterior tratamento da área; A população deve receber informações precisas da real necessidade do tratamento que está sendo realizado. das ações de controle.",836,What is a common problem of roedores?
hantavirose_manual_1.txt,Foto 74 - Mulher lavando roupa em esgoto em área de risco Foto cedida dos arquivos do Centro de Controle de Zoonoses de São Paulo.,837,What is the name of the animal that lavando roupa?
hantavirose_manual_1.txt,FUNASA - dezembro/2002 - pág. 102 • Fatores predisponentes à instalação e proliferação de roedores .,838,What is the name of the group that is a proponent of the installation and proliferaço of roedores?
hantavirose_manual_1.txt,"Deverá ser desenvolvido um trabalho educativo junto às famílias, aos comerciantes, a industriais e à comunidade, instalação e proliferação de roedores.",839,What is the purpose of a trabalho educativo?
hantavirose_manual_1.txt,Foto 75 - Educação da população Foto cedida por Eloy Yanes Martin. 6.1.4.,840,What is the name of the photo?
hantavirose_manual_1.txt,"Ações educativas na comunidade referentes a: • Técnicas de abordagem nas visitas domiciliares, na unidade de serviço, em escolas, etc.",841,What are the types of educational activities in the community?
hantavirose_manual_1.txt,"Qualquer tipo de abordagem pessoal deverá ser realizada por técnicos devidamente treinados, com amplo conhecimento do assunto, a fim de fornecerem informações e esclarecer as dúvidas da população local. • Principais doenças transmitidas por roedores e /ou seus ectoparasitas (leptospirose, peste, hantavirus, brucelose, salmonelose e outras).",842,What is the name of the pessoal that is a tehnico?
hantavirose_manual_1.txt,Aspectos da prevenção de doenças transmitidas por roedores tais como: • Não permitir que crianças brinquem em águas de enxurrada; • Não permitir que crianças brinquem com roedores mortos ou manipulem excretas ou secreções; • Evitar freqüentar lixões; • Desprezar alimentos roídos ou com excretas de roedores para fins de consumo humano ou animal; • Usar equipamentos de proteção individual ao limpar locais frequentados por roedores; • Procurar assistência médica imediata quando houver suspeita clínica de leptospirose ou outra enfermidade associada à exposição direta ou indireta a excretas de roedores; 6.1.5.,843,What are some of the aspects of the prevention of doenças transmitted by roedores?
hantavirose_manual_1.txt,"Medidas de controle ambiental • Melhorias do ambiente a fim de se corrigirem irregularidades que predisponham a instalação e proliferação de roedores; • Acondicionamento e disposição adequada do lixo doméstico; • Remoção e destino correto de entulhos de construção domiciliar como material de demolição, telhas, tijolos, madeiras, caixas de papelão, etc; • Não permitir sobras alimentares dos animais domésticos principalmente ao anoitecer, por ser hábito dos roedores se alimentarem destas sobras; • Cuidados com caixas de água, cisternas, vazamentos e águas paradas.",844,What is the main purpose of anoitecer?
hantavirose_manual_1.txt,FUNASA - dezembro/2002 - pág. 103 6.2.,845,What is FUNASA's dezembro/2002?
hantavirose_manual_1.txt,"Parte prática 6.2.1.Treinamento do pessoal em relação às atividades junto à população Qualquer tipo de contato com a comunidade deverá ser acompanhado por um técnico devidamente treinado, a desenvolvimento das etapas do programa.",846,What is the main purpose of the program?
hantavirose_manual_1.txt,"Boa apresentação, identificação pessoal e institucional em lugar visível do uniforme, linguagem clara e acessível, explicando o motivo da visita são essenciais para que se obtenha êxito numa entrevista. 6.2.2.",847,What is the main reason for a visit?
hantavirose_manual_1.txt,"Treinamento do pessoal para atividades de inspeção e cadastramento trilhas, manchas de gordura, alimentos danificados, tocas, fezes, odor de urina, bem como a identificação da espécie infestante, se possível, quando da inspeção e cadastramento. 6.2.3.",848,What is the possiblity of identifying an infested area?
hantavirose_manual_1.txt,"Na prática, deve-se visitar locais que possam potencialmente apresentar infestações conforme os citados abaixo: Locais de infestação em áreas rurais: • Locais de armazenamento de grãos: Tulha e paiol; Sala de ração; Depósito de sementes.",850,What are the locations that can present infestaçes?
hantavirose_manual_1.txt,"Foto 76 - Armazenamento inadequado de arroz, servindo de atrativo a roedores Foto cedida por Eloy Yanes Martin.",851,What is the name of the photo?
hantavirose_manual_1.txt,FUNASA - dezembro/2002 - pág. 104 Foto 77 - Armazenagem inadequada de grãos com roedores em paiol Foto cedida por Jovito Gonçalves Dias Filho. • Aviários: fábrica de ração; galpões de aves; depósito de grãos; residências; Foto 78 - Aviário Foto cedida por Eloy Yanes Martin.,852,What is the name of the photo taken by Jovito Gonçalves Dias Filho?
hantavirose_manual_1.txt,FUNASA - dezembro/2002 - pág. 105 Foto 79 - Tocas de roedores ao lado de aviário Foto cedida por Eloy Yanes Martin. • Suinocultura: fábrica de ração; depósito de grãos; galpão de alojamento de animais; residências.,853,What is the name of the project that was created by Eloy Yanes Martin?
hantavirose_manual_1.txt,Foto 80 - Criação de suínos Foto cedida por Eloy Yanes Martin.,854,What is the name of the photo taken by Eloy Yanes Martin?
hantavirose_manual_1.txt,"FUNASA - dezembro/2002 - pág. 106 • Confinamento e granjas leiteiras: fábrica de ração; depósitos de grãos; sala de ordenha; cochos de alimentação; bezerreiros; silos e trincheiras; depósito de fardo de feno; bebedouros de água; barracão de implementos e máquinas agrícolas; sala de tralhas de montaria; curral e suas dependências; residências. • Madeiras empilhadas: lascas, mourões e outros; • Materiais empilhados: tijolos, telhas, pisos, etc.; • Entulhos de construção: tijolos, telhas, pisos, etc.; • Sacarias vazias; • Maquinários desativados ou abandonados.",855,What is the name of the granjas leiteiras?
hantavirose_manual_1.txt,"Foto 81 - Sacarias vazias e mal acondicionadas em local inadequado Foto cedida por Márcio Costa Mello Alves. • lixões a céu aberto; • usinas de reciclagem de lixo; • mercados municipais; • praças públicas; • galerias pluviais; • galerias de esgoto; • terrenos baldios; • construções abandonadas; • locais de feiras livres; • depósito para coleta de lixo; • áreas comerciais; • áreas industriais; • áreas residenciais; • local de comércio de ambulantes (“camelódromos”, “marreteiros”, etc.); • canais de esgoto ou córregos a céu aberto; FUNASA - dezembro/2002 - pág. 107 • áreas de assentamento ou favelas; • pocilgas e galinheiros de fundo de quintal; • tulhas e paiol; • sala de ração; • depósito de sementes. 6.2.4.",856,What is the name of the local area that is inadequad?
hantavirose_manual_1.txt,"Tratamento químico das áreas afetadas Durante o treinamento, os técnicos e operacionais deverão ser capacitados para fazer uso devido dos diversos tipos e formulações de raticidas nas diferentes situações, bem como suas formas de manuseio.",857,What is the main difference between the different types of manuseio?
hantavirose_manual_1.txt,"Os treinandos deverão ser também esclarecidos (conforme já citado no capítulo 4) sobre os riscos dos raticidas, que devem ser aplicados de forma segura e, sempre que possível, protegidos, para se evitar contato ou ingestão por crianças e/ ou animais domésticos, bem como possíveis contaminações do meio ambiente, tais como: nascentes de água, rios, lagos, etc.",858,What is the risk of crianças and animais domésticos?
hantavirose_manual_1.txt,"Esclarecer também que, para proteção dos raticidas, pode-se utilizar caixas de madeira, plástico, papelão, metal, PVC, onde hajam orifícios de entrada e saída para livre acesso dos roedores, facilitando, desta forma, o consumo.",859,"What is the use of caixas of madeira, plástico, papelo, metal, PVC?"
hantavirose_manual_1.txt,"Estas embalagens devem ser identificadas de forma visível e esclarecedora pelos avisos: PERIGO, VENENO PARA RATOS.",860,What are the names of the embalagen?
hantavirose_manual_1.txt,"Deve-se também frisar, que serão mantidas visitas periódicas para acompanhamento e desenvolvimento do tratamento implantado, bem como vistoriados os pontos de iscagem para reavaliação das ações.",861,What is the name of the procedure that is used to help patients with implanted limbs?
hantavirose_manual_1.txt,Foto 82 - Ponto de envenenamento permanente (PEP) com aviso sobre o conteúdo raticida Foto cedida por Nyrad Menzen. 6.2.5.,862,What is the name of the photo?
hantavirose_manual_1.txt,Biossegurança O grupo deverá se apresentar munido de equipamentos de proteção individual (EPI’s) necessários e dentro de normas de biossegurança exigidas para tais atividades.,863,What is the requirement for a group to present munido de equipamentos de proteço individual?
hantavirose_manual_1.txt,"De forma geral, para o trabalho diário deverão estar trajando luvas e botas de borracha, macacão ou jaleco identificados, máscaras de filtro de carvão ativado ou contra partículas P3 (principalmente para uso em áreas internas) e crachás de identificação.",864,What is the main purpose of a trabalho diário?
hantavirose_manual_1.txt,"Durante e após a aplicação dos raticidas são necessários os seguintes cuidados: não comer, beber ou fumar.",865,What are the requirements for a raticida?
hantavirose_manual_1.txt,"Tomar banho, trocar e lavar as vestimentas diariamente, conforme as normas de biossegurança necessárias.",866,What are the requirements of biossegurança?
hantavirose_manual_1.txt,"Lembrar-se que pessoas freqüentemente expostas, seja pelo local de moradia, por manipulação ou contato profissional com roedores, têm maior risco de exposição a excretas e às zoonoses provindas destes animais do que a população em geral, devido ao maior tempo e frequência de exposição.",867,What is the risk of excretas and zoonoses provindas?
hantavirose_manual_1.txt,"Portanto, medidas de prevenção e proteção individual deverão ser rigorosamente observadas em situações específicas.",868,What are the medidas of prevenço e proteço individual?
hantavirose_manual_1.txt,"Nas obras e construções, 01 Locais de refeições e preparo de alimentos fechados com tampas pesadas, dificultando o acesso do roedor ao lixo.",871,What is the name of the tampas pesadas?
hantavirose_manual_1.txt,"Em hospitais e hóteis, resíduos alimentares.",872,What is the name of the food that is consumed?
hantavirose_manual_1.txt,"Juntar os restos de cozinha em vasilhas adequadas, 02 Acondicionamento do lixo de preferência dentro de sacos plásticos para serem momento adequado. terreno.",873,What is the name of the lixo that is used to describe the sacs?
hantavirose_manual_1.txt,"Se não houver coleta regular pelo lixeiro, 03 Vazamento de lixo removê-lo ou enterrá-lo em valas no solo, recobrindo-o com terra. 04 Remoção de entulhos construção, lixo de varreduras, galhos e troncos e amontoados de pedras, evitando que sirvam de local de abrigo para o roedor. 05 Limpeza do terreno vegetação, permitindo desta forma, sinais de roedores. vegetação e seus leitos desobstruídos.",874,What is the simplest way to remove a lixeiro?
hantavirose_manual_1.txt,"Assim, não 06 Controle de córrego e canais abertos de ninheiras.",875,What is the name of the control system?
hantavirose_manual_1.txt,"Sacos, fardos e caixas em depósitos devem ser colocados sobre estrados, com altura mínima de 07 Estocagem de alimentos 40 cm, afastados da parede e uns dos outros, por os lados, 08 Controle de garagens e depósitos quaisquer depóstios para acúmulo de objetos inúteis ou em desuso, FUNASA - dezembro/2002 - pág. 121 permita a passagem de ratazanas, 6 mm no máximo. 09 Ralos e tampas de bueiros até 1cm.",876,What is the altura of a saco?
hantavirose_manual_1.txt,"Devem ter piso concretado e cama adequada, de fácil 10 Instalações para animais remoção.",877,What is the name of the project?
hantavirose_manual_1.txt,Aviários com telamento de malha de 6mm. anoitecer.,878,What is the name of the aircraft?
hantavirose_manual_1.txt,"Fechar com lâmina de metal, vãos de portas com mais 11 Fechamento de vãos e buracos de 6 mm.",879,What is the size of the metal fechar?
hantavirose_manual_1.txt,Buracos e vãos em paredes devem ser fechados com argamassa adequada.,880,What is the name of the argamassa?
hantavirose_manual_1.txt,"Fechar quaisquer abertura de aeração, entradas de 12 Telamento condutores de eletricidade ou vãos de adutores de qualquer natureza, com tela metálica forte com malhas de 6mm removível.",881,What is the name of the entradas that can be used to create a quaisquer abertura?
hantavirose_manual_1.txt,"Ou golas metálicas com 30 cm de aba, deve ser 13 Rateiras colocadas em esteios ou pilastras de sustentação de paióis ou de galinheiros com gaiolas suspensas.",882,What is the size of the golas metálicas?
hantavirose_manual_1.txt,"Colocá-las, no mínimo, a 70 cm do chão.",883,What is the name of the colocá-las?
hantavirose_manual_1.txt,"FUNASA - dezembro/2002 - pág. 122 A Secretaria Municipal de Saúde orienta os interessados no controle de rato preto ou de telhado, recomendando adotar as medidas preventivas abaixo indicadas: Limpar diariamente, antes do anoitecer, os locais de refeições e preparo de alimentos.",884,What is the name of the secretaria municipal de Sade?
hantavirose_manual_1.txt,"Em obras e construções, determinar um local comum para refeições e exigir a colocação dos restos de alimento em recipientes fechados.",885,What is the local comum for refeiçes?
hantavirose_manual_1.txt,Em hospitais e hotéis prover as enfermarias ou quartos com vasilhames fechados para o recolhimento dos resíduos alimentares.,886,What is the name of the food that is consumed?
hantavirose_manual_1.txt,"Recolher os restos alimentares em recipientes adequados, preferencialmente sacos plásticos, que uma camada de terra de 30 cm de espessura.",887,What is the preferred method of recolher os restos alimentares?
hantavirose_manual_1.txt,"Colocar sacos, fardos e caixas de depósitos sobre estrados com altura mínima de 40 cm e afastados uns dos outros e das paredes, deixando espaçamentos que permitem a inspeção em todos os lados.",888,What is the altura of the estrados?
hantavirose_manual_1.txt,Não deixar encostados em muros e paredes objetos que facilitem o acesso de roedores.,889,What is the purpose of encosting a horse?
hantavirose_manual_1.txt,Podar galhos de árvores que possam servir de acesso aos telhados.,890,What is the purpose of arvores?
hantavirose_manual_1.txt,"Não acumular objetos inúteis ou em desuso em porões, sótãos ou garagens.",891,What is a garagen?
hantavirose_manual_1.txt,Vedar com lâmina de metal vãos de janelas com mais de 6 mm.,892,What is the thickness of a janela?
hantavirose_manual_1.txt,Buracos e vãos entre telhas devem ser vedados com argamassa adequada.,893,What is the name of the argamassa adequada?
hantavirose_manual_1.txt,"Colocar telas removíveis em aberturas de aeração, entradas de condutores de eletricidade ou vãos de adutores de qualquer natureza, utilizando, para isso, tela de metal resistente de 6 mm Utilizar rateiras ou golas metálicas com 30 cm de aba em amarras de embarcações em estacas de palafitas para impedir a penetração de ratos nas mesmas.",894,What is the use of a tela de metal resistente de 6 mm?
hantavirose_manual_1.txt,"FUNASA - dezembro/2002 - pág. 123 A Secretaria Municipal de Saúde orienta os interessados no controle de camundongos, recomendando adotar as medidas preventivas abaixo indicadas: anoitecer.",895,What is the name of the anoitecer?
hantavirose_manual_1.txt,"Nas obras e construções, determinar um local 01 Locais de refeições e preparo de alimentos comum para refeições e exigir a colocação dos restos em latas fechadas.",896,What is the local 01 Locais de refeiçes?
hantavirose_manual_1.txt,Em hospitais e hóteis prover as o recolhimento dos resíduos alimentares. altas infestações de camundongos.,897,What is the name of the recolhimento?
hantavirose_manual_1.txt,Somente a 02 Controle de resíduos alimentares antes do anoitecer podem evitar este problema.,898,What can be avoided by avoiding anoitecer?
hantavirose_manual_1.txt,"Juntar os restos de cozinha em vasilhas adequadas, de 03 Acondicionamento do lixo preferência em sacos plásticos, para serem recolhidos pela coleta urbana ou enterrados diariamente. 04 Controle de armários e depósitos objetos eliminando, assim os abrigos mais comuns de camundongos.",899,What is the main purpose of the control of armários and depósitos objetos?
hantavirose_manual_1.txt,"Caminhões devem ser vistoriados na carga e descarga, 05 Transporte de alimentos e outros materiais para evitar o transporte passivo de camundongos.",900,What do Caminhes need to avoid?
hantavirose_manual_1.txt,"Sacos, fardos e caixas em depósitos devem ser colocados sobre estrados com altura mínima de 40 cm, 06 Estocagem de alimentos lados.",901,"What are the dimensions of the sacos, fardos and caixas?"
hantavirose_manual_1.txt,"Devem ter piso concretado e cama adequada, de fácil remoção. 07 Instalações para animais Aviários com telamento de malha de 6 mm.",902,What is the name of the instalaçes for animais Aviários?
hantavirose_manual_1.txt,Retirar alimento de cães e outros animais antes do anoitecer.,903,What is the main purpose of anoitecer?
hantavirose_manual_1.txt,Vãos de portas e janelas com mais de 6 mm devem ser fechados com lâmina de metal.,904,What is the thickness of a porta?
hantavirose_manual_1.txt,"Buracos e vãos em 08 Fechamento de vãos, aberturas e buracos paredes devem ser fechados com argamassa adequada.",905,What is the name of the buracos that are fechados with argamassa adequada?
hantavirose_manual_1.txt,"Fechar qualquer abertura de aeração, entradas de 09 Telamento condutores de eletricidade ou vãos de adutores de qualquer natureza, com tela metálica forte com malha de 6 mm removível.",906,What is the name of the entrada that can be used to create a teletricidade?
hantavirose_manual_1.txt,Obs: As instruções inseridas são de caráter sugestivo e deverão ser adaptadas à realidade local.,907,What are the instruçes inseridas?
hantavirose_manual_1.txt,FUNASA - dezembro/2002 - pág. 124 Allen JA.,908,What is the name of the person who was the first to be a member of FUNASA?
hantavirose_manual_1.txt,Mammals collecte on the Roosevelt Brazilian Expedition with field notes by Leo E.,909,What did Leo E collect on the Roosevelt Expedition?
hantavirose_manual_1.txt,Bulletin of the American Museum of Natural History 1916; 13:219-27.,910,What is the name of the journal that was published in 1916?
hantavirose_manual_1.txt,Brazilian rodents: their habitats and habits.,911,What do Brazilian rodents do?
hantavirose_manual_1.txt,Mammalin Biology in South America 1982; 6:144-66.,912,What is the name of the species that is a part of the genus Species?
hantavirose_manual_1.txt,"Estudos bacteriológicos e sorológicos de um surto de peste no estado da Paraíba, Brasil.",913,What is the name of the study?
hantavirose_manual_1.txt,Memórias do Instituto Oswaldo Cruz 1989 abr/jun; 84(2):249-56.,914,What was the name of the paper that was published in 1989?
hantavirose_manual_1.txt,Pesquisa de Yersinia pestis em roedores e outros pequenos mamíferos nos focos pestosos do nordeste do Brasil 1966 a 1982.,915,What is the name of the pest that is found in the region of Brasilia?
hantavirose_manual_1.txt,Revista de Saúde Pública 1987; 21(3):265-7.,916,What is the name of the journal that published the first issue of the Spanish magazine?
hantavirose_manual_1.txt,"Almeida AMP, Leal NC, Sobrinho JD, Almeida CR.",917,What is the name of the person who is a member of the AMP?
