Arquivo,Parágrafo,Número do parágrafo,Pergunta
poliomielite_diretriz_nacional_1.txt,Continuar fortalecendo as atividades de vigilância: ◼ Conscientizar e sensibilizar os profissionais Até o de notificação.,532,What is the main vigilance a person should be doing?
poliomielite_diretriz_nacional_1.txt,Autoridades nacionais encerramento ARS – 3 meses ◼ Revisar e reclassificar os estabelecimentos OPRTT coordenará. do surto da rede de notificação negativa de PFA.,533,What is the name of the ARS?
poliomielite_diretriz_nacional_1.txt,Avaliar e fortalecer os esforços para aumentar a imunidade da população. 2.,534,What is the purpose of the esforços?
poliomielite_diretriz_nacional_1.txt,Avaliar e fortalecer a sensibilidade da vigilância. 3.,535,What is the purpose of a vigilance?
poliomielite_diretriz_nacional_1.txt,"Avaliar o progresso no sentido de inter- ARS – 6, 9, de saúde com apoio dos de contas de vacinas após cada etapa, OPRTT coordenará. 12 meses etc. escritórios da OMS e do incluindo a Campanha 1.",536,OPRTT coordenará 12 meses etc. escritórios da OMS e do includo a Campanha 1.
poliomielite_diretriz_nacional_1.txt,"Sede da OMS coordena, encerramento classificação reanalisada a cada 3 meses; se o grau mudar, Emergências realiza a do surto – 3 meses a resposta será adaptada de acordo. classificação em consulta com o escritório regional. as lições aprendidas. escritórios da OMS e do Unicef no país.",537,Emergências realiza a do surto – 3 meses a resposta será adaptada de acordo?
poliomielite_nota_tecnica_2txt_notatecnica2023.txt,Alerta sobre a detecção de Poliovírus Circulante Derivado Vacinal po 3 (cPVDV3) em amostras de águas residuais na Guiana Francesa. 2.,1,What is the detecço de Poliovrus Circulante Derivado Vacinal po 3?
poliomielite_nota_tecnica_2txt_notatecnica2023.txt,"Figura 1: Localização geográfica de São Jorge do Oiapoque na Guiana Francesa, onde foi detectad cPVDV3.",4,What was the geográfica of So Jorge do Oiapoque?
poliomielite_nota_tecnica_2txt_notatecnica2023.txt,"Apesar do úlmo caso de poliomielite no Brasil ter ocorrido há 35 anos e o país ter recebido o cerficado de área livre de circulação do PVS, segund Comissão Regional de Cerficação da Erradicação da Poliomielite na Região das Américas, o risco de reintrodução do PVS e surgimento do PVDV é alto. 2.4.",5,What is the risk of reintroduço do PVS e surgimento do PVDV?
poliomielite_nota_tecnica_2txt_notatecnica2023.txt,"Segundo ferramenta de análise de risco da Organização Pan-Americana da Saúde (OPAS), realizada anualmente em todos municípios brasileiros, q avalia dados de cobertura vacinal, vigilância, água potável, esgotamento sanitário e casos/surtos de doenças Imunopreveníveis, os 16 municípios do Amapá for classificados para reintrodução do PVS e surgimento do PVDV: Muito alto risco: Macapá, Mazagão, Oiapoque, Porto Grande, Pracuuba, Santana Alto risco: Pedra Branca do Amapari, Cuas, Ferreira Gomes, Itaubal, Laranjal do Jari, Vitória do Jari Médio risco: Amapá, Calçoene, Tartarugalzinho Baixo risco: Serra do Navio 2.5.",6,What is the OPAS's risk assessment?
poliomielite_nota_tecnica_2txt_notatecnica2023.txt,"Referente às coberturas vacinais da poliomielite, o estado do Amapá teve uma cobertura variando de 42,68% em 2020 a 92,38% em 2015, sendo que Quadro 1: Coberturas vacinais segundo UF e ano.",7,What is the cobertura of vacinas in the Amapa?
poliomielite_nota_tecnica_2txt_notatecnica2023.txt,"UF 2014 2015 2016 2017 2018 2019 2020 2021 2022 2023* Brasil 96,76 98,29 84,43 84,74 89,54 84,19 76,79 71,04 77,20 86,55 Amapá 80,66 92,38 47,59 63,18 68,74 73,01 42,68 45,37 52,87 65,59 Dados de 2014 a 2022 TABNET. *Atualização do painel em 17/09/2024 às 05:21:19, com dados condos na Rede Nacional de Dados Saúde (RNDS) até o dia 16/09/2024.",8,What year did Brasilia receive the most votes?
poliomielite_nota_tecnica_2txt_notatecnica2023.txt,"Dados referentes a Agosto de 2024. *Dados preliminares e sujeitos a alteração. 07/11/2024, 07:10 SEI/MS - 0044044664 - Nota Técnica Conjunta 3.",9,What is the name of the document that was renamed to the Agosto de 2024?
poliomielite_nota_tecnica_2txt_notatecnica2023.txt,"De acordo com o documento da Organização Mundial da Saúde (OMS), Standard Operang Procedures for responding to a poliovirus event or outbreak v4.0 – March 2022, (PROCEDIMENTOS OPERACIONAIS PADRÃO RESPOSTA A UM EVENTO OU SURTO DE POLIOVÍRUS, disponível em hps://polioeradicaon.org/wp-content/uploads/2024/05/9789275726259_por.pdf), a idenficação de um caso de Poliovírus Selvagem (PVS) ou de PVDV em humanos ou a idenficação desses vírus no ambiente deve ser tratada como uma prioridade para os serviços de saúde pública, principalmente para as localidades que estejam com baixas coberturas vacinais, assim como aquelas com indicadores de vigilância epidemiológica abaixo da meta preconizada. 3.2.",11,What is the name of the document that describes the Standard Operang Procedures for responding to a poliovirus event or outbreak?
poliomielite_nota_tecnica_2txt_notatecnica2023.txt,"As estratégias se dividem em quatro eixos, com os seguintes objevos: Imunização: realizar varredura vacinal (casa a casa), com a VOPb e VIP, para atualizar o esquema vacinal das crianças menores de cinco anos de idade e aumentar as coberturas vacinais, visando a prevenção da doença; Vigilância Epidemiológica: aprimorar/intensificar a busca ava de casos de paralisias flácidas agudas na comunidade e nas instuições de saúde; Inquérito Coprológico: Coleta de fezes por amostragem em crianças menores de cinco anos, não vacinadas ou com esquema vacinal incompleto para pesquisa de poliovírus; Invesgação de Águas Residuais: coleta de amostra de águas residuais em diversos pontos do município de Oiapoque para pesquisa de poliovírus.",14,What is the varredura vacinal?
poliomielite_nota_tecnica_2txt_notatecnica2023.txt,"Realizar intensificação vacinal em 15 municípios do estado do Amapá e varredura vacinal no Oiapoque (casa a casa) com a idenficação de crianças menores de cinco anos de idade para serem vacinadas, de forma seleva, com a vacina inavada poliomielite (VIP) e oral poliomielite bivalente (VOPb), conforme Calendário Nacional de Vacinação; Verificar o histórico vacinal das crianças menores de cinco anos de idade que se dirigem aos estabelecimentos de saúde, por qualquer movo de consulta, e atualizar a situação vacinal para poliomielite conforme normas do DPNI; Realizar treinamento, oficinas, cursos, simulações realíscas e outras ações com finalidade de preparar profissionais da saúde para realizar abordagem adequada às famílias hesitantes a vacinação; Manter a vigilância de Eventos Supostamente Atribuíveis à Vacinação ou Imunização (Esavi) sensível.",15,What is the idenficaço of crianças menores de idade?
poliomielite_nota_tecnica_2txt_notatecnica2023.txt,Aproveitar as oportunidades de vacinação: o Os profissionais das equipes da APS devem verificar a situação vacinal durante todos os atendimentos.,16,What is the opportunity of vacination?
poliomielite_nota_tecnica_2txt_notatecnica2023.txt,"Caso seja idenficado pendências vacinais, encaminhar o usuário à sala de vacina; o A cada consulta de puericultura deve ser avaliado o cartão de vacina da criança; o As Equipes Muldisciplinares de Saúde Indígena (EMSI), devem realizar a conferência da caderneta da criança no momento do atendimento, informando as equipes de vacinação dos Distritos Sanitários Especiais Indígenas (Dsei) para atualização da mesma.",17,What is the purpose of encaminhar the usuário à sala de vacina?
poliomielite_nota_tecnica_2txt_notatecnica2023.txt,Garanr a sala de vacina aberta todo o horário de funcionamento da Unidade Básica de Saúde (UBS): o Recomenda-se manter serviços de vacinação em todas as UBS.,18,What is the name of the UBS?
poliomielite_nota_tecnica_2txt_notatecnica2023.txt,"Na inviabilidade de se seguir essa recomendação, é primordial que seja população; o Realizar controle de estoque e garanr disponibilidade das vacinas conforme normas do Programa Nacional de Imunizações em todas as salas de vacina e insumos necessários.",19,What is the importance of populaço?
poliomielite_nota_tecnica_2txt_notatecnica2023.txt,"Evitar barreiras e a burocrazação do acesso: o Avaliar a possibilidade de parcerias para a instalação de pontos de vacinação em locais de grande circulação; o Permir o acesso à vacinação das crianças menores de cinco anos de idade que esverem sem o cartão de vacina, sem o comprovante de residência ou sem outro documento.",20,What is the purpose of a parkeria?
poliomielite_nota_tecnica_2txt_notatecnica2023.txt,"Priorizar o registro oportuno e adequado das doses aplicadas tanto na intensificação quanto na varredura vacinal, bem como monitoramento e avaliação das ações: o Idenficar pessoas que não possuam cartão de vacina, assegurar a distribuição, administrar as doses recomendadas e registrá-las nos sistemas; o Garanr o registro de 100% das doses administradas nos sistemas de informação, em tempo oportuno; o Solicitar nos atendimentos domiciliares de rona e nas avidades colevas de saúde o cartão de vacina para verificação e atualização; o Monitorar e realizar vigilância das coberturas vacinais para poliomielite; o Subsidiar o agente comunitário de saúde, Agentes Indígenas de Saúde (AIS) e enfermeiros dos Distritos Sanitários Especiais Indígenas responsáveis pela vacinação em território indígena (lista de vacinas disponíveis, calendário nacional de vacinação simplificado, cursos dentre outros) para busca ava e idenficação de pendência vacinal; 07/11/2024, 07:10 SEI/MS - 0044044664 - Nota Técnica Conjunta o Aprimorar os mecanismos de monitoramento de coberturas vacinais com base em dados disponíveis para a gestão local (SI-PNI, PEC, SISAB, SIASI, dentre outros); o Realizar acompanhamento e discussão conjunta com a vigilância sobre as coberturas vacinais, e quando necessário, levar as discussões para as instâncias colegiadas (Comissão Intergestora Biparte - CIB e Comissão Intergestora Regional - CIR); o Produzir e divulgar periodicamente documentos informavos com análises locais das coberturas vacinais; · Promover encontros na comunidade com profissionais de saúde locais e especialistas, a fim de sanar dúvidas e desmisficar crenças, mitos, tabu preconceitos sobre as vacinas, esmulando a reflexão sobre os benecios para a saúde da comunidade, reforçando seu caráter de prevenção; Realizar a intensificação das ações de busca ava de casos de PFA nas unidades de saúde e hospitais e na comunidade (busca ava instucional e comunitária): o Preparar relatório da busca realizada contendo semana epidemiológica, número de hospitais ou unidades de saúde visitados, número total prontuários revisados, número total de casos de PFA encontrados na busca, número de casos de PFA que já estavam noficados no sistema vigilância e número de casos encontrados que não estavam noficados.",22,What is the registro of doses administradas in the system?
poliomielite_nota_tecnica_2txt_notatecnica2023.txt,"Orientar a população sobre atualização do calendário vacinal: o Divulgar em redes sociais, rádios, televisão e outros meios de comunicação as ações colevas, vacinas disponíveis, unidades vacinador dentre outras informações inerentes ao processo de vacinação; o Realizar ampla divulgação do calendário vacinal a população.",24,What is the main purpose of the Divulgar?
poliomielite_nota_tecnica_2txt_notatecnica2023.txt,"Como parceiros potenciais sugere-se ações conjuntas com os conselhos de saú conselhos das categorias profissionais, universidades, grupos sociais, dentre outros.",25,What do parceiros suggest to their friends?
poliomielite_nota_tecnica_2txt_notatecnica2023.txt,"Intensificar as ações conjuntas de imunizações, VE-PFA/Pólio, laboratório, atenção primária à saúde, atenção especializada à saúde, saúde indígena, conselhos de saúde e parceiros (OPAS, Rotary, Unicef, Pastoral da Criança, dentre outros), em especial nos municípios com instalações portuárias fluviais, aeroportos e rodoviárias. 4.",27,What is the name of the organization that is specialized in sade?
poliomielite_nota_tecnica_2txt_notatecnica2023.txt,"Realizada reunião em 17/09/24 para discur ações a serem desenvolvidas no estado e municípios fronteiriços, diante da confirmação do isolamento de PVDV3 em águas residuais na Guiana Francesa.",28,What was the name of the event that was held on 17/09/24?
poliomielite_nota_tecnica_2txt_notatecnica2023.txt,"Realizado em 26/09/24, webinário de Vigilância Epidemiológica das Paralisias Flácidas Aguda/Poliomielite, imunização e laboratórios e orientações de coleta acondicionamento e envio (transporte) das amostras de fezes para o Lacen e laboratório de referência.",30,What is the name of the webinario?
poliomielite_nota_tecnica_2txt_notatecnica2023.txt,"Parciparam do webinar, técnicos do Estado do Amapá, municípios e áreas afins.",31,What are some of the things you can do to get a webinar?
poliomielite_nota_tecnica_2txt_notatecnica2023.txt,"Anexos: Apresentação Imunização (0043490023), Apresentação Vigilância (0043490143) e Apresentação IEC (0043500370). 4.3.",32,What is the name of the Apresentaço Imunizaço?
poliomielite_nota_tecnica_2txt_notatecnica2023.txt,Alinhamento interno em 26/09/24 com equipe do CGICI/DPNI sobre a prorrogação de prazo para uso da vacina oral poliomielite bivalente (VOPb) para intensificação vacinal no Estado do Amapá conforme o Calendário Nacional de Vacinação. 4.4.,33,What is the name of the vaccine?
poliomielite_nota_tecnica_2txt_notatecnica2023.txt,Elaboração em 27/09/24 Comunicado à Coordenação Estadual de Imunizações sobre a dilação de prazo para uso da VOPb para intensificação vacinal no Estado do Amapá e novas datas para a mudança do esquema exclusivo com vacina inavada poliomielite (VIP) e logísca reversa das doses de VOPb considerando a detecção de poliovírus derivado vacinal po 3 (PVDV3) em amostras de águas residuais na Guiana Francesa (0043455725). 4.5.,34,What was the name of the study?
poliomielite_nota_tecnica_2txt_notatecnica2023.txt,"Em atenção à solicitação de 3 mil doses de vacinas de VOP pelo Estado do Amapá, as mesmas foram encaminhadas em 01/10/24, além de 5 mil doses de VIP em 02/10/24 para o Amapá para intensificar a vacinação de rona, tendo sido recebidas pelo estado em 7 e 10/10/24, respecvamente. 4.6.",35,How many doses of VOP were encaminhadas on 01/10/24?
poliomielite_nota_tecnica_2txt_notatecnica2023.txt,"Elaboração, em 02/10/24, de novo Comunicado à Coordenação Estadual de Imunizações com atualização da prorrogação de prazo para uso da VOPb no Estado do Amapá considerando que 14 municípios deveriam ulizar VOPb até 18/10/24, Oiapoque e Laranjal do Jari até 31/10/24.",37,What was the name of the project that was a part of the elaboration?
poliomielite_nota_tecnica_2txt_notatecnica2023.txt,"Em virtude da situação de emergência, foi alinhado junto ao estado do Amapá que o Oiapoque realizará estratégia de varredura vacinal casa a casa.",38,What is the name of the island that is a part of the Oiapoque?
poliomielite_nota_tecnica_2txt_notatecnica2023.txt,"Além disso, o comunicado tratou das novas datas para a mudança do esquema exclusivo com vacina inavada poliomielite (VIP) e logísca reversa das doses de VOPb (0043559733). 4.8.",39,What is the name of the drug that has been used to treat poliomielite?
poliomielite_nota_tecnica_2txt_notatecnica2023.txt,"Realizada reunião em 08/10/24, para tratar do registro das doses aplicadas na estratégia de varredura vacinal no Oiapoque com a Coordenação de Imunização do Estado do Amapá, apoiadora de imunizações do DPNI que está no estado, Núcleo de Governança da Informação (NGI), equipe de análise (CGICI) e área técnica de poliomielite do DPNI. 4.9.",40,What was the name of the reunio held on 08/10/24?
poliomielite_nota_tecnica_2txt_notatecnica2023.txt,"As ações de prevenção e monitoramento fazem parte das ações integradas de resposta programadas para o município de Oiapoque, baseadas nos quatro eixos já referidos. 4.10.",42,What is the name of the program that is incorporated into the Oiapoque program?
poliomielite_nota_tecnica_2txt_notatecnica2023.txt,"Realizada reunião em 18/10/24 com a Coordenação de Imunização do Estado do Amapá, apoiadora de imunizações do DPNI que está no estado, técnicos da CGICI e CGVDI e representante da SESAI para alinhar a operacionalização da varredura vacinal no município de Oiapoque.",43,What is the name of the group that organized the reunio?
poliomielite_nota_tecnica_2txt_notatecnica2023.txt,"Ainda, foi realizada reunião do DPNI com a “Câmara Técnica Nacional de Especialistas para Cerficação da Erradicação da Poliomielite” para discur a emergência da cPVDV3 na Guiana Francesa e as ações desenvolvidas até o momento, tendo sido recomendado pela Câmara a vacinação seleva em conformidade com o calendário de vacinação do Brasil, além do fortalecimento da vigilância epidemiológica e laboratorial no local. 4.11.",45,What was the name of the reunio?
poliomielite_nota_tecnica_2txt_notatecnica2023.txt,POLIOMIELITE E PARALISIA CAUSADA POR POLIOVIRUS CIRCULANTE DERIVADO VACINAL TIPO 3 – CPVDV3 5.1.,48,What is the name of the molecule that is a part of the molecule?
poliomielite_nota_tecnica_2txt_notatecnica2023.txt,"A poliomielite é uma doença infectocontagiosa viral aguda caracterizada por um quadro de paralisia flácida, de início súbito, que ocorre em aproximadamente 1% das infecções causadas pelo poliovírus selvagem (PVS) po 1, 2 ou 3.",49,What is the percentage of cases of poliomielite?
poliomielite_nota_tecnica_2txt_notatecnica2023.txt,"O déficit motor instala-se subitamente e sua evolução, frequentemente, não ultrapassa três dias.",50,What happens to the motor when it is installed?
poliomielite_nota_tecnica_2txt_notatecnica2023.txt,"Acomete, em geral, os membros inferiores, de forma assimétrica, tendo como principais caracteríscas a flacidez muscular, com sensibilidade preservada, e arreflexia no segmento angido. 5.2.",51,What are the characteristics of inferiors?
poliomielite_nota_tecnica_2txt_notatecnica2023.txt,"A VOP que levou o poliovírus selvagem à beira da erradicação tem muitos benecios: o vírus vivo atenuado (enfraquecido) da vacina fornece melhor imunidade no intesno, que é onde a poliomielite se replica.",52,What is the imunity of a poliomielite?
poliomielite_nota_tecnica_2txt_notatecnica2023.txt,"O vírus da vacina também é excretado nas fezes e, em comunidades com saneamento de baixa qualidade, isso significa que ele pode ser transmido de pessoa para pessoa e, na verdade, ajudar a proteger a comunidade.",53,What does the vrus da vacina signify?
poliomielite_nota_tecnica_2txt_notatecnica2023.txt,"No entanto, em comunidades com baixas coberturas vacinais, à medida que o vírus é transmido de uma criança não vacinada para outra ao longo de um longo período de tempo (geralmente ao longo de cerca de 12-18 meses), ele pode sofrer mutação e assumir uma forma que pode causar paralisia, surgindo assim o PVDV.",54,What is the vrus transmido of a criança no vacinada?
poliomielite_nota_tecnica_2txt_notatecnica2023.txt,"Esse po poliovírus pode readquirir a capacidade de circular na comunidade com baixa cobertura vacinal e então se espalhar causando casos e surtos de poliomielite por PVDV, que podem ser do po 1, 2 e 3.",55,What is the capacity of circular in poliovrus?
poliomielite_nota_tecnica_2txt_notatecnica2023.txt,"Conforme a OMS, a causa do surgimento de PVDV são as baixas coberturas vacinais.",56,What is the cause of the surgimento of PVDV?
poliomielite_nota_tecnica_2txt_notatecnica2023.txt,Esses casos apresentam os mesmos sinais e sintomas da poliomielite causada pelo poliovírus selvagem e deixar sequelas permanentes.,57,What are the causes of poliomielite?
poliomielite_nota_tecnica_2txt_notatecnica2023.txt,"Quando os PVDV adquirem a capacidade de circular na comunidade causando surtos, são denominados poliovírus circulante derivado vacinal (cPVDV). 5.3.",58,What is the term for poliovrus circulante derivado vacinal?
poliomielite_nota_tecnica_2txt_notatecnica2023.txt,"A baixa cobertura vacinal pode favorecer o surgimento de poliomielite causada pelo poliovírus derivado vacinal (PVDV), assim é importante que sejam alcançadas altas e homogêneas coberturas vacinais para prevenção da poliomielite. 5.4.",59,What is the importance of alcançadas altas and homogêneas coberturas vacinais?
poliomielite_nota_tecnica_2txt_notatecnica2023.txt,Os PVDVs podem ainda ser classificados de outras formas no documento descrito no item 3.1. 6.,60,What is the classification of PVDVs?
poliomielite_nota_tecnica_2txt_notatecnica2023.txt,SITUAÇÃO ATUAL DA POLIOMIELITE NO MUNDO 6.1.,61,What is the name of the island?
poliomielite_nota_tecnica_2txt_notatecnica2023.txt,"De acordo com a Iniciava Global de Erradicação da Poliomielite (GPEI), a doença permanece endêmica no Paquistão e Afeganistão, sendo confirmados 36 casos por PVS em 2024 (Paquistão 17 casos e Afeganistão 19 casos) de janeiro a setembro de 2024.",62,What is the name of the project that will be implemented in 2024?
poliomielite_nota_tecnica_2txt_notatecnica2023.txt,"Além disso, foram detectados 165 casos de poliovírus circulante derivado vacinal (cPVDV) dos pos 1 e 2, em 17 países nesse período, todos localizados nas Regiões Africana, Sudeste Asiáco e Mediterrâneo Oriental (Figura 2).",63,What were the 165 cases of poliovrus circulante derivado vacinal?
poliomielite_nota_tecnica_2txt_notatecnica2023.txt,Fonte: hps://polioeradicaon.org/polio-today/ *Dados preliminares e sujeitos a alteração.,64,What is the name of the website that polioeradicaon.org uses?
poliomielite_nota_tecnica_2txt_notatecnica2023.txt,"Figura 2: Distribuição dos casos de poliovírus selvagem po 1 (PVS1) e poliovírus circulante derivado vacinal (cPVDV) pos 1, 2 detectados nos úlmos 6 meses nos países afetados. 6.2.",65,What is the distribution of poliovrus selvagem?
poliomielite_nota_tecnica_2txt_notatecnica2023.txt,"O risco de reintrodução de PVS e surgimento de PVDV devem ser tratados como uma prioridade para os serviços de saúde pública, principalmente para as localidades que estejam com baixas coberturas vacinais, assim como os que se encontram com os indicadores de vigilância epidemiológica abaixo da meta preconizada. 7.",66,What are the two main reasons for the risk of PVS and PVDV?
poliomielite_nota_tecnica_2txt_notatecnica2023.txt,"Documento assinado eletronicamente por Greice Madeleine Ikeda do Carmo, Coordenador(a)-Geral de Vigilância das Doenças Imunopreveníveis, em 30/10/2024, às 12:26, conforme horário oficial de Brasília, com fundamento no § 3º, do art. 4º, do Decreto nº 10.543, de 13 de novembro de 2020; e art. 8º, da Portaria nº 900 de 31 de Março de 2017.",69,What is the name of the document that was assinado eletronicamente by Greice Madeleine Ikeda?
poliomielite_nota_tecnica_2txt_notatecnica2023.txt,"Documento assinado eletronicamente por Ana Catarina de Melo Araujo, Coordenador(a)-Geral de Incorporação Cienfica e Imunização, em 30/10/2024, às 13:56, conforme horário oficial de Brasília, com fundamento no § 3º, do art. 4º, do Decreto nº 10.543, de 13 de novembro de 2020; e art. 8º, da Portaria nº 900 de 31 de Março de 2017.",70,What is the name of the document that was assinado eletronicamente by Ana Catarina de Melo Araujo?
poliomielite_nota_tecnica_2txt_notatecnica2023.txt,"Documento assinado eletronicamente por Ethel Leonor Noia Maciel, Secretário(a) de Vigilância em Saúde e Ambiente, em 01/11/2024, às 17:03, conforme horário oficial de Brasília, com fundamento no § 3º, do art. 4º, do Decreto nº 10.543, de 13 de novembro de 2020; e art. 8º, da Portaria nº 900 de 31 de Março de 2017.",71,What is the name of the document that was assinado eletronicamente by Ethel Leonor Noia Maciel?
poliomielite_nota_tecnica_2txt_notatecnica2023.txt,"A autencidade deste documento pode ser conferida no site hp://sei.saude.gov.br/sei/controlador_externo.php? acao=documento_conferir&id_orgao_acesso_externo=0, informando o código verificador 0044044664 e o código CRC DC612303.",72,What is the autencidad of the document?
poliomielite_nota_tecnica_3txt_notatecnica2023.txt,"Revoga a Nota Informativa nº 66/2022-CGPNI/DEIDT/SVS/MS, referente ações de Vigilância Epidemiológica das Paralisias Flácidas Agudas (PFA) junto aos refugiados/repatriados Ucrânia. 2.",1,What is the name of the Nota Informativa?
poliomielite_nota_tecnica_3txt_notatecnica2023.txt,Situação epidemiológica da poliomielite no mundo e no Brasil: 2.1.1.,2,What is the epidemiology of poliomielite?
poliomielite_nota_tecnica_3txt_notatecnica2023.txt,"No cenário global da poliomielite, dados da Organização Mundial de Saúde (OMS) demonstram que o Poliovírus Selvagem (PVS) permanece endêmico em dois países (Paquistão e Afeganistão) e que, apesar da redução no número de casos, nos últimos anos, houve importação do vírus e ocorrência de casos de PVS em países onde a doença estava eliminada (Malawi e Moçambique)1.",3,What did OMS demonstrate about the Poliovrus Selvagem?
poliomielite_nota_tecnica_3txt_notatecnica2023.txt,Vários países apresentam surto de Poliovírus Derivado Vacinal (PVDV) que ocorrem pela diminuição progressiva da imunidade da população.,4,What is the name of the PVDV?
