Arquivo,Parágrafo,Número do parágrafo,Pergunta
sifilis_manual_1txt_manual2023.txt,"Dessa forma, além de possibilitar a ampliação do acesso ao diagnóstico de HIV e sífilis, o uso dos testes Duo HIV/Sífilis proporciona agilidade no tratamento das gestantes e, consequentemente, a prevenção da transmissão vertical de HIV e da sífilis congênita.",28,What is the effect of the Duo HIV/Sfilis test?
sifilis_manual_1txt_manual2023.txt,"Outras vantagens incluem a redução de custos com transporte e armazenamento, a ser coletado e a minimização da produção de resíduos hospitalares6. 5 WORLD HEALTH ORGANIZATION.",29,What is one of the benefits of being coletad?
sifilis_manual_1txt_manual2023.txt,"Diagnóstico laboratorial de doenças sexualmente transmissíveis, incluindo o vírus da imunodeficiência humana.",30,What is the name of the laboratorial of doenças sexually transmissiveis?
sifilis_manual_1txt_manual2023.txt,"Geneva: WHO, 2013. p. 175-188. cap. 15.",31,What is the name of the book that was published by WHO in 2013?
sifilis_manual_1txt_manual2023.txt,Acesso em: 24 set. 2021. 6 WORLD HEALTH ORGANIZATION.,32,What is the name of the WORLD HEALTH ORGANIZATION?
sifilis_manual_1txt_manual2023.txt,Dual HIV/syphilis rapid diagnostic tests can be used as the first test in antenatal care.,33,What is the first test in antenatal care?
sifilis_manual_1txt_manual2023.txt,"Geneva: WHO, nov. 2019. p. 4.",34,What is the name of the document that was published in the november 2019 issue of WHO?
sifilis_manual_1txt_manual2023.txt,"Com o sistema, é possível gerenciar os estoques e monitorar a finalidade de uso dos testes, bem como verificar o número de testes reagentes, perdidos ou inválidos.",37,What is a system that can monitor the finality of use of tests?
sifilis_manual_1txt_manual2023.txt,"A distribuição ocorre por capilaridade, sendo realizada inicialmente de forma direta do MS para os estados, distritos sanitários especiais indígenas e capitais desvinculadas da gestão estadual; essas instâncias, por sua vez, organizam suas próprias redes de distribuição dentro dos respectivos territórios.",38,What is the distribution of MS?
sifilis_manual_1txt_manual2023.txt,O quantitativo de testes enviados pelo MS é definido de acordo com as solicitações mensais realizadas por meio do Sisloglab.,39,What is the quantitativo of tests enviados by MS?
sifilis_manual_1txt_manual2023.txt,"O MS oferece a plataforma Telelab (http://telelab.aids.gov.br) com cursos sobre as diretrizes de diagnóstico e procedimentos de testagem rápida, compostos por videoaulas e manuais.",40,What is the name of the program Telelab?
sifilis_manual_1txt_manual2023.txt,Essa plataforma permite capacitação a distância e gratuita dos profissionais da rede de atenção à saúde.,41,What is the cost of a plataform?
sifilis_manual_1txt_manual2023.txt,"Avaliação Externa da Qualidade para Testes Rápidos (AEQ-TR) rápidos no SUS, o MS conta com o Programa de Avaliação Externa da Qualidade para Testes Rápidos (AEQ-TR) (http://qualitr.paginas.ufsc.br).",42,What is the AEQ-TR?
sifilis_manual_1txt_manual2023.txt,"O AEQ-TR é uma ferramenta de gestão com foco educacional, não punitivo, não obrigatório e gratuito, utilizado para monitorar a qualidade dos resultados da testagem rápida, permitindo que cada execução de testes rápidos no diagnóstico das infecções sexualmente transmissíveis.",43,What is the AEQ-TR?
sifilis_manual_1txt_manual2023.txt,É considerada uma intercorrência com testes rápidos qualquer observação de: • Avaria no kit: quando ocorre a perda da integralidade ou das características diagnóstico (kit); • Resultado inválido: quando a linha colorida da região controle não aparece na janela de leitura; • Suspeita de resultados falsos: quando a condição de saúde do indivíduo e da conclusão diagnóstica contradizem o resultado obtido nos TR em questão.,44,What is the result of a test that is not a kit?
sifilis_manual_1txt_manual2023.txt,"Caberá às referências técnicas o encaminhamento dos formulários ao Serviço de Atendimento ao Cliente – SAC da empresa fornecedora, que irá investigar e elucidar a intercorrência.",46,What is the name of the service that investigates the intercorrência?
sifilis_manual_1txt_manual2023.txt,O MS monitora mensalmente o desfecho e a devolutiva dada pelas empresas aos serviços de saúde notificantes.,47,What is the desfecho of MS?
sifilis_manual_1txt_manual2023.txt,"Quando esses componentes estão em suspensão, eles se ligam ao acaso, devido a características da própria estrutura química, formando estruturas globulares chamadas de micelas (Figura 1).",49,What do the components of micelas form?
sifilis_manual_1txt_manual2023.txt,"Figura 1 – Representação esquemática da estrutura da micela Fonte: adaptado de Brasil, 2014.",50,What is the name of the figure?
sifilis_manual_1txt_manual2023.txt,"Quando presentes na amostra, os anticorpos não treponêmicos (anticorpos anticardiolipina) ligam-se às cardiolipinas das micelas presentes na suspensão antigênica.",51,What do anticorpos no treponêmicos ligam-se às cardiolipinas das micelas presentes na suspenso antigênica?
sifilis_manual_1txt_manual2023.txt,"Quando essa ligação ocorre simultaneamente a várias micelas, há floculação e formação de grumos (Figura 2).",52,What is the ligaço ocorre simultaneamente a várias micelas?
sifilis_manual_1txt_manual2023.txt,Esses grumos são visualizados em microscópios nos testes de VDRL e USR e a olho nu nos testes RPR e TRUST.,53,What are the test results of VDRL and USR?
sifilis_manual_1txt_manual2023.txt,"Figura 2 – Representação esquemática da ligação do anticorpo anticardiolipina ao Fonte: adaptado de Brasil, 2014.",54,What is the name of the ligaço do anticorpo anticardiolipina?
sifilis_manual_1txt_manual2023.txt,"Quando há grande quantidade de anticorpos anticardiolipina na amostra, podem ocorrer resultados falso-não reagentes em consequência do chamado fenômeno prozona (Figura 3).",55,What is the effect of anticorpos anticardiolipina?
sifilis_manual_1txt_manual2023.txt,"Esse fenômeno consiste na ausência da floculação, resultante de simultaneamente, sem formação de grumos.",56,What is the result of the floculaço?
sifilis_manual_1txt_manual2023.txt,"Figura 3 – Representação esquemática do fenômeno prozona Fonte: adaptado de Brasil, 2014.",57,What is the name of the fenômeno prozona?
sifilis_manual_1txt_manual2023.txt,"Observações: • Resultado obtido conforme estabelecido pela Portaria nº 2.012, de 19 de outubro de 2016. • Provável ocorrência de resultado falso não reagente no teste treponêmico ________.",61,What was the result of the test?
sifilis_manual_1txt_manual2023.txt,"Observações: • Resultado obtido conforme estabelecido pela Portaria nº 2.012, de 19 de outubro de 2016. • Persistindo a suspeita de sífilis, uma amostra deverá ser coletada após 30 dias e submetida a uma nova testagem. • Provável ocorrência de resultado falso-reagente no teste não treponêmico para sífilis.",63,What was the result of the falso-reagent test?
sifilis_manual_1txt_manual2023.txt,"Observações: • Resultado obtido conforme estabelecido pela Portaria nº 2.012, de 19 de outubro de 2016. • A não detecção de anticorpos pelo teste não treponêmico pode significar infecção muito recente ou presença de cicatriz sorológica pós-tratamento.",70,What was the result of the test?
sifilis_manual_1txt_manual2023.txt,"Amostra biológica ou amostra do paciente: porção de fluido corporal, células ou tecido retirado de um indivíduo para exame, estudo ou análise.",75,What is the term for amostra do paciente?
sifilis_manual_1txt_manual2023.txt,"Anticorpo: proteína (imunoglobulina) produzida por linfócitos B, que se liga especificamente a uma substância reconhecida como estranha pelo organismo.",76,What is the name of the protein that is produzida by linfocitos B?
sifilis_manual_1txt_manual2023.txt,Antígeno: qualquer substância ou material que possa estimular a produção de anticorpos em um organismo.,77,What is an antgeno?
sifilis_manual_1txt_manual2023.txt,"Cancro duro ou cancro primário: lesão primária da sífilis, que ocorre aproximadamente três semanas após a infecção pelo Treponema pallidum.",78,What is the term for cancro duro?
sifilis_manual_1txt_manual2023.txt,"Cicatriz ou memória sorológica: caracteriza-se pela persistência de resultados reagentes nos testes treponêmicos e/ou reagentes com baixa titulação nos testes não treponêmicos após o tratamento correto para sífilis, sem que isso indique infecção.",79,What is the term for a sorologica?
sifilis_manual_1txt_manual2023.txt,"Colagenoses: doenças autoimunes, inflamatórias e degenerativas do tecido conjuntivo.",80,What are the three main types of colagenoses?
sifilis_manual_1txt_manual2023.txt,"Doença de Lyme: causada pelas bactérias Borrelia burgdorferi e, mais raramente, Borrelia mayonii.",81,What is the name of the bacterium that causes Lyme?
sifilis_manual_1txt_manual2023.txt,"É transmitida por meio da picada de carrapatos infectados e causa, em humanos, sintomas como febre, dor de cabeça, fadiga e eritema migrans.",82,What is the name of the virus that is transmitted by humanos?
sifilis_manual_1txt_manual2023.txt,"Se não for tratada, a infecção pode se espalhar para as articulações, o coração e o sistema nervoso.",83,What is the infecço that can be used to treat a nervoso?
sifilis_manual_1txt_manual2023.txt,Especificidade clínica ou especificidade diagnóstica: capacidade de um ensaio de determinada doença ou desordem clínica.,84,What is the term for a specificity clnica?
sifilis_manual_1txt_manual2023.txt,Espiroquetas: bactérias de forma helicoidal que tendem a apresentar um movimento ondulante semelhante ao de uma hélice.,85,What are bactérias of form helicoidal that tendem a apresentar um movimento ondulante semelhante ao de uma hélice?
sifilis_manual_1txt_manual2023.txt,Exames diretos: testes que detectam o patógeno em uma amostra biológica.,86,What are tests that detect a patógeno in a biológica?
sifilis_manual_1txt_manual2023.txt,Falso-não reagente: resultado negativo ou não reagente obtido em um teste para uma doença ou condição na realidade presente.,87,What is the result of a negative test?
sifilis_manual_1txt_manual2023.txt,Falso-reagente: resultado positivo ou reagente obtido em um teste para uma doença ou condição na realidade ausente.,88,What is the term for a reagent that is obtido em a teste para uma doença or condiço na realidade ausente?
sifilis_manual_1txt_manual2023.txt,Imunoensaio: método que detecta a presença de um complexo antígeno-anticorpo em uma amostra biológica.,89,What is the name of the test that detects a complex antgeno-anticorpo?
sifilis_manual_1txt_manual2023.txt,"Inativação da amostra: método que consiste em submeter a amostra a banho-maria, a 56°C, por 30 minutos.",90,What is the temperature of the amostra?
sifilis_manual_1txt_manual2023.txt,Sensibilidade clínica ou sensibilidade diagnóstica: capacidade de um ensaio determinada doença ou desordem clínica.,91,What is the definition of a diagnóstica?
sifilis_manual_1txt_manual2023.txt,"Síndrome da imunodeficiência adquirida (aids): síndrome clínica caracterizada por graus de imunodepressão variáveis, decorrente da infecção pelo HIV.",92,What is the syndrome clnica?
sifilis_manual_1txt_manual2023.txt,A definição clínica de início da aids é o aparecimento de infecções oportunistas e/ou neoplasias.,93,What is the definition of incio da aids?
sifilis_manual_1txt_manual2023.txt,"Desde 1993, a aids também pode ser definida por critério laboratorial, utilizando a contagem de linfócitos T-CD4+.",94,What is the definition of aids?
sifilis_manual_1txt_manual2023.txt,Soroconversão: fase da resposta imune na qual ocorre a produção de anticorpos suficientes para serem detectados por um teste diagnóstico imunológico.,95,What is the resposta imune?
sifilis_manual_1txt_manual2023.txt,"Teste rápido: dispositivo de teste de uso único, que não depende de infraestrutura laboratorial.",96,What is the test method?
sifilis_manual_1txt_manual2023.txt,Produz resultado em tempo igual ou inferior a 30 minutos e que pode ser interpretado a olho nu.,97,What is the time of the result?
sifilis_manual_1txt_manual2023.txt,"Testes imunológicos: testes que detectam, em uma amostra biológica, anticorpos contra um antígeno específico.",98,What are tests that detect?
sifilis_manual_1txt_manual2023.txt,Valor preditivo positivo: proporção de indivíduos com um resultado positivo em um teste e que apresentam a doença ou condição de interesse.,99,What is the value of a positive test?
sifilis_manual_1txt_manual2023.txt,"Esse valor, normalmente, é apresentado em porcentagem. bvsms.saude.gov.br",100,What is the valor of a porcentagem?
tuberculose_protocolo_1.txt,1.1. agente etiológico 27 1.2. transmissão 28 1.3.,1,What is the name of the agent that is etiológico?
tuberculose_protocolo_1.txt,O Problema da Tuberculose 31 2.1. no mundo 31 2.2. no brasil 34 2.3. determinação social da tuberculose 40 Referências 42 PARTE II • DIAGNÓSTICO 45 1.,3,What is the social problem of tuberculosis?
tuberculose_protocolo_1.txt,Diagnóstico Clínico 48 1.1. tuberculose pulmonar 48 1.2. tuberculose extrapulmonar 49 2.,4,What is the name of the tuberculose that is pulmonar?
tuberculose_protocolo_1.txt,"Diagnóstico Bacteriológico 54 3.1. exame microscópico direto – baciloscopia direta 54 3.2. teste rápido molecular para tuberculose (tRM-tb) 55 3.3. cultura para micobactéria, identificação e teste de sensibilidade 61 3.4. coleta, armazenamento e transporte de amostras de escarro 62 4.",5,What is the name of the exam?
tuberculose_protocolo_1.txt,Radiografia de tórax 65 4.2. tomografia computadorizada de tórax 65 4.3. outros exames de imagem na avaliação de tuberculose pulmonar e extrapulmonar 66 4.4. achados da tuberculose pulmonar em exames de imagem 67 5.,7,What is the name of the computer that is used to diagnose TB?
tuberculose_protocolo_1.txt,Outros Métodos Diagnósticos 71 6.1. adenosina deaminase (ada) 71 6.2. outras técnicas biomoleculares 71 7.,8,What is the name of the enzyme that is adenosina deaminase?
tuberculose_protocolo_1.txt,Diagnóstico de HIV nas Pessoas com Tuberculose 73 8.,9,What is the name of the disease?
tuberculose_protocolo_1.txt,Diagnóstico em Situações Especiais 75 8.1. diagnóstico da tuberculose na infância 75 8.1.1.,10,What is the definition of tuberculose?
tuberculose_protocolo_1.txt,Manifestações clínicas da tb pulmonar em crianças (<10 anos de idade) e adolescentes 75 8.1.2. diagnóstico da tuberculose pulmonar por sistema de escore 76 8.1.3. outros exames complementares para o diagnóstico da tuberculose na criança 78 8.1.4. tuberculose extrapulmonar na criança 79 8.1.5. tuberculose perinatal 79 8.2. diagnóstico de tuberculose em pessoas vivendo com HiV 80 8.2.1.,11,What is the escore for tuberculose?
tuberculose_protocolo_1.txt,Síndrome inflamatória da Reconstituição imune (SiR) 82 8.2.2. diagnóstico diferencial 82 9.,12,What is the name of the diagnostico diffencial?
tuberculose_protocolo_1.txt,Diagnóstico da Infecção Latente pelo M. tuberculosis (ILTB) 83 9.1.,13,What is the name of the disease?
tuberculose_protocolo_1.txt,Definição de infecção latente pelo M. tuberculosis 83 9.2. diagnóstico pela prova tuberculínica 84 9.3. diagnóstico pelo iGRa 87 Referências 88 PARTE III • TRATAMENTO 95 1.,14,What is the name of the disease?
tuberculose_protocolo_1.txt,Bases Bacteriológicas e Farmacológicas 98 3.,15,What is the base of Bacteriológicas e Farmacológicas?
tuberculose_protocolo_1.txt,A Escolha do Melhor Esquema de Tratamento 102 4.,16,What is the name of the escolha do Melhor Esquema de Tratamento?
tuberculose_protocolo_1.txt,Esquemas de Tratamento para a Tuberculose 104 4.1. esquema básico (eb) 105 4.1.1. esquema básico para o tratamento de adultos e adolescentes (≥ 10 anos de idade): 2RHZE/4RH 105 4.1.2. esquema básico para tratamento da tb meningoencefálica e osteoarticular em adultos e adolescentes (≥ 10 anos de idade): 2RHZE/10RH 106 4.1.3. esquema básico para crianças (< 10 anos de idade): 2RHZ/4RH 108 4.1.4. esquema básico para tratamento da tb meningoencefálica e osteoarticular para crianças (< 10 anos de idade): 2RHZ/10RH 108 4.2. considerações sobre o tratamento 110 4.3.,17,What is the esquema básico for treatment of tb meningoencefálica e osteoarticular?
tuberculose_protocolo_1.txt,Modalidades de tratamento 111 4.4. tratamento da tuberculose em condições especiais 111 4.4.1.,18,What is the name of the treatment that is offered to tuberculose?
tuberculose_protocolo_1.txt,Hepatopatias 112 4.4.3. nefropatias 113 4.4.4. diabetes 114 4.4.5. infecção pelo HiV 115 5.,19,What is the most common cause of diabetes?
tuberculose_protocolo_1.txt,Seguimento do Tratamento 122 5.1. seguimento do tratamento em adultos 122 5.2. seguimento do tratamento em crianças e adolescentes 124 6.,20,What is the treatment for adultos?
tuberculose_protocolo_1.txt,Reações Adversas e Interações Medicamentosas 127 6.1.,21,What is the name of the group that has a reputation for being a Medicamentosa?
tuberculose_protocolo_1.txt,Reações adversas 127 6.1.1. ao esquema básico 127 6.1.2. aos esquemas especiais e esquemas para tb resistente 130 6.2.,22,What is the esquema básico?
tuberculose_protocolo_1.txt,Reações adversas com o uso de fármacos para tb e antirretrovirais 135 6.3. interações medicamentosas 137 7.,23,What is the number of reaçes adversas com o uso de fármacos para tb e antirretrovirais?
tuberculose_protocolo_1.txt,Tratamento da Tuberculose Drogarresistente 142 7.1.,24,What is the number of Tuberculose Drogarresistente?
tuberculose_protocolo_1.txt,Resistência adquirida ou secundária 143 7.2.,25,What is the definition of resistance?
tuberculose_protocolo_1.txt,Resistência primária 143 7.3. intervenções para prevenir a tuberculose drogarresistente 144 7.4.,26,What is the number of interventions to prevent tuberculosis?
tuberculose_protocolo_1.txt,Classificação da tuberculose drogarresistente 144 7.5.,27,What is the classification of tuberculose?
tuberculose_protocolo_1.txt,"Recomendações para a elaboração dos esquemas terapêuticos 145 7.6. tratamento da tb mono e polirresistente 148 7.6.1. tratamento da monorresistência à isoniazida 149 7.6.2. tratamento da monorresistência à rifampicina 151 7.6.3. tratamento da polirresistência 152 7.6.4. tratamento da tuberculose com resistência à rifampicina (tb RR), com multirresistência (tb MdR) e com resistência extensiva (tb XdR) 153 7.7. esquemas individualizados 157 7.8. situações especiais 158 7.8.1. tuberculose drogarresistente em crianças 158 7.8.2. tuberculose drogarresistente em gestantes e lactantes 159 7.8.3.",28,What is the treatment for polirresistence?
tuberculose_protocolo_1.txt,Tuberculose drogarresistente na insuficiência renal 160 7.8.4. tuberculose drogarresistente em hepatopatias 160 7.8.5. tuberculose drogarresistente em pessoas vivendo com HiV 160 7.9. seguimento do tratamento da tuberculose drogarresistente 161 8.,29,What is the treatment for tuberculosis drogarresistente?
tuberculose_protocolo_1.txt,Tratamento da Infecção Latente pelo M. tuberculosis (ILTB) 163 8.1. introdução 163 8.2. prevenção da infecção pelo M. tuberculosis ou quimioprofilaxia primária 163 8.3. tratamento da infecção latente 165 8.4. indicações de tratamento da infecção latente 165 8.4.1. crianças (< 10 anos de idade) contatos de casos pulmonares 165 8.4.2. adultos e adolescentes 166 8.5. situações especiais 167 8.5.1.,30,What is the name of the disease?
tuberculose_protocolo_1.txt,Gestantes 167 8.5.2. pessoas vivendo com HiV 167 8.5.3. contatos de tuberculose com resistência extensiva ou tuberculose multirresistente 167 8.6.,31,What is the resistance of tuberculose?
tuberculose_protocolo_1.txt,O Enfrentamento da Tuberculose 187 2.,33,What is the name of the 187th tuberculose?
tuberculose_protocolo_1.txt,"Vacinação 188 2.1. indicações 188 2.2. contraindicações 189 2.3. adiamento da vacinação 189 2.4. esquema de vacinação bcG, dose e via de administração 190 2.5. evolução da lesão vacinal 190 2.6. eventos adversos 191 2.7. educação permanente nos serviços de vacinação 191 3.",34,What is the era of vacinaço bcG?
tuberculose_protocolo_1.txt,Detecção de Casos de Tuberculose 193 3.1. busca ativa de sintomático respiratório (sR) 193 3.1.1.,35,What is the busca ativa de sintomático respiratório?
tuberculose_protocolo_1.txt,Definição de Sintomático Respiratório 194 3.1.3. objetivo 194 3.1.4. planejamento da busca ativa de sR 194 3.1.5. estratégia de busca ativa em serviços de saúde 195 3.1.6.,37,What is the definition of Sintomático Respiratório?
tuberculose_protocolo_1.txt,Estratégias de Busca Ativa em contextos específicos 195 3.2. busca passiva de casos 197 4.,38,What is the definition of a busca passiva?
tuberculose_protocolo_1.txt,Adesão 199 4.1. conceito 199 4.2. importância da adesão 199 4.3. o processo de adesão 200 4.3.1. adesão no início do tratamento 200 4.3.2. adesão durante o seguimento do tratamento 200 4.4.,39,What is the name of the conceito?
tuberculose_protocolo_1.txt,Fatores que interferem na adesão 201 4.5. estigma 202 4.6. estratégias que podem melhorar a adesão 202 4.6.1. acolhimento 202 4.6.2. tratamento diretamente observado (tdo) 203 4.6.3. projeto terapêutico singular (pts) 206 4.6.4. atitude da equipe para o fortalecimento da adesão 208 4.6.5. organização e estruturação do serviço 208 4.7. outras atividades de apoio à adesão 208 4.8.,40,What is the name of the adeso that can be melhorared?
tuberculose_protocolo_1.txt,Monitoramento e avaliação da adesão 209 4.8.1. “Faltoso” ao tratamento 209 4.8.2. abandono do tratamento 210 4.8.3. estratégias de busca de faltosos e abandonos 210 4.9. quando as estratégias falham 211 4.10.,41,What is the name of the treatment?
tuberculose_protocolo_1.txt,Recomendações para os serviços 211 5.,42,What is the number of recommendations for the services?
tuberculose_protocolo_1.txt,Definições para proceder ao controle de contatos 213 5.2. identificação e priorização da avaliação de contatos 214 5.3. indicações da avaliação de contatos 214 5.4. avaliação dos contatos 215 5.5. sobre testagem do HiV em contatos 217 5.6. operacionalização da avaliação de contatos nos serviços de saúde 218 6.,44,What is the name of the controle de contatos?
tuberculose_protocolo_1.txt,Medidas de Controle de Infecção da Tuberculose em Unidades de Saúde 219 6.1. conjuntos de medidas de controle da transmissão do M. tuberculosis 220 6.1.1.,45,What are the conjuntos of medidas de controle da transmisso do M. tuberculosis?
tuberculose_protocolo_1.txt,Medidas administrativas (ou gerenciais) 220 6.1.2.,46,What is the name of the Medidas administrativas?
tuberculose_protocolo_1.txt,Medidas de controle ambiental (ou de engenharia) 221 6.1.3.,47,What is the name of the control system?
tuberculose_protocolo_1.txt,Medidas de proteção respiratória (ou de proteção individual) 222 6.2. controle de infecção pelo M. tuberculosis no domicílio e em outros ambientes 223 6.3. controle de infecção pelo M. tuberculosis na atenção básica 224 6.4. controle de infecção pelo M. tuberculosis em serviços que atendem pVHiV 225 6.5. controle de infecção pelo M. tuberculosis em ambientes hospitalares 225 6.6. controle de infecção pelo M. tuberculosis em laboratórios 227 7.,48,What is the name of the individual that controls tuberculosis?
tuberculose_protocolo_1.txt,Ações Estratégicas para Situações e Populações Especiais 229 7.1. pessoas Vivendo com HiV (pVHiV) 229 7.1.1. caracterização da população 229 7.1.2. atividades programáticas recomendadas 229 7.1.3. organização da rede de atenção 231 7.2. pessoas privadas de liberdade (ppl) 232 7.2.1. caracterização da população 233 7.2.2. atividades programáticas recomendadas 233 7.2.3.,49,What is the name of the program that is recommended for the populace?
tuberculose_protocolo_1.txt,Medidas para reduzir a transmissão do M. tuberculosis no contexto carcerário 238 7.2.4.,50,What is the name of the drug used to reduzir a tuberculosis infection?
tuberculose_protocolo_1.txt,Detecção de TB entre profissionais do sistema penitenciário 239 7.2.5.,51,What is the definition of TB?
tuberculose_protocolo_1.txt,"Vigilância epidemiológica, monitoramento e avaliação 239 7.2.6. ações de informação, educação e comunicação 240 7.2.7. organização da rede de atenção 241 7.3. população em situação de Rua (psR) 241 7.3.1. caracterização da população 242 7.3.2. atividades programáticas recomendadas 243 7.3.3. organização da Rede de atenção integrada às pessoas em situação de rua com tuberculose 245 7.4. indígenas 246 7.4.1. caracterização da população e especificidades quanto à atenção à saúde 247 7.4.2. atividades programáticas recomendadas 248 7.4.3. organização da rede de atenção à saúde dos povos indígenas 249 7.5. profissionais de saúde 252 7.5.1. caracterização da população 252 7.5.2. atividades programáticas recomendadas 253 7.5.3. organização da rede de atenção 256 7.6. usuários de álcool e outras drogas 257 7.6.1. caracterização da população 257 7.6.2. atividades programáticas recomendadas 257 7.6.3.",52,What is the main feature of the rede?
tuberculose_protocolo_1.txt,Priorização Política do Controle da Tuberculose 279 2.,54,What is the Priorizaço Poltica do Controle da Tuberculose 279?
