Arquivo,Parágrafo,Número do parágrafo,Pergunta
tuberculose_protocolo_14.txt,Após este período o sangue pode hemolisar. 82.7 Conservação das amostras até o envio  As amostras biológicas de soro ou plasma devem ser armazenadas em geladeira (2ºC a 8°C) para envio em até 12 horas.,371,question: What is the effect of the amostras?
tuberculose_protocolo_14.txt,"Após esse período, congelar as amostras a -20°C. 82.8 Condições de transporte  As amostras biológicas devidamente identificadas devem ser acondicionadas em tubos de plásticos com rosca (tipo KMA) e enviadas, refrigeradas em caixa térmica contendo gelo reciclável ou gelo seco, para transporte em até seis horas;  Para transporte que exceda seis horas, deve-se proceder da seguinte forma:  Comunique o envio das amostras ao destinatário, Seção de Hepatologia do Instituto Evandro Chagas, pelo telefone (0xx91) 3214- 2077 com a data e o horário de chegada, previstos;  Acondicione as amostras na embalagem de envio de material biológico (Embalagem 650 - Substâncias Biológicas - Categoria B);  A embalagem consistirá de três componentes: recipiente primário, embalagem secundária e embalagem externa rígida. a) Recipientes primários: devem ser acondicionados em embalagens secundárias, de tal modo que, sob as condições normais de transporte, não possam ser quebrados, perfurados ou vazar o seu conteúdo para a embalagem secundária; b) Embalagens secundárias: devem ser acomodadas na embalagem externa, com material acolchoado apropriado, de modo que qualquer material acolchoado ou a embalagem externa.",372,question: What is the acondicionation of amostras in embalagem?
tuberculose_protocolo_14.txt,"No caso de amostras de tecido, recomenda-se a coleta logo após procedimento cirúrgico de ressecção de lesões. 83.6 Orientações para a Coleta de Amostra  As coletas (excisão de cistos e tecidos adjacentes) devem ser realizadas mais rápido possível até a Seção de Hepatologia (SAHEP) do Instituto Evandro Chagas (IEC).",375,question: What is the procedure to ressect leses?
tuberculose_protocolo_14.txt,Não adicionar conservante.  As coletas de fluídos devem ser realizadas com material descartável e estéril.,376,question: Do acessos de fludos devem ser realizadas com material descartável e estéril?
tuberculose_protocolo_14.txt,"Não adicionar conservante. 83.7 Conservação das amostras até o envio  As amostras de tecido, bem como, de secreções devem ser armazenadas em freezer -20ºC ou -70°C caso não possam ser enviadas o mais rápido possível até a Seção de Hepatologia (SAHEP) do Instituto Evandro Chagas (IEC).",377,question: What is the main reason for the armazenadas?
tuberculose_protocolo_14.txt,"Nota: Para pesquisa de TORCH em crianças, recomenda-se a análise em urina. 90.5 Período de Coleta das Amostras Biológicas  Fase aguda ou convalescente da doença ou a critério clínico. 90.6 Orientações Para a Coleta de Amostras Biológicas  Sangue total: Coleta de sangue total em tubos com anticoagulante exclusivamente com EDTA (não enviar soro ou plasma);  Urina: A urina pode ser a primeira da manhã, mas não é obrigatório.",379,question: What is the urina?
tuberculose_protocolo_14.txt,"Deve com bactérias da região, desprezando-se o primeiro jato.",380,"question: Deve com bactérias da regio, desprezando-se?"
tuberculose_protocolo_14.txt,"Os frascos de coleta devem ser estéreis, sendo que crianças menores de 1 ano pode ser feito em sacos coletores para coleta de urina rotina;  LCR: O LCR pode ser enviado em tubos de ensaio 12x75 mm ou frascos de microcentrífuga ou tubos tipo KMA, estéreis com tampa que promova boa vedação.",381,question: What can be enviado em tubos de microcentrfuga?
tuberculose_protocolo_14.txt,"Se a amostra não for enviada imediatamente, para o acondicionamento e transporte das mesmas. 90.7 Orientações Para Conservação das Amostras Biológicas Até o Envio  Após a coleta do material, as amostras para diagnóstico devem ser enviadas imediatamente ou no máximo entre 24h à 48h, desde que sejam mantidas sobre refrigeração, pois amostras antigas comprometem a qualidade do exame;  As amostras que não puderem ser enviadas dentro do prazo acima estabelecido podem ser congeladas, desde que não seja sangue total, pois o congelamento e descongelamento do sangue promovem hemólise.",382,question: What is the reason for a rapid enviada of amostras?
tuberculose_protocolo_14.txt,"Caso a amostra seja urina ou LCR e deva permanecer por mais de 48h no seu local de origem, o congelamento é possível se for à – 20º.C ou - 70ºC. 90.8 Orientações Para o Acondicionamento e Transporte de Amostras  Todas as amostras devem ser encaminhadas ao laboratório logo após a coleta, devidamente identificadas com o nome do paciente, número da amostra (1ª, 2ª, 3ª amostra ...) e data da coleta.",383,question: What is the temperature of the amostra?
tuberculose_protocolo_14.txt,"Se a amostra for enviada logo após a coleta, não há necessidade de almofadas de gelo, mas se exceder muito o tempo da coleta, manter sobre refrigeração (não congelar) e enviar com almofada de gelo;  Caso elas estejam congeladas a -20ºc ou -70ºc., recomendamos o transporte em gelo seco.",384,"question: A amostra for enviada logo após a coleta, no há necessidade de almofadas de gelo?"
tuberculose_protocolo_14.txt,"Reiteramos que o sangue total não deve ser congelado em hipótese alguma. 90.9 Documentos Requeridos Para o Envio de Amostras Biológicas  Ficha clínica epidemiológica contendo dados do paciente de forma legível, assim como dados clínicos e terapêuticos. 90.10 Dados Imprescindíveis Que Devem Constar na Ficha:  Todos os dados de identificação do paciente (nome, idade, data de nascimento e sexo), data da coleta, sinais e sintomas, data de início dos sintomas, local de residência, procedência da amostra.",385,"question: What is the definition of a ""singue total""?"
tuberculose_protocolo_14.txt,"Informar nas fichas se é amostra de monitoramento clínico-terapêutico e o tipo de imunodeficiência (TORCH, transplantado, HIV ou outros);  Relatório de exames encaminhados para rede do GAL/ IEC. 90.11 Critérios Para Rejeição de Amostras  Amostra sem identificação ou com identificação ilegível;  Ausência de correlação entre a identificação da ficha e da amostra;  As amostras que não estejam acompanhadas com os dados pessoais, clínicos e epidemiológicos do paciente;  Amostras hemolisadas e antigas;  Amostras de pacientes imunocompetente sem indicação clínica compatível para o exame.  É importante ressaltar que a pesquisa viral por métodos moleculares é mais indicada para pacientes com doenças graves, principalmente, imunodeficientes ou imunoincompetentes.",386,question: What is the purpose of a ficha?
tuberculose_protocolo_14.txt,"Pacientes imunocompetentes podem ter seu diagnóstico realizado por métodos sorológicos, caso seja imprescindível o diagnóstico por método molecular, cabe ao médico solicitante uma justificativa para o caso. 90.12 Prazo de Liberação dos Resultados Laboratoriais  Prazo de liberação dos resultados de 15 dias a contar a partir do recebimento do material no Laboratório. 91 LABORATÓRIO DE TOXICOLOGIA HUMANA E AMBIENTAL - BANCADA 92 METAIS EM SANGUE TOTAL 92.1 Exame  Pesquisa toxicológica em sangue total humano dos elementos químicos: Alumínio (Al), Arsênio (As), Bário (Ba), Berílio (Be), Bismuto (Bi), Cádmio (Cd), Chumbo (Pb), Cobalto (Co), Cobre (Cu), Cromo (Cr), Manganês (Mn), Molibdênio (Mo), Mercúrio (Hg), Níquel (Ni), Selênio (Se), Estrôncio (Sr), Estanho (Sn), Antimônio (Sb), Platina (Pt), Prata (Ag), Vanádio (V), Titânio (Ti), Tálio (Tl), Zinco (Zn)e Urânio (U). 92.2 Metodologia  Leitura em Espectrômetro de Massas com Plasma Induzido (ICP-MS). 92.3 Amostras Biológicas  Sangue Total 92.4 Volume  Sangue total: no mínimo 4 mL. 92.5 Período de Coleta  Preferência pela parte da manhã, sem a necessidade de o paciente estar em jejum. 92.6 Orientações Para a Coleta de Amostra  Sangue: Coletar o sangue por punção venosa em frasco de coleta próprio para análise de elementos traços em sangue total (BD Vacutainer® Trace Element K EDTA 10.8 mg) (Figura 1) e homogeneizar por inversão suavemente.",387,question: What is the diagnostico of a patient that is imunocompetentes?
tuberculose_protocolo_14.txt,"Figura 1 - Frasco de coleta próprio para análise de elementos traços em sangue total (BD Vacutainer® Trace Element K EDTA 10.8 mg). 92.7 Conservação das Amostras Até o Envio  Refrigerar de 2º a 8°C, por no máximo 5 dias, até envio ao laboratório.",388,question: What is the name of the BD Vacutainer® Trace Element K EDTA?
tuberculose_protocolo_14.txt,"Fonte: Instituto 92.8 Condições de Transporte  Acondicionar o material biológico devidamente em caixa de transporte, enviar refrigerado em gelo seco ou gelo reutilizável. 92.9 Formulários Requeridos  Ficha epidemiológica preenchida.  Todos os dados de identificação do indivíduo (nome, idade, data de nascimento, sexo, data da coleta, local de residência) e procedência da amostra. 92.10 Critérios Para Rejeição de Amostras  Amostra coletada em frasco inadequado;  Amostra com volume mínimo insuficiente;  Amostra sem identificação ou com identificação ilegível;  Ausência de correlação entre a identificação da ficha e da amostra;  As amostras que não estejam acompanhadas com os dados pessoais, clínicos e epidemiológicos do indivíduo;  Amostras hemolisadas. 92.11 Prazo de Liberação dos Resultados Laboratoriais  Prazo de liberação dos resultados de 30 dias a contar a partir do recebimento do material no Laboratório. 93 METAIS EM SORO SANGUÍNEO 93.1 Exame  Pesquisa toxicológica em soro sanguíneo dos elementos químicos: Alumínio (Al), Arsênio (As), Bário (Ba), Berílio (Be), Bismuto (Bi), Cádmio (Cd), Chumbo (Pb), Cobalto (Co), Cobre (Cu), Cromo (Cr), Manganês (Mn), Molibdênio (Mo), Mercúrio (Hg), Níquel (Ni), Selênio (Se), Estrôncio (Sr), Estanho (Sn), Antimônio (Sb), Vanádio (V), Titânio (Ti), Tálio (Tl), Zinco (Zn), Platina (Pt), Prata (Ag), Ferro (Fe) e Urânio (U). 93.2 Metodologia  Leitura em Espectrômetro de Massas com Plasma Induzido (ICP-MS). 93.3 Amostras Biológicas  Soro sanguíneo. 93.4 Volume  Soro: no mínimo 4 mL. 93.5 Período de Coleta  Preferência pela parte da manhã, sem a necessidade de o paciente estar em jejum. 93.6 Orientações para a Coleta de Amostra  Soro: É obtido após a coleta do sangue total, coagulação da amostra e posterior centrifugação.",389,question: What is the name of the Instituto 92.8 Condiçes de Transporte?
tuberculose_protocolo_14.txt,"O objetivo é que haja a formação de coágulo, e nesse processo os fatores da coagulação, plaquetas e fibrinogênio são consumidos.",390,question: What is the purpose of the coágulo formation?
tuberculose_protocolo_14.txt,"Então, de forma simplificada, o soro é o plasma sem fibrinogênio e fatores da coagulação.",391,question: What is the coagulaço?
tuberculose_protocolo_14.txt,Abaixo o frasco (BD Vacutainer® Trace Element Serum) (Figura 2) utilizado para coleta do sangue e posteriormente separação do soro em tubos KMA (Figura 3).,392,question: What product is used to remove sangue?
tuberculose_protocolo_14.txt,Figura 2 - Frasco de coleta próprio para análise de elementos traços em soro sanguíneo (BD Vacutainer® Trace Element Serum).,393,question: What is the name of the BD Vacutainer® Trace Element Serum?
tuberculose_protocolo_14.txt,Fonte: Instituto Evandro Chagas Figura 3 - Tubo de KMA utilizado para armazenamento do soro sanguíneo.,394,question: What is the name of the figure 3 used by the KMA?
tuberculose_protocolo_14.txt,"Fonte: Instituto Evandro Chagas 93.7 Conservação das Amostras Até o Envio  Refrigerar de 2º a 8°C, por no máximo 5 dias, até envio ao laboratório. 93.8 Condições de Transporte  Acondicionar o material biológico devidamente em caixa de transporte, enviar refrigerado em gelo seco ou gelo reutilizável. 93.9 Formulários Requeridos  Ficha epidemiológica preenchida;  Todos os dados de identificação do indivíduo (nome, idade, data de nascimento, sexo, data da coleta, local de residência) e procedência da amostra. 93.10 Critérios Para Rejeição de Amostras  Amostra coletada em frasco inadequado;  Amostra sem identificação ou com identificação ilegível;  Ausência de correlação entre a identificação da Ficha e da amostra;  As amostras que não estejam acompanhadas com os dados pessoais, clínicos e epidemiológicos doindividuo;  Amostras hemolisadas. 93.11 Prazo de liberação dos resultados laboratoriais  Prazo de liberação dos resultados de 30 dias a contar a partir do recebimento do material no Laboratório. 94 METAIS EM TECIDO CAPILAR 94.1 Exame  Pesquisa toxicológica em tecido capilar dos elementos químicos: Alumínio (Al), Arsênio (As), Bário (Ba), Berílio (Be), Bismuto (Bi), Cádmio (Cd), Chumbo (Pb), Cobalto (Co), Cobre (Cu), Cromo (Cr), Manganês (Mn), Molibdênio (Mo), Mercúrio (Hg), Níquel (Ni), Selênio (Se), Estrôncio (Sr), Estanho (Sn), Antimônio (Sb), Platina (Pt), Prata (Ag), Vanádio (V), Titânio (Ti), Tálio (Tl), Zinco (Zn)e Urânio (U). 94.2 Metodologia  Leitura em Espectrômetro de Massas com Plasma Induzido (ICP-MS). 94.3 Amostras Biológicas  Tecido Capilar 94.4 Volume  Tecido Capilar: massa mínima 300g. 94.5 Período de Coleta  Não há necessidade de período (manhã ou tarde) para realizar a coleta do tecido capilar. 94.6 Orientações Para a Coleta de Amostra  Tecido Capilar: A coleta é feita através da seleção de uma mecha da região occipital da cabeça.",395,question: What is the name of the Instituto Evandro Chagas?
tuberculose_protocolo_14.txt,"Para cabelos longos, após a seleção da mecha, deve-se amarrar o cabelo com barbante cerca de 1 a 2 cm do couro cabeludo (Figura 4).",396,question: What is the length of a cabelo?
tuberculose_protocolo_14.txt,"E posteriormente efetuar o corte, com auxilio de tesoura, e este deve ser realizado o mais próximo possível do couro cabeludo (Figura 5), com margem suficiente para evitar cortes no couro cabeludo, após o corte a mecha deve ser armazenada em envelopes de papel e/ou sacos zip lock previamente identificados com os dados do indivíduo (nome, data de nascimento, data da coleta, sexo, RG ou CPF), ou acompanhada da ficha epidemiológica preenchida.",397,"question: O corte a mecha deve ser armazenada em envelopes de papel e/ou sacos zip lock previamente identificados com os dados do indivduo (nome, data de nas"
tuberculose_protocolo_14.txt,"Em seguida ocorre a identificação no frasco de coleta, referente aos dados do indivíduo (nome, número de registro).",399,"question: A identificaço no frasco de coleta, referente aos dados do indivduo (nome, nmero de registro) issuing?"
tuberculose_protocolo_14.txt,"Deverá ser coletado o volume mínimo estipulado pelo laboratório 10 mL e/ou o máximo do frasco (50 mL), o indivíduo deverá realizar a higiene pessoal intima antes de coletar entrega no laboratório e/ou recolha do material na residência.",400,question: O indivduo deverá realizar a higiene pessoal intima antes de coletar entrega no laboratório e/ou recolha do material na residência
tuberculose_protocolo_14.txt,"Os materiais utilizados são isentos de qualquer tipo de conservantes, limpos, estéreis e lacrados. 95.7 Conservação das Amostras Até o Envio  Refrigerar de 2º a 8°C até o momento da entrega ao laboratório. 95.8 Condições de Transporte  Acondicionar o material biológico devidamente em caixa de transporte, enviar refrigerado em gelo seco ou gelo reutilizável. 95.9 Formulários Requeridos  Ficha epidemiológica preenchida;  Todos os dados de identificação do indivíduo (nome, idade, data de nascimento, sexo, data da coleta, local de residência) e procedência da amostra. 95.10 Critérios Para Rejeição de Amostras  Amostra com volume insuficiente;  Amostra sem identificação ou com identificação ilegível;  Ausência de correlação entre a identificação da Ficha e da amostra;  As amostras que não estejam acompanhadas com os dados pessoais; clínicos e epidemiológicos doindividuo;  Amostras sem refrigeração (em temperatura ambiente); 95.11 Prazo de Liberação dos Resultados Laboratoriais  Prazo de liberação dos resultados de 30 dias a contar a partir do recebimento do material no Laboratório. 96 METAIS EM LEITE MATERNO 96.1 Exame  Pesquisa toxicológica em Leite Materno dos elementos químicos: Alumínio (Al), Arsênio (As), Bário (Ba), Berílio (Be), Bismuto (Bi), Cádmio (Cd), Chumbo (Pb), Cobalto (Co), Cobre (Cu), Cromo (Cr), Manganês (Mn), Molibdênio (Mo), Mercúrio (Hg), Níquel (Ni), Selênio (Se), Estrôncio (Sr), Estanho (Sn), Antimônio (Sb), Platina (Pt), Prata (Ag), Vanádio (V), Titânio (Ti), Tálio (Tl), Zinco (Zn) e Urânio (U). 96.2 Metodologia  Leitura em Espectrômetro de Massas com Plasma Induzido (ICP-MS). 96.3 Amostras Biológicas  Leite Materno 96.4 Volume  Leite Materno: volume mínimo 5 mL. 96.5 Período de Coleta  Preferência pela parte da manhã, não há a necessidade de o indivíduo estar em jejum. 96.6 Orientações Para a Coleta de Amostra  Leite Materno: A coleta do leite materno deverá ser realizada através da expressão manual, realizada por pessoas capacitadas no procedimento (Figura 6).",401,question: What is the definition of a material that is used?
tuberculose_protocolo_14.txt,"Procedendo a higienização das mãos e das mamas, com água deionizada, e lubrificação da pele da aréola e dos mamilos com o próprio leite.",402,question: What is the process of higienizaço of mos and das mamas?
tuberculose_protocolo_14.txt,O volume da amostra deverá ser no mínimo o volume de 5 mL e com ácido nítrico a 10%.,403,question: What is the acid ntrico percentage?
tuberculose_protocolo_14.txt,"Figura 6: Coleta do leite materno Fonte: Instituto Evandro Chagas 96.7 Conservaçãodas Amostras Até o Envio  Refrigerar de 2º a 8°C até o momento da entrega ao laboratório e ao chegar no laboratório a mesma deverá ser armazenada em freezer -20°C até o momento da análise. 96.8 Condições de Transporte  Acondicionar o material biológico devidamente em caixa de transporte, enviar refrigerado em gelo seco ou gelo reutilizável. 96.9 Formulários Requeridos  Ficha epidemiológica preenchida.  Todos os dados de identificação do indivíduo (nome, idade, data de nascimento, sexo, data da coleta, local de residência) e procedência da amostra. 96.10 Critérios Para Rejeição de Amostras  Amostra com volume insuficiente;  Amostra sem identificação ou com identificação ilegível;  Ausência de correlação entre a identificação da Ficha e da amostra;  As amostras que não estejam acompanhadas com os dados pessoais; clínicos e epidemiológicos doindividuo;  Amostras sem refrigeração (em temperatura ambiente); 96.11 Prazo de Liberação dos Resultados Laboratoriais  Exame: Prazo de liberação dos resultados de 30 dias a contar a partir do recebimento do material no Laboratório. 97 LABORATÓRIO DE TOXICOLOGIA HUMANA E AMBIENTAL - BANCADA 98 ANÁLISE DE DICLORO DIFENIL TRICLOROETANO (DDT) 98.1 Exame  Pesquisa toxicológica em soro sanguíneo humano para análise de DDT. 98.2 Metodologia  Cromatografia Gasosa com Detecção de captura de elétrons (GC-ECD). 98.3 Amostras Biológicas  Soro sanguíneo. 98.4 Volume  Soro: de 3 a 5 mL 98.5 Período de Coleta  Preferência pela parte da manhã, sem a necessidade do paciente estar em jejum. 98.6 Orientações para a Coleta de Amostra  Soro: É obtida após a coleta, coagulação da amostra e posterior centrifugação, sendo que nenhum anticoagulante é utilizado.",404,question: What is the name of the Instituto Evandro Chagas?
tuberculose_protocolo_14.txt,"O objetivo é que haja a formação de coágulo, e nesse processo os fatores da coagulação, plaquetas e fibrinogênio são consumidos.",405,question: What is the purpose of the coágulo formation?
tuberculose_protocolo_14.txt,"Então, de forma simplificada, o soro é o plasma sem fibrinogênio e fatores da coagulação.",406,question: What is the coagulaço?
tuberculose_protocolo_14.txt,"Nota: Pode ser utilizado qualquer tubo para coleta de sangue desde que o mesmo contenha gel separador e ativador de coágulo, conforme o exemplo da Figura 7, e para o armazenamento do soro sanguíneo, utilizar os tubos de KMA Figura 8.",407,question: What is the use of tubos in KMA Figura 8?
tuberculose_protocolo_14.txt,Figura 7 - Tubo contendo amostra de fase.,408,question: What is the title of the figure 7?
tuberculose_protocolo_14.txt,Fonte: Instituto Evandro Chagas Figura 8 - Tubos para congelamento criogênico KMA.,409,question: What is the name of the Instituto Evandro Chagas?
tuberculose_protocolo_14.txt,"Fonte: Instituto Evandro Chagas 98.7 Conservação das amostras até o envio  Refrigerar de 2º a 8°C, por no máximo 5 dias, até envio ao laboratório. 98.8 Condições de transporte  Acondicionar o material biológico (soro sanguíneo) devidamente em caixa de transporte, enviar refrigerado em gelo seco ou gelo reutilizável. 98.9 Formulários requeridos  Ficha epidemiológica preenchida. 98.10 Dados imprescindíveis que devem constar na ficha  Todos os dados de identificação do paciente (nome, idade, data de nascimento, sexo, data da coleta, local de residência) e procedência da amostra. 98.11 Critérios para rejeição de amostras  Amostra coletada em frasco inadequado;  Amostra sem identificação ou com identificação ilegível;  Ausência de correlação entre a identificação da Ficha e da amostra;  As amostras que não estejam acompanhadas com os dados pessoais, clínicos e epidemiológicos do paciente;  Amostras hemolisadas. 98.12 Prazo de liberação dos resultados laboratoriais  Prazo de liberação dos resultados de 30 dias a contar a partir do recebimento do material no Laboratório. 99 ANÁLISE DE COLINESTERASE 99.1 Exame  Pesquisa toxicológica em sangue total humano para análise de colinesterase. 99.2 Metodologia  Método de Ellman Modificado. 99.3 Amostras Biológicas  Sangue total. 99.4 Volume  Sangue total: de 2 a 4 mL (conforme frasco de coleta). 99.5 Período de Coleta  Preferência pela parte da manhã, sem a necessidade do paciente estar em jejum. 99.6 Orientações Para a Coleta de Amostra  Sangue: Coletar o sangue por punção venosa em frasco contendo anticoagulante EDTA (tubos k3 ou k2) Figura 9 ou na ausência desses, qualquer tubo que contenha EDTA.",410,question: What is the name of the institute that provides the following guidelines for refrigerating amostras?
tuberculose_protocolo_14.txt,Figura 9 - Tubos k2 e k3 com anticoagulantepara análise de colinesterase.,411,question: What is the name of the figure 9?
tuberculose_protocolo_14.txt,"Fonte: indiamart.com 99.7 Conservação das Amostras Até o Envio  Refrigerar de 2º a 8°C, por no máximo 5 dias, até envio ao laboratório. 99.8 Condições de Transporte  Acondicionar o material biológico devidamente em caixa de transporte, enviar refrigerado em gelo seco ou gelo reutilizável. 99.9 Formulários Requeridos  Ficha epidemiológica preenchida. 99.10 Dados Imprescindíveis Que Devem Constar na Ficha  Todos os dados de identificação do paciente (nome, idade, data de nascimento, sexo, data da coleta, local de residência) e procedência da amostra. 99.11 Critérios Para Rejeição de Amostras  Amostra coletada em frasco inadequado;  Amostra sem identificação ou com identificação ilegível;  Ausência de correlação entre a identificação da Ficha e da amostra;  As amostras que não estejam acompanhadas com os dados pessoais, clínicos e epidemiológicos do paciente; 99.12 Prazo de Liberação dos Resultados Laboratoriais Prazo de liberação dos resultados de 30 dias a contar a partir do recebimento do material no laboratório. 100 SEÇÃO DE PARASITOLOGIA 101 LABORATÓRIO DE LEISHMANIOSES “PROF.",412,question: What is the name of the website that provides information about the dados that are used to identify a patient?
