Arquivo,Parágrafo,Número do parágrafo,Pergunta
tuberculose_protocolo_14.txt,"A amostra não deve passar por processo de resfriamento ou congelamento;  Conservar as amostras biológicas frescas (sangue total/soro, LCR) em freezer a -70ºC e/ou nitrogênio líquido até o envio ao laboratório de destino. 143.8 Orientações Para o Acondicionamento e Transporte de  No caso de amostras parafinadas ou em formol/álcool 70% as amostras devem seguir as seguintes orientações: a) Acondicionar o material biológico em caixa de transporte ou isopor, introduzir as peças em frascos de boca larga com identificação do paciente, contendo solução de formalina a 10%, transportar em temperatura ambiente; Figura 10 - Envio de amostras em formol ou parafina.",527,question: What is the envio of amostras em formol or parafina?
tuberculose_protocolo_14.txt,"A componentes de identificação, B organização e Fonte: Instituto Evandro Chagas b) A amostra não deve passar por processo de resfriamento ou congelamento; c) A Central de Recebimento de Amostras do Instituto Evandro Chagas, apenas irá receber as amostras que estiverem dentro da conformidade deste protocolo;  Amostras biológicas: devem ser colocadas em criotubo transparente de forma individualizada.",528,question: What components of the Instituto Evandro Chagas are involved in the identification of an amostra?
tuberculose_protocolo_14.txt,"Nos casos de fezes sólidas em fraldas, coletar com espátula e colocar no frasco coletor.",530,question: What do you do when you have a feze that is not a frasco coletor?
tuberculose_protocolo_14.txt,"Para fezes líquidas, utilizar compressa cirúrgica entre a criança e a fralda, e posteriormente acondicionar a compressa no frasco coletor. 145.7 Orientação para conservação das amostras biológicas até o envio  Refrigerar as fezes (2ºC a 8°C) por até 4 horas.",531,question: What is the use of compressa cirrgica?
tuberculose_protocolo_14.txt,"Após este prazo, congelar a -20°C. 145.8 Orientação para acondicionamento e transporte de amostras  Acondicionar devidamente o material biológico em caixa de transporte, e enviar sob refrigeração (em gelo seco ou gelo reutilizável). 145.9 Documentos requeridos para o envio de amostras biológicas  Ficha clínico epidemiológica ou ficha do SINAN, preenchida adequadamente com todos os dados do paciente (nome completo, idade, sexo, data de nascimento, data de coleta da amostra, sinais e sintomas clínicos, data do início dos sintomas, dados epidemiológicos, local de residência e procedência do indivíduo). 145.10 Critérios de rejeição para recebimento das amostras biológicas  Amostra sem identificação ou com identificação ilegível;  Ausência de correlação entre a identificação da ficha e da amostra;  Amostras que não estejam acompanhadas com os dados pessoais, clínicos e epidemiológicos do paciente. 145.11 Prazo de liberação dos resultados laboratoriais  O tempo de liberação estimado depende da metodologia utilizada como descrito abaixo:  Teste Imunocromatográfico (“Teste Rápido”): 5 dias;  Ensaio Imunoenzimático (EIE): 7 dias;  Eletroforese em Gel de Poliacrilamida (EGPA): 7 dias;  Reação em Cadeia da Polimerase e suas variações (PCR, RT-PCR e RT-qPCR): 14 dias;  Sequenciamento: 20 dias. 145.12 Comentários  As amostras fecais devem ser obtidas o mais precocemente possível no curso da diarreia. 145.13 Proveniência das Amostras:  As amostras são encaminhadas pela Rede Pública de Saúde e Rede de Vigilância Epidemiológica. 146 LABORATÓRIO DE ENTEROVÍRUS 146.1 Exames  Pesquisa de Enterovírus/Poliovírus/Coxsakievírus e outros picornavírus;  Pesquisa de Herpesvírus 1 e 2. 146.2 Técnicas Laboratoriais  Isolamento viral em cultura celular;  Reação em cadeia da Polimerase precedida de Transcrição Reversa (RT- PCR);  Reação em cadeia da Polimerase (PCR). 146.3 Amostras Biológicas  Pesquisa de Enterovírus: fezes, LCR, swab de lesão (orofaringe, conjuntiva), liquido pericárdico;  Pesquisa de Poliovírus e outros picornavírus: fezes;  Pesquisa de Herpesvírus 1 e 2: LCR, swab de lesão (orofaringe, conjuntiva), fragmentos de tecido. 146.4 Volume das amostras biológicas  Fezes: 4 a 8 g;  LCR: mínimo de 1 mL;  Swab de lesão: dois swabs em 2 mL de meio de transporte viral (tubo único);  Liquido pericárdico: mínimo de 1 mL. 146.5 Período de Coleta  Fezes: até 14 dias do início dos sintomas;  LCR: fase aguda da doença (durante atendimento);  Swab de lesão (orofaringe, conjuntiva): fase aguda da doença - aparecimento de vesículas no caso de suspeita de infecção por Herpes;  Fragmento de tecido: fase aguda da doença (durante atendimento/internação);  Líquido pericárdico: fase aguda da doença (durante atendimento/internação).",532,question: What is the temperature of the amostras?
tuberculose_protocolo_14.txt,"Nota: Em casos suspeitos de enteroviroses, pode ser coletado swab de lesão ou espécimes diferentes. 146.6 Orientações Para Coleta de Amostras Biológicas  Fezes: coletar de 4 a 8 g sem meio de transporte, em frasco limpo, seco, de boca larga, com tampa de rosca e devidamente identificado (nome do paciente e data da coleta);  LCR: punção lombar;  Swab de lesão.  Orofaringe: utilizar um swab estéril de Rayon e introduzi-lo suavemente na área posterior da faringe e tonsilas, evitando tocar na língua.",533,question: What is the swab of leso?
tuberculose_protocolo_14.txt,Realizar movimentos circulares a fim de envolver totalmente o swab com as células da mucosa.,534,question: What is the purpose of a circular motion?
tuberculose_protocolo_14.txt,"Ao final da coleta os swabs devem ser acondicionados com meio de transporte viral com antibiótico (1-2 mL);  Conjuntiva: com um swab estéril de Rayon, coletar amostra da olho, com movimentos circulares.",535,question: What is the effect of a swab on the viral transmission?
tuberculose_protocolo_14.txt,Para ajudar no processo de lacrimejamento pode-se passar levemente o swab no saco conjuntival abaixando a pálpebra.,536,question: What is the process of lacrimejamento?
tuberculose_protocolo_14.txt,"É importante manter, por alguns segundos, o lacrimejamento e absorção da secreção pelo swab.",537,question: O lacrimejamento e aborço da secreço pelo swab é importante?
tuberculose_protocolo_14.txt,Colocar o swab em um tubo contendo meio de transporte viral com antibiótico (1-2 mL);  Fragmento de tecido e liquido pericárdico - Punção.,538,question: What is the effect of a swab on a person's immune system?
tuberculose_protocolo_14.txt,"Nota: Os Herpesvírus, por se tratarem de vírus envelopados, são menos resistentes a variação de temperatura. 146.7 Orientação Para Conservação das Amostras Biológicas Até o Envio  Fezes: no caso de envio imediato ao laboratório não há necessidade de congelar, apenas manter refrigerado (2º a 8°C) por no máximo 12h.",539,question: What is the temperature of Herpesvrus?
tuberculose_protocolo_14.txt,"Na impossibilidade do envio imediato, as amostras devem ser armazenadas - 20 °C;  O LCR deve ser aliquotado após a coleta e a amostra que será enviada para pesquisa viral deve ser congelada a -20°C o quanto antes.",540,question: What is the temperature of the amostras that are enviada for a viral infection?
tuberculose_protocolo_14.txt,Nota: O LCR não deve ficar aguardando a citologia e bioquímica a temperatura ambiente. 146.8 Orientação Para Acondicionamento e Transporte de Amostras  Acondicionar o material biológico devidamente em caixa de transporte e envia-lo congelado em gelo seco (preferencialmente) ou gelo reutilizável.,541,question: What is the nature of the material that is used for transport?
tuberculose_protocolo_14.txt,"Nota: Caso as amostras possam ser entregues ao laboratório em até 12h da coleta, é possível envia-las sob-refrigeração (2º a 8°C). 146.9 Documentos Requeridos Para o Envio de Amostras Biológicas  Ficha clínico epidemiológica ou ficha do SINAN, preenchida adequadamente com todos os dados do paciente (nome completo, idade, sexo, data de nascimento, data de coleta da amostra, sinais e sintomas clínicos, data do início dos sintomas, dados epidemiológicos, local de residência e procedência do indivíduo);  Na ausência da ficha, enviar histórico do paciente e o requerimento de solicitação do exame. 146.10 Critérios de Rejeição Para Recebimento das Amostras Biológicas  Amostra sem identificação ou com identificação ilegível;  Ausência de correlação entre a identificação da Ficha e da amostra;  As amostras que não estejam acompanhadas com os dados pessoais, clínicos e epidemiológicos do paciente. 146.11 Prazo de Liberação dos Resultados Laboratoriais  O tempo de liberação estimado depende da metodologia utilizada como descrito abaixo:  Isolamento viral em cultura celular: 14 dias;  Reação em cadeia da Polimerase precedida de Transcrição Reversa (RT-PCR): 7 dias;  Reação em cadeia da Polimerase (PCR): 7 dias. 146.12 Proveniência das Amostras:  As amostras são encaminhadas pela Rede Pública de Saúde e Rede de Vigilância Epidemiológica. 147 LABORATÓRIO DE VÍRUS RESPIRATÓRIOS 147.1 Exames  Pesquisa de vírus Influenza A (H1N1pdm09 e H3N2), Influenza B, Vírus Influenza de origem aviária (H5, H7, H9), Vírus Respiratório Sincicial Humano, Metapneumovírus Humano, Adenovírus Humano, Parainfluenza I, Parainfluenza II, Parainfluenza III, Parainfluenza IV, Enterovírus Respiratório, Coronavírus associado à Síndrome Respiratória Aguda Grave 2 (SARS-CoV-2), Coronavírus Humano OC43, Coronavírus Humano HKU1, Coronavírus Humano NL63, Coronavírus Humano 229E, Rinovírus Humano, Bocavírus Humano, entre outros. 147.2 Técnicas Laboratoriais  Reação em Cadeia da Polimerase precedida de Transcrição Reversa em tempo real (RT-qPCR);  Sequenciamento pelo método de Sanger;  Sequenciamento genômico de nova geração (NGS);  Isolamento viral em cultura celular. 147.3 Amostras Biológicas  Aspirado de nasofaringe;  Swab de orofaringe e nasofaringe;  Fragmento de tecidos (pulmão, tonsilas, mucosa nasal e brônquios). 147.4 Volume das Amostras Biológicas  Aspirado de nasofaringe - 3 mL;  Swab de orofaringe e nasofaringe - 3 mL;  Fragmento de tecidos - 1 a 3 cm. 147.5 Período de Coleta  Pacientes com síndrome gripal até sete dias após o início dos sintomas.  Pacientes com SRAG (Síndrome Respiratória Aguda Grave) internados em UTI, a coleta da amostra deve ser feita independente do dia de início dos sintomas.  Amostras pós-mortem devem ser coletadas até 12 horas após o óbito. 147.6 Orientações Para Coleta de Amostras Biológicas  Para a coleta de aspirado de nasofaringe deve ser utilizado o coletor apropriado e bomba a vácuo.",542,question: What is the tempo of liberaço estimado?
tuberculose_protocolo_14.txt,"Durante a coleta, a sonda é inserida através da narina até atingir a região da nasofaringe, quando então o vácuo é aplicado, aspirando a secreção para o interior do coletor.",543,question: A sonda é inserida através da narina até atingir a regio da nasofaringe?
tuberculose_protocolo_14.txt,"Este procedimento deve ser realizado em ambas as narinas, mantendo mucosa, evitando o sangramento.",544,question: What is the process of generating a narina?
tuberculose_protocolo_14.txt,"Após aspirar a secreção, deve-se colocar 3 mL de meio de transporte viral;  Para o swab de orofaringe e nasofaringe deverão ser coletados três swabs, um swab de orofaringe e dois swabs de nasofaringe, sendo um de cada narina.",545,question: What is the secret of a viral infection?
tuberculose_protocolo_14.txt,A coleta deve ser realizada com a fricção do swab na região posterior do meato nasal (swab de nasofaringe) para se obter células da mucosa.,546,question: What is the procedure used to remove células?
tuberculose_protocolo_14.txt,"E na área posterior da faringe e tonsilas, evitando tocar na língua (swab de orofaringe).",547,question: Where do you avoid tocar na lngua?
tuberculose_protocolo_14.txt,"Todos os swabs deverão ser colocados em meio de transporte viral (3mL);  A coleta das amostras de fragmento de tecidos, de diferentes sítios das vias respiratórias ou de qualquer outra localização anatômica, deve ser feita, observando-se os protocolos em vigência, nos serviços locais de patologia clínica.",548,question: What is the risk of swabs being colocated?
tuberculose_protocolo_14.txt,Os fragmentos de tecido deverão ser conservados em 3 mL de meio de transporte viral.,549,question: How many viral fragments are there?
tuberculose_protocolo_14.txt,"Notas:  Para o diagnóstico da etiologia viral por biologia molecular a partir de fragmento de tecidos só serão aceitas amostras frescas, não podendo ser utilizadas amostras conservadas em formalina;  Os vírus respiratórios são termolábeis, desta forma torna-se de coleta, transporte e armazenamento das amostras. 147.7 Orientação Para Conservação das Amostras Biológicas Até o Envio salina tamponada (PBS pH 7.2), suplementadas com antibióticos e gelatina 0,5%.  As amostras podem ser mantidas a 4°C por até 48h após a coleta.",550,question: What is the etiologia viral?
tuberculose_protocolo_14.txt,"Se o envio ultrapassar o período de 48h, a amostra deverá ser armazenada a - 70°C ou em nitrogênio líquido. 147.8 Orientação Para Acondicionamento e Transporte de Amostras  As amostras biológicas deverão ser acondicionadas em caixas categoria adequada, preferencialmente em gelo seco.",551,question: What is the temperature of the amostra?
tuberculose_protocolo_14.txt,"Via de regra os pacientes investigados são portadores do eritema infeccioso (no caso do Parvovírus B19) ou exantema súbito (no caso do HHV-6), embora as doenças linfoproliferativas também pareçam se associar ao HHV-6; específica por EIE. 148.13 Proveniência das Amostras  Amostras são encaminhadas pela Rede Pública de Saúde. 149 LABORATÓRIO DE RETROVÍRUS 149.1 Exames  Pesquisa de anticorpos totais anti-HIV-1/2 e anti-HTLV-1/2;  Pesquisa do DNA proviral do HIV-1/2 e HTLV-1/2. 149.2 Técnicas laboratoriais  Pesquisa de HIV-1/HIV-2  Ensaio Imunoenzimático (EIE) para detecção de anticorpos totais anti- HIV-1/2;  Imunoblot - teste confirmatório.",553,question: What is the eritema infeccioso?
tuberculose_protocolo_14.txt,Detecção de anticorpos específicos anti- HIV-1/2;  Western Blot - teste confirmatório.,554,question: What is the name of the test that confirms HIV-1/2?
tuberculose_protocolo_14.txt,Detecção sorológica de anticorpos específicos anti-HIV-1/2;  Reação em Cadeia da Polimerase em tempo real (qPCR) e Reação em cadeira da polimerase (PCR).,555,question: What is the name of the two methods used to detect HIV-1/2?
tuberculose_protocolo_14.txt,Detecção do DNA proviral do HIV-1/2.  Metodologia para pesquisa de HTLV-1/HTLV-2  Ensaio imunoenzimático (EIE) - ensaio de triagem para detecção sorológica de anticorpos totais anti-HTLV-1/2;  Western Blot - teste confirmatório.,556,question: What is the purpose of EIE?
tuberculose_protocolo_14.txt,Detecção sorológica de anticorpos específicos anti-HTLV-1/2;  Reação em Cadeia da Polimerase em tempo real (qPCR).,557,question: What is the name of the qPCR?
tuberculose_protocolo_14.txt,"Detecção do DNA proviral do HTLV-1/2. 149.3 Amostras Biológicas  Soro;  Plasma;  Sangue Total;  LCR. 149.4 Volume das amostras biológicas  Soro, plasma ou LCR: 500 µL;  Sangue total: 4 mL. 149.5 Período de coleta das amostras biológicas  Fase aguda ou convalescente da doença. 149.6 Orientações para coleta de amostras biológicas  Coletar o sangue por punção venosa com posterior e mais rápida possível separação do soro e/ou plasma para evitar hemólise;  Coleta do sangue total utilizando um sistema de coleta a vácuo em tubo contendo EDTA como anticoagulante;  Coleta de LCR por punção lombar. 149.7 Orientações Para Conservação das Amostras Biológicas Até o Envio  Sangue total: acondicionar as amostras à temperatura de 4ºC até o momento do transporte;  Soro, plasma ou LCR: congelar a -20ºC até o momento do transporte. 149.8 Orientações Para o Acondicionamento e Transporte de Amostras  Soro, plasma, LCR ou sangue total: acondicionar devidamente em caixa de transporte, e enviar sob refrigeração (gelo reutilizável). 149.9 Documentos Requeridos Para o Envio de Amostras Biológicas  Ficha clínico epidemiológica ou ficha do SINAN, preenchida adequadamente com todos os dados do paciente (nome completo, idade, sexo, data de nascimento, data de coleta da amostra, sinais e sintomas clínicos, data do início dos sintomas, dados epidemiológicos, local de residência e procedência do indivíduo). 149.10 Critérios de Rejeição Para Recebimento das Amostras Biológicas  Amostra sem identificação ou com identificação ilegível;  Ausência de correlação entre a identificação da Ficha e da amostra;  As amostras que não estejam acompanhadas com os dados pessoais, clínicos e epidemiológicos do paciente;  Amostras hemolisadas, lipêmicas ou que estejam em volume insuficiente. 149.11 Prazo de Liberação dos Resultados Laboratoriais  O tempo de liberação estimado depende da metodologia utilizada como descrito abaixo:  Ensaio Imunoenzimático (EIE): 10 dias;  Imunoblot: 10 dias;  Western Blot: 10 dias;  Reação em Cadeia da Polimerase em tempo real (qPCR) e Reação em cadeira da polimerase (PCR): 14 dias. 149.12 Comentários  O EIE representa o procedimento de escolha na triagem do HIV, destacando-se a necessidade da confirmação laboratorial por Imunoblot, Western Blot, qPCR ou PCR.",558,question: What is the name of the gene that causes DNA to proviral?
tuberculose_protocolo_14.txt,"O diagnóstico primário da infecção por HTLV se efetua com o EIE, recomendando-se confirmação com Western blot ou qPCR.",559,question: What is the first step in detecting HTLV?
tuberculose_protocolo_14.txt,"Esses dois últimos, permitem a diferenciação entre os tipos 1 e 2.",560,question: Os tipos 1 e 2 permitm a diferenciaço entre os tipos 1 e 2.
tuberculose_protocolo_14.txt,"A detecção de anticorpos ou do DNA proviral no LCR reserva especial importância no diagnóstico da paraparesia tropical espástica, condição neurológica associada principalmente ao HTLV-1. 149.13 Proveniência das Amostras  As amostras são encaminhadas pela Rede Pública ou Privada de Saúde. 150 LABORATÓRIO DE VÍRUS EPSTEIN BARR 150.1 Exames  Pesquisa de Vírus Epstein-Barr, Vírus da Caxumba e Vírus da Varicela. 150.2 Técnicas Laboratoriais  Pesquisa de Vírus Epstein-Barr:  Ensaio Imunoenzimático (EIE) para detecção de anticorpos de classe IgM contra o antígeno de capsídeo viral do EBV.  Pesquisa de Vírus da Caxumba:  Ensaio Imunoenzimático (EIE) para detecção de anticorpos de classe IgM contra o vírus da Caxumba.  Pesquisa de Vírus da Varicela:  Ensaio Imunoenzimático (EIE) para detecção de anticorpos de classe IgM direcionados contra o Vírus da Varicela. 150.3 Amostras Biológicas  Soro.  Plasma. 150.4 Volume das Amostras Biológicas  200µL. 150.5 Período de Coleta das Amostras Biológicas  Vírus Epstein-Barr:  Fase aguda, de 7-14 dias após o início da doença.  Vírus da Caxumba:  Fase aguda, de 5-10 dias após o início dos sintomas.  Vírus da Varicela:  Fase aguda, de 7-14 dias após o início da doença (erupções cutâneas vermelhas). 150.6 Orientações Para Coleta de Amostras Biológicas  Coletar sangue periférico através de punção venosa e posterior separação do soro e/ou plasma para evitar hemólise. 150.7 Orientações Para Conservação das Amostras Biológicas Até o Envio  Refrigerar de 2º a 8°C até envio para o laboratório. 150.8 Orientações Para Acondicionamento e Transporte de Amostras  Acondicionar o material biológico devidamente em caixa de transporte, enviar sob refrigeração (em gelo seco ou gelo reutilizável). 150.9 Documentos Requeridos Para o Envio de Amostras Biológicas  Ficha clínico epidemiológica ou ficha do SINAN, preenchida adequadamente com todos os dados do paciente (nome completo, idade, sexo, data de nascimento, data de coleta da amostra, sinais e sintomas clínicos, data do início dos sintomas, dados epidemiológicos, dados de vacinação, local de residência e procedência do indivíduo). 150.10 Critérios Para Rejeição de Amostras  Amostra sem identificação ou com identificação ilegível;  Diferenças entre a identificação da Ficha e da amostra;  As amostras que não estejam acompanhadas com os dados pessoais, clínicos e epidemiológicos do paciente;  Amostras hemolisadas (intensa coloração vermelha);  Amostras visualmente lipêmicas (aspecto “leitoso”). 150.11 Prazo Para Liberação do Resultado  Ensaio Imunoenzimático: 10 dias. 150.12 Comentários  Vírus Epstein-Barr  Os procedimentos imunoenzimáticos são dotados de praticidade.",561,question: What is the name of the EIE?
tuberculose_protocolo_14.txt,A presença de IgM anti-VCA usualmente indica infecção aguda pelo EBV.  Vírus da Caxumba  A presença de anticorpos de classe IgM contra o vírus da Caxumba tipicamente indica infecção recente ou atual.,562,question: What does the presença de IgM anti-VCA do?
tuberculose_protocolo_14.txt,"Baixos níveis de IgM podem permanecer por mais de 12 meses após a infecção.  Vírus da Varicela  A varicela é uma infecção viral primária, aguda, altamente contagiosa, caracterizada por surgimento de exantema de aspecto máculo-papular e distribuição centrípeta, que, após algumas horas, torna-se vesicular, evolui rapidamente para pústulas e, posteriormente, forma crostas, em 3 a 4 dias.",563,question: What is the occurrence of varicela?
tuberculose_protocolo_14.txt,Pode ocorrer febre moderada e sintomas sistêmicos.,564,question: What is the purpose of a sistomas sistomas?
tuberculose_protocolo_14.txt,"A principal característica clínica é o polimorfismo das lesões cutâneas, que se apresentam nas diversas formas evolutivas, acompanhadas de prurido.",565,question: What is the main characteristic of cutaneas?
tuberculose_protocolo_14.txt,Manual de vigilância sanitária sobre transporte de material biológico humano para fins de diagnóstico clínico.,568,question: What is the name of the manual?
tuberculose_protocolo_14.txt,NBR 6023: informação e documentação: referências: elaboração.,570,question: What is the NBR 6023?
tuberculose_protocolo_14.txt,Manual de diagnóstico laboratorial da malária. 2. ed.,572,question: What is the name of the book that was published in the second edition of this book?
tuberculose_protocolo_14.txt,Guia para a Rede Laboratorial de Vigilância de Influenza no Brasil.,576,question: What is the name of the document that is available to the Brazilian public?
tuberculose_protocolo_14.txt,Disponível em: <http://bvsms.saude.gov.br/bvs/publicacoes /guia_laboratorial_influenza_vigilancia_influenza_brasil.pdf>ISBN 978-85-334- 2402-9.,578,question: What is the name of the book?
tuberculose_protocolo_14.txt,Guia prático de tratamento da malária no Brasil. 2.,581,question: What is the name of the treatment that is offered to malarious patients?
tuberculose_protocolo_14.txt,Guia de Vigilância Epidemiológica. 7. ed.,584,question: What is the name of the book that was published in the summer of 2007?
tuberculose_protocolo_14.txt,Manual técnico de diagnóstico das hepatites virais. 2 ed.,588,question: What is the name of the book that describes the hepatitis virus?
tuberculose_protocolo_14.txt,Manual de vigilância da leishmaniose tegumentar.,592,question: What is the manual of vigilance?
tuberculose_protocolo_14.txt,Protocolo de notificação e investigação: toxoplasmose gestacional e congênita.,596,question: What is the definition of a toxoplasmose gestacional and congênita?
tuberculose_protocolo_14.txt,Vigilância da esquistossomose mansoni: diretrizes técnicas. 4. ed.,599,"question: What is the name of the book that is titled ""diretrizes técnicas""?"
tuberculose_protocolo_14.txt,Atlas de leishmaniose tegumentar americana: diagnóstico clínico e diferencial.,602,question: What is the name of the clnico and diferencial tegumentar americana?
tuberculose_protocolo_14.txt,Manual de controle da leishmaniose tegumentar americana. 2. ed. atual.,604,question: What is the name of the book that is a manual?
tuberculose_protocolo_14.txt,"Soroepidemiologia da infecção pelo toxoplasma gondii no município de Novo Repartimento, estado do Pará, Brasil.",606,question: What is the name of the disease that causes it to spread?
tuberculose_protocolo_14.txt,Revista Pan - Amazônica de Saúde.,607,question: What is the name of the magazine that is published by the Spanish government?
tuberculose_protocolo_14.txt,Diagnóstico Laboratorial das Parasitoses Humanas: métodos e técnicas.,608,question: What is the name of the laboratory that produces the Parasitoses Humanas?
tuberculose_protocolo_14.txt,"Rio de Janeiro: MEDSI Editora Médica e Científica Ltda, 1994.",609,question: What publication was published in 1994?
tuberculose_protocolo_14.txt,"II Consenso Brasileiro em Doença de Chagas, 2015.",610,question: What was the name of the second consenso brasileiro em doença de Chagas?
tuberculose_protocolo_14.txt,"Brasília, v. 25, n. spe. p. 7-86, 2016.",612,question: What is the name of the Brazilian magazine that was published in 2016?
