Arquivo,Parágrafo,Número do parágrafo,Pergunta
tuberculose_protocolo_5.txt,"Se não aparecer resistência, aguardar até completar 42 dias de incubação, tendo em vista que o resultado definitivo é emitido após a leitura do TS completar esse tempo incubado.",462,question: Aguardar até completar 42 dias de incubaço?
tuberculose_protocolo_5.txt,Deve-se conciliar os resultados do teste de um paciente com resultados anteriores obtidos para o mesmo paciente.,463,question: What is the purpose of a patient's test results?
tuberculose_protocolo_5.txt,"No caso de observar incoerências ou discordâncias entre os resul- tados, repetir o teste partindo, de preferência, do isolamento primário. 9.6.5 CIQ do sistema automatizado – MGIT Para descartar uma possível contaminação bacteriana ou fúngica, deve-se semear cada suspensão bacteriana a ser testada em um tubo de meio de cultura TSA: » incubar a 36°C ± 1°C e realizar a leitura após 48 horas de incubação; e » utilizar uma cepa de referência M. tuberculosis H37Rv a cada lote novo de fármacos a serem testadas.",464,question: What is the main reason for repeating the test?
tuberculose_protocolo_5.txt,"Essa cepa controle é sensível a todos os fármacos de primeira linha na concentração utilizada na técnica. 9.7 Avaliação Externa da Qualidade do Teste de Sensibilidade Desde 1994, a OMS criou uma Rede de Laboratórios Supranacionais (RLSN) que norma- liza e coordena a supervisão externa indireta do TS no mundo, também chamado de ensaio de proficiência.39 Atualmente, o laboratório coordenador da RLSN é o Instituto de Medicina Tropical da Bélgica.",465,question: What is the concentraço used in the test?
tuberculose_protocolo_5.txt,"Essa rede está conformada por 20 laboratórios supranacio- em alguma região. 9 TESTE DE SENSIBILIDADE de referência, seja nacional, seja regional, e esses devem ser avaliados por um laboratório supranacional (LSN).",466,question: What is the definition of a LSN?
tuberculose_protocolo_5.txt,"Em cada país, o LRN deve coordenar um programa de CQ para os laboratórios da sua rede que realizam TS.",467,question: What does the LRN do to help the laboratórios that do TS?
tuberculose_protocolo_5.txt,"No Brasil, como foi descrito no capítulo 7 para o AEQ da Cultura, o LRN deve executar esse programa em conjunto com os LRR.",468,question: What is the LRN's program?
tuberculose_protocolo_5.txt,"O ensaio de proficiência consiste no envio de um painel de cepas com fenótipo de resis- tência selecionado para poder avaliar, em cada laboratório, a precisão dos resultados do TS frente aos fármacos de primeira e segunda linha.",469,question: What is the purpose of a TS?
tuberculose_protocolo_5.txt,"O número de cepas que compõe o painel é duplicado e recebe um código sorteado ao acaso, que, assim como os resultados dos testes, somente o laboratório, que está coordenando o programa, conhece.",470,question: O nmero de cepas que compe o painel é duplicado e recebe um código sorteado ao acaso?
tuberculose_protocolo_5.txt,"O laboratório coordenador realiza os TS de cada cepa do painel e os replica, em número suficiente, para enviar aos laboratórios da rede que serão supervisionados.",471,"question: O coordenador realiza os TS de cada cepa do painel e os replica, em nmero suficiente, para enviar aos laboratórios da rede que sero supervisionados"
tuberculose_protocolo_5.txt,Os painéis material de risco biológico.,472,question: Os painéis material de risco biológico?
tuberculose_protocolo_5.txt,"Os laboratórios supervisionados realizam os TS às cegas, utilizando o método recomenda- do e aplicado na rotina de trabalho.",473,question: Os laboratórios superviseados realizam os TS às cegas?
tuberculose_protocolo_5.txt,"Os resultados informados de cada laboratório são comparados com o “resultado consenso” (acordado pela maioria dos laboratórios supranacionais), e cada resultado é classificado em: i) verdadeiro resistente; ii) falso resistente; iii) falso sensível; e iv) verdadeiro sensível.",474,question: What is the classification of each result?
tuberculose_protocolo_5.txt,"Para cada fármaco, são calculadas a sensibilidade, especificidade, eficiência e reprodutibi- lidade.",475,question: What are the three main aspects of a person's life?
tuberculose_protocolo_5.txt,"A sensibilidade avalia o acerto na detecção da resistência; a especificidade, o acerto na determinação da ausência de resistência; e a eficiência, o acerto no total de resultados.",476,"question: A sensibilidade avalia o acerto na detecço da resistência; a especificidade, o acerto na determinaço da ausência de resistência;"
tuberculose_protocolo_5.txt,A reprodutibilidade avalia a consistência dos resultados produzidos pelo laboratório. incrementar a qualidade dos laboratórios.,477,question: A reprodutibilidade avalia a consistência dos resultados produzidos pelo laboratório.
tuberculose_protocolo_5.txt,"Como meta de desempenho para os labora- tórios, espera-se uma eficiência de 92% para estreptomicina e etambutol, de 97% para isoniazida e de 99% para rifampicina.",478,question: What is the percentage of isoniazida that is effective?
tuberculose_protocolo_5.txt,"Os limites de aceitabilidade de eficiência estabele- cidos classificam como não aceitáveis as eficiências menores que 80% para estreptomicina e etambutol; 89% para isoniazida; e 95% para rifampicina.39 Após análise dos resultados, cada laboratório participante deve ser informado dessa ava- liação.",479,question: What is the limit of aceitabilidade of eficiência estabele- cidos?
tuberculose_protocolo_5.txt,"No caso de serem observados resultados imprecisos, em especial à isoniazida e à rifampicina, deverá ser identificada a causa da imprecisão, assim como sugestões para reverter essa situação.",480,question: What is the causa of imprecise results?
tuberculose_protocolo_5.txt,"Como consequência, pode ser oferecido treinamento, se for o caso, e assim é enviado novo painel ao laboratório, desenhado especialmente de acordo com o problema detectado.",481,question: O painel ao laboratório é enviado especialmente de acordo com o problema detectado.
tuberculose_protocolo_5.txt,"Até que se verifique que o laboratório recuperou a qualidade do seu trabalho, os TS da rotina do laboratório deverão ser realizados pelo LRN.",482,question: Os TS da rotina do laboratório devero ser realizados pelo LRN?
tuberculose_protocolo_5.txt,Technical manual for drug susceptibility testing of medicines used in the treatment of tuberculosis.,484,question: What is the name of the document that is used to test for drug susceptibility?
tuberculose_protocolo_5.txt,"Disponível em: em: 15 jul.TESTE RÁPIDO TUBERCULOSE – TRM-TB 10 TESTE RÁPIDO MOLECULAR PARA TUBERCULOSE – TRM-TB 10.1 Introdução Os métodos moleculares apresentam diversas vantagens no manejo laboratorial da TB, principalmente no que diz respeito à velocidade para a emissão dos resultados, à padro- nização dos testes e aos requisitos reduzidos de biossegurança exigidos nos laboratórios, quando comparado a exames como cultura, tanto em meio líquido quanto meio sólido. por meio de PCR, em tempo real, e têm sido desenvolvidos para o diagnóstico rápido da TB e para TS aos fármacos, sendo implementados em diversos países. e promover a equidade e integralidade do cuidado às pessoas com TB, uma vez que a detecção rápida e adequada da doença possibilita o tratamento correto de forma precoce, o que favorece o controle da TB.",485,question: When was the release of the TB drug?
tuberculose_protocolo_5.txt,"Um exemplo desses testes é o utilizado no sistema GeneXpert®, que foi lançado em 2004 e teve como objetivo a simplificação dos testes moleculares, pois integrou e automatizou tempo real (preparação da amostra, amplificação e detecção).",486,question: What is the name of the system that GeneXpert® was created to simplify molecular test?
tuberculose_protocolo_5.txt,"O sistema consiste em um equipamento, um computador, um leitor de código de barras e um software; e utiliza um cartucho que contém os reagentes liofilizados, tampões e soluções.",487,"question: O cartucho contém reagentes liofilizados, tampas e soluçes?"
tuberculose_protocolo_5.txt,"A detecção e caracterização do alvo são realizadas em tempo real, usando um dispositivo a laser de detecção de seis cores.1,2,3 Os cartuchos utilizados para o diagnóstico da TB detectam o CMTB, assim como as mutações que conferem a resistência à rifampicina, usando primers específicos e sondas moleculares únicas, que garantem um alto grau de sensibilidade e especificidade.",488,question: What is the tempo real?
tuberculose_protocolo_5.txt,"O ensaio fornece resultados, diretamente de amostras biológicas, entre 65 a 77 minutos.1,2,3 O teste é espe- cífico para detecção do CMTB, não detectando MNT1,2,3.",489,question: What is the result of the ensaio?
tuberculose_protocolo_5.txt,O MS adotou a terminologia de TRM-TB para indicar o teste com o cartucho Xpert® MTB/RIF Ultra. 10.2 Teste rápido molecular para o diagnóstico da TB pulmonar 1-7 O TRM-TB é considerado um importante avanço na luta contra a TB.,490,question: What is the name of the test?
tuberculose_protocolo_5.txt,"Pela primeira vez, um teste molecular é, suficientemente, simples e robusto para ser usado em laboratórios básicos que utilizam a baciloscopia como método diagnóstico.",491,question: What is a teste molecular?
tuberculose_protocolo_5.txt,A OMS recomenda que o TRM-TB seja utilizado como o teste diagnóstico inicial (em vez da baciloscopia e da cultura) em todos os adultos e as crianças com sinais e sintomas de TB.,492,question: What is the OMS's recommendation for using TRM-TB as a test?
tuberculose_protocolo_5.txt,"É importante enfatizar que crianças com suspeita de TB, que tiveram um único resultado negativo, devem ter seus casos investigados utilizando o sistema de escore estabelecido no Manual de Recomendações para o Controle da Tuberculose no Brasil,8 e aqueles que de tratamento, mesmo com um resultado de TRM-TB negativo.",493,"question: What is important to enfatizar that crianças com suspeita de TB, that tiveram um nico resultado negativo, devem ter seus casos investigados using o sistema de"
tuberculose_protocolo_5.txt,O TRM-TB pode ser usado diretamente em amostras de escarro ou a partir do sedimento de preparação para inoculação da amostra em meios de cultura.,494,question: What is the TRM-TB used for?
tuberculose_protocolo_5.txt,"Além disso, deve ser usa- da apenas uma amostra de escarro, pois o processamento de múltiplas amostras, apesar de aumentar a sensibilidade do teste, ocasiona um gasto de recursos que pode inviabilizar a utilização ideal do teste como diagnóstico.",495,"question: O processamento de mltiplas amostras, apesar de aumentar a sensibilidade do teste, ocasiona um gasto de recursos que pode inviabilizar a utilizaç"
tuberculose_protocolo_5.txt,A baciloscopia e a cultura permanecem como ferramentas essenciais para o monitora- mento do tratamento e para a realização de TS aos fármacos de primeira e segunda linha.,496,question: What do baciloscopia and a cultura permanecem as ferramentas essenciais?
tuberculose_protocolo_5.txt,"As amostras que podem ser usadas para o diagnóstico da TB pulmonar no TRM-TB são: escarro, escarro induzido, LBA e lavado gástrico. 10.3 Teste rápido molecular para diagnóstico de TB extrapulmonar 16 O TRM-TB pode ser usado para diagnóstico nos seguintes materiais extrapulmonares: » LCR; » linfonodos (punção ou macerado); » macerados de tecidos; » líquido sinovial; » líquido peritoneal; » líquido pericárdio; » líquido pleural; e » urina.",497,question: What is the name of the amostras that can be used to diagnose TB?
tuberculose_protocolo_5.txt,"É importante enfatizar que indivíduos com suspeita de terem TB extrapulmonar que tive- ram um único resultado negativo no TRM-TB devem ter seus casos investigados por outros métodos diagnósticos, e aqueles que tiverem alta suspeita clínica de TB (especialmente crianças) devem ser tratados mesmo com um resultado de TRM-TB negativo.",498,question: What is important to be aware of when a person with TB has a negative result?
tuberculose_protocolo_5.txt,"Para amostras de LCR, o TRM-TB deve ser usado, preferencialmente a cultura, se o volume fazer um diagnóstico rápido.",499,question: What is the TRM-TB?
tuberculose_protocolo_5.txt,"Se o material tiver um volume suficiente é preferível usar o método de concentração da amostra para aumentar a recuperação de bacilos, e inocular em meios de cultura e em um cartucho.",500,question: O material tiver um volume suficiente é preferable usar o método de concentraço da amostra?
tuberculose_protocolo_5.txt,"O líquido pleural não é a amostra ideal para a confirmação bacteriológica de TB pleu- ral, independentemente do método utilizado.",501,question: What is the best way to confirm TB?
tuberculose_protocolo_5.txt,Recomenda-se o uso de biópsia pleural.,502,question: What do you recommend?
tuberculose_protocolo_5.txt,A sensibilidade do TRM-TB em líquido pleural é muito baixa.,503,question: A sensibilidade do TRM-TB em lquido pleural é muito baixa.
tuberculose_protocolo_5.txt,"No entanto, um indivíduo 10 TESTE RÁPIDO MOLECULAR PARA TUBERCULOSE – TRM-TB com resultado positivo no TRM-TB deve ser tratado para TB pleural; e aqueles com um resultado negativo no TRM-TB devem ter outros testes realizados. 10.4 Vantagens e desvantagens do TRM-TB O TRM-TB apresenta muitas vantagens em relação aos métodos convencionais, como: » teste diagnóstico inicial que fornece o resultado de resistência ou sensibilidade à rifampicina, substituindo a baciloscopia; » maior sensibilidade em relação à baciloscopia; » na sua versão atual em uso (Ultra) possui sensibilidade semelhante à da cultura; » menor tempo de execução quando comparado à baciloscopia, à cultura e ao TS; » baixo risco biológico; » menor custo em relação à cultura e ao TS; » menos trabalho e tempo despendido pelo técnico de laboratório; e » menor incidência de erros laboratoriais, por ser praticamente automatizado e ter, portanto, a influência de erro humano reduzida.",504,question: What is the TB pleural test?
tuberculose_protocolo_5.txt,"Como desvantagens, pode-se ressaltar: » não poder ser empregado para controle de tratamento; » custo elevado quando comparado à baciloscopia; e » exigências mínimas de infraestrutura laboratorial: refrigeração, fornecimento con- tínuo de energia, nobreak, biossegurança e local adequado para armazenamento dos cartuchos. 10.5 Método de execução do teste rápido molecular para tuberculose 1,6,7 A metodologia descrita a seguir é para amostras de escarro.",505,question: A metodologia descrita a seguir é para amostras de escarro.
tuberculose_protocolo_5.txt,"Para outras amostras pulmo- nares (escarro induzido, lavado brônquico, LBA, aspirado transtraqueal e lavado gástrico), deve-se realizar o pré-tratamento da amostra de acordo com o Quadro 14 do capítulo 7.",506,question: What is the pre-tratamento of a pulmo- nare?
tuberculose_protocolo_5.txt,"Precaução: » realizar os procedimentos utilizando os cuidados de biossegurança, tais como as BPL e o uso de EPI adequado, conforme descrito no capítulo 3; » abrir um pote de cada vez e com cuidado para evitar a formação de aerossóis; » procurar utilizar a porção mais purulenta do escarro; e » realizar, no máximo, oito amostras de cada vez e manter a área de trabalho com iluminação adequada e organizada para evitar a troca de amostras.",507,question: What is the purpose of using a more purulent escarro?
tuberculose_protocolo_5.txt,"Equipamento: » sistema GeneXpert® (equipamento GeneXpert, computador e leitor de código de barras); » nobreak; » CSB (desejável, mas não obrigatório) ou bico de Bunsen; » geladeira; Reagentes: » kit Xpert® MTB/RIF Ultra para dez ou 50 testes; » solução de álcool a 70%; e » solução de NaClO a 1%.",508,question: What is GeneXpert?
tuberculose_protocolo_5.txt,As fórmulas e o preparo dos reagentes acima estão descritos nos anexos do capítulo 3.,509,question: O preparo dos reagentes acima esto descritos nos anexos do captulo 3.
tuberculose_protocolo_5.txt,"Insumos: » pipeta Pasteur estéril, descartável; » tubo Falcon de 15 ml; » cronômetro; » papel-absorvente (papel de filtro ou papel-toalha) para forrar a bancada; » bandejas de metal (opcional); » caneta marcadora; » gaze estéril em pedaços; » respiradores N95; » aventais de laboratório; » luvas descartáveis; e » recipiente de vidro ou metal, fundo e de boca larga, para descarte de material a ser autoclavado e lavado.",510,question: What is the name of the instrument used to descarte material?
tuberculose_protocolo_5.txt,Conservação e manuseio: » conservar os kits a 2°C-28°C; » não utilizar reagentes ou cartuchos fora do prazo de validade; » não abrir a tampa do cartucho até o momento de adicionar a amostra; » utilizar o cartucho nos 30 minutos seguintes à abertura da sua tampa; » o cartucho é estável até sete dias após a abertura da embalagem metalizada; » não utilizar um cartucho que caiu ou que foi agitado depois da amostra tratada ter sido adicionada; » não utilizar um cartucho se ele parecer úmido ou se o lacre da tampa estiver partido; e » não utilizar um cartucho que tenha o tubo de reação danificado. 10 TESTE RÁPIDO MOLECULAR PARA TUBERCULOSE – TRM-TB 1.,511,question: What are the two main things that you can do with your kits?
tuberculose_protocolo_5.txt,Forrar a bancada (ou CSB) com papel-absorvente que tenha capacidade de absorver respingos. 2.,512,question: What is the purpose of a bancada?
tuberculose_protocolo_5.txt,Providenciar e organizar na bancada (ou CSB) os materiais necessários para realização do teste. 3.,513,question: What do CSBs do?
tuberculose_protocolo_5.txt,Organizar tudo de forma a assegurar um fluxo de trabalho lógico e seguro.,514,question: What is the purpose of a trabalho?
tuberculose_protocolo_5.txt,"Manter o pa- pel-absorvente e o frasco com solução desinfetante à mão, na bancada, para desinfecção se houver respingos, conforme descrito no capítulo 3. 4.",515,"question: O pa-pel-absorvente e o frasco com soluço desinfetante à mo, na bancada, para desinfecço se houver respingos?"
tuberculose_protocolo_5.txt,Forrar a bandeja de metal com papel-absorvente e colocá-la na bancada (ou CSB) à sua frente. 5.,516,question: What is the purpose of a bandeja de metal?
tuberculose_protocolo_5.txt,"Colocar as amostras clínicas de acordo com o número de ordem de registro, sobre a área de trabalho forrada. 6.",517,question: What is the purpose of a nmero of ordem de registro?
tuberculose_protocolo_5.txt,Identificar cada cartucho com o número de registro de cada amostra clínica. 7.,518,question: What is the purpose of identifying a cartucho?
tuberculose_protocolo_5.txt,"Ligar o instrumento GeneXpert e, em seguida, o computador. 8.",519,question: What does GeneXpert do?
tuberculose_protocolo_5.txt,O software GeneXpert DX deve ser carregado automaticamente na tela do computador.,520,question: GeneXpert DX is a software that can be used to automatically generate data?
tuberculose_protocolo_5.txt,"Caso isso não aconteça, fazer duplo clique, no ambiente de trabalho Windows, no ícone de atalho do GeneXpert DX. 9.",521,question: What is the main reason for a duplo clique?
tuberculose_protocolo_5.txt,Iniciar a sessão no software do sistema GeneXpert utilizando o nome de login e senha (padrão da Cepheid®).,522,question: What is the purpose of using the GeneXpert software?
tuberculose_protocolo_5.txt,"Procedimento de realização: preparo das amostras pulmonares (escarro, escarro induzido, lavado gástrico e LBA) 1.",523,question: What is the process of preparation of amostras pulmonares?
tuberculose_protocolo_5.txt,"Processar, um de cada vez, apenas as amostras suficientes para os módulos disponíveis para a execução do teste no sistema GeneXpert.",524,question: A GeneXpert execuço do teste é ainda como a execuço do teste?
tuberculose_protocolo_5.txt,ATENÇÃO: o volume mínimo de escarro para a preparação é de 1 ml. 2.,525,question: ATENO: o volume mnimo de escarro para a preparaço é de 1 ml.
tuberculose_protocolo_5.txt,"Retirar, lentamente, a tampa do pote de escarro para evitar a formação de aerossóis. 3.",526,question: What is the purpose of avoiding aerossois?
tuberculose_protocolo_5.txt,Deixar a amostra no pote de coleta do escarro. 4.,527,question: What is the main reason for not having a pot of coleta?
tuberculose_protocolo_5.txt,Adicionar ao pote de escarro o reagente de amostra na seguinte proporção: dois volumes de reagente para um volume de amostra (2:1). 5.,528,question: Adicionar ao pote de escarro o reagente de amostra na seguinte proporço: Dois volumes de reagente para um volume de amostra (2:1).
tuberculose_protocolo_5.txt,Agitar vigorosamente de dez a 20 vezes (ou usar o agitador mecânico).,529,question: How many times do you need to agitate?
tuberculose_protocolo_5.txt,Um movimento para cima e para baixo corresponde a uma agitação.,530,question: A agitaço corresponde a movimento para cima e para baixo?
tuberculose_protocolo_5.txt,"ATENÇÃO: o volume 2:1 de reagente e amostra não necessita ser exato, mas como exemplo: para 1 ml de amostra adicione 2 ml de reagente; 2 ml de amostra – 4 ml de reagente. 6.",531,question: What is the difference between a reagente and amostra?
tuberculose_protocolo_5.txt,Incubar durante dez minutos a temperatura ambiente. 7.,532,question: How long does it take to incubate?
tuberculose_protocolo_5.txt,Agitar vigorosamente de dez a 20 vezes (ou use o agitador mecânico). 8.,533,question: How many times do you need to agitate?
tuberculose_protocolo_5.txt,Incubar mais cinco minutos a temperatura ambiente. 9.,534,question: Incubar a temperatura ambiente for how long?
tuberculose_protocolo_5.txt,"Verificar se as amostras estão totalmente liquefeitas, sem qualquer viscosidade.",535,question: What is the purpose of liquefying amostras?
tuberculose_protocolo_5.txt,"Caso não estejam totalmente liquefeitas, agitar novamente e deixar em temperatura ambiente por mais cinco, no máximo dez minutos.",536,question: What is the effect of agitating novamente?
tuberculose_protocolo_5.txt,A etapa de descontaminação e liquefação não deve ultrapassar 35 minutos no total.,537,question: How long does it take to complete the descontaminaço e liquefaço?
tuberculose_protocolo_5.txt,Não tocar no tubo de reação do cartucho. 1.,538,question: What is the purpose of a cartucho?
tuberculose_protocolo_5.txt,Identificar cada cartucho com o número da amostra (escreva nos lados do cartucho ou afixe uma etiqueta de código de barras).,539,question: What is the purpose of identifying a cartucho?
tuberculose_protocolo_5.txt,Não coloque a etiqueta na tampa do cartucho nem obstrua o código de barras 2D existente na frente do cartucho. 2.,540,question: Do cartuchos na tampa do cartucho nem obstrua o código de barras 2D existente na frente do cartucho?
tuberculose_protocolo_5.txt,Abrir a tampa do cartucho. 3.,541,question: What is the name of the cartucho?
tuberculose_protocolo_5.txt,"Usando a pipeta de transferência esterilizada fornecida, aspirar a amostra liquefeita para a pipeta de transferência até o menisco estar acima da marca presente na pipeta.",542,question: A amostra liquefeita para a pipeta de transferência até o menisco estar acima da marca presente na pipeta?
tuberculose_protocolo_5.txt,Não prosseguir com o processamento da amostra no caso de o volume ser insuficiente.,543,question: A processamento da amostra no so insuficiente?
tuberculose_protocolo_5.txt,É muito importante que seja inserido no cartucho 2 ml ou mais da amostra processada. 4.,544,question: How much water does a cartucho take?
tuberculose_protocolo_5.txt,"Transferir a amostra para o orifício localizado ao lado direito da parte superior do cartu- cho, que aparece quando se levanta a tampa (Figura 25).",545,question: What is the process of transferring a cart to a tampa?
tuberculose_protocolo_5.txt,Dispensar a amostra lentamente para evitar a formação de aerossóis e bolhas.,546,question: What is the purpose of lently dispensing amostra?
tuberculose_protocolo_5.txt,"Figura 25 – Esquematização da adição da amostra no cartucho de TRM-TB Fonte: Cepheid, 2017. 5.",547,question: What is the name of the figure 25?
tuberculose_protocolo_5.txt,Certificar-se de que a tampa fique bem encaixada.,549,question: What is the main reason for a tampa being encaixada?
tuberculose_protocolo_5.txt,"O restante da amostra preparada pode ser conservado até 12 horas a 2°C-8°C, caso seja necessário repetir o teste. 6.",550,question: How long can a preparada be kept?
tuberculose_protocolo_5.txt,Colocar os cartuchos na bandeja de metal e levar até o equipamento.,551,question: What is the purpose of a metal band?
tuberculose_protocolo_5.txt,ATENÇÃO: nunca coloque a amostra no orifício central do cartucho.,552,question: What is the name of the cartucho?
tuberculose_protocolo_5.txt,"Após inserir a amostra no cartucho, mantê-lo sempre na vertical e nunca o deitar.",553,question: A cartucho is a vertical or horizontal thing to do?
tuberculose_protocolo_5.txt,Importante: certificar-se de que o teste seja iniciado 30 minutos após a preparação do cartucho.,554,question: What is the importance of confirming that the cartucho is ready for use?
