Arquivo,Parágrafo,Número do parágrafo,Pergunta
tuberculose_protocolo_5.txt,"Condutas: » instalar o destilador em local próximo à rede hidráulica e elétrica; e » mensalmente, ou sempre que houver depósitos ou incrustações, lavar o recipiente de evaporação e a resistência com esponja de aço, água e sabão neutro.",801,question: What is the purpose of a destilador?
tuberculose_protocolo_5.txt,"Enxaguar com bastante água para retirar o resíduo de sabão. 13 USO E MONITORAMENTO DE EQUIPAMENTOS BÁSICOS Uso: » confirmar se há fornecimento de água e ligar a torneira que abastece de água o destilador; » aguardar a saída de água pelo dreno de resfriamento do condensador; » ligar a chave elétrica geral do equipamento e aguardar a saída da água destilada pelo respectivo dreno; » acondicionar a água destilada em recipiente apropriado; » desligar a chave elétrica geral do destilador ao término do processo; » deixar a torneira, que abastece o destilador, aberta até o resfriamento do conden- sador; e » desligar o fornecimento de água.",802,question: What is the main purpose of the agua destilador?
tuberculose_protocolo_5.txt,"Monitoramento: » a cada uso, verificar a presença de obstrução ou vazamentos no circuito de abaste- cimento de água; e » verificar sempre as condições das instalações elétricas. 13.2.11 Estufas bacteriológicas É aconselhável que as estufas bacteriológicas tenham o maior tamanho possível, uma aberta.",803,question: What is the purpose of monitoring a cada uso?
tuberculose_protocolo_5.txt,"Nas situações em que a temperatura de incubação é menor que a temperatura ambiente, por exemplo, na incubação de provas bioquímicas, deve ser utilizada uma es- tufa bacteriológica com sistema refrigerado incluso.2 Conduta: » evitar sobrecarregar o interior da estufa para assegurar a circulação de ar e a ma- nutenção da temperatura interna; » abrir a porta somente o necessário; e » instalar as estufas em locais bem ventilados, distantes de fontes de calor e de água.",804,question: What is the main advantage of using a bacteriológica bacteriológica com systema refrigerado?
tuberculose_protocolo_5.txt,Uso: » organizar todo material a ser incubado para abrir a estufa uma única vez; » distribuir os materiais nos diversos compartimentos e fechar corretamente a porta; » verificar se a porta ficou devidamente fechada; e » realizar os mesmos passos ao retirar o material incubado.,805,question: What is the purpose of retirar o material incubado?
tuberculose_protocolo_5.txt,"Monitoramento:1 deve ser realizado diariamente, ao início da rotina do laboratório, com duas leituras de temperatura: uma utilizando um termômetro de leitura pontual e outra com o termôme- tro de máxima e mínima; » realizar outra leitura no horário de maior uso do equipamento, com termômetro de leitura pontual; e » registrar os dados de cada leitura no “Formulário de Monitoramento – Estufa Bacteriológica”.",806,question: What does the termômetro de leitura pontual do?
tuberculose_protocolo_5.txt,"Já a temperatura ideal para o refrigerador é de 4°C, com variação aceitável de 2°C a 8°C.",808,question: What is the temperature ideal for a refrigerator?
tuberculose_protocolo_5.txt,ATENÇÃO: os equipamentos que não formam gelo (frost free) provocam evaporação excessiva de líquidos em frascos não fechados hermeticamente.,809,question: What is the term for a device that does not form gelo?
tuberculose_protocolo_5.txt,"Condutas: » instalar o refrigerador e o freezer em locais bem ventilados, ou distantes de fonte de calor, deixando a distância mínima de 10 cm entre cada equipamento ou da parede.",810,question: What is the difference between a refrigerator and a freezer?
tuberculose_protocolo_5.txt,Uso: » evitar o acondicionamento do excesso de material e não forrar as prateleiras para não interferir na refrigeração interna1; e » organizar todo o material a ser armazenado para abrir a porta uma única vez.,811,question: What is the purpose of avoiding excess material?
tuberculose_protocolo_5.txt,Monitoramento: » fazer uma verificação periódica das borrachas de vedação; » descongelar freezer e refrigerador mensalmente.,812,question: What is the purpose of a freezer and refrigerador?
tuberculose_protocolo_5.txt,"Inicialmente, deve-se transferir todo conteúdo para outro local refrigerado.",813,question: What is the process of transferring to another location?
tuberculose_protocolo_5.txt,"Desligar os equipamentos e, após o degelo, desinfetar internamente com um pano umedecido com solução de álcool a 70%, e depois com água e detergente neutro.",814,question: What is the purpose of a degelo?
tuberculose_protocolo_5.txt,"A preparação e o Formulário de Controle da Preparação da Solução de Álcool a 70% estão descritos no capítulo 3; e » realizar diariamente controle de temperatura,1 no início da rotina do laborató- rio, com o termômetro de máxima e mínima, exclusivo para cada equipamento, e no horário de maior uso do equipamento.",815,question: What is the formulario of controle?
tuberculose_protocolo_5.txt,Registrar os dados de cada leitura no “Formulário de Monitoramento – Refrigerador e Freezer”.,816,question: What is the process of registering a dados of cada leitura?
tuberculose_protocolo_5.txt,"ATENÇÃO: no uso de termômetro eletrônico, o mostrador deve ser fixado externa- mente, já que a simples abertura da porta pode alterar a leitura da temperatura. 13.2.13 Medidor de pH Equipamento utilizado para determinação de pH, por meio do método eletromagnético, com compensação automática de temperatura. 13 USO E MONITORAMENTO DE EQUIPAMENTOS BÁSICOS Condutas: » antes de ligar, verificar se o equipamento e a rede elétrica estão na mesma volta- gem; e » ao término de cada medição ou calibração manter a chave seletora em repouso (standby).",818,question: What is the purpose of a mostrador?
tuberculose_protocolo_5.txt,"Uso: » para ligar o aparelho, acionar a chave geral liga-desliga; » manter o aparelho ligado por, no mínimo, 30 minutos, para aquecer e estabilizar os componentes eletrônicos; » conectar bem o eletrodo e o sensor de temperatura ao aparelho; » lavar bem o eletrodo com água destilada e secar com papel-absorvente macio sem esfregar a membrana; » mergulhar o eletrodo e o sensor de temperatura na solução tampão de valor pH a 25°C e ajustar com o potenciômetro “Potenciômetro de ajuste do tampão pH 7 e do potencial mV relativo – Calibração”.",819,question: What is the main purpose of ligar a aparelho?
tuberculose_protocolo_5.txt,Medir a temperatura da solução (ver tabela pH/t inscrita no frasco da solução tampão que acompanha o aparelho) e ajustar o valor exato do pH de acordo com a temperatura; » retirar o eletrodo e o sensor afixados no suporte da solução.,820,question: What is the purpose of a sensor?
tuberculose_protocolo_5.txt,"Enxaguar ambos com água destilada, secar com papel-absorvente e macio; » para medir na faixa ácida, mergulhar o eletrodo e o sensor de temperatura na solução tampão pH 4.01, ajustar com o potenciômetro “Potenciômetro de ajuste do (SLOPE), declive, ou do tampão diferente de pH 7,” para exatamente o valor da solução tampão de acordo com a temperatura da solução, da mesma forma como foi descrito para ajustar tampão pH 7.",821,question: What is the best way to measure the temperature of a tampa?
tuberculose_protocolo_5.txt,"Para as medições de rotina na faixa alcalina, realizar o mesmo procedimento, porém, com a solução tampão de valor pH 9,18 ou pH 10,01; » ao terminar esses procedimentos, o medidor de pH está calibrado e pronto para ser usado nas medições de rotina; » retirar o eletrodo e o sensor da última solução tampão usada.",822,question: What is the process of calibrating a tampon?
tuberculose_protocolo_5.txt,"Lavar com água destilada, secar com papel-absorvente macio para não arranhar a membrana de vidro gelatinoso, antes de introduzi-los na amostra a ser medida; » mergulhar o eletrodo e o sensor na amostra.",823,question: What is the main purpose of a saline molecule?
tuberculose_protocolo_5.txt,"O valor que aparecer no visor é o pH da amostra; » para desligar, lavar o eletrodo com água destilada e seguir as instruções para ma- nutenção e conservação dos eletrodos descritas a seguir; e » desligar a chave geral liga-desliga e a tomada do sensor de temperatura.",824,question: What does the pH of the amostra indicate?
tuberculose_protocolo_5.txt,"Monitoramento: » depois de usar o eletrodo, lavar e colocar a proteção da membrana com solução de repouso (solução de KCl 3M), para mantê-lo úmido; » quando o eletrodo de referência não estiver em uso, deve ficar imerso na solução de repouso; » caso o eletrodo seque ou fique parado por um longo período, deixar imerso em solução e em repouso por seis horas; » a umidade e os agentes corrosivos danificam o aparelho; caso o medidor de pH apresente leituras instáveis, limpar o conector (plug) do eletrodo e a tomada do aparelho, com álcool etílico ou acetona.",825,question: What does a eletrodo de referência do?
tuberculose_protocolo_5.txt,"ATENÇÃO: quando o pH da água destilada for medido e o aparelho indicar o valor na faixa ácida, e essa leitura ficar instável, é necessário utilizar um par combinado de eletrodo especial que tenha a junção tipo “luva” e, então, deverão ser adicionadas, na água, algumas gotas de KCl para aumentar a condutividade.",826,question: What does a junço tipo of luva do?
tuberculose_protocolo_5.txt,"Aguardar 24 horas para fazer a medição. » Para a preparação da solução KCl 3M, deve-se pesar 223,68 g de KCl, dissolver em 1 litro de água destilada e deionizada.",827,question: How long does it take to make a solution of KCl 3M?
tuberculose_protocolo_5.txt,"Armazenar a solução em frasco de polietileno, entre 2°C a 8°C.",828,question: What is the solution of polietileno?
tuberculose_protocolo_5.txt,"A sua estabilidade é de seis meses, sob refrigeração. 13.2.14 Micropipetadores conjuntamente “ponteiras”.",829,question: What is the duration of a micropipetador's life?
tuberculose_protocolo_5.txt,"As micropipetas podem ser de volume fixo ou variável, mo- nocanal ou multicanal, dependendo da metodologia a ser empregada.",830,question: What do micropipetas do?
tuberculose_protocolo_5.txt,"Condutas:1 » utilizar preferencialmente ponteiras com barreira ou filtro antiaerossol; » evitar a reutilização de ponteiras, já que os procedimentos de lavagem não garan- tem a remoção completa dos resíduos; » manter as micropipetas sempre na posição vertical; e » limpar externamente a micropipeta com solução de álcool a 70%, antes e após o uso.",831,question: What do micropipetas always have to be in a vertical position?
tuberculose_protocolo_5.txt,A preparação e o Formulário de Controle da Preparação da Solução de Álcool a 70% estão descritos no capítulo 3.,832,question: A preparaço e o Formulário de Controle da Preparaço da Soluço de lcool a 70% esto descritos no captulo 3.
tuberculose_protocolo_5.txt,"Uso: » selecionar a micropipeta e o volume de acordo com as soluções a serem pipetadas; » acoplar a ponteira à micropipeta; » pressionar o êmbolo da micropipeta até o primeiro estágio; » introduzir a ponteira abaixo da superfície do líquido, aproximadamente 5 mm; » soltar o êmbolo gradativamente, aspirando ao líquido; » dispensar o líquido, pressionando o êmbolo até o segundo estágio; » soltar o êmbolo lentamente até a sua posição original; e » descartar as ponteiras em recipiente contendo NaClO 2% ou em saco plástico autoclavável. 13 USO E MONITORAMENTO DE EQUIPAMENTOS BÁSICOS Monitoramento: » verificar a presença de algum componente quebrado, dificuldade no acionamento do êmbolo ou vazamento no sistema; » Realizar o teste hidrostático1 para detectar vazamento no sistema.",833,question: What is the purpose of the instrument?
tuberculose_protocolo_5.txt,"Proceder confor- me descrito a seguir: › fixar a ponteira na micropipeta; › aspirar água destilada até o primeiro estágio; › tampar a extremidade inferior da ponteira com um dedo; › para micropipetas de menos de 1 ml: – pressionar o êmbolo até o segundo estágio, permanecendo assim por 20 segundos; › para micropipetas de mais de 1 ml: – pressionar o êmbolo até o ponto médio entre os dois estágios da micropipeta. › liberar o êmbolo lentamente até a posição original; › retirar o dedo da extremidade da ponteira e verificar se há deslocamento da água.",834,question: What is the process of removing the êmbolo?
tuberculose_protocolo_5.txt,"Se houver, a micropipeta deve ser encaminhada para manutenção e ajus- te; e › os micropipetadores devem fazer parte do programa de manutenção preventi- pelo método gravimétrico. 13.2.15 Microscópio O microscópio deve ser binocular, possuir um bom conjunto óptico, ser ergonômico e possuir objetiva de imersão planocromática.",835,question: What is a micropipeta?
tuberculose_protocolo_5.txt,"Condutas: » instalar longe de equipamentos que causem vibrações, de reagentes químicos ou da rede hidráulica e em sala limpa, bem ventilada ou que tenha ar-condicionado para evitar a proliferação de fungos no sistema óptico;1,4 » evitar que o microscópio fique sem as objetivas ou oculares para impedir a entrada de poeira; » coibir a desmontagem do microscópio para não desalinhar o conjunto óptico; e » carregar sempre com as duas mãos, uma segurando firmemente o braço do micros- cópio e a outra, a base.4 Uso: » impedir o uso de papel-toalha comum ou gaze para evitar riscos nas lentes; » nunca use detergente, xilol, etanol 96% ou outro solvente para a limpeza das len- tes.",836,question: What do you do to prevent a proliferaço of fungos no systema óptico?
tuberculose_protocolo_5.txt,Esses produtos podem retirar a cola que fixa as lentes aos corpos das objetivas e oculares; e1 » verificar os procedimentos de uso do microscópio no capítulo 6 desse Manual.,837,question: What do retirar a cola that fixa as lentes aos corpos das objetivas e oculares?
tuberculose_protocolo_5.txt,"Monitoramento: » efetuar mensalmente a limpeza geral do microscópio,1 executando os seguintes passos: › retirar a poeira agregada aos mecanismos de movimentação da platina, do condensador e do ajuste de foco com um pincel de cerdas macias; › realizar a limpeza geral com um pano limpo umedecido com solução de álcool a 70%, com exceção do conjunto óptico (objetivas e oculares).",838,"question: A limpeza geral com um pano limpo umedecido com soluço de álcool a 70%, com exceço do conjunto óptico (objetivas e oculare"
tuberculose_protocolo_5.txt,A preparação e o Formulário de Controle da Preparação da Solução de Álcool a 70% estão descritos no capítulo 3; e › executar a limpeza das objetivas e oculares com papel-absorvente macio umedecido em uma solução contendo 60% de etanol e 40% de éter etílico.,839,question: A compra de etanol e 40% de éter etlico tem o que a compra de etanol e 40% de éter etlico tem o que a
tuberculose_protocolo_5.txt,"A limpeza da objetiva de imersão deverá ser feita com um papel-absorvente macio para a retirada do excesso de óleo, seguida da aplicação da solução de álcool-éter. 13.2.16 Termociclador O termociclador é utilizado nas técnicas moleculares para amplificar ácidos nucleicos. de biologia molecular e da metodologia a ser utilizada, sendo que cada modelo apresenta manuais.",840,question: What is the purpose of a papel-absorvente macio?
tuberculose_protocolo_5.txt,"De modo geral, as condutas, o uso e o monitoramento são a seguir apresentados.",841,question: O uso e o monitoramento so a seguir apresentados?
tuberculose_protocolo_5.txt,"Condutas: » instalar o termociclador em sala isolada ou distante das áreas de pré-PCR e pós-PCR; » utilizar uma tomada aterrada e, se possível, conectar o termociclador a um nobre- ak; e » evitar o seu funcionamento durante o período noturno, sempre que possível, para incrementar a vida útil do equipamento, especialmente em regiões onde ocorre interrupção no fornecimento de energia elétrica.",842,question: What is a termociclador used for?
tuberculose_protocolo_5.txt,Uso: » ligar o termociclador; » inserir o programa de PCR a ser utilizado.,843,question: What is the purpose of a program of PCR?
tuberculose_protocolo_5.txt,"Caso já esteja inserido, selecioná-lo entre os programas armazenados; » colocar os microtubos no bloco de amostras; » fechar a tampa do equipamento; » iniciar o programa escolhido; e » verificar periodicamente o andamento do programa. 13 USO E MONITORAMENTO DE EQUIPAMENTOS BÁSICOS Monitoramento: » limpar o bloco de amostras e a tampa do termociclador pelo menos uma vez por mês ou sempre que necessário.",844,question: What is the purpose of a program that is not yet in use?
tuberculose_protocolo_5.txt,"Usar uma haste de algodão ou swab embebida com álcool isopropílico; » realizar mensalmente o “autoteste” ou teste de desempenho do sistema, para ve- rificar a necessidade ou não de encaminhar o equipamento para manutenção; e » encaminhar anualmente para a assistência técnica credenciada para realizar a ma- nutenção geral do equipamento. 13.2.17 Termômetros Nos laboratórios, os termômetros são instrumentos imprescindíveis para o controle da temperatura em vários ensaios, na conservação de substâncias e microrganismos, no pró- prio ambiente de trabalho e no monitoramento de alguns equipamentos.",845,question: What is a termômetro?
tuberculose_protocolo_5.txt,Os mais utili- zados são os termômetros de máxima e mínima e os de leitura pontual ou instantânea.1 em um momento ou para o monitoramento de equipamentos.,846,question: Os termômetros de máxima e mnima e os de leitura pontual ou instantanea so os which?
tuberculose_protocolo_5.txt,"Eles são de tipo eletrônico e possuem as resoluções padrões de 0,5°C e 0,1°C, respectivamente.1 Os termômetros de máxima e mínima mostram as temperaturas extremas ocorridas duran- te um determinado período.",847,question: Os termômetros de máxima e mnima mostram as temperaturas extremas ocorridas duran- te um determinado perodo?
tuberculose_protocolo_5.txt,"Possuem duas colunas de mercúrio, sendo uma para indicar a temperatura mínima e outra para a máxima.",848,question: What is the difference between a máxima and a mnima?
tuberculose_protocolo_5.txt,"São utilizados para o monitoramento de equipamentos como freezer, geladeiras e estufas, além do controle da temperatura ambiente do laboratório.",849,question: What is the use of a monitor for equipment?
tuberculose_protocolo_5.txt,"Eles acusam se houve a interrupção temporária de fornecimento de energia elétrica ou o mau funcionamento de um equipamento.1 Condutas: » guardar o termômetro em sua embalagem original para evitar a quebra, quando não estiver em uso; » no termômetro eletrônico, retirar a bateria do seu compartimento e ter sempre uma sobressalente; e » posicionar os termômetros de modo que os sensores fiquem localizados mediana- mente no espaço interno do equipamento.",850,question: Os sensores fiquem localizados mediana-mente no espaço interno do equipamento?
tuberculose_protocolo_5.txt,"Não os posicionar muito próximo às resistências de estufa, banho-maria ou da ventilação interna do refrigerador e do freezer, sob o risco de realizar uma leitura equivocada.",851,"question: Os posicionar muito próximo às resistências de estufa, banho-maria, da ventilaço interna do refrigerador e do freezer?"
tuberculose_protocolo_5.txt,"Uso do termômetro de leitura pontual: » colocar os sensores dos termômetros de leitura pontual em um frasco contendo uma solução de glicerol a 10% em água, para manter a temperatura estável.1 Lacrar o frasco e acondicioná-lo no compartimento interno do equipamento a ser controlado.",852,question: What do sensors do?
tuberculose_protocolo_5.txt,Aguardar pelo menos um pernoite para realizar a primeira leitura; e » realizar a leitura: › termômetro eletrônico: ler a temperatura indicada no mostrador externo e anotá-la no respectivo mapa de controle.,853,question: What is the first step in a leitura?
tuberculose_protocolo_5.txt,Uso do termômetro de máxima e mínima: » colocar o termômetro no compartimento interno do equipamento a ser controla- do.,854,question: What does the termômetro of máxima and mnima mean?
tuberculose_protocolo_5.txt,"Aguardar pelo menos um pernoite para realizar a primeira leitura; » abrir a porta do equipamento e, imediatamente, verificar as temperaturas máxima e mínima, anotando-as no respectivo mapa de controle; e » recolocar o termômetro no interior do equipamento.",855,question: What is the main purpose of abrir a porta do equipamento?
tuberculose_protocolo_5.txt,"Monitoramento: » verificar se os termômetros utilizados no laboratório exibem a mesma leitura de Metrologia, Qualidade e Tecnologia (Inmetro). 1.",856,question: What is the termômetros used in metrology?
tuberculose_protocolo_5.txt,Equipamentos – Utilização e monitoramento em unidades hemoterápicas e laboratórios de saúde pública.,857,question: Equipamentos – Utilizaço e monitoramento em unidades hemoterápicas e laboratórios de sade pblica.
tuberculose_protocolo_5.txt,"Brasília, DF: MS, 1998. (Série TELELAB). 2.",858,question: What is the name of the Brazilian government?
tuberculose_protocolo_5.txt,Tuberculosis bacteriology – Organization and Practice.,859,question: What is the name of the organization and practice that is responsible for the treatment of tuberculosis?
tuberculose_protocolo_5.txt,Processing sputum specimens in a refrigerated centrifuge does not increase the rate of isolation of Mycobacterium tuberculosis.,860,question: Does centrifuges help isolate Mycobacterium tuberculosis?
tuberculose_protocolo_5.txt,"Journal of Clinical Microbiology, v. 41, p. 469-471, 2003. 4.",861,question: What is the name of the journal that published in 2003?
tuberculose_protocolo_5.txt,Laboratory services in tuberculosis control: Part III: Culture.,862,question: What is the third part of the study of tuberculosis?
tuberculose_protocolo_5.txt,Laboratory services in tuberculosis control: Part II: Microscopy.,863,question: What is the second part of the service in tuberculosis control?
tuberculose_protocolo_5.txt,Equipamentos – Utilização e monitoramento em unidades hemoterápi- cas e laboratórios de saúde pública.,865,question: Equipamentos – Utilizaço e monitoramento em unidades hemoterápi- cas e laboratórios de sade pblica.
tuberculose_protocolo_5.txt,B) Estufa bacteriológica Formulário de monitoramento – Marca: Modelo: N.º patrimônio: Sala: Mês: Ano: A – Hora do início da rotina B – Hora do maior uso do equipamento Irregularidades/ocorrências: Ações corretivas ou preventivas: Data: Desinfecção mensal: Técnico: ___/___/_____ Fonte: adaptado de BRASIL.,867,question: What is the name of the bacteriológica formulário?
tuberculose_protocolo_5.txt,Equipamentos – Utilização e monitoramento em unidades hemoterápi- cas e laboratórios de saúde pública.,868,question: Equipamentos – Utilizaço e monitoramento em unidades hemoterápi- cas e laboratórios de sade pblica.
tuberculose_protocolo_5.txt,"Brasília: Série TELELAB,1998, 76 p. 13 USO E MONITORAMENTO DE EQUIPAMENTOS BÁSICOS C) Refrigerador e freezer Formulário de monitoramento – Marca: Modelo: N.º patrimônio: Sala: Mês: Ano: A – Hora do início da rotina B – Hora do maior uso do equipamento Irregularidades/ocorrências: Ações corretivas ou preventivas: Data: Desinfecção mensal: Técnico: ___/___/_____ Fonte: adaptado de BRASIL.",869,question: What is the name of the model?
tuberculose_protocolo_5.txt,Equipamentos – Utilização e monitoramento em unidades hemoterápi- cas e laboratórios de saúde pública.,870,question: Equipamentos – Utilizaço e monitoramento em unidades hemoterápi- cas e laboratórios de sade pblica.
tuberculose_protocolo_5.txt,Equipamentos – Utilização e monitoramento em unidades hemoterápi- cas e laboratórios de saúde pública.,873,question: Equipamentos – Utilizaço e monitoramento em unidades hemoterápi- cas e laboratórios de sade pblica.
tuberculose_protocolo_5.txt,"Brasília: Série TELELAB,1998, 76 p. 13 USO E MONITORAMENTO DE EQUIPAMENTOS BÁSICOS B) Cabine de Exaustão – CE Formulário de registro de uso – Cabine de Exaustão (CE) Marca: Modelo: N.º patrimônio: Sala: Mês: Ano: Irregularidades/ocorrências: Ações corretivas ou preventivas: Data: Desinfecção mensal: Técnico: ___/___/_____ Fonte: adaptado de BRASIL.",874,question: What is the name of the model?
tuberculose_protocolo_5.txt,Equipamentos – Utilização e monitoramento em unidades hemoterápi- cas e laboratórios de saúde pública.,875,question: Equipamentos – Utilizaço e monitoramento em unidades hemoterápi- cas e laboratórios de sade pblica.
tuberculose_protocolo_5.txt,Conte-nos o que pensa sobre esta publicação.,877,question: What is the public's opinion of the news?
tuberculose_protocolo_6.txt,"1 TUBERCULOSE EM PROFISSIONAIS DE SAÚDE: A TB é uma doença infecciosa e transmissível, que possui elevado coeficiente de incidência e mortalidade em várias regiões do mundo (WHO, 2019).",1,question: A TB possui elevado coeficiente de incidência e mortalidade em várias regies.
tuberculose_protocolo_6.txt,"No Brasil, em 2019, houve cerca de 74 mil casos novos e 4,5 mil óbitos por TB (BRASIL, 2020b).",2,question: How many TB cases did Brazil have in 2019?
