Arquivo,Parágrafo,Número do parágrafo,Pergunta
tuberculose_protocolo_3.txt,O TP proporciona dados através da comparação de resultados com outros laboratórios semelhantes.,151,question: O TP proporciona dados através da comparaço de resultados com outros laboratórios semelhantes?
tuberculose_protocolo_3.txt,"O Teste de Proficiência coordenado pela CGLAB consiste: • No envio, pela CGLAB, de um painel contendo 10 lâminas com esfregaço de es- carro, corados pelo Método de Ziehl-Neelsen para os laboratórios participantes. • Na análise e encaminhamento dos resultados das lâminas pelo laboratório parti- cipante para a CGLAB. • Na comparação e análise dos resultados do laboratório participante com os re- sultados previamente conhecidos. • Na comunicação, pela CGLAB, ao laboratório participante do seu desempenho na análise das lâminas.",152,question: What is the test of proficiency?
tuberculose_protocolo_3.txt,"A participação dos laboratórios deverá ser formalizada e o processo formalização de- verá ser constituído de: • Ofício convite elaborado pela CGLAB dirigido aos responsáveis dos laboratórios alvo do programa, modelo de ofício é apresentado nos anexos deste capítulo. • Formulário de participação do laboratório na AEQ, modelo de formulário é apresentado nos anexos deste capítulo. • Ofício informativo do envio do painel com as características éticas e técnicas da AEQ, modelo de ofício é apresentado nos anexos deste capítulo. • Formulário de Recebimento do Material e Identificação do Profissional Participante do AEQ, modelo de formulário é apresentado nos anexos deste ca- pítulo. • Formulário para Envio dos Resultados, modelo de formulário é apresentado nos anexos deste capítulo. 2 .4 .2 Releitura de lâminas É uma atividade orientadora e educacional, exercida por profissionais, com reco- nhecida experiência, com o objetivo de melhorar a qualidade do trabalho e promover o desenvolvimento profissional.",153,question: What is the process of formalizing the laboratório?
tuberculose_protocolo_3.txt,"Capítulo 2 – Sistema de Garantia da Qualidade de Baciloscopia Em 2007, a CGLAB, em conjunto com um grupo de técnicos representantes de LACEN sob a coordenação de uma consultoria internacional da OMS, elaborou o Protocolo de Controle Externo de Qualidade da Baciloscopia (PCEQB) segundo re- comendações do Consenso Global1.",154,question: What did CGLAB create in 2007?
tuberculose_protocolo_3.txt,Ressaltamos que o foco desse controle de quali- individuais ou de correção de diagnóstico de pacientes.,155,question: What is the focus of the control of quali- individuais or of correço de diagnóstico de patients?
tuberculose_protocolo_3.txt,O objetivo do PCEQB é definir procedimentos e estabelecer critérios para a exe- de baciloscopia.,156,question: What is the PCEQB's goal?
tuberculose_protocolo_3.txt,O PCEQB se aplica a todos os laboratórios que realizam baciloscopia para o diagnóstico e controle da Tuberculose no âmbito do Sistema Único de Saúde.,157,question: What does the PCEQB do?
tuberculose_protocolo_3.txt,"O controle externo de qualidade (CEQ) consiste no envio de lâminas já lidas nos LL para os LR ou LA para releitura e subseqüente análise estatística, buscando deter- minar variações e discordâncias.",158,question: What is the CEQ?
tuberculose_protocolo_3.txt,A releitura é feita sem que o profissional avaliador conheça o resultado da baciloscopia fornecido pelo laboratório participante.,159,question: A releitura é feita sem que o profissional avaliador conheça o resultado da baciloscopia fornecido pelo laboratório participante.
tuberculose_protocolo_3.txt,"O PCEQB recomenda também a avaliação da qualidade do esfregaço, da colo- ração e da numeração das lâminas, procedimentos que influenciam na qualidade do resultado. 2 .4 .2 .1 Fundamentos do CEQ da baciloscopia que realizam baciloscopia através da releitura, por parte de um LA, de uma amostra representativa, selecionada através de amostragem aleatória, das lâminas examinadas na rotina do LL e a qualificação do grau de concordância/discordância entre ambas leituras.",160,question: What does the PCEQB recommend?
tuberculose_protocolo_3.txt,"O grupo determinou que o tamanho da amostra é de 80 lâminas por laboratório a ser avaliado, em função do número médio de exames realizados pelos LL e a capaci- dade do LA de realizar a releitura. 58 Secretaria de Vigilância em Saúde/MS A sensibilidade é a capacidade de descobrir os resultados positivos no LL com- parados com o LA.",162,question: What is the tamanho of the amostra?
tuberculose_protocolo_3.txt,"Em função da dificuldade de se obter uma sensibilidade de 100%, em razão dos resultados das lâminas com poucos bacilos (de 1 a 9 BAAR em 100 campos observados), recomenda-se utilizar um intervalo de sensibilidade entre 75 e 85%, neste protocolo fixamos o valor de 80% de sensibilidade, valor apresentado no Quadro 2.",163,question: What is the value of 80%?
tuberculose_protocolo_3.txt,A especificidade é a capacidade de detectar os resultados negativos.,164,question: A especificidade é a capacidade de detectar os resultados negativos.
tuberculose_protocolo_3.txt,"Por razões operacionais se adotou, neste protocolo, a especificidade de 100%.",165,question: What percentage of the data is generated?
tuberculose_protocolo_3.txt,"Quadro 2 Tamanho da amostra recomendado para releitura de lâminas (anual ou trimestral) 5% 10% 13% 15% 18% 200 107 72 61 54 46 300 129 80 67 59 50 400 143 86 70 61 51 500 154 89 71 62 52 700 167 92 75 65 54 1000 180 96 76 66 55 WHO, APHl, CDC, IUATLD, KNCV e RIT.",166,question: What is the percentage of lâminas that is recommended for releitura?
tuberculose_protocolo_3.txt,"External Quality Assessment for AFB Smear Microscopy, Cooperative Agreement.",167,question: What is the outcome of the external quality assessment?
tuberculose_protocolo_3.txt,"U60/CCU303019, Washington DC. 2002. a) Definição do quociente proporcional: O quociente proporcional é obtido através da divisão do número total de lâminas recebidas por 80 (tamanho da amostra).",168,question: What is the name of the document that defines the quociente proporcional?
tuberculose_protocolo_3.txt,"No caso do resultado ser um número decimal, arredondar para o número inteiro mais próximo, com a condição que sejam no mínimo 80 lâminas.",169,question: A condiço que sejam no mnimo 80 lâminas tem um nmero decimal?
tuberculose_protocolo_3.txt,"Caso o sorteio não atinja as 80 lâminas, sortear aleatoriamente outras lâminas para completar o tamanho da amostra.",170,question: What is the process of sorting out the lâminas?
tuberculose_protocolo_3.txt,"Exemplo: Se o laboratório analisou durante o trimestre um total de 1.420 lâminas, o quociente proporcional é obtido da divisão de 1.420 por 80 = 17,7 ou seja, 18. b) Escolha do número de partida: Através de uma tabela de números aleatórios ou procedimento equivalente, deverá ser sorteado um número qualquer entre 1 e 18.",171,question: What is the nmero of a party?
tuberculose_protocolo_3.txt,Exemplo: foi sorteado o número 15. c) Seleção das lâminas: A primeira lâmina a ser selecionada corresponde ao núme- ro de partida.,172,question: A primeira lâmina corresponde ao nme-ro de partida?
tuberculose_protocolo_3.txt,"No exemplo, a décima quinta lâmina seqüencial a partir do primei- Capítulo 2 – Sistema de Garantia da Qualidade de Baciloscopia ro número de ordem recebido.",173,question: What is the minimum amount of bacteria that is allowed to be cured?
tuberculose_protocolo_3.txt,"A partir dessa primeira lâmina é selecionada uma lâmina a cada 18, na ordem do livro de registro.",174,question: A lâmina a cada 18 is selecionada na ordem do livro de registro?
tuberculose_protocolo_3.txt,"Exemplo: Se o LL encaminhou cópia do registro das lâminas com números de ordem que começam em 215 e acabam em 1.635, as lâminas selecionadas são 230 – 248 – 266 – 284, e assim sucessivamente até completar 80 lâminas.",175,question: What is the LL's registro?
tuberculose_protocolo_3.txt,"ATENÇÃO: Se no período avaliado o laboratório não atingir o ta- manho da amostra (80 lâminas) deverá ser realizada a releitura de todas as lâminas . 2 .4 .2 .3 Fluxo de lâminas O LA deverá solicitar a cada LL o envio de cópia das folhas do Registro de Ba- ciloscopia, que contém o número de ordem e os resultados das lâminas examinadas durante o período a ser avaliado (trimestral ou semestral) através de um documen- to conforme descrito no item 2.9.3.1 dos anexos deste capítulo.",176,question: What does the avaliado do?
tuberculose_protocolo_3.txt,"Deve ser solicitado também, todas as lâminas relativas ao período a ser avaliado.",177,question: Dos lâminas relativas ao perodo a ser solicitado?
tuberculose_protocolo_3.txt,"No item 2.9.3.2 dos anexos deste capítulo apresentamos as orientações de con- servação das lâminas para o CEQ para os LL. • Encaminhar ao LA, quando solicitado, as lâminas e cópia das páginas do Registro de Baciloscopia do mesmo período.",179,question: What is the lâminas and cópia of the Registro de Baciloscopia?
tuberculose_protocolo_3.txt,"No item 2.8.3.2 dos anexos deste capítulo apresentamos as orientações de con- servação das lâminas para o CEQ para os LL. 2 .4 .2 .5 Avaliação das lâminas • O técnico avaliador não deverá conhecer os resultados das lâminas recebidas an- tes de realizar as releituras. • A releitura das lâminas deverá ser realizada utilizando os critérios de leitura para diagnóstico, conforme descrito no item 6.5.1 do Capítulo 6 deste manual.",180,question: What is the avaliador's opportunity to produce results?
tuberculose_protocolo_3.txt,"Freqüência da avaliação dos LL Elaborar um cronograma anual de avaliações dos laboratórios, conforme descrito nos anexos deste capítulo no item 2.9.3.3.",181,question: What is the frequency of avaliaçes dos LL?
tuberculose_protocolo_3.txt,Dependendo da possibilidade do LA serão realizadas uma ou duas avaliações anual de cada LL.,182,question: Are there any avaliaçes that are done annually?
tuberculose_protocolo_3.txt,"O profissional avaliador deverá analisar o esfregaço de cada uma das lâminas, classificando-os como: a) Satisfatório: Homogêneo b) Não satisfatório: Não homogêneo Caso o esfregaço seja classificado como não homogêneo fazer uma segunda clas- sificação: Não homogêneo: • Espesso • Delgado Capítulo 2 – Sistema de Garantia da Qualidade de Baciloscopia Na avaliação microscópica devem ser avaliados dois aspectos: I) Coloração II) Concordância de resultados I) Coloração O profissional avaliador deverá analisar a coloração de cada uma das lâminas, classi- ficando-as como: a) Satisfatória b) Não satisfatória: Descoloração inadequada uma segunda classificação: • Presença de cristais de fucsina • Excesso de aquecimento na avaliação das deficiências que eventualmente ocorram, podendo induzir a erros de interpretação e, portanto, a resultados falso-positivos ou falso-negativos. um laboratório realizar o cálculo do percentual de adequação do esfregaço.",183,question: What is the definition of a satisfatorio?
tuberculose_protocolo_3.txt,Exemplo: • Número de esfregaços adequados dividido pelo total de esfregaços classifica- dos X 100 = A • Número de esfregaços com coloração adequada dividida pelo total de esfrega- ços classificados X 100 = B Para classificação final do esfregaço realizar o seguinte cálculo: • Classificação final da qualidade do esfregaço= A + B dividido por 2 i) Se o resultado encontrado for > 80% a qualidade do esfregaço é Adequada. ii) Se o resultado encontrado for < 80% a qualidade do esfregaço é Inadequada.,184,question: What is the number of esfregaços com coloraço adequada?
tuberculose_protocolo_3.txt,Um resultado abaixo de 80% indica uma necessidade de capacitação em coleta de escarro e em confecção e coloração de esfregaço.,185,question: Um resultado abaixo de 80% indica a necessidade de capacitaço em coleta de escarro em confecço e coloraço de esf
tuberculose_protocolo_3.txt,"II) Avaliação das concordâncias/discordâncias dos resultados As diferenças dos resultados no número de cruzes em lâminas positivas, não são consideradas discordâncias significativas para o diagnóstico do paciente. 62 Secretaria de Vigilância em Saúde/MS São classificadas como discordantes: a) Falso Negativa (FN): lâminas com resultado negativo no LL e positivo na relei- tura. b) Falso Positiva (FP): lâminas com resultado positivo no LL e negativo na releitu- ra.",186,question: What is the difference between positive and negative results?
tuberculose_protocolo_3.txt,"O cálculo da concordância é feito de acordo com a seguinte tabela: Nº Lâminas FN _________ % Relativo de FN_______________ Nº Lâminas FP________ % Relativo de FP________________ Cálculo de Concordância, FP e FN Laboratório Local Positivo (a) (b) (a+b) Negativo (c) (d) (c+d) Total (a+c) (b+d) (a+b+c+d) % concordância: (a+d)/ (a+b+c+d) Resultados FN: (c) Resultados FP: (b) % relativo de resultados FN: [c/ (c+d)] x 100 (Nº FN/ Total resultados negativos do Laboratório Local x 100) % relativo de resultados FP: [b/ (a+b)] x 100 (Nº FP/ Total resultados positivos do Laboratório Local x 100) Toda vez que uma releitura caracteriza uma discordância, deverá ser realizada uma segunda releitura confirmatória, por um outro técnico.",187,question: What is the cálculo de Concordância?
tuberculose_protocolo_3.txt,"As lâminas com discordâncias confirmadas deverão ser revistas junto com o téc- nico do LL, para verificação da discordância, na visita técnica.",188,question: What is the purpose of a revista of a discordance?
tuberculose_protocolo_3.txt,Diferenças de resultados em lâminas com 1 a 9 BAAR em 100 campos obser- vados não são classificadas como discordâncias importantes.,189,question: What is the difference in results?
tuberculose_protocolo_3.txt,"Nesses casos, porém, a diferença é anotada no formulário Relatório do Controle de Qualidade da Ba- ciloscopia, no campo das observações.",190,question: A diferença é anotada no formulário Relatório do Controle de Qualidade da Ba- ciloscopia?
tuberculose_protocolo_3.txt,O resultado do CEQ deve ser encaminhado ao LL no prazo máximo de 30 dias após o recebimento das lâminas.,192,question: O CEQ deve ser encaminhado ao LL?
tuberculose_protocolo_3.txt,O resultado do CEQ deve ser encaminhado através ofício acompanhado do Relatório do Controle de Qualidade da Baciloscopia.,193,question: O resultado do CEQ deve ser encaminhado através ofcio acompanhado do Relatório do Controle de Qualidade da Baciloscopia?
tuberculose_protocolo_3.txt,Mo- delo de ofício e de relatório são apresentados nos itens 2.9.3.5 e 2.9.3.6 dos Anexos deste Capítulo.,194,question: What are the two main types of information that are presented in the Anexos of this Captulo?
tuberculose_protocolo_3.txt,"Quando as lâminas encaminhadas pelo LL forem classificadas como inadequa- das, de acordo com os critérios estabelecidos anteriormente, o relatório de avaliação deve informar as principais deficiências técnicas observadas, orientar o laboratorista sobre as possíveis causas e recomendar as ações pertinentes para corrigi-las.",195,question: What does the LL do to determine the lâminas?
tuberculose_protocolo_3.txt,"IMPORTANTE: Caso a amostragem não contemple lâminas positi- vas, selecionar algumas para avaliar a coloração .",196,question: What is the importance of selecionar algumas?
tuberculose_protocolo_3.txt,Essas lâminas não entrarão no cálculo da amostragem .,197,question: What do lâminas no entraro no cálculo da amostragem?
tuberculose_protocolo_3.txt,"Conclusão: é a avaliação final dos resultados da releitura de lâminas. • Concordância total = 100%: Parabenizar o laboratório como forma de incenti- vo. • Concordância total < 99%: Não aprovado. 64 Secretaria de Vigilância em Saúde/MS Investigar as possíveis causas de erro como microscópio, corantes, técnicas de esfregaço, coloração e leitura, erros de numeração e transcrição dos resultados.",198,question: What is the final result of the avaliaço final?
tuberculose_protocolo_3.txt,Medidas corretivas devem ser tomadas em caso de concordância total < 99%.,199,question: What percentage of corretivas are tomadas?
tuberculose_protocolo_3.txt,"Essas medidas devem ser capacitação, visita técnica, substituição de reagentes ou uma segunda avaliação, devendo ser programadas em conjunto com o LL.",200,"question: Os medidas devem ser capacitaço, visita técnica, substituiço de reagentes ou uma segunda avaliaço?"
tuberculose_protocolo_3.txt,"A detecção de um FP é considerada erro grave, exigindo uma investigação ime- diata das causas.",201,"question: A detecço de um FP é considerada erro grave, exigindo uma investigaço ime- diata das causas."
tuberculose_protocolo_3.txt,"A detecção de um FN indica que o laboratório apresenta um erro significativo e, portanto, não estará aprovado no controle de qualidade.",202,"question: A detecço de um FN indica que o laboratório apresenta um erro significativo e, portanto, no estará aprovado no controle de qualidad"
tuberculose_protocolo_3.txt,"É importante considerar todas as causas potenciais de erros, incluindo a quali- dade dos corantes, a técnica de coloração e preparo de esfregaço, a qualidade e manu- tenção do microscópio, e procedimentos administrativos incorretos como registros e emissão de laudos.",203,"question: A qualidade e manu- tenço do microscópio, a qualidade e manu- tenço do microscópio, e procedimentos administrativos incor"
tuberculose_protocolo_3.txt,"No item 2.9.3.7 dos anexos deste capítulo, apresentamos modelo de registro geral o ano.",204,question: What is the model of registro geral o ano?
tuberculose_protocolo_3.txt,Esse relatório deve ser encaminhado aos responsáveis pelos laboratórios e co- ordenadores municipais e estadual dos PCT. 2 .4 .3 Visita técnica aos laboratórios locais A visita técnica é o processo mais adequado para observar as condições de um la- boratório e as atividades técnicas nele desenvolvidas.,205,question: What is the process of visita técnica?
tuberculose_protocolo_3.txt,"Por ter um contato direto, é mais locais.",206,question: Um contato direto é mais locais.
tuberculose_protocolo_3.txt,"É imprescindível que as visitas técnicas sejam realizadas de forma programada, sistemática, periódica, e que o LA disponha de apoio e de recursos financeiros da ins- tituição a que está vinculado.",207,question: O LA disponha de apoio e de recursos financeiros da ins- tituiço a que está vinculado?
tuberculose_protocolo_3.txt,As vantagens da visita técnica sobre os outros componentes do CEQ são: • Permitir contato direto com a equipe técnica do LL. • Motivar a equipe técnica. • Observar diretamente a prática laboratorial. • Identificar causas de erro. • Verificar a qualidade e funcionamento dos equipamentos.,208,question: What is the purpose of a visit to a técnica?
tuberculose_protocolo_3.txt,"Capítulo 2 – Sistema de Garantia da Qualidade de Baciloscopia As desvantagens são: • Ser um processo seletivo, e difícil de extrapolar os dados para o resto da rede de laboratórios. • Exigir muito tempo de trabalho. • Ter um custo relativamente elevado.",209,question: What is the benefit of a seletivo process?
tuberculose_protocolo_3.txt,"É uma atividade que precisa ser realizada durante o período de trabalho, espe- cialmente quando há mudanças de recursos humanos, de procedimentos, de local ou de equipamento.",210,question: What is a atividade that needs to be realized during a perodo of trabalho?
tuberculose_protocolo_3.txt,Permite a coleta de dados para o PCEQB e melhora o fluxo de informação entre os diversos níveis laboratoriais.,211,question: What does the PCEQB do to increase the flux of information between different nveis?
tuberculose_protocolo_3.txt,"Recomenda-se como rotina uma visita anual e, se necessário, uma freqüência maior.",212,question: What is the best way to get a visit?
tuberculose_protocolo_3.txt,"A seguir, apresentamos o roteiro de verificações da visita técnica • Avaliar condições de infra-estruturas. • Verificar se a norma de prazo para emissão dos resultados (especialmente os ca- sos positivos) está sendo seguida. • Verificar se as lâminas estão guardadas apropriadamente para o controle externo de qualidade. • Verificar se a equipe técnica tenha sido capacitada para as técnicas específicas. • Avaliar a carga de trabalho em relação a disponibilidade de profissionais. • Verificar e avaliar a quantidade de baciloscopias realizadas e a proporção de lâmi- nas positivas. • Verificar se os casos positivos notificados pelo laboratório constam dos registros da unidade de tratamento. • Verificar também os seguintes requisitos: – Possuir POP das técnicas e manuais de laboratório. – Possuir insumos em quantidade e qualidade adequadas. – Possuir um planejamento para compra de insumos necessários. – Possuir equipamentos (microscópio) em funcionamento apropriado. – Possuir um sistema de controle de qualidade interno. – Possuir normas de biosseguranca. – Possuir controle de saúde dos profissionais periódicos. – Possuir registro de acidentes de trabalho. – Possuir e manter registros dos exames padronizados. – Possuir requisição de exame padronizada. 66 Secretaria de Vigilância em Saúde/MS • Observar e avaliar a classificação de qualidade da amostra, os processos de pre- paração de esfregaço, coloração e leitura. • Assegurar que sejam feitos os controles de qualidade dos corantes. • Fazer releitura de algumas lâminas com o profissional do local, para avaliar a qualidade do esfregaço, da coloração e da leitura. • Revisar os resultados anteriores do controle externo de qualidade por releitura, discutir sugestões e recomendações para o melhoramento. • Quantas amostras foram realizadas por sintomático respiratório. • Qual a positividade da baciloscopia diagnóstica. • Qual o percentual de sintomáticos respiratórios positivos a baciloscopia. • Qual a positividade da baciloscopia total. • Qual o percentual de amostras com aspecto de saliva. • Qual o percentual de positividade da baciloscopia de amostras com aspecto de saliva.",213,question: Avaliar condiçes de infra-estruturas?
