Arquivo,Parágrafo,Número do parágrafo,Pergunta
tuberculose_protocolo_5.txt,Retirar os tubos de meios de cultura semeados da estante e movimentar cada um deles colônias separadas para a contagem. 5.,272,question: What is one way to move a collection of cultural pieces?
tuberculose_protocolo_5.txt,"Acondicionar os tubos de meios inoculados em bandeja de polipropileno, inclinados de voltada para cima.",273,question: What is the purpose of inoculating tubos of meios?
tuberculose_protocolo_5.txt,"Cuidar para que os tubos não rolem, pois isso propicia crescimento nas bordas do meio de cultura, impossibilitando a contagem das colônias. 6.",274,question: What is the purpose of the tubos?
tuberculose_protocolo_5.txt,Incubar em estufa bacteriológica a 36°C ± 1°C por dez dias.,275,question: What is the temperature of the bacteria?
tuberculose_protocolo_5.txt,"Após 48 horas de incubação, fechar as tampas completamente (somente quando o inóculo tiver sido absorvido total- mente); se ainda permanecer úmido manter a tampa frouxa por mais 24 ou 48 horas. 7.",276,question: How long do you need to incubate a tampa?
tuberculose_protocolo_5.txt,"Realizar a limpeza, a descontaminação da bancada e o descarte do material contaminado conforme descrito no capítulo 3. 8.",277,question: What does the captulo 3 do?
tuberculose_protocolo_5.txt,"Após dez dias, adicionar 0,5 ml do reagente de revelação A em um dos tubos controle. 9.",278,question: What is the amount of reagente used to generate the control?
tuberculose_protocolo_5.txt,"Se aparecer a cor, revelar, da mesma maneira, o tubo com droga: a. tubo controle (+) e tubo com fármaco (+): resistência à rifampicina; e b. tubo controle (+) e tubo com fármaco (–): incubar novamente os tubos e no 20º dia fazer a revelação do segundo tubo com fármaco droga e um outro tubo controle: i. após os 20 dias de incubação – tubo controle (+) e tubo com droga (+) = cepa resistente à rifampicina; e ii. após os 20 dias de incubação – tubo controle (+) e tubo com droga (-) = cepa sensível à rifampicina. 10.",279,question: What is the difference between a tubo controle and a tubo control?
tuberculose_protocolo_5.txt,"Se não houver mudança de cor, descartar o tubo e reincubar os outros.",280,question: What is the process of descarting a tubo and reincubating outros?
tuberculose_protocolo_5.txt,"Esse procedimento será repetido no dia 15º dia de incubação usando o segundo tubo controle, e, se necessá- rio, também no dia 20º dia usando o terceiro tubo controle. 9.4.1.4 Sistemas comerciais automatizados de TS Um dos sistemas automatizados comercializados (BD BACTEC™ MGIT™) utiliza tubos de cultura que contêm no fundo um composto fluorescente, embebido em silicone, que é sensível à presença do oxigênio dissolvido no meio.",281,question: What is the process of incubation?
tuberculose_protocolo_5.txt,"Quando o microrganismo cresce no meio de cultura e consome o oxigênio do meio ocasiona a emissão da fluorescência, que é detectada pelo leitor do equipamento.",282,question: What is the effect of microrganism on the fluorescencia?
tuberculose_protocolo_5.txt,As leituras da fluorescência são realizadas de maneira contínua e simultânea a cada 60 minutos.,283,question: How long do the leituras do fluorescencia last?
tuberculose_protocolo_5.txt,"O TS para M. tuberculosis pode ser realizado a partir de culturas em meios sólidos ou líquidos para os seguintes fármacos: estreptomicina, isoniazida, rifampicina e etambutol (Kit SIRE).",284,question: What is the name of the drug that is used to treat tuberculosis?
tuberculose_protocolo_5.txt,Os resultados são interpretados e liberados automaticamente entre 4 e 42 dias.,285,question: Os resultados so interpretados e liberados automaticamente entre 4 e 42 dias?
tuberculose_protocolo_5.txt,"O teste é baseado no crescimento de M. tuberculosis em tubos contendo cada fármaco, sendo 9 TESTE DE SENSIBILIDADE comparado ao tubo sem fármaco (controle de crescimento).",286,question: What is the test base on?
tuberculose_protocolo_5.txt,"A análise da fluorescência no que determina os resultados dos TS, sendo realizados automaticamente pelo equipamen- to.",287,question: What is the result of fluorescencia?
tuberculose_protocolo_5.txt,"Após essa análise, ele interpreta os resultados utilizando algoritmo específico e libera o TS como S (sensível) ou R (resistente).",288,question: O TS libera o TS como S (sensible) ou R (resistente)?
tuberculose_protocolo_5.txt,"Esses sistemas comerciais seguem o mesmo princípio do método das proporções, utilizando resistentes.",289,question: Os sistemas comerciais seguem o mesmo principio do método das proporçes?
tuberculose_protocolo_5.txt,"A seguir serão descritas as etapas para a realização do TS no sistema automatizado atual- mente comercializado no Brasil.35 9.4.1.4.1 Procedimentos do TS em sistema automatizado de EPI adequados, conforme descrito no Capítulo 3.",290,question: What is the etapas for a realizaço do TS?
tuberculose_protocolo_5.txt,Observação: o preparo de criotubos com miçangas e meio líquido Sauton (ou Middlebrook 7H9 com OADC) com 10% de glicerol para manutenção dos isolados bacterianos está descrito no capítulo 11.,291,question: What is the name of the bacteria that is prepared for the use of criotubos?
tuberculose_protocolo_5.txt,Equipamentos: » CSB classe II B2; » equipamento automatizado BACTEC™ MGIT™; » estufa bacteriológica a 36°C ± 1°C; » freezer -20°C; » freezer -70°C; » refrigerador; » micropipeta automática com capacidade de 10 a 100 µl; e » micropipeta automática com capacidade de 100 a 1.000 µl.,292,question: What is the BACTECTM MGITTM?
tuberculose_protocolo_5.txt,Reagentes: » água destilada estéril; » solução de álcool a 70%; » solução de fenol a 5%; e » escala 1 de McFarland.,293,question: What are some of the suggestions for a fenol solution?
tuberculose_protocolo_5.txt,"Vidrarias: » frasco 1: frasco de vidro transparente contendo pérolas de vidro, com capacidade de 5 ml ou mais, com tampa de rosca e autoclavável ou resistentes à esterilização em forno a 160°C a 180°C por duas horas; » frasco 2: tubo de ensaio de 12 x 120 mm de vidro transparente; » frasco 3: frascos de vidro transparente, com capacidade de 7 ml ou mais, com tampa de rosca e autoclavável ou resistentes à esterilização em forno a 160°C a 180°C por duas horas; e » frasco 4: frascos com capacidade de 15 ml ou mais, com tampa de rosca e autoclavá- vel ou resistentes à esterilização em forno a 160°C a 180°C por duas horas.",294,question: What is a frasco of vidro transparente?
tuberculose_protocolo_5.txt,"Insumos: » papel-absorvente (papel de filtro ou papel-toalha) para forrar a bancada; » bandejas quadriculadas de alumínio; » estantes de metal; » estantes de acrílico compatíveis com o equipamento (AST Set Carrier); » estante de metal para transporte das estantes AST; » canetas para marcar vidro, com ponta fina e comum; » alça bacteriológica descartável estéril; » criotubos com seis miçangas estéreis; » tubo 12 x 120 mm com tampa de silicone estéril; » frasco de vidro com tampa de rosca, capacidade para cerca de 10 ml; » frasco de vidro com tampa de rosca, capacidade para cerca de 30 ml; » pipeta Pasteur descartável estéril; » dispensador com seringa plástica de volume específico; » ponteiras com capacidade de 10 a 100 µl; » ponteiras com capacidade de 100 a 1.000 µl; » gaze estéril em pedaços; » BD BBL™ MGIT™ – Tubo de meio de cultura com indicador do crescimento de mi- cobactérias (Tubo MGIT); » kit SIRE (S – estreptomicina, I – isoniazida, R – Rifampicina e E – etambutol): › BACTEC®: – estreptomicina (MGIT-S): 83 µg/ml; – isoniazida (MGIT-I): 8,3 µg/ml; – rifampicina (MGIT-R): 83 µg/ml; – etambutol (MGIT-E): 415 µg/ml; e – enriquecimento OADC. » tubo com meio de cultura com TSA ou similar; » solução estoque de PNB; » meio Sauton com 10% de glicerol; » enriquecimento OADC (para uso no tubo de meio com PNB); » lâmina para microscopia; » recipiente plástico de boca larga para o material ser autoclavado e descartado; e 9 TESTE DE SENSIBILIDADE » saco plástico autoclavável para acondicionamento dos recipientes de descarte.",295,question: What is the MGIT-I?
tuberculose_protocolo_5.txt,"Adicionar 4 ml de água destilada estéril em cada frasco com os fármacos SIRE, conforme indicações do fornecedor. 2.",296,question: What is the agua destilada estéril em cada frasco?
tuberculose_protocolo_5.txt,"Assepticamente, utilizando uma micropipeta, adicionar 0,8 ml de suplemento SIRE em cada tubo MGIT (5 tubos para cada teste com os fármacos). 3.",297,question: How much SIRE does a MGIT tub contain?
tuberculose_protocolo_5.txt,"Assepticamente, utilizando uma micropipeta, pipetar o volume indicado de cada fármaco (SIRE) em quatro tubos para cada teste.",298,question: What is the volume indicated of cada fármaco?
tuberculose_protocolo_5.txt,"Observações: a concentração crítica de rifampicina é 0,5 µg/ml. 4.",299,question: What is the concentration of rifampicina?
tuberculose_protocolo_5.txt,Um tubo sem fármaco será usado como controle de crescimento bacteriano (CC) e deverá conter a identificação do isolado. 5.,300,question: What isolado can be identified?
tuberculose_protocolo_5.txt,"Colocar os tubos no AST Set Carrier na seguinte sequência: CC, S, I, R, E e incubar no equipamento MGIT.",301,question: What is the purpose of a MGIT?
tuberculose_protocolo_5.txt,"Para preparo do meio com PNB 36: » Assepticamente, utilizando uma micropipeta, adicionar 0,8 ml de OADC em cada tubo MGIT (um tubo para cada teste).",302,question: What is the OADC used in a test tube?
tuberculose_protocolo_5.txt,"Assepticamente, utilizando uma micropipe- ta, pipetar 168 µl da solução estoque PNB (25 mg/ml) em cada tubo MGIT. 9.4.1.4.2 Preparação do inóculo a.",303,question: What is the amount of PNB in a tubo MGIT?
tuberculose_protocolo_5.txt,A partir de crescimento em meio líquido de MGIT.,304,question: A partir de crescimento em meio lquido de MGIT?
tuberculose_protocolo_5.txt,"Para os isolados em meio líquido, recepcionados nos laboratórios, aspirar com uma pipeta Pasteur aproximadamente 3 ml do sedimento e dispensar 2 ml no frasco 1, com pérolas de vidro e sem água, e 0,5 ml no criotubo com miçanga de vidro. 2.",307,question: What isolados can use a pipeta Pasteur?
tuberculose_protocolo_5.txt,"No frasco 1, agitar vigorosamente até a obtenção de uma suspensão homogênea de bactérias. 3.",308,question: What is the main reason for a bactéria to be a problem?
tuberculose_protocolo_5.txt,Deixar a suspensão em repouso por cinco minutos (para decantar). 4.,309,question: How long does it take to get a suspense?
tuberculose_protocolo_5.txt,"Com uma pipeta Pasteur, transferir cerca de 1 ml do sobrenadante para o frasco 2 (cuida- do para não misturar com o sedimento). 5.",310,question: How much water should be transferred to the frasco 2?
tuberculose_protocolo_5.txt,"Com a mesma pipeta, retirar todo o meio líquido do criotubo com miçanga de vidro. 6.",311,question: What is the purpose of a pipeta?
tuberculose_protocolo_5.txt,"Com outra pipeta Pasteur ajustar a turbidez da suspensão para a escala 1 de McFarland, adicionando água destilada estéril, gota a gota. 7.",312,question: Pasteur ajusta a turbidez da suspenso para a escala 1 de McFarland.
tuberculose_protocolo_5.txt,"Com micropipeta, diluir 1 ml da suspensão acima em 4 ml de água destilada estéril, que deverá estar no frasco 3 (suspensão 1:5). 8.",313,question: How much água destilada estéril does a person need to consume to be considered a good drink?
tuberculose_protocolo_5.txt,"Com micropipeta diluir 0,1 ml da suspensão 1:5 em 10 ml de água destilada estéril, que deverá estar no frasco 3 (suspensão 1:100).",314,question: How much água destilada estéril does a micropipeta produce?
tuberculose_protocolo_5.txt,"Observações: suspensão 1:5 = inóculo para uso nos meios com fármacos, no PNB e uma gota no TSA ou similar.",315,question: What is the suspense ratio?
tuberculose_protocolo_5.txt,Suspensão 1:100 = inóculo para uso no meio controle. c.,316,question: What is the amount of time that is needed to use the mouse?
tuberculose_protocolo_5.txt,"Frasco 1 – para fazer a suspensão: » utilizar um frasco com tampa de rosca, com capacidade para cerca de 3 ml; » colocar aproximadamente seis pérolas de vidro; » esterilizar em estufa a 180°C por duas horas; e » distribuir, assepticamente, 2 ml de água destilada estéril com pipeta graduada, em cada um dos frasquinhos.",318,question: What is the capacity of a frasco?
tuberculose_protocolo_5.txt,"Frasco 2 – para fazer a diluição 1/5: » utilizar um frasco com tampa de rosca, com capacidade para cerca de 10 ml; » esterilizar os frascos a 180°C por duas horas; e » assepticamente, distribuir 4 ml de água destilada estéril.",319,question: What is the recommended amount of agua destilada?
tuberculose_protocolo_5.txt,"Frasco 3 – para fazer a diluição 1/100: » utilizar um frasco com tampa de rosca, com capacidade para cerca de 30 ml; » esterilizar os frascos a 180°C por duas horas; » assepticamente, distribuir 10 ml de água destilada estéril; » bandeja: preparar uma bandeja de alumínio com divisões colocando um frasco 1, um frasco 2 e um criotubo contendo ou não miçangas (capítulo 11).",320,question: What is the smallest frasco?
tuberculose_protocolo_5.txt,Numerar todos os tubos com o número de cada isolado a ser testado.,321,question: What is the purpose of testing tubos?
tuberculose_protocolo_5.txt,"Para os criotubos marcar o número do isolado bacteriano no corpo e na tampa dos tubos, com etiqueta própria para congelamento; numerar o frasco 3 com os números de cada isolado bacteriano a ser testado – colocar os frascos 3 em bandeja separada; e » preparar uma listagem com o número dos isolados a serem testados. 1.",322,question: What is the etiqueta própria for congelamento?
tuberculose_protocolo_5.txt,"Colocar a estante com os isolados bacterianos, a bandeja de alumínio com divisões com um frasco 1, um frasco 2 e um criotubo contendo ou não miçanga (capítulo 11), e a ban- deja com os frascos 3 dentro da CSB. 2.",323,question: What is a ban- deja com os frascos 3 dentro da CSB?
tuberculose_protocolo_5.txt,"Com alça bacteriológica descartável estéril, retirar uma boa porção da massa bacteriana que está sobre o meio (buscar não retirar o meio).",324,question: What is the main purpose of retirar a boa porço da massa bacteriana that is sobre o meio?
tuberculose_protocolo_5.txt,Procurar tocar em todas as colônias para ter uma boa representatividade da amostra. 3.,325,question: What is the purpose of a good representation of the amostra?
tuberculose_protocolo_5.txt,"Abrir o frasco 1, colocar a alça sobre as pérolas e fazer uma suspensão homogênea de bactérias. 9 TESTE DE SENSIBILIDADE 4.",326,question: What is the purpose of the frasco 1?
tuberculose_protocolo_5.txt,Pegar mais massa bacilar com alça e fazer o mesmo no criotubo contendo ou não miçanga (capítulo 11). 5.,327,question: What is the point of bacilar?
tuberculose_protocolo_5.txt,Descartar a alça no saco autoclavável. 6.,328,question: What is the process of removing the autoclavavel sac?
tuberculose_protocolo_5.txt,Repetir esse procedimento até que todas as suspensões dos isolados bacterianos e da cepa controle (M. tuberculosis H37Rv) estejam prontas. 7.,329,question: What is the process of reviving the process?
tuberculose_protocolo_5.txt,"Deixar a suspensão em repouso por 15 minutos, para decantar as partículas maiores e evitar dispersão de aerossóis. 8.",330,question: How many minutes do you need to wait for the air to clear?
tuberculose_protocolo_5.txt,"Com uma pipeta Pasteur, retirar cerca de 1 ml do sobrenadante e gotejar pela parede do tubo, ajustando a turvação da suspensão com escala 1 de McFarland. 9.",331,question: How much water does a pipeta Pasteur take?
tuberculose_protocolo_5.txt,"Com a mesma pipeta, retirar todo o meio líquido do criotubo, se estiver usando o criotubo com miçangas; essa etapa não é realizada se estiver utilizando o criotubo sem miçangas. 10.",332,question: What is the etapa of using a criotubo?
tuberculose_protocolo_5.txt,"Realizar os procedimentos 8 e 9 para todas os isolados bacterianos, utilizando uma pipeta para cada isolado. 11.",333,question: What is the process 8 and 9 for?
tuberculose_protocolo_5.txt,"Com micropipeta automática, diluir 1 ml da suspensão acima em 4 ml de água destilada estéril (frasco 2) – suspensão 1:5. 12.",334,question: How much agua destilada estéril does one need to drink to get the desired effect?
tuberculose_protocolo_5.txt,"Com micropipeta automática, diluir 0,1 ml da suspensão preparada no item 8, em 10 ml de água destilada estéril (frasco 3) – suspensão 1:100.",335,question: How much agua destilada estéril does the user need to drink to be considered a good buy?
tuberculose_protocolo_5.txt,Observações: Suspensão 1:5 = inóculo para uso nos meios com fármacos e no TSA.,336,question: What is the amount of inoculos that can be used to use the TSA?
tuberculose_protocolo_5.txt,Suspensão 1:100 = Inóculo para uso no meio controle. 13.,337,question: What is the time limit for the inoculum?
tuberculose_protocolo_5.txt,"Guardar os isolados bacterianos originais na geladeira até a liberação dos resultados dos testes. 9.4.1.4.3 Preparação dos meios MGIT Para a preparação dos meios de cultura MGIT para TS utilizados no sistema automatizado, seguir as instruções do fabricante, consistindo em preparar um tubo de MGIT com PNB (opcional) e quatro tubos com os fármacos SIRE. a.",338,question: What is the purpose of a geladeira?
tuberculose_protocolo_5.txt,Preparação do meio MGIT com PNB 1.,339,question: What is the difference between a MGIT and a PNB?
tuberculose_protocolo_5.txt,"Assepticamente, adicionar 0,8 ml de OADC em cada tubo MGIT (um tubo para cada teste).",340,question: How much OADC should be adicionar in a MGIT tub?
tuberculose_protocolo_5.txt,"Esse OADC não deve ser retirado do kit SIRE, pois esse kit é utilizado para o preparo dos meios com fármaco estreptomicina, isoniazida, rifampicina e etambutol. 2.",341,question: What is the purpose of the OADC kit?
tuberculose_protocolo_5.txt,"Assepticamente, utilizando uma micropipeta automática, pipetar 168 µl da solução estoque PNB em cada tubo MGIT. 3.",342,question: What is the amount of pipetas used in MGIT?
tuberculose_protocolo_5.txt,Marcar os tubos com o símbolo na cor padronizada pelo laboratório.,343,question: What is the purpose of a tubing symbol?
tuberculose_protocolo_5.txt,Exemplo: símbolo – dois traços em X na cor preta. b.,344,question: What is the term for a traço em X?
tuberculose_protocolo_5.txt,Preparação do meio MGIT com fármacos SIRE 1.,345,question: What is the difference between a MGIT and a SIRE?
tuberculose_protocolo_5.txt,"Para o preparo da solução estoque dos fármacos SIRE, adicionar 4 ml de água destilada estéril em cada frasco com os fármacos SIRE, conforme orientações do fornecedor. 2.",346,question: What is the amount of agua destilada estéril em cada frasco?
tuberculose_protocolo_5.txt,"Assepticamente, adicionar 0,8 ml de suplemento SIRE (OADC) em cada tubo MGIT (5 tubos para cada teste). 3.",347,question: How much SIRE does MGIT produce?
tuberculose_protocolo_5.txt,"Assepticamente, utilizando uma micropipeta automática, pipetar a quantidade indica- da de cada fármaco (SIRE) em cada tubo marcado (um tubo para cada fármaco).",348,question: What is the SIRE?
tuberculose_protocolo_5.txt,"Observação: a concentração crítica de rifampicina para o MGIT é de 0,5 µg/ml. 4.",349,question: What is the concentration of rifampicina for MGIT?
tuberculose_protocolo_5.txt,Marcar os tubos com o símbolo na cor padronizada pelo laboratório.,350,question: What is the purpose of a tubing symbol?
tuberculose_protocolo_5.txt,"Exemplo: símbolo = um traço inclinado, cores: vermelha = estreptomicina, preta = isoniazida, azul = rifampicina e verde = etambutol. 5.",351,"question: What is the meaning of the word ""smbolo""?"
tuberculose_protocolo_5.txt,"Colocar o tubo controle de crescimento e um tubo de cada fármaco em uma estante seguindo a ordem SIRE, o tubo de PNB e o de TSA. 2.",353,question: What is a tubo controle de crescimento?
tuberculose_protocolo_5.txt,"Identificar com o número do isolado bacteriano o tubo CC, o tubo PNB e tubo TSA. 1.",354,question: What is the name of the bacteriano tubo?
tuberculose_protocolo_5.txt,"Inocular o tubo CC: com micropipeta automática, inocular 0,5 ml da suspensão 1:100 no tubo MGIT CC. 2.",355,question: What is the dose of the tubo MGIT CC?
tuberculose_protocolo_5.txt,"Inocular os tubos contendo fármacos: com micropipeta automática, inocular 0,5 ml da suspensão 1:5 em cada um dos tubos contendo fármacos estreptomicina (S), isoniazida (I), rifampicina (R), etambutol (E) e ácido p-nitrobenzoico (PNB). 3.",356,question: What is the suspenso of a tubo?
tuberculose_protocolo_5.txt,"Rosquear e homogeneizar bem cada um dos tubos, para não prejudicar a leitura. 4.",357,question: What is the purpose of homogeneizar in each tubo?
tuberculose_protocolo_5.txt,"Inocular um tubo com TSA ou similar: com micropipeta automática inocular 0,5 ml da suspensão. 5.",358,question: What is the size of a tubo with TSA?
tuberculose_protocolo_5.txt,"Após a inoculação de todos os testes, realizar a limpeza, a descontaminação da CSB e da bancada e o descarte do material contaminado, conforme descrito no capítulo 3. 9.4.1.4.5 Incubação no sistema automatizado 1.",359,question: What is the purpose of the incubation?
tuberculose_protocolo_5.txt,"Dispor cinco tubos (CC e SIRE) na estante AST Set Carrier, na seguinte sequência: (CC, S, I, R, E). 2.",360,question: What is the AST Set Carrier?
tuberculose_protocolo_5.txt,Incubar sistema de incubação BACTEC™ MGIT™. 3.,361,question: What is the name of the system?
tuberculose_protocolo_5.txt,"Antes de incubar cada estante, verificar o número do isolado bacteriano e localizá-lo na listagem de cepas.",362,question: What is the nmero of bacteriano?
tuberculose_protocolo_5.txt,"Na coluna posição, anotar letra e números da gaveta na qual a estante será incubada. 4.",363,question: What is the nascent posiço?
tuberculose_protocolo_5.txt,Após a incubação de todas as estantes repetir o procedimento para os tubos MGIT PNB. 5.,364,question: How do you repeat the process for MGIT PNB?
tuberculose_protocolo_5.txt,"Antes de incubar cada tubo, verificar o número do isolado bacteriano e anotar a letra e o número da gaveta que o tubo será incubado. 6.",365,question: What is the procedure to check for bacteria in a tubo?
tuberculose_protocolo_5.txt,"Após o término, aguardar cerca de dois minutos para verificar se ocorreu algum erro no momento da incubação. 7.",366,question: Aguardar cerca de dois minutos para verificar se ocorreu algum erro no moment da incubaço?
tuberculose_protocolo_5.txt,"No caso de erro, acenderá o botão (!) da gaveta onde estiver o problema.",367,question: A boto (!) da gaveta onde estiver o problem?
tuberculose_protocolo_5.txt,Consultar o manual de instruções do instrumento BACTEC™ MGIT™. 8.,368,question: What is the name of the manual?
tuberculose_protocolo_5.txt,Incubar o tubo com TSA ou similar em estufa bacteriológica a 36°C ± 1°C.,369,question: What is the process of incubating a tubo with TSA?
tuberculose_protocolo_5.txt,"Se houver contaminação com outros microrganismos, anotar o resultado de contaminação. 9 TESTE DE SENSIBILIDADE 9.4.1.4.6 Leitura e registro dos resultados no sistema automatizado 1.",370,question: What is the result of contaminaço?
tuberculose_protocolo_5.txt,"Verificar diariamente a indicação de resultados finalizados no equipamento BACTEC™ MGIT™, que fornecerá os resultados de resistência ou sensibilidade dos fármacos a cada isolado bacteriano testado. 2.",371,question: What is the purpose of the BACTECTM MGITTM?
tuberculose_protocolo_5.txt,Imprimir os resultados dos testes finalizados. 3.,372,question: What do testes finalizados dos resultados dos testes?
tuberculose_protocolo_5.txt,"Antes da liberação dos resultados os laudos devem ser conferidos por duas pessoas quanto ao número da cultura, nome e resultado. 5.",374,question: What do laudos do resultados do?
tuberculose_protocolo_5.txt,"Anotar os testes que apresentarem erro e tomar as providências devidas, descritas pelo fabricante.",375,question: What is the purpose of testing erro?
tuberculose_protocolo_5.txt,Discordância entre os resultados do TS – Entre o isolado bacteriano recebido anterior- mente e o isolado atual: a. repetir novamente o TS dos dois isolados e no caso de manter a discordância soltar o resultado com uma carta explicativa. 1.,376,question: What is the result of a TS?
tuberculose_protocolo_5.txt,"Acompanhar o tubo PNB de acordo com o protocolo de leitura dos meios com fármaco, ou seja, resultado positivo ou erro.",377,question: What is the result of a tubo PNB?
tuberculose_protocolo_5.txt,O teste com PNB finaliza e será interpretado como negativo três dias após a finalização de todos os TS. 2.,378,question: What is the result of the finalization of all TS?
tuberculose_protocolo_5.txt,Anotar os resultados do PNB no livro de registro.,379,question: What is the purpose of registering a PNB account?
