Arquivo,Parágrafo,Número do parágrafo,Pergunta
tuberculose_protocolo_8.txt,"Contudo, a análise de como se processa a técnico-instrumental, com base no modelo biomédico e preventivo, que tem por foco o controle das doenças e dos fatores de risco, distante, portanto, da integralidade da saúde que caracteriza as propostas do SUS e do modelo de atenção vigente, pautado na promoção da saúde com enfoque integral e integrado, em acordo com as necessidades e demandas individuais e coletivas (ALMEIDA; SOARES, 2011).",13,question: What is the process of a técnico-instrumental?
tuberculose_protocolo_8.txt,"A atuação dos enfermeiros na APS também contempla a pesquisa, presente na busca de evidências para qualificar o trabalho assistencial, gerencial e educativo junto a 20 | TUBERCULOSE NA ATENÇÃO PRIMÁRIA À SAÚDE: PROTOCOLO DE ENFERMAGEM usuários e trabalhadores, bem como nas atividades docentes e de pesquisa.",14,question: A APS atuaço contempla a pesquisa?
tuberculose_protocolo_8.txt,"As entidades profissionais de enfermagem e as mudanças de suas práticas no cotidiano dos serviços, em particular, a ABEn, que, dentre várias iniciativas, promove anualmente o Seminário Nacional de Diretrizes para Educação em Enfermagem (Senaden), e o Cofen, que produzir pesquisa de temáticas mais imediatamente vinculadas à prática dos serviços. 1.1.3 Ampliação da dimensão assistencial e da prática clínica do enfermeiro na APS se inicia na década de 80, e tem como atribuições: realizar atenção à saúde aos indivíduos e famílias vinculadas às equipes, no domicílio e em outros espaços comunitários; realizar consulta de enfermagem e outros procedimentos, solicitar exames terapêuticas; realizar e supervisionar acolhimento com escuta qualificada e classificação de risco; elaborar plano de cuidados para as pessoas que possuem condições crônicas no território, junto aos demais membros da equipe; realizar atividades em grupo; planejar, gerenciar e avaliar as ações desenvolvidas pelos técnicos/auxiliares de enfermagem e agentes comunitários de saúde (ACS); supervisionar as ações do técnico/auxiliar de enfermagem; implementar e manter atualizados protocolos, rotinas e fluxos relacionados à sua área de competência na UBS, entre outras (BRASIL, 2017).",15,question: What does the ABEn promote
tuberculose_protocolo_8.txt,"Estudo documental sobre competências, atividades, ações e intervenções dos trabalhadores de enfermagem na APS mostra o predomínio de atividades assistenciais, tanto para enfermeiros como para os técnicos e auxiliares de enfermagem, com destaque especial para as ações de prevenção de riscos e agravos, e também de recuperação da saúde (LIMA, 2018).",16,question: What is the purpose of the study?
tuberculose_protocolo_8.txt,"A consulta de enfermagem, a visita e o atendimento domiciliar são reconhecidos pelos enfermeiros como prática clínica, embora com predomínio “da lógica da atenção clínica individual, curativa, sem ampliar a compreensão do processo saúde/doença como produção social” (MATUMOTO et al., 2011).",17,question: What do enfermeiros do that are considered to be a prática clnica?
tuberculose_protocolo_8.txt,"Outro estudo também analisa que a ampliação da prática clínica do enfermeiro na APS mantém a dominância do modelo biomédico, restrito à patologia e às alterações fisiológicas no corpo individual sem contextualização, ou seja, com prática centrada no corpo da pessoa e na doença (TOSO; FILIPPON; GIOVANELLA, 2016).",18,question: What is the effect of the ampliaço of the APS on the model?
tuberculose_protocolo_8.txt,"Todavia, entende-se que há alternativas à prática exclusivamente clínica e centrada no modelo biomédico, se os enfermeiros protagonizarem esse debate, e ampliarem sua prática em diálogo e parceria com os demais profissionais de saúde, gestores, pessoas que utilizam os serviços, famílias e comunidade do território (PEDUZZI et al., 2019), com base na integralidade do cuidado e na concepção ampliada da saúde (MATUMOTO et al., 2011; BARBIANI; DALLA NORA; SCHAEFER, 2016).",19,question: What is the main argument that enfermeiros protagonize esse debate?
tuberculose_protocolo_8.txt,"Cabe destacar o amplo debate e a implementação, no cenário mundial, da Enfermagem de Prática Avançada (EPA), iniciada em alguns países como Estados Unidos da América, Canadá e Reino Unido, a partir dos anos 1960 do século passado, estendendo- | 21 se até à década dos anos 2000, com o apoio do Conselho Internacional de Enfermagem (CIE).",20,question: What is the EPA?
tuberculose_protocolo_8.txt,"A EPA é definida como o enfermeiro que adquiriu uma base de conhecimentos especializados, habilidades na tomada de decisões complexas e competências clínicas para uma prática mais ampla, cujas características são moldadas pelo contexto e/ou país no qual ele está credenciado a praticar a profissão.",21,question: What is the EPA?
tuberculose_protocolo_8.txt,"O mestrado é recomendado para esse nível (CASSIANI; ZUG, 2014).",22,question: What is the mestrado?
tuberculose_protocolo_8.txt,"Na América Latina, a ampliação da prática clínica do enfermeiro na APS também vem se expandindo e passa a ter maior visibilidade nos anos 2000, em especial impulsionada pelas discussões promovidas na região pela Opas, que recomenda aumentar o número de enfermeiros de Prática Avançada (CASSIANI; ZUG, 2014).",23,question: What is the APS's goal to achieve?
tuberculose_protocolo_8.txt,"No Brasil, o debate sobre a âmbito do SUS (MATUMOTO et al., 2011; MIRANDA NETO et al., 2018; TOSO; FILIPPON; GIOVANELLA, 2016; PEDUZZI et al., 2019). da atenção à saúde, dentre os quais: aumento do acesso aos serviços de saúde; melhor manejo de condições e doenças crônicas; maior satisfação das pessoas que utilizam os serviços e que necessitam de cuidados de saúde no atendimento (SWAN et al., 2015; MIRANDA NETO et al., 2018; LAURANT et al., 2018).",24,question: What is the debate about a âmbito do SUS?
tuberculose_protocolo_8.txt,"Esse Plano é consoante ao documento da Opas “Ampliação do papel dos enfermeiros na Atenção Primária à Saúde” (OPAS, 2018), que ressalta o papel crítico a ser desempenhado pela enfermagem no avanço da APS, com destaque para a sua atuação na eliminação da tuberculose como problema de saúde pública.",26,question: What is the Plano?
tuberculose_protocolo_8.txt,"Dentre as ações propostas no Plano Nacional pelo Fim da Tuberculose (BRASIL, 2017b), incluem-se as relacionadas a seguir, as quais requerem a participação qualificada do enfermeiro: >> Garantia de elevada cobertura da vacina BCG; >> Descentralização das ações de detecção, diagnóstico e acompanhamento da >> TB para a APS; >> Ampliação da participação da sociedade civil no enfrentamento da doença; >> Desenvolvimento de estratégias de análise de dados para o monitoramento das ações de controle da TB no âmbito da APS; >> Formação e fortalecimento de rede de pesquisa em TB; >> Manutenção do enfrentamento da doença na agenda política; >> Implantação de novas tecnologias de diagnóstico e tratamento da doença; >> Vigilância do óbito por TB, da infecção latente e da tuberculose resistente; >> Fortalecimento das ações de controle da doença nas populações mais vulneráveis; >> Abordagem da TB na perspectiva dos determinantes sociais; 22 | TUBERCULOSE NA ATENÇÃO PRIMÁRIA À SAÚDE: PROTOCOLO DE ENFERMAGEM >> Expansão da descentralização e qualificação das ações de enfrentamento da doença na APS; >> Melhoria dos indicadores de desfecho do tratamento; e >> Melhoria nos sistemas de informação.",27,question: What is the extent of the enfermeiro?
tuberculose_protocolo_8.txt,"Considerando a fase 2 do Plano Nacional pelo Fim da Tuberculose (BRASIL,2 A assistência de enfermagem: acolhimento, diagnóstico laboratorial vulnerável e a pandemia de covid-19 na 2.1 A abordagem do sintomático respiratório na população geral e a enfermagem O enfermeiro, ao desenvolver as ações de controle da tuberculose na APS, deve identificar a situação de saúde, a forma como se dá o trabalho da equipe e como estão organizadas as práticas de atenção à saúde no território, além de obter informações clínicas, epidemiológicas e sociais das pessoas com sinais e sintomas da TB, a fim de tomar providências com relação ao cuidado e a assistência a ser prestada a essas pessoas. do MS, segundo a Portaria da Atenção Básica nº 648, de 28 de março de 2006 (BRASIL, 2006), no que se refere às seguintes atribuições: “conforme protocolos ou outras normativas técnicas estabelecidas pelo gestor municipal ou do Distrito Federal, observadas as disposições legais da profissão, realizar consulta de enfermagem, solicitar exames complementares e prescrever medicações” (BRASIL, 2011); além disso, deve realizar a programação anual de insumos, planejar os indicadores e monitorar as ações de controle da TB, bem como organizar os fluxos para identificar os sintomáticos respiratórios (SR) e pessoas com TB ativa e seus contatos (BRASIL, 2002). atuam, oportunizando a identificação precoce da doença.",28,question: What is the BRASIL plan?
tuberculose_protocolo_8.txt,"Para tanto, é fundamental conhecer a área adscrita à unidade de saúde, sua dimensão geográfica e populacional, doença, além de identificar potenciais apoiadores e parceiros. | 39 A busca ativa é uma atividade de identificação de casos suspeitos, a fim de propiciar o diagnóstico precoce da enfermidade.",29,"question: A busca ativa é uma atividade de identificaço de casos suspeitos, a fim de propiciar o diagnóstico precoce da enfermidade."
tuberculose_protocolo_8.txt,"Cabe ressaltar que uma pessoa leiga não associa tosse e expectoração com TB e, por isso, raras vezes procura a unidade de saúde no início dos sintomas; como consequência, observa-se uma chegada tardia à unidade de saúde, implicando o atraso na identificação, diagnóstico e início do tratamento da doença.",30,"question: A chegada tardia à unidade de sade implicando o atraso na identificaço, diagnóstico e incio do tratamento da doença?"
tuberculose_protocolo_8.txt,"Por sua vez, a busca de SR na comunidade ou no próprio serviço de saúde depende também da infraestrutura da unidade, dos fluxos dos exames, da capacitação dos profissionais, da supervisão e mobilização dos trabalhadores, além da prioridade do atendimento ao SR para a realização de exames.",31,question: A busca de SR depende de what?
tuberculose_protocolo_8.txt,"Adicionalmente, nesse primeiro contato, devem-se considerar as vulnerabilidades individuais e sociais da pessoa, como desemprego, dificuldade de deslocamento e acesso, violência, entre outros (FAÇANHA et al., 2009), uma vez que elas podem favorecer o desenvolvimento da TB.",32,question: What is a vulnerabilidad individuais e sociais da pessoa?
tuberculose_protocolo_8.txt,"Nesse contexto, dentre as estratégias para a identificação do SR, destaca-se a busca ativa e a busca passiva. 2.1.1 Busca ativa de sintomáticos respiratórios Considera-se busca ativa de pessoas com sintomas respiratórios uma atividade orientada a identificar precocemente pessoas, da população geral, com tosse por tempo igual ou superior a três semanas (BRASIL, 2019).",33,question: What is the SR's atividad?
tuberculose_protocolo_8.txt,"Para estratégias de controle de infecção dentro do serviço de saúde, considera-se SR tosse por duas semanas (BRASIL, 2019).",34,question: What is the SR tosse for?
tuberculose_protocolo_8.txt,"Em populações específicas, como pessoas vivendo com HIV, contatos de pessoas com TB ativa, imigrantes, indígenas, quilombolas, profissionais de saúde, PSR e PPL, deve-se considerar SR a pessoa que apresentar tosse com qualquer tempo de duração.",35,question: What do imigrantes do that are considered to be a sex?
tuberculose_protocolo_8.txt,"Na população geral que procura o serviço de saúde, e para pessoas com diabetes melittus, considera-se o tempo de tosse de duas semanas ou mais (BRASIL, 2019).",36,question: What is the BRASIL 2019 trend?
tuberculose_protocolo_8.txt,"Também é definida como busca ativa a procura rotineira, pelo serviço, de pessoas com suspeita de TB em populações-alvo predefinidas ou na população geral, com base nos sintomas e/ou resultados de exames laboratoriais, histológicos e/ou radiológicos.",37,question: What is the definition of TB?
tuberculose_protocolo_8.txt,"Adicionalmente, a visita domiciliar deve ser estimulada e incrementada nas equipes de saúde da família, uma vez que favorece a busca ativa do SR.",38,question: A visita domiciliar deve ser estimulada e incrementada nas equipes de sade da famlia?
tuberculose_protocolo_8.txt,"Outro aspecto importante da busca ativa é a possibilidade de “interagir não só com o usuário, de maneira isolada, mas com o mundo que o cerca, seu espaço e território”, ou seja, permite conhecer o contexto de produção da doença (PEREIRA et al., 2013).",39,question: What is the possibility of interagir no só com o usuário?
tuberculose_protocolo_8.txt,"Nessa lógica, a unidade de saúde adota uma abordagem proativa, buscando identificar precocemente a pessoa doente e ofertar o tratamento (SOARES, 2012).",40,question: What is the purpose of SOARES?
tuberculose_protocolo_8.txt,"Ainda existem evidências da relação entre a taxa de detecção de casos e a incidência de TB, e quanto mais elevada for a 40 | TUBERCULOSE NA ATENÇÃO PRIMÁRIA À SAÚDE: PROTOCOLO DE ENFERMAGEM detecção dos casos de TB pelos serviços, maior a queda na sua incidência (DOWDY; CHAISSON, 2009).",41,question: What is the relationship between TB and its taxa?
tuberculose_protocolo_8.txt,"Nesse sentido, a busca ativa objetiva identificar precocemente os casos de TB, (BRASIL, 2019), melhorando o diagnóstico e diminuindo a subnotificação de casos no território, o que denota a eficácia dessa técnica.",42,question: A busca ativa ativa objetiva identificar precocemente os casos de TB?
tuberculose_protocolo_8.txt,"Considerando todos os aspectos acima citados, torna-se importante a descentralização das ações de busca ativa para as equipes da APS, as quais devem ser adequadas às realidades locais de forma progressiva.",43,question: What is the importance of descentralizing the busca ativa?
tuberculose_protocolo_8.txt,"Ressalta-se que a busca ativa de SR deve ser realizada permanentemente por todos os profissionais nos serviços de saúde, desde o vigilante, recepcionista e agentes comunitários de saúde à equipe de enfermagem, médicos, outras categorias profissionais de saúde, equipes de saúde na escola e agentes de diferentes instituições (sistema prisional, agentes indígenas de saúde e outras de longa permanência); enfim, a busca deve ocorrer além das unidades de atenção primária, secundária e terciária de saúde, incluindo hospitais e emergências.",44,question: A busca ativa de SR deve ser realizada permanentemente by todos os profissionais?
tuberculose_protocolo_8.txt,"Também é importante a busca ativa em drogarresistente (TB DR), bem como naquelas pessoas que retornam aos serviços após abandono do tratamento, recidiva ou falência, além de pessoas com comorbidades, profissionais de saúde ou em situações de vulnerabilidades.",45,question: What is a busca ativa em TB DR?
tuberculose_protocolo_8.txt,"Para tanto, a discussão e o conhecimento dos fluxos de atendimento estabelecidos todos os profissionais da APS. 2.1.2 Busca passiva de pessoas com sintomas respiratórios realizado (WHO, 2013): a) A pessoa deve reconhecer os sintomas da TB e procurar espontaneamente o serviço de saúde; ou b) O profissional de saúde deve reconhecer os sinais e sintomas e/ou os critérios para suspeição da doença TB e encaminhar o suspeito para diagnóstico.",46,question: What does the APS do to discuss the currents of atendimento?
tuberculose_protocolo_8.txt,"Portanto, apesar de a busca ativa ser uma das mais importantes estratégias de abordagem ao SR na APS, a identificação da pessoa com suspeita de TB de forma passiva pelos trabalhadores da saúde também contribui para que esses casos sejam identificados, encaminhados para investigação e submetidos à avaliação diagnóstica imediata. | 41 2.1.3 Problemas identificados para a baixa busca de sintomáticos Dentre os diferentes problemas observados para a baixa busca de SR na APS, os mais importantes envolvem: a desmobilização das equipes saúde da família; o baixo engajamento dos trabalhadores da saúde com a questão da TB nas unidades de saúde; a elevada rotatividade dos profissionais de saúde; a desarticulação entre os laboratórios e os serviços; equipes de saúde da família incompletas; equipes de saúde da família com população adstrita maior do que a recomendada e/ou sem o devido cadastramento da população; excesso de atribuições das equipes de saúde; estigma e discriminação em relação à doença, tanto por parte dos profissionais como da população; presença de violência nos territórios; abuso de álcool e de drogas ilícitas.",47,question: What is a problem identified for a busca de sintomáticos?
tuberculose_protocolo_8.txt,"Além disso, verifica-se uma e contrarreferência entre unidades e municípios, uma vez que existem suspeitos que não retornam para realização dos exames. 2.1.4 Como realizar a busca ativa de sintomático respiratório? Antes de planejar as ações estratégicas para a busca de SR (ativa e/ou passiva) é fundamental que o enfermeiro conheça o território (vulnerabilidades/riscos e oportunidades de apoio) e as metas estimadas de SR (quantitativo da população), identificando as populações alvo/especiais (imunodeprimidos, idosos, pessoas com diabetes, tabagistas, hipertensos, usuários de álcool e ou drogas, população em situação de rua, albergados, indígenas, privados de liberdade, entre outros) e a estrutura para a realização dos exames após identificação das pessoas com SR (registros, insumos, local, periodicidade e sistema de coleta/transporte ou entrega das espécimes e resultados).",48,question: What is the estrutura for a busca ativa de sintomático respiratório?
tuberculose_protocolo_8.txt,"Além disso, o enfermeiro deve organizar e estabelecer os fluxos entre os laboratórios e os serviços: explicar onde serão realizados os exames, como será feita a coleta e devolvidos os resultados, incluindo orientação para a rede de conveniados privados e a coordenação do programa de TB, bem como identificar quais são os encaminhamento da unidade para os serviços especializados e referências.",49,question: O enfermeiro deve organizar e estabelecer os fluxos entre os laboratórios e os serviços?
tuberculose_protocolo_8.txt,"É necessário garantir a realização dos exames com qualidade, obedecendo aos critérios para o bom andamento dos exames e os respectivos resultados, e idealmente entregar à pessoa com suspeita de TB os resultados dos exames em até 48 horas do recebimento da amostra (baciloscopia ou TRM-TB), tanto em laboratórios públicos quanto naqueles conveniados ao SUS.",50,question: What is the importance of ensuring the quality of exams?
tuberculose_protocolo_8.txt,"Outra etapa importante é a orientação para a coleta do escarro, como e onde deve ser realizada (BRASIL, 2019), seja no domicílio ou nas áreas externas das unidades de saúde, respeitando as técnicas de controle de infecção (BRASIL, 2019). (seja no empoderamento das pessoas ou na formação de novos profissionais de enfermagem) e questões gerenciais (coordenação, articulação, direção, gestão dos serviços, entre outras) e assistenciais para os casos de TB, de forma individual e coletiva, locais de trabalho. 42 | TUBERCULOSE NA ATENÇÃO PRIMÁRIA À SAÚDE: PROTOCOLO DE ENFERMAGEM 2.1.5 Atividades/ações a serem realizadas pela enfermagem para ampliar da tosse, seja na unidade de saúde, seja na visita domiciliar e/ou na comunidade.",51,question: What is a stewardship of TB?
tuberculose_protocolo_8.txt,"Nas unidades da APS, a abordagem do SR deve ser realizada nos setores de acolhimento, triagem, recepção, laboratório ou farmácia, no primeiro atendimento e sempre que observado algum sinal e sintoma da doença.",52,"question: A SR deve ser realizada nos setores de acolhimento, triagem, recepço, laboratório ou farmácia?"
tuberculose_protocolo_8.txt,"A investigação deve atingir todas as pessoas que buscam o serviço de saúde por qualquer motivo (ginecologia, pediatria, clínica médica, entre outros), inclusive nas filas de entrada para atendimento ou na triagem, incluindo ou não.",53,question: What is the purpose of investigating?
tuberculose_protocolo_8.txt,"Ao identificar o suspeito, é preciso iniciar a investigação para TB imediatamente.",54,question: A TB suspeito é ainda ainda ainda ainda ainda ainda ainda ainda ainda ainda a
tuberculose_protocolo_8.txt,"No caso de a pessoa vir encaminhada de outro serviço com queixa de tosse, ou ter sido orientada a buscar ajuda na unidade de saúde, ou até mesmo no caso de procura espontânea pelo serviço de saúde diante da percepção de algum sinal ou sintoma da TB, deve-se iniciar a investigação e realização dos exames diagnósticos para TB. obrigatoriamente registrada, examinada na unidade de saúde e orientada quanto ao resultado do exame bacteriológico.",55,question: What is the most common cause of TB?
tuberculose_protocolo_8.txt,"A busca e a identificação de SR bem documentada reflete a situação epidemiológica do território, bem como a qualidade do trabalho executado pela UBS.",56,question: A busca e a identificaço de SR bem documentada reflete a situaço epidemiológica do território?
tuberculose_protocolo_8.txt,"A qualidade dos registros irá retratar a boa vigilância em saúde nas unidades e nos municípios envolvidos. 2.1.6 Exemplos de estratégias de busca ativa do sintomático respiratório na a) Realizar agendamento aberto: encaminhar e priorizar a consulta logo após a identificação do SR, seguida da solicitação de exames e remarcação de retorno para entrega dos resultados.",57,question: What is the purpose of a good vigilance?
tuberculose_protocolo_8.txt,"Sempre receber as demandas realizando um acolhimento de qualidade. b) Mobilizar as equipes saúde da família para a realização da busca ativa: promover reuniões periódicas das equipes para discutir os dados de SR; analisar com a equipe as informações nos instrumentos de registro (Livro de Registro de Sintomático Respiratório nos serviços de saúde); pactuar, avaliar e monitorar mensalmente as metas estimadas e as ações realizadas pelas equipes (busca ativa na triagem, laboratório, sala de espera, laboratório e demais áreas das unidades de saúde); motivar a equipe para o alcance dos indicadores planejados (GABARDO et al., 2019); distribuir a equipe em pontos estratégicos para a identificação do SR; marcar com cartazes o local de acesso da pessoa ao diagnóstico da TB.",58,question: What is the goal of equipes?
tuberculose_protocolo_8.txt,"Nas localidades não cobertas pela ESF, ocasionalmente, os profissionais de saúde devem se | 43 programar para realizarem visita domiciliar e/ou outras atividades, de acordo com a necessidade da área adscrita à unidade de saúde, de forma a atender a totalidade da população. c) Garantir que todos os trabalhadores da saúde estejam engajados nas atividades de busca de SR: realizar reuniões na unidade de saúde para discutir o papel de cada trabalhador da saúde na atividade de busca ativa de SR; estimular a cooperação para o cumprimento de metas; escalar diariamente trabalhadores para identificar áreas e/ou locais para a busca de SR na unidade de saúde e território; manter pelo programa de TB (Livro de Registro de Sintomático Respiratório, solicitação de exame bacteriológico, baciloscopia e/ou TRM-TB e cultura), entre outros, de forma adequada e oportuna (DIAS, 2014). d) Desenvolver atividades de educação permanente: manter a equipe atualizada por meio de realização de cursos de educação a distância (EaD), incluindo particularmente os novos funcionários; utilizar aplicativos para comunicação (WhatsApp, Facebook, YouTube, Instagram e outros); organizar reuniões mensais de equipe com discussão de casos envolvendo a busca ativa; promover palestras rápidas e filmes sobre TB nas salas de espera e corredores da unidade de saúde; fornecer orientações por autofalante na sala de espera; manter as equipes de ESF capacitadas permanentemente; incluir discussões sobre as avaliações dos pelo MS.",59,question: What is the purpose of a reunie?
tuberculose_protocolo_8.txt,"Recomenda-se promover capacitações periódicas de forma simples e objetiva, preferencialmente nos serviços.",60,question: What do you recommend to promote capacitaçes periódicas?
tuberculose_protocolo_8.txt,"Todos devem participar dessas reuniões na unidade de saúde, desde o vigilante, recepcionista e agentes comunitários de saúde até a equipe de enfermagem, profissionais de laboratório, médicos, outras categorias de profissionais de saúde, equipes do programa saúde na escola e agentes de diferentes instituições (sistema prisional, aldeias indígenas e representantes dos conselhos de saúde, como os usuários conselheiros e outras instituições de longa permanência). e) Buscar SR nos programas específicos da unidade de saúde: buscar suspeitos entre pessoas com diabetes e hipertensão, idosos, doentes crônicos pulmonares, PVHIV, usuários de Centros de Atenção Psicossocial (Caps) e submetê-los ao questionamento da tosse.",61,question: What is the SR of the program?
