Arquivo,Parágrafo,Número do parágrafo,Pergunta
tuberculose_protocolo_3.txt,"Journal of Clinical Microbiology, vol 6(2), p. 149-153.1977. 6.",2938,question: What is the name of the journal that published the article?
tuberculose_protocolo_3.txt,Controle Interno da Qualidade para Testes de Sensibilidade a Antimicrobianos.,2940,question: What is the name of the test?
tuberculose_protocolo_3.txt,"From ATCC Connection 23(2): 6-7, 2003.",2943,question: What was the date of the ATCC Connection 23(2)?
tuberculose_protocolo_3.txt,Capítulo 10 – Conservação de Micobactérias 8.,2944,question: What is the name of the captulo 10?
tuberculose_protocolo_3.txt,ATCC/American Tissue American Tissue Culture Collection.,2945,question: What is the ATCC/American Tissue American Tissue Culture Collection?
tuberculose_protocolo_3.txt,"Para preparar 1.000 ml de meio dissolver 4,7 gramas do meio base em 800 ml de água deionozada.",2947,question: How many grams of meio base do you need to dissolve?
tuberculose_protocolo_3.txt,Autoclavar por 15 minutos a 127ºC.,2949,question: How long does it take to autoclave?
tuberculose_protocolo_3.txt,Aguardar até que esfrie e adicionar 100 ml de OADC.,2950,question: Aguardar e adicionar 100 ml de OADC?
tuberculose_protocolo_3.txt,"Colocar um rótulo contendo o nome do meio, nº do lote, data do preparo e de validade.",2951,question: What does a rótulo do?
tuberculose_protocolo_3.txt,Dependendo da quantidade de cepas congeladas na rotina do laboratório pode- se fazer este meio em menor volume ou fazer 5 alíquotas de 200 ml.,2952,question: What is the amount of cepas congeladas in a rotina?
tuberculose_protocolo_3.txt,"Isto evita a con- taminação do meio. 10 .5 .3 .2 Meio de Sauton com 10% de Glicerol L-asparagina 4 g Sulfato de magnésio 0,5 g Fosfato bipotássico 0,5 g Ácido cítrico 2 g Citrato férrico amoniacal 0,05 g Glicerol 100 ml Água destilada qsp 1000 ml Preparo: Pesar os sais separadamente e dissolver os componentes em água fervente.",2953,question: What is the main benefit of a 10% de Glicerol L-asparagina?
tuberculose_protocolo_3.txt,"Acertar o pH para 7,2 com NaOH, filtrar em papel de filtro e autoclavar a 121ºC/15 min.",2954,question: What is the process of acertar pH?
tuberculose_protocolo_3.txt,"Colocar um rótulo contendo o nome do meio, nº do lote, data do preparo e de validade. 404 Secretaria de Vigilância em Saúde/MS 11 .1 Descrição para a qualidade dos exames realizados.",2955,question: What is the name of the rótulo?
tuberculose_protocolo_3.txt,"O mau uso, a constante utilização ou até mesmo o uso não periódico fazem com que o padrão de desempenho seja perdido.",2956,question: O padro de desempenho seja perdido?
tuberculose_protocolo_3.txt,"Por esse motivo, é muito importante o monitoramento dos equipamentos.",2957,question: O monitoramento dos equipamentos é muito important?
tuberculose_protocolo_3.txt,"São recomendações gerais para a instalação e uso dos equipamentos de labora- tório1. • Realizar o aterramento da rede elétrica. • Utilizar uma tomada para cada equipamento. • Anotar a voltagem das tomadas e dos cabos de cada equipamento. • Treinar os profissionais nos procedimentos de uso (POP – Procedimento Operacional Padrão) e limpeza dos equipamentos. • Seguir as instruções de instalação contidas nos manuais. • Manter em local acessível o manual de cada equipamento. • Evitar o uso de capas plásticas na proteção dos equipamentos, quando os mes- mos estão fora de uso.",2959,question: What are the recomendaçes gerais for?
tuberculose_protocolo_3.txt,"Elas favorecem a condensação de umidade, resultando na oxidação dos componentes elétricos/eletrônicos, bem como o crescimento de fungos.",2960,question: What is the effect of oxidation of components elétricos/eletrônicos?
tuberculose_protocolo_3.txt,As capas confeccionadas em tecidos que não soltam fibras são as indica- das para esse fim. • Desligar os equipamentos da rede elétrica antes de qualquer procedimento de limpeza. • Desinfetar os equipamentos antes de enviá-los à manutenção. • Fazer contrato de assistência técnica sempre que possível. • Registrar todos os equipamentos no programa de manutenção preventiva do la- boratório.,2961,question: What is the purpose of a capas confeccionadas?
tuberculose_protocolo_3.txt,"Conforme o método de diagnóstico, os equipamentos necessários estão apresen- tados no Quadro 1.",2962,question: Os equipamentos necessários esto apresen- tados no Quadro 1?
tuberculose_protocolo_3.txt,"Capitulo 11 – Uso e Monitoramento de Equipamentos Quadro 1 Equipamentos utilizados conforme métodos de diagnóstico de CULTURA, IDENTIFICAÇÃO FENOTÍPICA E CONSERVAÇÃO DE CEPAS Banho-Maria Cabine de Segurança Biológica Capela de Exaustão Medidor de pH Micro-Centrifuga Micropipetadores 11 .2 Equipamentos 11 .2 .1 Agitador mecânico Usado para promover a agitação e homogeneização de soluções em tubos (ensaio ou centrífuga) ou microtubos. • Verificar sempre a presença de fissuras nos tubos de ensaio de vidro antes de efetuar a agitação. • Verificar sempre as condições da borracha do receptáculo de tubo. • Selecionar a chave de “agitação contínua” ou “agitação periódica”.",2963,question: What is the Capitulo 11 – Uso e Monitoramento de Equipamentos Quadro 1 Equipamentos utilizados conforme métodos de diagnóstico de CULTURA?
tuberculose_protocolo_3.txt,"No uso da contínua, regular a velocidade desejada girando o potenciômetro e colocar o tubo ou frasco para agitação.",2964,question: A velocidade desejada girando o potenciômetro e colocar o tubo ou frasco para agitaço?
tuberculose_protocolo_3.txt,"Na periódica, o aparelho permanece desligado e 406 Secretaria de Vigilância em Saúde/MS para colocá-lo em funcionamento, basta pressionar o receptáculo de borracha com o próprio tubo a ser agitado. • Enviar para assistência técnica credenciada, anualmente, para realização para aferição e ajuste. 11 .2 .2 Autoclave A autoclave é um equipamento utilizado para esterilização de materiais e, no caso de ser uma autoclave vertical, não deve estar dentro do laboratório, mas deve estar o mais próximo possível do mesmo2.",2965,question: What is the name of the person who is responsible for the security of the public?
tuberculose_protocolo_3.txt,"O ideal para o laboratório de tuberculose é a instalação de uma autoclave horizontal (com duas portas), para que o material utilizado na área contaminada seja colocado diretamente na autoclave e, depois de autoclavado, seja retirado pela outra porta para uma área não contaminada.",2966,question: What is the ideal way to remove contaminated material from a tuberculose?
tuberculose_protocolo_3.txt,Para que o processo de esterilização seja eficiente é necessário que todo ar resi- material a ser autoclavado3.,2967,question: What is the need for todo ar resi- material to be autoclavado3
tuberculose_protocolo_3.txt,"Por isso, é importante que não seja colocado material em excesso. (o vapor saturado desnatura as suas proteínas) do que pelo calor seco3.",2968,question: What is important to not colocado material em excesso?
tuberculose_protocolo_3.txt,"A temperatura mínima deve ser de 121ºC e mantida por 15-20 minutos, mas alguns equipamentos automatizados operam a 134ºC por 3-5 minutos2. • Utilizar pelo menos duas autoclaves, uma para esterilizar reagentes e meios de cultura e outra para o “lixo infeccioso”, antes do mesmo ser encaminhado para a coleta de lixo hospitalar/laboratorial2 ou para o local de reciclagem no caso de vidros.",2969,question: What is the temperature of the autoclave?
tuberculose_protocolo_3.txt,"ATENÇÃO: Verificar periodicamente as borrachas de vedação e substituí-las, se necessário, para assegurar a vedação hermética e evitar o escape do vapor de água . • Instruir todos os usuários para o correto uso da autoclave. • Manter sempre limpos o cesto e a câmara de autoclavação; lavar com esponja de aço e sabão, e retirar os resíduos com bastante água1. • Trocar a água da câmara de autoclavação pelo menos uma vez por semana.",2970,question: What is the purpose of a vedaço hermética?
tuberculose_protocolo_3.txt,"Capitulo 11 – Uso e Monitoramento de Equipamentos • Verificar se a autoclave está desligada, com o manômetro zerado e sem indício de produção de vapores. • Abrir a tampa e verificar o nível de água.",2971,question: What is the title of the document that will help you to check the nvel of água?
tuberculose_protocolo_3.txt,"Se necessário acrescentar água até o nível de trabalho, ou seja, a resistência deve estar submersa. • Distribuir os materiais no cesto de autoclavação, de forma que a circulação de vapor não seja prejudicada. • Fechar a tampa.",2972,question: What is the resistance to submerging?
tuberculose_protocolo_3.txt,Encaixar e apertar as garras de fechamento firmemente. • Ligar a chave do equipamento no máximo.,2973,question: What is the purpose of a fechamento?
tuberculose_protocolo_3.txt,Deixar a válvula de exaustão de va- por aberta. • Aguardar a saída de vapor úmido pela válvula de exaustão.,2974,question: How do you generate vapor?
tuberculose_protocolo_3.txt,Manter a válvula de exaustão aberta por pelo menos 5 minutos após o início da fervura da água (ga- rante a eliminação total do ar residual).,2975,question: What is the process of removing the total residual?
tuberculose_protocolo_3.txt,Fechar a válvula de exaustão de vapor. • Aguardar a autoclave atingir 121ºC.,2976,question: What is the purpose of a vaporizer?
tuberculose_protocolo_3.txt,Mudar a chave para médio ou mínimo para que seja mantida a temperatura de autoclavação.,2977,question: What is the purpose of a chave?
tuberculose_protocolo_3.txt,"Marcar o tempo. • Ao término do tempo, desligar a chave do equipamento e aguardar o seu esfria- mento ou a queda total da pressão interna. • Abrir a válvula de exaustão para garantir a saída de toda pressão interna. • Desrosquear as garras de fechamento, abrir a tampa e retirar o material autocla- vado. • Deixar esfriar e fechar a tampa. • A eficiência do processo de autoclavação pode ser avaliada por controle biológi- co.",2978,question: What is the término of the tempo?
tuberculose_protocolo_3.txt,Nas esterilizações por vapor úmido deve ser utilizada qualquer apresentação comercial de Bacillus stearothermophilus1.,2979,question: What is the purpose of esterilizaçes by vapor mido?
tuberculose_protocolo_3.txt,Essa é submetida à autoclavação e verificação de desenvolvimento.,2980,question: A sade é submetida à autoclavaço e verificaço de desenvolvimento.
tuberculose_protocolo_3.txt,"Caso haja desenvolvimento do bacilo, deve-se solicitar calibração por assistência técnica credenciada.",2981,question: What is the reason for a bacilo being analyzed?
tuberculose_protocolo_3.txt,"Esse controle biológico deve ser realizado pelo menos uma vez no mês, preferencialmente quando o equipamento estiver com a sua carga máxima de sua capacidade. • O ajuste da autoclave deve ser realizado por assistência técnica credenciada pelo menos uma vez ao ano. 11 .2 .3 Balanças Podem ser mecânicas ou eletrônicas1 e são usadas para pesar as substâncias que compõem os reagentes e soluções.",2982,question: O ajuste da autoclave deve ser realizado por assistência técnica credenciada pelo menos uma vez ao ano.
tuberculose_protocolo_3.txt,"Para quantidade máxima de 200 g deve ser utilizada balança analítica, com intervalo de leitura de 0,0001g.",2983,question: What is the minimum amount of balança analtica?
tuberculose_protocolo_3.txt,"Acima dessa quantidade, deve- se utilizar balança semi-analítica, com intervalo de leitura de 0,1g, 0,01g ou 0,001g. 408 Secretaria de Vigilância em Saúde/MS será instalada.",2984,question: What is the amount of balança semi-analtica?
tuberculose_protocolo_3.txt,"Para instalação ou uso devem ser observados os seguintes critérios de: • Instalar em bancadas de alvenaria com tampo de concreto, mármore ou granito, em paredes1. • Nivelar a balança antes do uso e da aferição. • Limpar delicadamente a balança após o uso, com auxílio de um pincel de cerdas macias. • Não fazer pesagens diretamente sobre o prato da balança.",2985,question: What do you need to observe in order to install or use a balança?
tuberculose_protocolo_3.txt,Usar papel ou reci- pientes próprios para pesagem4.,2986,question: What is the main purpose of a pesagem4?
tuberculose_protocolo_3.txt,"Estes, não podem reagir com a substância a ser pesada. • Determinadas substâncias requerem o uso de EPI para serem manipuladas du- rante a pesagem.",2987,question: What is the effect of EPI on substancias?
tuberculose_protocolo_3.txt,Uso da balança mecânica1 • Tarar (zerar) a balança. • Pesar o papel ou recipiente de pesagem.,2988,"question: What is the meaning of ""tarar"" a balança?"
tuberculose_protocolo_3.txt,Anotar o peso. • Somar o peso do papel ao peso da substância a ser pesada.,2989,question: What do you do to a peso?
tuberculose_protocolo_3.txt,"O valor encontrado é o total a ser pesado. • Travar a balança, marcar ou adicionar o peso correspondente ao valor final. • Destravar a balança e adicionar a substância até que a escala da balança atinja o valor total determinado.",2990,question: What is the total of a balança?
tuberculose_protocolo_3.txt,"Uso da balança eletrônica1 • Ligar a balança e aguardar pelo menos 30 minutos para estabilizá-la. • Colocar o papel ou recipiente de pesagem no prato da balança. • Tarar a balança, descontando o peso do papel ou recipiente de pesagem. • Adicionar a substância a ser pesada até alcançar o valor desejado. • Deve ser realizado pela pesagem de um “peso padrão” – objeto de aferição, com uma carga determinada e conhecida.",2991,question: A balança eletrônica is ligada and aguardar pelo menos 30 minutos para estabilizá-la.
tuberculose_protocolo_3.txt,As balanças que indicarem peso diferente ao do “peso padrão” devem ser encaminhadas para ajuste em uma assistência técnica credenciada.,2992,question: What do balanças that indicarem peso diferente ao do “peso padro” devem ser encaminhadas?
tuberculose_protocolo_3.txt,Capitulo 11 – Uso e Monitoramento de Equipamentos 11 .2 .4 Banho-maria Os banhos-maria são equipamentos utilizados em alguns testes bioquímicos de identificação de micobactérias.,2993,question: What is the title of the Capitulo 11 – Uso e Monitoramento de Equipamentos?
tuberculose_protocolo_3.txt,São projetados para trabalhar na temperatura reque- rida por determinada técnica e possuem tampa para evitar a perda de calor e a eva- poração excessiva da água.,2994,question: A temperatura reque- rida por determinada técnica e possuem tampa para evitar a perda de calor e a eva- poraço excessiva da água?
tuberculose_protocolo_3.txt,Essas tampas devem ser inclinadas para que a água da condensação não goteje sobre o que está sendo incubado3. • No uso primário ou após limpeza encher o reservatório com água destilada. • Desligar o banho-maria da tomada sempre que realizar a limpeza e nunca fazê-la diretamente sob a água corrente.,2995,question: A tampa devem ser inclinadas para que a água da condensaço no goteje sobre o que está sendo incubado3
tuberculose_protocolo_3.txt,"Mensalmente ou sempre que houver depósitos ou incrustações, lavar as partes metálicas com esponja de aço e sabão neutro enxaguando com bastante água1. • Ter cuidado com toques involuntários durante a limpeza da bancada ou uso do próprio equipamento para não alterar a posição do termostato1. • Verificar se o nível de água está cobrindo a resistência e o sensor do termômetro. trabalho. • Ajustar o termostato para a temperatura desejada, sempre observando o limite de temperatura de trabalho do equipamento. • Utilizar o equipamento somente quando a temperatura estiver estabilizada. • Manter sempre o banho-maria tampado durante o uso para evitar variação da temperatura e evaporação da água. • Durante o uso, verificar a temperatura antes e durante o processo de incubação, utilizando um termômetro de leitura pontual ou instantânea. • Após pernoite ligado e sem uso, medir a temperatura antes do processo de incu- bação e anotar o resultado no Formulário de Monitoramento – Banho-maria.",2996,question: What is the main purpose of using a banho-maria?
tuberculose_protocolo_3.txt,O Formulário de Monitoramento – Banho-maria é apresentado no item 11.4.1 nos anexos deste Capítulo. 11 .2 .5 Cabine de Segurança Biológica (CSB) a identificação do M. tuberculosis.,2997,question: What is the name of the document that identifies tuberculosis?
tuberculose_protocolo_3.txt,As CSB foram projetadas para evitar a dispersão de aerossóis de materiais perigosos para o ambiente de trabalho.,2998,question: What was the purpose of the CSB's project?
tuberculose_protocolo_3.txt,"A CSB Classe II, tipos B2 ou B3 é ideal para o uso em laboratórios de microbiologia - micobactérias, pois 410 Secretaria de Vigilância em Saúde/MS oferece proteção ao técnico, ao ambiente e ao produto manipulado3.",2999,question: What type of microbiology class is ideal for use in the lab?
tuberculose_protocolo_3.txt,"Nessa, o ar filtra- do da área de trabalho da CSB forma uma “cortina” ou barreira de ar na janela frontal, dispersão de aerossóis de dentro da CBS para o ambiente do laboratório2. • Instalar a CSB em um local distante da entrada principal do laboratório, já que o trânsito de pessoas próximas ao equipamento pode causar interferência na corti- na de ar da janela frontal.",3000,question: What is the effect of the CSB on the air quality?
tuberculose_protocolo_3.txt,"O mesmo pode ocorrer quando a CSB está próxima às janelas abertas ou equipamentos que podem proporcionar movimentação de ar3, exemplo: centrífugas. • Não utilizar bico de Bunsen no interior da CSB devido ao risco de interferência no fluxo de ar interno e danos ao filtro HEPA. • Desinfetar as paredes internas e a superfície da área de trabalho com gaze, papel- toalha ou pano umedecido com Solução de Álcool a 70%. • Cobrir a bancada com papel de filtro ou outro papel absorvente cuidando para não obstruir os orifícios do fluxo de ar. • Colocar somente o material necessário no interior da CSB.",3001,question: What is the CSB's policy on a centrifuge?
tuberculose_protocolo_3.txt,O excesso de mate- ou contaminação cruzada. • Ligar a CSB e a lâmpada germicida UV pelo menos 20 minutos antes de iniciar seu uso. • Desligar a lâmpada UV e ligar a lâmpada fluorescente.,3002,question: What does a contaminaço cruzada cause?
tuberculose_protocolo_3.txt,"Introduzir as mãos e antebraços na CSB, aguardar pelo menos 60 segundos e dar início às manipula- ções. • Evitar a manipulação dos materiais com gestos bruscos para não alterar o fluxo de ar. • Manter saco plástico autoclavável no interior da CSB para o descarte de material contaminado.",3003,question: What is the purpose of a CSB?
tuberculose_protocolo_3.txt,"Ao término do trabalho, adicionar pequena quantidade de água (para assegurar a geração de calor úmido durante a autoclavação) e fechá-lo hermeticamente. • Esperar 5 minutos após o término das manipulações para desligar a CSB e pro- ceder aos passos seguintes. • Abrir a janela de vidro frontal.",3004,"question: A cada hora de desligar a CSB e pro-ceder aos passos seguintes, aquela quantidade de água e fechá-lo hermeticamente?"
tuberculose_protocolo_3.txt,"Desinfetar as paredes internas e a superfície da área de trabalho com gaze, papel-toalha ou pano ume- decido com Solução de Álcool a 70%.",3005,question: What is the purpose of a soluço de lcool a 70%?
tuberculose_protocolo_3.txt,Ligar a lâmpada UV por 30 minutos.,3006,question: What is the purpose of a 30 minute period of exposure to UV light?
tuberculose_protocolo_3.txt,Capitulo 11 – Uso e Monitoramento de Equipamentos • Desligar a lâmpada UV e registrar o uso da CSB.,3007,question: What is the title of the document?
tuberculose_protocolo_3.txt,O Formulário de Registro de Uso – Cabine de Segurança Biológica (CSB) é apresentado no item 11.4.2 nos anexos deste Capítulo. • Deve ser executado pelo fabricante ou assistência técnica credenciada.,3008,question: What is the name of the form that is available on the CSB?
tuberculose_protocolo_3.txt,"Inclui testes de velocidade do ar, perda de pressão dos filtros HEPA, contagem de par- tículas e eficiência dos filtros.",3009,question: What tests do HEPA produce?
tuberculose_protocolo_3.txt,A troca do filtro deve ser realizada quando houver o acionamento do alarme de saturação ou após 18-24 meses de uso.,3010,question: A troca do filtro deve ser realizada when houver o acionamento do alarme de saturaço?
tuberculose_protocolo_3.txt,"Antes de qualquer procedimento da assistência técnica, realizar a desinfecção2.",3011,question: A desinfecço2 é realizada
tuberculose_protocolo_3.txt,O proce- dimento consta em ferver formalina e água para liberar formaldeído.,3012,question: O proce- dimento consta em ferver formalina e água para liberar formaldedo?
tuberculose_protocolo_3.txt,"A água é necessária para manter a umidade relativa em torno de 70%, na qual o gás tem o máximo efeito antimicrobiano.",3013,question: What is the minimum amount of antimicrobiano?
tuberculose_protocolo_3.txt,Proceder conforme a seguir:  Usar EPI conforme descrito no Capítulo 3.  Colocar uma placa aquecedora no interior da CSB.  Preparar em um copo de Becker 25 ml de formalina e 25 ml de água.,3014,question: How do you use EPI?
tuberculose_protocolo_3.txt,"Colocá- lo sobre a placa aquecedora e ligar a mesma.  Lacrar a abertura frontal com plástico ou outro material impermeável usan- do fita auto-adesiva para selar.  Ligar a CSB por apenas 15 segundos quando metade da mistura evaporar para que o formaldeído seja aspirado e alcance o filtro HEPA.  Desligar a placa aquecedora quando toda a mistura tiver evaporado e ligar a CSB novamente por 15 segundos.  Esperar no mínimo 6 horas, descolar parcialmente o plástico que cobre a abertura frontal e ligar a CSB para exaurir o formaldeído.  Remover totalmente a cobertura da janela frontal após 5 minutos, manten- do-a ligada por mais 30 minutos para exaurir o formaldeído restante.",3015,question: How many times do you need to ligar a CSB?
tuberculose_protocolo_3.txt,ATENÇÃO: Esse procedimento é seguro para as CSB que possuem exaustão para o ambiente externo .,3016,question: What is the procedure for CSB?
tuberculose_protocolo_3.txt,"Naquelas em que o ar é recir- culado para o próprio ambiente de trabalho, será necessário isolar/ selar a sala onde a CSB se encontra . 11 .2 .6 Capela de Exaustão (CE) técnico de vapores tóxicos.",3017,question: What is the CSB's requirement for isolar?
tuberculose_protocolo_3.txt,"É importante que a CE tenha uma exaustão suficiente para a geração de pressão negativa em seu interior, não permitindo o escape de vapores tóxicos para o ambiente do laboratório. 412 Secretaria de Vigilância em Saúde/MS • Planejar e instalar a CE em local amplo e arejado. • Evitar o armazenamento de produtos químicos na CE, mesmo daqueles que são utilizados mais frequentemente. • Colocar somente o material necessário e produtos químicos no interior da CE. acidentes. • Ligar a CE e a iluminação interna.",3018,question: What is important to ensure that a CE has enough exausto?
tuberculose_protocolo_3.txt,Verificar a presença de pressão negativa. • Fechar a janela frontal deixando espaço apenas para a introdução das mãos e antebraços. • Evitar a manipulação dos produtos químicos com gestos bruscos. • Manter a CE ligada por 5 minutos após o término das manipulações para que o em suspensão. • Abrir a janela de vidro frontal.,3019,question: What is the purpose of a janela frontal?
tuberculose_protocolo_3.txt,Retirar todos os materiais e produtos químicos. • Desligar a CE e registrar o uso.,3020,question: What is the purpose of registering a CE?
tuberculose_protocolo_3.txt,"O Formulário de Registro de Uso – Cabine de Exaustão (CE) para registro é apresentado no item 11.4.3 nos anexos deste Capítulo). • Limpar as paredes internas e a superfície da área de trabalho com gaze, papel- toalha ou pano umedecido com água. • Contatar o fabricante ou assistência técnica credenciada caso haja a perda da capacidade de exaustão ou qualquer outra anormalidade observada em seu fun- cionamento. 11 .2 .7 Centrífuga e microcentrífuga São utilizadas principalmente para concentrar os bacilos ou seus ADN.",3021,question: What is the form for registering?
tuberculose_protocolo_3.txt,"É reco- mendado que as centrífugas tenham rotor de ângulo fixo, o qual permite a centrifuga- excessiva e a ruptura dos mesmos3. 11 .2 .7 .1 Centrífuga Para a cultura, a centrífuga deve, preferencialmente, ser refrigerada e capaz de atingir pelo menos 3000 x g, caso contrário, muitas micobactérias permanecerão em suspensão e serão descartadas junto com o sobrenadante3.",3022,question: A centrifuga- excessiva e a ruptura dos mesmos3
tuberculose_protocolo_3.txt,"É imprescindível que as centrífugas tenham caçapas seladas, que evita a dispersão de aerossol caso haja a que- Capitulo 11 – Uso e Monitoramento de Equipamentos bra de algum tubo durante a centrifugação.",3023,question: What is the main reason for the use of a selada?
