Arquivo,Parágrafo,Número do parágrafo,Pergunta
zoonoses_manual_1.txt,"O animal pode ser conduzido a um local em que seja possível contê-lo e embarcá-lo, por meio do uso de corda, cabresto ou outros métodos apropriados para contenção e condução de grandes animais.",158,question: What is a local animal able to do?
zoonoses_manual_1.txt,"Maior atenção deve ser dispensada às fêmeas prenhes e/ou com potro/bezerro, uma vez que podem existir animais que nunca tenham sido manejados e embarcados anteriormente.",159,question: A fema de atenço deve ser dispensada às fêmeas prenhes e/ou com potro/bezerro?
zoonoses_manual_1.txt,"Igual atenção precisa ser dada à abordagem com machos, mais agitados e agressivos.",160,"question: Igual atenço precisa ser dada à abordagem com machos, mais agitados e agressivos?"
zoonoses_manual_1.txt,"O veículo de transporte deve ser apropriado para essa finalidade, mantendo-se a rampa de embarque e desembarque, sempre que possível, com uma inclinação suave.",161,"question: A rampa de embarque e desembarque é possvel, com uma inclinaço suave."
zoonoses_manual_1.txt,"É necessário, primeiramente, ser avaliado (quanto à segurança física do funcionário, das pessoas no local e do animal) se é possível conter o animal com as próprias mãos, encaminhando-o/levando-o até o veículo de transporte.",162,question: Avaliado is necessary for what?
zoonoses_manual_1.txt,"Caso seja necessário o uso de material específico, deve ser priorizado o uso de corda, laço, cabresto ou cachimbo. 2.1.3 Transporte O embarque dos animais a serem removidos no veículo de transporte (nos respectivos compartimentos inerentes às espécies envolvidas) deve ser realizado com segurança e tranquilidade, evitando-se ruídos e movimentos bruscos para reduzir riscos de traumas, estresse, acidentes ou fugas. em questão.",163,question: What is the need to prioritize?
zoonoses_manual_1.txt,"Ele precisa estar com os compartimentos fechados, ter ventilação apropriada, ser higienizado e proporcionar segurança ao animal, à população e aos funcionários.",164,question: What is the need for a fechados to be higienized?
zoonoses_manual_1.txt,O motorista deve ser capacitado para realizar o transporte de carga viva.,165,question: O motorista deve ser capacitado para realizar o transporte de carga viva?
zoonoses_manual_1.txt,"Devem ser considerados o horário, a temperatura ambiente, a distância e o roteiro, para redução do tempo de permanência dos animais no veículo.",166,"question: A temperatura ambiente, distância, roteiro, e o horário so considerados o horário?"
zoonoses_manual_1.txt,"O animal deve ser transportado diretamente para a UVZ, sem paradas.",167,question: What is the purpose of transporting an animal to UVZ?
zoonoses_manual_1.txt,"Quando for necessário parar, deve-se, em dias quentes de sol, estacionar o veículo na sombra.",168,question: What do you do when you need to parach?
zoonoses_manual_1.txt,"A altura do veículo deve ser compatível com a atividade de embarque e desembarque de animais. veículo e devem estar segregados por espécie, porte e comportamento.",169,question: A altura do veculo deve ser compatvel com a atividade de embarque e desembarque de animais?
zoonoses_manual_1.txt,"Quando forem usadas gaiolas ou caixas de transporte, estas devem ser de tamanho adequado, acomodadas e fixadas ao veículo.",170,question: Are gaiolas or caixas of transporte adequado?
zoonoses_manual_1.txt,"Fêmeas prenhes ou com ninhadas e animais idosos, feridos ou acidentados devem ser transportados individualmente e encaminhados prioritariamente para o local de triagem e alojamento na UVZ.",171,question: What do prenhes and animais idosos produce?
zoonoses_manual_1.txt,"Espécies diferentes devem ser transportadas em compartimentos separados, a fim de evitar agressões, ferimentos e, eventualmente, óbito.",172,question: What is the purpose of a compartment being separated?
zoonoses_manual_1.txt,"No caso de animais agressivos ou arredios, deve-se utilizar de métodos ou dispositivos que reduzam seu estresse.",173,question: What do you need to use in order to reduzam your estresse?
zoonoses_manual_1.txt,"No desembarque, para definição da conduta e da destinação adequadas, os animais devem ser avaliados por médico veterinário. tranquilidade, evitando-se ruídos e movimentos bruscos para reduzir riscos de traumas, estresse, acidentes ou fugas.",174,question: What do adequadas dos animais do?
zoonoses_manual_1.txt,"Quando o embarque de animais ocorrer em via pública, deve ser solicitado o suporte dos organismos responsáveis pelo controle de trânsito do local, e os funcionários devem utilizar coletes refletores mesmo durante o dia, para proteção e sinalização de ações.",175,question: O embarque de animais ocorrer em via pblica deve ser solicitado o suporte dos organismos responsáveis pelo controle de trânsito do local?
zoonoses_manual_1.txt,"Manual de Vigilância, Prevenção e Controle de Zoonoses: Normas Técnicas e Operacionais observações: • A captura e o eventual transporte de animais invertebrados de relevância para a saúde pública devem ser realizados em recipiente fechado, acondicionado conforme especificado no tópico de “Coleta, acondicionamento, conservação, armazenamento e transporte de espécimes de relevância para a saúde pública” deste Manual. • O veículo deve exibir a identificação do órgão a que pertence (logotipo, nome) e telefone. 2.2 Alojamento e manutenção dos animais vertebrados recolhidos 2.2.1 Manutenção de higiene, espaço físico, abrigo, arejamento/ventilação, iluminação, alimentação e hidratação.",176,question: What is the name of the manual that describes the control of zoonoses?
zoonoses_manual_1.txt,"Os animais devem estar protegidos contra intempéries naturais; separados por sexo (quando não castrados), espécie e comportamento.",177,question: Os animais devem estar protegidos contra intempéries naturais?
zoonoses_manual_1.txt,"Essas condições objetivam evitar estresse, acidentes, fugas e transmissão de doenças.",178,"question: What do condiçes aprendiram to evitar estresse, acidentes, fugas e transmiso de doenças?"
zoonoses_manual_1.txt,"Devem-se observar os prazos estipulados de permanência do animal na UVZ, conforme normatização vigente.",179,"question: Os prazos estipulados de permanência do animal na UVZ, conforme normatizaço vigente."
zoonoses_manual_1.txt,"O alojamento prolongado de animais em canis ou gatis não é recomendado, pois favorece a transmissão de doenças, disputas territoriais (brigas) e alterações comportamentais, comprometendo sua condição de saúde, sua imunidade e a funcionalidade do serviço.",180,"question: O alojamento prolongado de animais no é recomendado, pois favorece a transmisso de doenças, disputas territoriais (brigas) e altera"
zoonoses_manual_1.txt,"Para maior segurança nos procedimentos com os animais domésticos e domesticados, somente funcionários do bloco de controle animal poderão manipular os animais, com o uso de equipamentos de proteção individual (EPIs) apropriados.",181,question: What do funcionários do bloco de controle animal can manipulate os animais?
zoonoses_manual_1.txt,"Os alojamentos (canis, gatis, entre outros) devem permanecer trancados para evitar fugas, acidentes e incurso de pessoas não relacionadas ao serviço. 2.2.2 Cuidados básicos Devem ser oferecidos aos animais alojados, quando necessário, cuidados básicos, bem como àqueles acometidos biológica/fisicamente por intervenções decorrentes de procedimentos realizados pela própria Unidade. procedimentos curativos, vedados o uso de tecnologias e aparelhagens específicas, exames clínicos laboratoriais, bem como a realização de procedimentos anestésicos e/ou cirúrgicos e a internação, e a proteção da saúde dos profissionais e dos demais animais recolhidos. observações: 1.",182,question: What do animais alojados do?
zoonoses_manual_1.txt,"Os animais invertebrados ou pequenos vertebrados, como roedores, de relevância para a saúde pública, podem ser mantidos (vivos ou mortos), de forma adequada, no laboratório de coleção de espécies, no laboratório de entomologia ou na sala de bioensaio para as atividades de educação em saúde, identificação, ou para estudos e pesquisas, conforme especificado no tópico de “Atividades laboratoriais” – Coleta, acondicionamento, conservação, armazenamento e transporte de espécimes de relevância para a saúde pública – deste Manual e de acordo com o estipulado no manual de estrutura física de UVZ para esses ambientes. 2.",183,question: What is the nature of the organisms that are mantidos?
zoonoses_manual_1.txt,"A manutenção e os cuidados básicos devem ser considerados apenas para os animais recolhidos que, após período de observação, sejam considerados clinicamente sadios e sem risco à saúde humana.",184,question: Os animais recolhidos sejam considerados clinicamente sadios e sem risco à sade humana?
zoonoses_manual_1.txt,"Os animais passíveis de recolhimento pelas Unidades de Vigilância de Zoonoses são somente aqueles de relevância para a saúde pública, definidos no art. 2º da Portaria MS/GM nº 1.138, de 23 de maio de 2014. 3.",185,question: What is the purpose of the sade pblica?
zoonoses_manual_1.txt,"Os animais alojados nas UVZ devem, sempre que possível, ser transferidos para estabeleci- mentos veterinários que tenham como prerrogativa/competência o cuidado com animais, haja vista serem locais mais apropriados para sua manutenção. 2.2.3 Alimentação e hidratação O animal deve ser alimentado e dessedentado, considerando-se a alimentação específica para cada espécie e idade, e utilizando como referência a composição mínima determinada pela legislação vigente (Ministério da Agricultura, Pecuária e Abastecimento – IN nº 07, de 5 de abril de 1999), em quantidade adequada às suas necessidades nutricionais.",186,question: What do veterinarians do to their animals to be able to eat more?
zoonoses_manual_1.txt,"Recomenda-se que cada unidade estabeleça protocolo próprio. observação: as rações devem ser armazenadas em ambientes físicos adequados para essa finalidade, impedindo o ingresso de animais, e acondicionadas em recipientes próprios para sua conservação. 2.2.4 Alojamento O alojamento deve ter espaço compatível com o número, o porte, a espécie e a condição fisiopatológica ou fisiológica dos animais, além de mantê-los de maneira segura.",187,question: What is the importance of a protocol that is adequate for the finality of the protocol?
zoonoses_manual_1.txt,O profissional médico veterinário deve segregar os animais considerando as seguintes categorias: • Animal em observação para alguma zoonose. • Animal com doença infectocontagiosa (identificada quando alojado). • Fêmea em estado de gestação evidente. • Fêmea com seus filhotes. • Filhote com até 90 dias de idade. • Animais de uma mesma ninhada. • Animais parceiros. • Fêmea adulta no cio. • Animal agressivo. • Animais de faixa etária compatível. • Animais de temperamento compatível. • Animais do mesmo sexo ou esterilizados.,188,question: What does a veterinarian do to determine the type of animal?
zoonoses_manual_1.txt,"Os animais devem ser identificados individualmente, por meio de confecção de prontuário próprio e de outras metodologias apropriadas.",189,question: What do animais do?
zoonoses_manual_1.txt,"Manual de Vigilância, Prevenção e Controle de Zoonoses: Normas Técnicas e Operacionais De acordo com as condições climáticas da região, o alojamento deve dispor de proteção/isolante térmico (piso e laterais), de fácil limpeza e higiene.",190,question: What does the alojamento do?
zoonoses_manual_1.txt,"Todos os animais devem ter acesso a banho de sol. observação: os animais alojados nas atuais UVZ devem ter acesso a banho de sol, seja por meio de passeios, de acesso a outras áreas da Unidade ou, ainda, por acesso à luz do sol (em grande parte do dia) no próprio canil. 2.2.5 Higienização A higienização de viaturas, gaiolas, caixas de transporte e demais equipamentos de manejo deverá ser realizada após cada uso, e a de comedouros e bebedouros, diariamente ou sempre que necessário, sendo mantidos permanentemente limpos, segundo manual de boas práticas estabelecido pela Unidade.",191,question: What do animais alojados nas atuais UVZ do?
zoonoses_manual_1.txt,"Quando necessário, deve-se proceder à desinfecção de ambientes, veículos, fômites e outros. 2.2.6 Identificação de doenças nos animais alojados Os animais devem ser observados diariamente, por médico veterinário e funcionários, para verificação das condições de saúde, manutenção e cuidados básicos.",192,"question: What is the process of desinfecço of ambientes, veculos, fômites e outros?"
zoonoses_manual_1.txt,"Os recursos materiais necessários devem ser providos em quantidade suficiente para o desenvolvimento satisfatório do procedimento. • No momento da eutanásia, o manejo e o trato com o animal devem ser respeitosos e o ambiente, tranquilo e silencioso, com o menor número de pessoas e a ausência de outros animais. • O método de eutanásia a ser utilizado é o de escolha do serviço de zoonoses local, devendo basear- -se em legislação vigente e seguir as normas técnicas do Conselho Federal de Medicina Veterinária. • O procedimento de eutanásia ficará sob responsabilidade de um médico veterinário até a comprovação do óbito, e este deve redigir laudo veterinário justificando o procedimento. • Os procedimentos executados pela unidade devem ser documentados, organizados e arquivados, por meio eletrônico ou impresso, visando favorecer a operacionalidade e o planejamento das ações e dos serviços. 2.4 Necropsia • Cada UVZ deve definir seu protocolo de necropsia, adequando-o a sua operacionalidade, e observar as normas de biossegurança vigentes, segundo a espécie a ser necropsiada. • Cabe ressaltar que os animais a serem submetidos à necropsia serão apenas aqueles de relevância para a saúde pública. • A necropsia deve ser realizada, sempre que necessário e possível, a fim de elucidar a causa do óbito do animal e/ou recolher amostras para diagnóstico laboratorial de zoonoses relevantes para a saúde pública. • Para isso, é indispensável que os profissionais sejam devidamente capacitados e que os recursos materiais necessários sejam providos de maneira suficiente. • O descarte de cadáveres, EPI, resíduos e materiais gerados pelo procedimento deve ser feito (consultar os tópicos de “Biossegurança e saúde do trabalhador” e “Gerenciamento de resíduos” deste Manual). • Recomenda-se que esse procedimento seja documentado. 2.4.1 Procedimentos pré-necrópsicos Devem-se obter, antecipadamente, as informações sobre o animal, como espécie, sexo, idade, peso, origem, além de todas as informações epidemiológicas disponíveis, de acordo com a suspeita clínico-epidemiológica (local de captura, condições ambientais, comportamento, sintomatologia), e também outras informações pertinentes, como histórico vacinal, de doenças, de procedimentos realizados e de medicamentos recentes.",196,question: What is the need for a veterinary aide to treat animals?
zoonoses_manual_1.txt,Essas informações devem ser registradas em formulário próprio.,197,question: How do you register your information?
zoonoses_manual_1.txt,"Em muitas situações, as informações sobre o animal somadas aos achados de necropsia propiciam o estabelecimento do diagnóstico.",198,question: What is the diagnóstico of animals?
zoonoses_manual_1.txt,"Manual de Vigilância, Prevenção e Controle de Zoonoses: Normas Técnicas e Operacionais 2.4.2 Recomendação para realização de necropsia Paramentação: luvas (cirúrgicas descartáveis, de borracha, nitrílica, com fio de aço, tricotadas etc), macacão, jaleco ou avental; calçado fechado (botas de borracha, de preferência), máscara, óculos e touca (obrigatórios, dependendo da suspeita clínico/epidemiológica).",199,question: What is the name of the manual?
zoonoses_manual_1.txt,O tipo e o tamanho dos instrumentos variam de acordo com o tamanho da espécie a ser necropsiada.,201,question: What is the type of instrument that can be used to make a necropsiada?
zoonoses_manual_1.txt,"Os instrumentos utilizados na necropsia devem ser colocados em uma bandeja, evitando, assim, que sejam colocados dentro ou sobre o animal e prevenindo acidentes.",202,question: O instrumento utilizados na necropsia devem ser colocados em uma bandeja?
zoonoses_manual_1.txt,"É fundamental que a pessoa que for realizar, auxiliar ou acompanhar a necropsia esteja devidamente paramentada (de acordo com o grau de exposição específico). porte para evitar que se rasguem com facilidade. 2.4.3 Exames complementares Exames complementares podem ser necessários, haja vista a avaliação macroscópica, muitas vezes, ser incapaz de detectar todas as lesões.",203,question: What is the importance of having a paramentada?
zoonoses_manual_1.txt,"Para isso, recomenda-se que, durante uma necropsia, os materiais utilizados para coleta de amostras para exames complementares (bacteriológico, parasitológico, virológico, toxicológico e bioquímico) estejam disponíveis. 2.5 Biossegurança e saúde do trabalhador 2.5.1 Biossegurança Condição de segurança alcançada por um conjunto de ações destinadas a prevenir, controlar, humana, animal e o meio ambiente.",204,question: What is the importance of a good saline for a patient?
zoonoses_manual_1.txt,"Assim, considerando que as ações desenvolvidas e executadas pela UVZ estão relacionadas a riscos com diferentes origens: biológicos, químicos, físicos e ergonômicos, deve-se atentar para a legislação vigente quanto às normas de biossegurança, especialmente para as doenças específicas que são alvos de cada atividade.",205,question: A UVZ tem açes que so alvos de cada atividade?
zoonoses_manual_1.txt,"As UVZ devem preferencialmente elaborar seus mapas de risco visando à biossegurança. 2.5.2 Saúde do trabalhador uniformizados e identificados por meio de crachá, em local visível.",206,question: What do UVZ preferencialmente elaborar seus mapas de risco visando à biossegurança?
zoonoses_manual_1.txt,"Esses funcionários devem estar paramentados com os equipamentos de proteção individual (EPIs) pertinentes para a atividade a ser realizada, garantindo sua segurança.",207,question: What do EPIs do?
zoonoses_manual_1.txt,"Além disso, é essencial que eles sejam capacitados continuamente sobre o uso dos EPIs, para a preservação da saúde do trabalhador e para o manejo com os animais, em atividades internas e externas.",208,question: What is the importance of EPIs?
zoonoses_manual_1.txt,"Outras medidas de segurança e questões sobre a saúde do trabalhador podem ser vistas em tópico específico deste Manual. 2.5.3 Equipamento de proteção coletiva (EPC) Os equipamentos de proteção coletiva (EPC) visam à proteção de uma coletividade específica, devendo proteger todos os funcionários, a comunidade e os animais expostos à determinada atividade da UVZ que possa representar risco para sua saúde e sua segurança.",209,question: What does the UVZ represent?
zoonoses_manual_1.txt,"O uso de EPC, nas atividades internas e de campo das UVZ, é imprescindível para o cumprimento das normas de biossegurança e de saúde do trabalhador.",210,question: O uso de EPC é imprescindible para o cumprimento das normas de biossegurança e de sade do trabalhador?
zoonoses_manual_1.txt,"As Unidades de Vigilância de Zoonoses devem ser bem sinalizadas internamente, tendo suas dependências devidamente identificadas, para maior segurança dos funcionários e para a otimização de sua operacionalidade, bem como restringir o acesso às áreas de alto risco ao público.",211,question: What do the Unidades de Vigilância de Zoonoses do?
zoonoses_manual_1.txt,Seguem listados alguns dos EPC relacionados às atividades da UVZ: 1.,212,question: What are some EPCs?
zoonoses_manual_1.txt,Portas que abram e fecham de forma adequada. 3.,213,question: What are the types of ports that abram and fecham de forma adequada?
zoonoses_manual_1.txt,Acesso facilitado às saídas da unidade em situações de emergência. 4.,214,question: Is a sado em situaçes de emergência aproveitado?
zoonoses_manual_1.txt,"Cones, faixas, placas de sinalização e luminosos para isolamento de área determinada. 5.",215,"question: What do faixas, placas de sinalizaço, and luminosos for isolamento de área determinada?"
zoonoses_manual_1.txt,Ventilação dos locais de trabalho. 6.,216,question: What is the name of the trabalho location?
zoonoses_manual_1.txt,Proteção de partes móveis de máquinas e equipamentos. 7.,217,question: What is the purpose of the use of parts móveis?
zoonoses_manual_1.txt,"Manual de Vigilância, Prevenção e Controle de Zoonoses: Normas Técnicas e Operacionais 2.5.4 Equipamento de proteção individual (EPI) EPI é todo dispositivo ou produto de uso individual utilizado pelo trabalhador, destinado à proteção de riscos suscetíveis de ameaçar a segurança e a saúde no trabalho. do trabalhador e para o cumprimento das normas de biossegurança.",218,"question: What manual does the vigilance, prevention, and control of zoonoses contain?"
zoonoses_manual_1.txt,"Seguem, como sugestão, alguns destes equipamentos, além de outros materiais para a realização das atividades com segurança.",219,question: What do you do with equipment?
zoonoses_manual_1.txt,"Quadro 1 – Equipamentos de Proteção Individual conforme as atividades internas e de campo das Nos canis, nos gatis e nos Macacão ou conjunto (calça e blusa de manga longa), óculos de segurança, ambientes destinados aos protetor auricular, cambão, calçado, bota de borracha, luva impermeável, animais de produção. puçá, armadilha, corda, cabresto, gaiola de contenção, focinheira, guia, mordaça, rede, laço, cestos de lixo segregados para descarte apropriado de materiais, entre outros.",220,question: What is the quadro 1 of Equipamentos de Proteço Individual?
zoonoses_manual_1.txt,"Na sala de vacinação e na Jaleco, luva impermeável, calça, calçado, gaiola de contenção, focinheira, avaliação animal. guia, mordaça, mesa pra vacinação (de aço inoxidável), cestos de lixo segregados para descarte apropriado de materiais, entre outros.",221,question: What is a common food that is a good source of nutrients?
zoonoses_manual_1.txt,"Nos laboratórios e na sala de Jaleco, luva impermeável, calça, calçado, máscara, óculos de segurança, bioensaio. cestos de lixo segregados para descarte apropriado de materiais, entre outros.",222,question: What is the main difference between the two types of products?
zoonoses_manual_1.txt,"Preparo e aplicação de Luvas impermeáveis, óculos de segurança, respirador e purificador de ar, bota inseticida impermeável de cano médio, bota impermeável com prolongamento até a e rodenticida. virilha, bancada, chuveiro de segurança, lava-olhos segregados, entre outros.",223,question: What is the purpose of the preparation and application of Luvas impermeables?
zoonoses_manual_1.txt,"Avaliação de áreas de risco e Macacão ou jaleco ou conjunto (calça e blusa), óculos de segurança, investigação epidemiológica respirador e purificador de ar, luva impermeável, bota ou calçado de campo. apropriado, boné, touca, creme protetor solar e repelente, entre outros.",224,question: What is a common cause of death in the elderly?
zoonoses_manual_1.txt,"Remoção de animais Macacão ou conjunto (calça e blusa), cambão, calçado, puçá, armadilha, domésticos. corda, cabresto, gaiola de contenção, focinheira, guia, mordaça, rede, laço, cachimbo, caixa de transporte, luvas de raspa de couro, entre outros.",225,question: What are some examples of animais?
zoonoses_manual_1.txt,"Controle de animais Luvas impermeáveis, macacão ou jaleco ou conjunto (calça e blusa), sinantrópicos. perneira, bota, boné, creme protetor solar e repelente, equipamentos apropriados para captura, pinças anatômicas, recipiente transparente de transporte, lanterna, luvas de raspa de couro, entre outros.",226,question: What is the name of the product that protects against abrasion?
zoonoses_manual_1.txt,"Nas salas de eutanásia e Jaleco, luva impermeável, calça, calçado, óculos de segurança, máscara, necropsia. avental descartável, entre outros.",227,question: What is the name of the calça?
zoonoses_manual_1.txt,"Jaleco, luva impermeável, calça, calçado, entre outros.",228,question: What are some other names for calça?
zoonoses_manual_1.txt,"Fonte: SVS/MS. 2.6 Recursos necessários para remoção, alojamento e manutenção de animais 2.6.1 Recursos humanos A equipe necessária para a execução do trabalho de remoção, alojamento e manutenção dos animais recolhidos pela UVZ deve ser composta por profissional de nível superior, que capacitará e supervisionará outros técnicos.",229,question: What is the name of the font used to describe the UVZ?
zoonoses_manual_1.txt,"A supervisão desses últimos poderá ser realizada por profissional de qualquer nível de escolaridade, desde que designado para essa atividade, dentro da estrutura organizacional adotada pela unidade.",230,question: Who can oversee the escolaridad?
