Arquivo,Parágrafo,Número do parágrafo,Pergunta
tuberculose_protocolo_6.txt,"Clinical Microbiology Reviews, Washington, DC, v. 27, n. 1, p. 3, 2014.",210,question: What is the name of the journal that published the journal?
tuberculose_protocolo_6.txt,Tuberculose ocupacional: análise documental de um hospital universitário no Rio de Janeiro.,211,question: What is the name of the document that is published by a hospital?
tuberculose_protocolo_6.txt,"Revista Cubana de Enfermería, Habana, v. 31, n. 4, dez. 2015.",212,question: What is the name of the magazine that published the article?
tuberculose_protocolo_6.txt,"Identifying socioeconomic, epidemiological and operational scenarios for tuberculosis control in Brazil: an ecological study.",214,question: What is the ecological study?
tuberculose_protocolo_6.txt,"BMJ Open, England, v. 8, p. e018545, 2018.",215,"question: What is the name of the journal that published the BMJ Open, England, v. 8, p. e018545, 2018?"
tuberculose_protocolo_6.txt,Estudo descritivo do tratamento da infecção latente por tuberculose do Programa de Controle da Tuberculose Hospitalar da Universidade Federal do Rio de Janeiro. 2007.,217,question: What is the name of the study that was done in 2007
tuberculose_protocolo_6.txt,Dissertação (Mestrado) – Programa de Pós-Graduação em Clínica Médica da Faculdade de Medicina da Universidade Federal do Rio de Janeiro.,218,question: What is the name of the program that provides post-graduate education?
tuberculose_protocolo_6.txt,"Rio de Janeiro, RJ: UFRJ, 2007.",219,question: What city was the UFRJ located in?
tuberculose_protocolo_6.txt,"Epidemiological profile of tuberculosis cases reported among health care workers at the University Hospital in Vitoria, Brazil.",220,question: What is the epidemiological profile of TB cases?
tuberculose_protocolo_6.txt,"Jornal Brasileiro de Pneumologia, Brasília, DF, v. 34, n. 8, p. 607-613, 2008.",221,question: What is the name of the journal that was published in 2008?
tuberculose_protocolo_6.txt,Prevalence of infection with Mycobacterium tuberculosis and associated factors in community health workers in Brazil based on the tuberculin skin test [Article in Portuguese].,224,question: What is the prevalence of tuberculosis among community health workers in Brazil?
tuberculose_protocolo_6.txt,"Caderno de Saúde Pública, Rio de Janeiro, RJ, v. 31, n. 10, p. 2199-210, 2015.",225,question: What is the name of the journal that was published in 2015?
tuberculose_protocolo_6.txt,"Revista da Associação Médica Brasileira, São Paulo, v. 25, p. 257-9, 1979.",226,question: What was the name of the publication that was published in 1979?
tuberculose_protocolo_6.txt,"Aids, tuberculosis, and the health care worker.",227,question: Who is a health care worker?
tuberculose_protocolo_6.txt,"Clinical Infectious Diseases, Chicago, IL, v. 20, n. 2, p. 232-242, 1995.",228,question: What publication did the publication of Clinical Infectious Diseases have?
tuberculose_protocolo_6.txt,"Tuberculin skin test conversion among medical students at a teaching hospital in Rio de Janeiro, Brazil.",230,question: What is the cause of the skin test conversion?
tuberculose_protocolo_6.txt,"Infection Control and Hospital Epidemiology, New Jersey, v. 23, n. 10, p. 591-594, 2002.",231,question: In what journal was the infection control and hospital epidemiology published?
tuberculose_protocolo_6.txt,"TRAJMAN, A.; TEIXEIRA, G.; STEFFEN, R.",233,question: What are the names of the three people who are known for their work?
tuberculose_protocolo_6.txt,The tuberculin booster phenomenon prevalence: a met analysis.,234,question: What is the prevalence of tuberculin boosters?
tuberculose_protocolo_6.txt,"American Journal of Respiratory and Critical Care Medicine, New York, v. 179, p.",235,question: What is the name of the journal that provides information about respiratory and critical care medicine?
tuberculose_protocolo_6.txt,Use of tuberculosis interferon-gamma release assays (IGRAs) in low- and middle-income countries: policy statement.,236,question: What is the policy statement for IGRAs?
tuberculose_protocolo_6.txt,Tuberculin reaction size on five consecutive days.,239,question: How many days in a row does the patient have to change their reaction size?
tuberculose_protocolo_6.txt,"Bulletin World Health Organization, v. 12, n. 1-2, p. 189-196, 1955.",240,question: What was the name of the issue that was published in 1955?
tuberculose_protocolo_6.txt,"Counting health workers: definitions, data, methods and global results.",242,"question: What are the definitions, data, methods, and global results of the health workers count?"
tuberculose_protocolo_6.txt,Risk of Tuberculosis Infection and Disease for Health Care Workers: An Updated Meta-Analysis.,244,question: What is the current meta-analysis of the risk of Tuberculosis Infection and Disease for Health Care Workers?
tuberculose_protocolo_6.txt,"Open Forum Infectious Diseases, Oxford, v. 4, n. 3, p. ofx137, 29 ago. 2017.",245,question: What is the name of the open forum infectious diseases?
tuberculose_protocolo_6.txt,CONTE-NOS O QUE PENSA SOBRE ESTA PUBLICAÇÃO.,247,question: QUE PENSA SOBRE ESTA PUBLICAO?
tuberculose_protocolo_6.txt,CLIQUE AQUI E RESPONDA A PESQUISA.,248,question: What is the name of the game?
tuberculose_protocolo_6.txt,Capa: Formato: 210mm x 297mm (larg x alt) - 4 pg Cor: 4/4 Papel: Supremo 320 g Encadernação: canoa Acabamento: BOPP Miolo: Formato: 210mm x 297mm (larg x alt) - 32 pg Cor: 4/4 Papel: Couchê fosco 90 g/m² Tiragem: 1000 bvsms.saude.gov.br Brasília - DF,249,question: What is the size of the canoa?
tuberculose_protocolo_7.txt,"1 Pobreza, desnutrição, baixa escolaridade, moradias precárias, alta densidade populacional, dificuldade de acesso aosserviçosdesaúde,viveremáreasdealtaincidênciadeTB,usoabusivodeálcooleoutrasdrogas,migração,além de barreiras culturais e econômicas como determinantes sociais relacionados à ocorrência de TB. precoce dos casos de TB, a qual inclui a busca ativa de sintomáticos respiratórios e a busca passiva de casos, para investigação, diagnóstico e tratamento (e ou devido encaminhamento); 2) o fortalecimento da adesão terapêutica, a qual inclui o acolhimento, a implementação do TDO, a construção do Projeto Terapêutico Singular (PTS), o monitoramento dos casos e busca de faltosos (BRASIL, 2019a).",1,question: What are the determinants of sociais relating to TB?
tuberculose_protocolo_7.txt,"Também está previsto na Carteira de Serviços da Atenção Primária à Saúde (BRASIL, 2019b) a “Prevenção, rastreamento de sintomáticos respiratórios, diagnóstico, tratamento e acompanhamento da pessoa com tuberculose (tratamento com esquema básico, tratamento diretamente observado, rastreamento em pulmonar).” Podemos citar também, para além da assistência individual, a necessidade de em Saúde (VS).",2,question: What is the BRASIL document that states the prevention of tuberculose?
tuberculose_protocolo_7.txt,"Tal integração colabora para que os profissionais de saúde reconheçam as particularidades do território, os determinantes e condicionantes da saúde individual e coletiva, as situações de risco sanitário e o contexto local das áreas de abrangência das Equipes de Saúde da Família (eSF) e das Equipes de Atenção Primária (eAP).",3,question: What does a sade collaboration help to reconhecate?
tuberculose_protocolo_7.txt,"A partir disso, diferentes processos de trabalho podem ser necessários, considerando as de cada território.",4,"question: A partir de disso, diferentes processos de trabalho podem ser necessários?"
tuberculose_protocolo_7.txt,"Portanto, a sensibilização das equipes da APS, quanto a importância de direcionar suas ações também para o tratamento da TB, contribui para o planejamento de estratégias de promoção e proteção da saúde da população, de prevenção e controle de riscos, agravos e doenças (BRASIL, 2018a).",5,"question: A sensibilizaço das equipes da APS, quanto a importância de direcionar suas açes também para o tratamento da TB, contribuie para o planejamento de estratégias"
tuberculose_protocolo_7.txt,"No Brasil, assim como em vários países, a TB é considerada condição sensível (BRASIL, 2017a): “Prevenção e Cuidado Integrado Centrado no Paciente”.",6,question: What is the Brazilian report on TB?
tuberculose_protocolo_7.txt,"Portanto, fortalecimento da adesão e redução de situações de vulnerabilidade2, contribuindo para maior controle da doença.",7,question: What contributes to a better control of doença?
tuberculose_protocolo_7.txt,"Dentre as ações realizadas na APS estão: - Identificar novos casos no território, através da busca ativa de sintomáticos respiratórios; 2 A dificuldadedeacessoaosserviçosdesaúdeéumdeterminantesocialrelacionadoàTBevistoqueaAPSéaporta de entrada preconizada aos serviços do SUS, o atendimento desta doença neste nível de atenção torna-se uma potencialidade para o controle da doença. - Realizar diagnóstico oportuno dos usuários, diminuindo a chance de transmissão da tuberculose para seus contatos; - Iniciar o tratamento imediatamente, evitando que o paciente circule por vários serviços até receber o medicamento; - Realizar a investigação e controle dos contatos, tratando, quando indicado, a infecção latente e/ou a doença; - Organizar, implementar e supervisionar o TDO nas Unidades de Saúde, diminuindo a chance de abandono do uso da medicação pelo usuário; - Participar da construção de estratégias que visem fortalecer a comunicação entre os três níveis de atenção, de forma a estimular que aconteça a referência e contrarreferência dos casos de TB; - Participar da construção de planos compartilhados de cuidado com a rede intersetorial, para a promoção do cuidado de usuários em situação de vulnerabilidade social.",8,question: What is the purpose of the TDO?
tuberculose_protocolo_7.txt,"APS, amplia-se a possibilidade de aumento dos índices de cura, a redução do abandono do tratamento, a redução de vulnerabilidades, a contribuição para o enfrentamento dos determinantes sociais relacionados à doença e, por consequência, o decréscimo da transmissão da tuberculose na população. 2.",9,question: What does APS do?
tuberculose_protocolo_7.txt,"OBJETIVO cuidado, frente às recomendações de controle da TB, as quais incluem o enfrentamento articulado em rede, além de definir critérios para o rastreamento, diagnóstico, tratamento e acompanhamento dos casos de tuberculose nas Unidades Básicas de Saúde (UBS), de forma a fortalecer e qualificar o cuidado ao indivíduo acometido por esta doença, garantindo a resolução prevista para esse ponto da Rede de Atenção à Saúde (RAS). 3.",10,question: What is the OBJETIVO cuidado?
tuberculose_protocolo_7.txt,"DETECÇÃO DE CASOS SUSPEITOS DE TUBERCULOSE O controle da TB requer uma ação permanente, sustentada e organizada, com assistência qualificada no processo de acompanhamento (BRASIL, 2017a).",11,question: What is the name of the TB control?
tuberculose_protocolo_7.txt,"O tempo de três semanas de tosse é válido para a população geral, porém em populações específicas pode ser duas semanas ou a qualquer tempo (BRASIL, 2019). de atividades de todos os membros das equipes de saúde, tendo em vista que a Nacional de Controle da Tuberculose.",13,question: What is the geral population?
tuberculose_protocolo_7.txt,"O rastreamento de casos sintomáticos respiratórios pode ocorrer de duas formas: Busca Passiva: é aquela em que a equipe de saúde investiga os usuários que procuram espontaneamente o serviço de saúde; e Busca Ativa: é aquela em que a equipe estabelece ações fora da Unidade de Saúde, na comunidade.",14,question: What is the name of the busca that investigates usuários that procuram espontaneamente o serviço de sade?
tuberculose_protocolo_7.txt,"Quadro 1: Orientações para busca de SR em populações específicas: - Busca Passiva: a partir da demanda espontânea (quando a PPL demanda por serviço de saúde), a equipe de saúde deve investigar a prisional3 TB; - Busca ativa de sintomático respiratório: deve ser realizada no momento do ingresso no sistema prisional (dentro de, no máximo, 7 dias) e entre os contatos.",15,question: What is the corresponding quadro of the busca ativa de sintomático respiratório?
tuberculose_protocolo_7.txt,"Além da busca ativa através de entrevista, é indicado, quando possível, o exame radiológico como forma de triagem, para todas as PPL.",16,"question: A busca ativa através de entrevista é indicado, quando possvel, o exame radiológico como forma de triagem, para todas as PPL?"
tuberculose_protocolo_7.txt,"Recomenda-se também o rastreamento em massa (“campanha”), idealmente duas vezes ao ano, o qual consiste em uma entrevista tosse, tratamento anterior de TB e infecção por HIV.",17,question: What is a rastreamento em massa?
tuberculose_protocolo_7.txt,"Se apresentar tosse de qualquer tempo de duração, deve ser encaminhado para a realização de exames de diagnóstico. 3Para mais informações acessarNota Informativa ConjuntaNº 01/2022 - Vigilância Epidemiológica da Tuberculose (TB) na Saúde Prisional.",18,question: What is the purpose of a TB exam?
tuberculose_protocolo_7.txt,"Em instituições fechadas na área dos serviços de APS, como Instituições de Longa Permanência e albergues, é desejável que a estratégia de busca ativa de SR seja realizada periodicamente.",19,question: A estratégia de busca ativa de SR seja realizada periodicamente?
tuberculose_protocolo_7.txt,"Se apresentar tosse de qualquer tempo de duração, deve ser encaminhado para a realização de exames de diagnóstico.",20,"question: Apresentar tosse de qualquer tempo de duraço, deve ser encaminhado para a realizaço de exames de diagnóstico?"
tuberculose_protocolo_7.txt,"Deve-se estabelecer uma rotina para a realização da busca ativa do SR, considerando o elevado risco de adoecimento dessa população. domiciliar e em eventos que ocorrem nas aldeias.",21,question: A rotina apresenta a SR?
tuberculose_protocolo_7.txt,"Se apresentar tosse de qualquer tempo de duração, deve ser encaminhado para a realização de exames de diagnóstico. situação de rua em conjunto com equipes de assistência social, serviços itinerantes e consultórios na rua, para identificação dos casos e encaminhamento, com articulação entre unidades de saúde e abrigos, visando o cuidado compartilhado.",22,"question: Apresentar tosse de qualquer tempo de duraço, deve ser encaminhado para a realizaço de exames de diagnóstico?"
tuberculose_protocolo_7.txt,"Se apresentar tosse de qualquer tempo de duração, deve ser encaminhado para a realização de exames de diagnóstico.",23,"question: Apresentar tosse de qualquer tempo de duraço, deve ser encaminhado para a realizaço de exames de diagnóstico?"
tuberculose_protocolo_7.txt,"Se apresentar tosse de qualquer tempo de duração, deve ser - Contato de encaminhado para a realização de exames de diagnóstico. - Pessoas que - Imigrantes -Profissionais Se apresentar tempo de tosse de 2 semanas ou mais, deve ser encaminhado para a realização de exames de diagnóstico.",24,question: What is the encaminhado for a presentation of a diagnosis?
tuberculose_protocolo_7.txt,"NOTIFICAÇÃO DOS CASOS DE TUBERCULOSE NO SISTEMA DE INFORMAÇÃO DE AGRAVOS DE NOTIFICAÇÃO (SINAN) Conforme Portaria Ministerial, a tuberculose é uma doença de notificação compulsória (Portaria nº 204, de 17 de fevereiro de 2016).",27,question: What does SINAN stand for?
tuberculose_protocolo_7.txt,Notifica-se apenas o caso confirmado de tuberculose (critério laboratorial ou clínico-radiológico/tratamento de prova).,28,question: What is the status of tuberculose?
tuberculose_protocolo_7.txt,"Outros serviços podem notificar o caso, como por exemplo, os laboratórios.",30,question: Os laboratórios possuiam notificar o caso?
tuberculose_protocolo_7.txt,"Estes dados devem ser inseridos mensalmente no SINAN, pela vigilância municipal. 5.",33,question: What do the vigilancia municipal do to the dados?
tuberculose_protocolo_7.txt,ORIENTAÇÕES PARA REGISTRO NO E-SUS APS O e-SUS APS é uma estratégia para reestruturar as informações da APS em nível nacional.,34,question: What is the purpose of the APS?
tuberculose_protocolo_7.txt,"Os municípios ainda podem utilizar sistemas próprios/terceiros, com adequada integração ao Sistema de Informação em Saúde para Atenção Básica (SISAB).",36,question: Os municpios podem utilizar sistemas próprios/terceiros?
tuberculose_protocolo_7.txt,"Cabe ressaltar que, a partir do novo modelo de financiamento da APS, os dados enviados ao SISAB serão fundamentais para o repasse financeiro às equipes, por meio da capitação ponderada e dos indicadores de desempenho.",37,question: Os dados enviados ao SISAB sero fundamentais para o repasse financeiro às equipes?
tuberculose_protocolo_7.txt,"É imprescindível que os registros das ações relacionadas ao cuidado dos usuários, seja em consultas, visitas domiciliares ou em outro tipo de atendimento, sejam inseridos através das ferramentas de entrada de dados da Estratégia e-SUS APS.",38,question: What is the açes relacionadas ao cuidado dos usuários?
tuberculose_protocolo_7.txt,"Isto é necessário para a realização adequada do monitoramento, avaliação e repasse financeiro referente às ações da tuberculose4.",39,question: What is the need for a tuberculose4 monitor?
tuberculose_protocolo_7.txt,"O correto registro das informações deve ser realizado observando: - O cadastro individual do usuário, o mais completo possível, com dados do CNS e/ou CPF atualizados; - O registro da condição ""tuberculose"" no prontuário eletrônico, por profissional médico ou enfermeiro, utilizando o campo “Problema e/ou condição detectada”, incluindo obrigatoriamente o CIAP2 ou CID10 correspondentes.",40,"question: O cadastro individual do usuário, com dados do CNS e/ou CPF atualizados, com o cadastro individual do usuário?"
tuberculose_protocolo_7.txt,Códigos CIAP2: Tuberculose código A70 (Figura 1).,41,question: What is the código A70?
tuberculose_protocolo_7.txt,Principais códigos CID10: Z20.1; Z11.1; Z030; A15; A17; A18; A19.,42,question: What are the following códigos?
tuberculose_protocolo_7.txt,Tuberculose associada a outras doenças: N74.0; N74.1; B20.0; J65; O98.0; P37.0.,43,question: What is the name of the tuberculose that is associated with other doenças?
tuberculose_protocolo_7.txt,"Considerar febre (R50) e tosse (R05). - A transmissão mensal dos dados de produção da Atenção Primária para a base nacional do SISAB, até o décimo dia útil do mês subsequente à sua realização5.",44,question: What are the dates of the SISAB's first two productions?
tuberculose_protocolo_7.txt,"Figura 1: Registro da condição tuberculose no campo Problema e/ou condição Fonte: e-SUS APS 4 Consultar Programa Estadual de Incentivos para Atenção Primária à Saúde (PIAPS). 5PORTARIA Nº 4, DE 28 DE JANEIRO DE 2021 6.",45,question: What is the name of the program?
tuberculose_protocolo_7.txt,"DIAGNÓSTICO epidemiológico, em função da transmissão por via respiratória.",46,question: What is the term for a disease that is a DIAGNOSTICO?
tuberculose_protocolo_7.txt,"Contudo, existem apresentações extrapulmonares, as quais têm seus sinais e sintomas dependentes dos órgãos ou sistemas acometidos (BRASIL, 2019).",47,question: What is the BRASIL's definition of extrapulmonares?
tuberculose_protocolo_7.txt,"Quando há suspeita de tuberculose secundária ou terciária de acompanhamento de tuberculose, já os pacientes HIV soropositivos devem ser encaminhados para o Serviço de Atenção Especializada (SAE).",48,question: What do HIV soropositivos do?
tuberculose_protocolo_7.txt,"Em relação à TB pulmonar, os métodos para o diagnóstico laboratorial são a baciloscopia, a cultura para micobactérias e o Teste Rápido Molecular/ GeneXpert (TRM-TB).",49,question: What is the name of the test that is used to diagnose TB?
tuberculose_protocolo_7.txt,"Mycobacterium tuberculosis (CMTB) e das micobactérias não tuberculosas (MNT), para posterior realização do Teste de Sensibilidade às Drogas Antimicrobianas (TSA).",50,question: What two bacterias are used in the TSA?
tuberculose_protocolo_7.txt,"Atentar para outros sinais e sintomas além da tosse, dentre os quais: febre vespertina, sudorese noturna, anorexia, astenia (cansaço e mal estar), emagrecimento, dor torácica, hemoptise e/ou escarro hemático.",51,question: A tosse e a hemoptise e/ou escarro hemático tem os quais?
tuberculose_protocolo_7.txt,"O diagnóstico precoce de infecção pelo HIV em pessoas com tuberculose tem indivíduo (Brasil, 2019). 6.1 MÉTODOS DIAGNÓSTICOS 6.1.1 Baciloscopia A pesquisa bacteriológica é de fundamental importância em adultos, tanto para o diagnóstico quanto para o controle de tratamento da TB.",52,question: What is the reason for the indivduo of HIV?
tuberculose_protocolo_7.txt,"Por ser um método simples e seguro, deve ser realizado por todo laboratório público de saúde e pelos laboratórios privados conveniados e tecnicamente habilitados.",53,question: What is the main purpose of a simple and secure process?
tuberculose_protocolo_7.txt,"A pesquisa do bacilo álcool-ácido resistente – BAAR, pelo método de Ziehl-Neelsen, é a técnica mais utilizada em nosso meio (BRASIL, 2019).",54,question: What is the name of the bacilo álcool-ácido resistente?
tuberculose_protocolo_7.txt,"A baciloscopia de escarro é indicada nas seguintes condições: - No sintomático respiratório, durante estratégia de busca ativa; - Em caso de suspeita clínica e/ou radiológica de TB pulmonar, independentemente do tempo de tosse; e - Para acompanhamento e controle de cura em casos pulmonares com confirmação laboratorial. amostras: uma por ocasião do primeiro contato com a pessoa que tosse e a outra preferencialmente no dia seguinte, com a coleta do material sendo feita ao despertar.",55,question: A baciloscopia de escarro é indicada nas seguintes condiçes:
tuberculose_protocolo_7.txt,"Para garantir a qualidade da baciloscopia, a coleta das amostras deve seguir as Recomendações para o Controle da Tuberculose no Brasil (2019), pág. 62.",56,question: What is the purpose of the Recomendaçes for a Controle da Tuberculose no Brasil?
tuberculose_protocolo_7.txt,"Municípios e/ou serviços de saúde que fazem a busca ativa de SR devem planejar e monitorar essa atividade, levando em conta a população local.",57,question: What do SRs do that can be used to monitor their atividad?
tuberculose_protocolo_7.txt,"Conforme já mencionado, o número de sintomáticos respiratórios que se espera encontrar é de 1% da população geral (Brasil, 2019). 6.1.2 Cultura para micobactérias, identificação e teste de sensibilidade: diagnóstico da TB.",58,question: What is the percentage of TB patients in Brazil?
tuberculose_protocolo_7.txt,"Tanto nas situações de retratamento (seja reingresso pós abandono ou recidiva), como nos casos de coinfecção com HIV, profissionais de saúde e situações de vulnerabilidade social (PSR, PPL, Albergues, Comunidades terapêuticas para usuários de álcool e outras drogas ou instituições de longa permanência, população indígena, imigrantes, dentre outros) a cultura com identificação e teste de sensibilidade, deve sempre ser solicitada. população privada de liberdade, a cultura e o TSA devem ser sempre realizados em todos os sintomáticos respiratórios identificados na população prisional, além da baciloscopia ou TRM-TB (BRASIL, 2019).",59,question: What is a social vulnerabilidade?
tuberculose_protocolo_7.txt,"Cabe ressaltar que, nos casos pulmonares com baciloscopia negativa, a cultura do escarro pode aumentar em até 30% o diagnóstico bacteriológico da doença.",60,question: A cultura do escarro pode aumentar em até 30% o diagnóstico bacteriológico da doença?
tuberculose_protocolo_7.txt,"Idealmente, a cultura deve ser realizada independente do resultado da baciloscopia para todos os casos com suspeita de TB.",61,question: A cultura deve ser realizada independente do resultado da baciloscopia?
tuberculose_protocolo_7.txt,"O teste de sensibilidade deverá reduzem o tempo para o resultado do perfil de sensibilidade/resistência às principais drogas utilizadas no tratamento (BRASIL, 2019). cultura, sugerimos que seja questionado ao gestor municipal a disponibilidade local ou regional, bem como estimulada a contratualização/pactuação para a realização desses exames. 6.1.3 Radiografía de tórax: Entre os métodos de imagem, a radiografia de tórax é o de escolha na avaliação inicial e no acompanhamento da TB pulmonar.",62,question: What is the purpose of the test?
tuberculose_protocolo_7.txt,Deve ser solicitada para todo o paciente com suspeita clínica de TB pulmonar.,63,question: What is the name of the TB pulmonar?
tuberculose_protocolo_7.txt,"Juntamente com as radiografias de tórax, sempre devem ser realizados exames laboratoriais (baciloscopias, cultura com TSA e/ou teste rápido molecular) na tentativa de buscar o diagnóstico bacteriológico e acompanhar a evolução baciloscópica.",64,question: What is a laboratorial exam?
tuberculose_protocolo_7.txt,"O exame radiológico em pacientes com diagnóstico bacteriológico tem como principais objetivos excluir outra doença pulmonar associada, avaliar a extensão do acometimento e sua evolução radiológica durante o tratamento.",65,question: O exame radiológico em pacientes com diagnóstico bacteriológico tem como principais objetivos excluir outra doença pulmonar associad
