Arquivo,Parágrafo,Número do parágrafo,Pergunta
tuberculose_protocolo_3.txt,"Biosafety in Microbiological and Biomedical Laboratories. 5. ed, U.S.",390,question: What is the name of the book that was published in the United States?
tuberculose_protocolo_3.txt,Department of Health and Human Services.,391,question: What department does the Department of Health and Human Services work for?
tuberculose_protocolo_3.txt,"Biossegurança em Laboratórios Biomédicos e de Microbiologia. 3ª edição revista e atualizada, Serie a Normas e Manuais Técnicos, 2004. 5 KENT, P.T. & KUBICA, G.P.",394,question: What is the name of the publication that was published in 2004?
tuberculose_protocolo_3.txt,"A Guide For The Level III Laboratoy, US Department of Health and Human Services; Public Health Service, Centersfor Disease Control, 1985. 6 CDC/Centers for Disease Control and Prevention.",395,question: What is the name of the book that was published in 1985?
tuberculose_protocolo_3.txt,Department of Health and Human Services.,396,question: What department does the Department of Health and Human Services work for?
tuberculose_protocolo_3.txt,"Goals for working safely with Mycobacterium tuberculosis in clinical, public health and research laboratories.Atlanta, 1997. 7 BRASIL.",397,"question: What are the goals for working safely with Mycobacterium tuberculosis in clinical, public health, and research laboratories?"
tuberculose_protocolo_3.txt,Coordenação Nacional de Doenças Sexualmente Transmissíveis e Aids.,398,question: What is the name of the organization that regulates transmissive and aids?
tuberculose_protocolo_3.txt,"Tuberculose – Diagnóstico Laboratorial – Baciloscopia, 72 p.",399,question: What is the price of Tuberculose?
tuberculose_protocolo_3.txt,"Brasília. 2001. 8 FLEMING, D.O.; RICHARDSON, J.H.; TULIS, J.J.; VESLEY, D.",400,question: What country did Brasilia visit in 2001?
tuberculose_protocolo_3.txt,"Laboratory Safety – Principles and Practices, ASM Press 2nd ed.",401,question: What is the title of the book?
tuberculose_protocolo_3.txt,"Washington, DC, 1995. 9 HIRATA, H.H.; FILHO, J.M.",402,question: Where was the first presidential election held?
tuberculose_protocolo_3.txt,"Rio de Janeiro: Manole, 2002. 10 ODA, L. & ÁVILA, S.M. (org).",403,"question: Where did ODA, L. and VILA, S.M. come from?"
tuberculose_protocolo_3.txt,Biossegurança em Laboratórios de Saúde Pública.,404,question: What is the name of the Brazilian organization that is a part of the Spanish government?
tuberculose_protocolo_3.txt,"Rio de Janeiro, 2 ed., 2000. 11 GONÇALVES, M.L.C.",405,question: What is the name of the book that was published in 2000?
tuberculose_protocolo_3.txt,Transmissão nosocomial da tuberculose: diminuindo o risco.,406,question: What is the risk of tuberculose?
tuberculose_protocolo_3.txt,"Boletim de Pneumologia Sanitária, Rio de Janeiro, p. 21-25, v. 9 nº 2 jul/dez 2001. 12 OPAS/Organización Panamericana de la Salud.",407,question: What was the name of the publication that was published in 2001?
tuberculose_protocolo_3.txt,"Cabinas de Seguridad Biológica:Uso, Desinfección y Manutenimento.",408,question: What are the three main activities of a biosecurity cabin?
tuberculose_protocolo_3.txt,"Washington, 2004. 13 WHO/World Health Organization.",409,question: What was the name of the WHO/World Health Organization meeting held in 2004?
tuberculose_protocolo_3.txt,"Guidance on regulations for the transport of infectious substances, 2007-2008.",410,question: What document was issued in 2007-2008?
tuberculose_protocolo_3.txt,Applicable as from 1 January 2007.WHO/CDS/ EPR/2007.2.,411,question: What is the date of the WHO/CDS/ EPR/2007.2?
tuberculose_protocolo_3.txt,"Resolução RDC 302, de 13 de outubro de 2005.",413,question: What was the name of the RDC 302?
tuberculose_protocolo_3.txt,Dispõe sobre Regulamento Técnico para Funcionamento de Laboratórios Clínicos.,414,question: What is the name of the document that is used to regulate the activities of the Laboratories?
tuberculose_protocolo_3.txt,"DOU, Brasília, 2005. 15 SES-PR/Secretaria do Estado da Saúde do Paraná.",415,question: What is the name of the document that was published in 2005?
tuberculose_protocolo_3.txt,Laboratório Central do Estado do Paraná.,416,question: What is the name of the facility?
tuberculose_protocolo_3.txt,Manual de Biossegurança e Segurança Química em Laboratório de Saúde Pública.,417,question: What is the name of the manual that is produced?
tuberculose_protocolo_3.txt,"Capítulo 3 – Biossegurança 16 KUEHNE, R.W.; et al., Primary Barriers and Personal Protective Equipment in Biomedical Laboratories, in: Laboratory Safety – Principles and Practices, p 145. 2nd Edition.",418,question: What is the title of the book?
tuberculose_protocolo_3.txt,"Tulis and Donald Vesley, 1995. 17.",419,question: Who were the two authors of the book?
tuberculose_protocolo_3.txt,CDC/Centers for Disease Control and Prevention.,420,question: Who is responsible for determining the health status of the population?
tuberculose_protocolo_3.txt,"Primary Containment for Biohazard: Selection, Installation and Use of Biological Safety Cabinets. 2nd Ed,: U.S.",421,question: What is the primary containment for biohazard?
tuberculose_protocolo_3.txt,Department of Health and Human Services.,422,question: What department does the Department of Health and Human Services work for?
tuberculose_protocolo_3.txt,"L.; LATRILHA F.O.; BRITO A.C.; GIAMPAGLIA, C.M.S.; SIMEÃO F.C.S.; TELLES M.A.S.",423,question: What is the name of the Brazilians that are known as 'L.'?
tuberculose_protocolo_3.txt,Cabine de segurança biológica: efeito da luz ultravioleta nas micobactérias.,424,question: What is the name of the cell that is protected from ultraviolet radiation?
tuberculose_protocolo_3.txt,"Rev Inst Adolfo Lutz, 65(3):222-224, 2006. 19.",425,question: What was the title of the Rev Inst Adolfo Lutz book?
tuberculose_protocolo_3.txt,Appendix E: Standard 49 for Class II (laminar flow) biohazard cabinetry.,426,question: What is standard 49 for Class II (laminar flow) biohazard cabinetry?
tuberculose_protocolo_3.txt,"Ann Arbor, MI: 4-E:39; 5-B:50, 1983. 20 BRASIL.",428,question: Where was the first BRASIL census?
tuberculose_protocolo_3.txt,ASSOCIAÇÃO BRASILEIRA DE NORMAS TÉCNICAS –ABNT.,429,question: What is the acronym for the association of brasilianes de normas tecnicas?
tuberculose_protocolo_3.txt,Norma Brasileira Registrada - NBR5992/80 - Determinação da massa específica e do teor 1980. 118 Secretaria de Vigilância em Saúde/MS 3 .8 Anexos do capítulo 3 .8 .1 Preparação de reagentes 3 .8 .1 .1 Quadro 1 – Preparação da Solução de Fenol a 5% PREPARAÇÃO DA SOLUÇÃO DE FENOL A 5% Cristal de fenol 50 g Água destilada qsp 1.000 ml 1.,430,question: What is the name of the registry?
tuberculose_protocolo_3.txt,Colocar o fenol em um balão de 1.000 ml. 2.,431,question: How much fenol does one need to take?
tuberculose_protocolo_3.txt,Adicionar 700 ml da Água destilada aos poucos no balão sobre o fenol. 3.,432,question: How much gua destilada dos poucos do balo?
tuberculose_protocolo_3.txt,Colocar o balão para aquecer em banho maria até o fenol dissolver completamente. 4.,433,question: How do you dissolve fenol?
tuberculose_protocolo_3.txt,Retirar do banho maria e acrescentar Água destilada até completar 1.000 ml. 5.,434,question: How much gua destilada does the banho maria contain?
tuberculose_protocolo_3.txt,Deixar esfriar em temperatura ambiente. 6.,435,question: Deixar esfriar em temperatura ambiente?
tuberculose_protocolo_3.txt,"Colocar a Solução de Fenol a 5% em um frasco âmbar de 1.000 ml, hermeticamente fechado para impedir desprendimento de vapores enquanto não está em uso, rotulado com as seguintes informações: nome da solução, data da preparação, de validade e a expressão “PRODUTO UTILIZADO APENAS PARA CONTENÇÃO DE DERRAMAMENTOS DE GRANDE VOLUME”. 7.",436,question: What is the purpose of the Soluço de Fenol?
tuberculose_protocolo_3.txt,Armazenar essa solução em temperatura ambiente. 3 .8 .1 .2 Quadro 2 – Preparação da Solução de Álcool a 70% PREPARAÇÃO DA SOLUÇÃO DE ÁLCOOL A 70% Álcool etílico comercial 95% 700 ml Água destilada qsp 1.000 ml 1.,437,question: What is the purpose of the Soluço de lcool?
tuberculose_protocolo_3.txt,Colocar o álcool etílico em um balão de 1.000 ml. 2.,438,question: What is the purpose of a bale of etlico?
tuberculose_protocolo_3.txt,Adicionar Água destilada aos poucos no balão sobre o álcool etílico até completar 1000 ml. 3.,439,question: What is the purpose of a destilada adobe?
tuberculose_protocolo_3.txt,"Colocar a solução da álcool etílico em um frasco bem vedado já rotulado com as seguintes informações: nome do corante, data da preparação e de validade. 4.",440,question: What is the name of the corante?
tuberculose_protocolo_3.txt,Armazenar ao abrigo da luz e a temperatura ambiente.,441,question: A abrigo da luz e a temperatura ambiente?
tuberculose_protocolo_3.txt,"OBS: O título “Solução de Álcool a 70%” significa percentagem em Peso/Peso (P/P), expressão usual.",442,"question: What does the term ""Soluço de lcool a 70%"" mean?"
tuberculose_protocolo_3.txt,"Na preparação da solução é mais prático trabalhar com vo- lume ao invés de peso, portanto, faz-se necessário uma conversão para a correção do teor alcoólico.",443,"question: A converso para correço do teor alcoólico é a mais prático trabalhar com vo- lume ao invés de peso, portanto, faz-se"
tuberculose_protocolo_3.txt,"Para isto considerar a relação: 770ml(volume) correspondem a 700g (peso) do álcool etílico comercial 95%.20 Capítulo 3 – Biossegurança 3 .8 .2 Formulários de controle da preparação 3 .8 .2 .1 Formulário – Controle da Preparação da Solução de Fenol a 5% 3 .8 .2 .2 Formulário – Controle da Preparação da Solução de Álcool a 70% 120 Secretaria de Vigilância em Saúde/MS 4 .1 Descrição Após a comprovação de que os agentes etiológicos da tuberculose (TB) e da han- seníase tinham características morfológicas de bacilos e tintoriais de álcool-ácido re- sistência, Lehmann e Neumann, em 1896, agruparam os agentes como pertencentes ao gênero Mycobacterium, estabelecendo as espécies Mycobacterium tuberculosis e M. leprae, respectivamente.",444,question: What is the amount of alcool etlico commercial 95%?
tuberculose_protocolo_3.txt,"A denominação do gênero originou-se do latim “fungus bac- terium”, pelo fato do M. tuberculosis apresentar algumas características semelhantes aos fungos quando cultivado em meio líquido1.",445,question: What is the origin of the term gênero?
tuberculose_protocolo_3.txt,"Posteriormente, foram visualizados e isolados, tanto do homem como do meio ambiente, vários outros bacilos com as mesmas características tintoriais do M. tuber- culosis, entretanto, com diversificações no tempo de crescimento in vitro, produção de pigmentos e patogenicidade para aos seres humanos.",446,question: What isolados do homem como do meio ambiente?
tuberculose_protocolo_3.txt,"A partir da década de 90, publicação 125 espécies e 11 subespécies são reconhecidas oficialmente2.",447,"question: A partir de 90, publicaço 125 espécies e 11 subespécies so reconhecidas oficialmente2"
tuberculose_protocolo_3.txt,"Com exceção do M. leprae que não cresce in vitro, essas espécies são divididas em dois grupos, as espécies pertencentes ao Complexo M. tuberculosis e as Micobactérias Não causadoras de Tubeculose (MNT)1’2’3.",448,question: What is the cause of the occurrence of M. leprae?
tuberculose_protocolo_3.txt,"A ligação de alguns des- característica tintorial de resistência à descoloração por soluções álcool-ácidas, Álcool-Ácido Resistentes.",450,"question: A ligaço de alguns des- caracterstica tintorial de resistência à descoloraço por soluçes álcool-ácidas, lcool-cido Resistentes?"
tuberculose_protocolo_3.txt,"Por esse motivo, na prática clínica e laboratorial são conhecidas e transcritas como BAAR.",451,question: What is the motivation for BAAR?
tuberculose_protocolo_3.txt,"Essa característica tintorial e o aspecto morfológico não permitem a definição da espécie micobacteriana, embora al- gumas se apresentem morfologicamente mais espessas e curtas.",452,question: O aspecto morfológico no permitem a definiço da especie micobacteriana?
tuberculose_protocolo_3.txt,"Assim, para a e identificados por testes fenotípicos e/ou moleculares.",453,question: What is the purpose of identifying moleculares?
tuberculose_protocolo_3.txt,"Nessa membrana são sinte- Capítulo 4 – Micobactérias tizados pigmentos carotenóides e niacina, utilizados nos testes de identificação fenotípica das espécies. • Cromossomo – constituído de ácido desoxiribonucleico (ADN) que codifica to- da micobactéria. • Ribossomos – corpúsculos espalhados no citoplasma da micobactéria contendo ácido ribonucleico (ARN) e proteínas.",455,question: What is the name of the bacteria that is a part of the membrana?
tuberculose_protocolo_3.txt,Na visualização micros- cópica podem aparecer como pequeninos grãos escuros localizados nas extremi- dades do bacilo. • Vacúolos lipídicos – armazenam lipídeos para uso nas necessidades metabólicas das células. • Mesossomos – encontram-se associados à membrana celular e desempenham função essencial no processo de divisão celular e nas atividades enzimáticas.,457,question: What is the visualizaço micros- cópica?
tuberculose_protocolo_3.txt,"As micobactérias são, também, classificadas, conforme sua capacidade de causar doença no homem, em (i) patogênicas, que obrigatoriamente causam doença; (ii) potencialmente patogênicas, que podem causar doença; (iii) raramente patogênicas, nunca ou com extrema raridade causam doença.",458,question: What do micobactérias do?
tuberculose_protocolo_3.txt,"Mediante essa classificação, as es- Quadro 1. 122 Secretaria de Vigilância em Saúde/MS Quadro 1 Espécies de micobactérias classificadas conforme M. leprae M. tuberculosis M. bovis M. africanum M. microti M. caprae M. avium M branderi M. genavense M. malmoense M. simiae M. avium subsp paratuberculosis M. celatum M. haemophilum M. marinum M. szulgai M. abscessus M. chelonae M. intracellulare M. peregrinum M. ulcerans M. asiaticum M. fortuitum M. kansasii M. scrofulaceum M. xenopi M. agri M. cooki M. gordonae M. phlei M. terrae M. aichiense M. diernhoferi M. hassiacum M. porcinum M. thermoresistible M. alvei M. duvalii M. komossense M. pulveris M. tokaiense M. aurum M. fallax M. lepraemurium M. rhodesiae M. triviale M. brumae M. farcinogenes M. mucogenicum M. senegalense M. vaccae M. austroafricanum M. flavescens M. nonchromogenicm M. shimoidei M. chitae M. gadium M. neoaurum M. smegmatis M. chubuense M. gastri M. obuense M. sphagni M. confluentis M. gilvum Fonte: CGLAB/DEVEP/SVS/MS Estudos taxonômicos demonstraram similaridades fenotípicas, relação de antí- genos citoplasmáticos e homologia do ADN, entre as várias espécies oficialmente des- critas induzindo, por razões operacionais de diagnóstico, o agrupamento de algumas e suas definições como complexos ou grupos.",459,question: What is the name of the quadro 1 of the Secretaria de Vigilância em Sade/MS?
tuberculose_protocolo_3.txt,"Assim, oficialmente fazem parte do Complexo M. tuberculosis (CMTB) as espécies: M. tuberculosis, M. bovis, M. bovis – BCG; M. africanum, M. microti, M. caprae e M. pinnipedii.",460,question: What is the name of the CMTB infection?
tuberculose_protocolo_3.txt,"A espécie M. canetti, descri- ta inicialmente por George Canetti em 1969, ainda não foi oficialmente reconhecida como membro do CMTB2.",461,question: What was the name of George Canetti's espécie?
tuberculose_protocolo_3.txt,"Capítulo 4 – Micobactérias Além do CMTB, tem-se o Complexo M. avium (MAC) que agrupa as espécies M. avium, M. avium subespécie paratuberculosis, M. intracellulare e M. scrofulaceum e Complexo M. terrae as espécies M. terrae, M. nonchromogenicum e M. triviale.",462,question: What is the MAC?
tuberculose_protocolo_3.txt,"Recentemente, algumas espécies de crescimento rápido foram reunidas em três grupos: (i) grupo M. fortuitum composto pelas espécies M. fortuitum, M. peregriu- num, M. mucogenicum, M. senegalense, M. mageritense, M. septicum, M. houstonense M. bonickei; (ii) grupo M. chelonae pelas espécies M. chelonae, M. abcessus, M. im- munogenum e (iii) grupo M. smegmatis, pelas espécies M. smegmatis, M. woliskyi, M. godii. 4 As espécies de MNT têm sido isoladas de diversas fontes ambientais (águas, solos, poeiras e materiais vegetais) e/ou de animais.",463,question: What is the name of the group that produces the most rabid growth?
tuberculose_protocolo_3.txt,Algumas espécies são encontradas na própria microbiota epidérmica e dos tratos respiratório e gástrico-intestinal dos seres humanos.,464,question: What are some of the encontradas
tuberculose_protocolo_3.txt,"Quando responsáveis por processos patológicos em humanos, as MNT podem acometer qualquer tecido dos sistemas ou disseminar-se por todo o organismo, prin- cipalmente em pacientes imunocomprometidos.",465,question: What do MNTs do?
tuberculose_protocolo_3.txt,"Por não serem transmissíveis, não existe obrigatoriedade de notificação, o indicador de incidência no Brasil é desconhecido. 124 Secretaria de Vigilância em Saúde/MS 4 .2 Referências 1 COLLINS, C.H.; GRANGE, J.M.; YATES, M.D.",467,question: What is the reason for the lack of notificaço?
tuberculose_protocolo_3.txt,"Butter Worth-Heinemann, Oxford, 2nd edition. 139 p, 1997. 2 EUZÉBY, J.P.",469,question: What is the name of the book that was published in 1997?
tuberculose_protocolo_3.txt,List of bacterial names with standing in nomenclature.,470,question: What is the name of the bacterial name that has standing in nomenclature?
tuberculose_protocolo_3.txt,"Jr, WINTHROP, K.; An official ATS/IDSA statement: diagnosis, treatment, and prevention of nontuberculous mycobacterial diseases.",472,"question: Who is responsible for the diagnosis, treatment, and prevention of nontuberculous mycobacterial diseases?"
tuberculose_protocolo_3.txt,"Am J Respir Crit Care Med, 175:367-416, 2007. 4.",473,question: What is the name of the journal that published in 2007?
tuberculose_protocolo_3.txt,Clinical and taxonomic status of pathogenic nonpigmented or late-pigmenting rapidly growing mycobacteria.,474,question: What is the status of mycobacteria that is not or late-pigmented?
tuberculose_protocolo_3.txt,"Clin Microbiol Rev, 15:716-46, 2002. 5 .1 Descrição As amostras clínicas enviadas ao laboratório para diagnóstico de micobactérias de- dos resultados dos exames: indicação correta da pesquisa de micobactérias, seleção do tipo de amostra mais representativa, cuidado na coleta, transporte, acondicionamento e recep- ção dessas amostras.",475,question: What is the name of the journal that describes the amostras clnicas enviada ao laboratório?
tuberculose_protocolo_3.txt,"Assim, os profissionais envolvidos nas atividades descritas devem ter o processo, incluindo aspectos de biossegurança no seu manuseio1.",476,question: Os profissionais envolvidos nas atividades descritas devem ter o processo?
tuberculose_protocolo_3.txt,"Alguns fatores podem comprometer um exame microbiológico, desde a hipótese diagnóstica mal elaborada, informações mal coletadas, incompletas ou não devida- mente interpretadas, requisição inadequada da análise laboratorial, coleta, conserva- ção e transporte inadequados, falha técnica na análise, demora na liberação do resul- tado e má interpretação dos resultados2. de amostras destinadas a análises num laboratório de microbiologia de micobactérias. 5 .2 Seleção e tipos de amostras Antes da coleta de amostra para análise no laboratório, é importante que o sítio anatômico de onde será coletada a amostra seja identificado como sendo representa- tivo do processo de doença ativa1,2.",477,question: What is a factor that can cause a problem with a microbiológico exam?
tuberculose_protocolo_3.txt,"O diagnóstico laboratorial de micobactérias pode ser realizado a partir de amos- tras provenientes de vários sítios do corpo humano e, para o diagnóstico da tubercu- lose, as amostras vão depender da forma de tuberculose que está sendo investigada, se tuberculose pulmonar ou extrapulmonar3.",478,question: What is the diagno-stico laboratorial of micobactérias?
tuberculose_protocolo_3.txt,No Quadro 1 estão descritas as amostras encaminhadas com maior freqüência para realização de baciloscopia e cultura para o diagnóstico laboratorial da tubercu- lose e micobacterioses4.,479,question: What is the encaminhadas in the Quadro 1?
tuberculose_protocolo_3.txt,"Quadro 1 Tipos de amostras utilizadas no diagnóstico laboratorial da TB escarro (espontâneo ou induzido) urina lavado brônquico líquidos: pleural, sinovial, peritoneal, pericárdico, ascítico e LCR lavado bronco-alveolar pulmonar (biópsia pulmonar) aspirado transtraqueal fragmentos de tecidos: biópsias cutâneas, de ossos e de órgãos lavado gástrico secreções purulentas de pele, nariz, ouvido, olhos, garganta Fonte: Brasil.",480,question: What is the name of the TB escarro?
tuberculose_protocolo_3.txt,Coordenação Nacional de Doenças Sexualmente Transmissíveis e Aids.,481,question: What is the name of the organization that regulates transmissive and aids?
tuberculose_protocolo_3.txt,Manual TELELAB – Tuberculose – Diagnóstico Laboratorial – Baciloscopia.,482,question: What is the name of the lab that produces Tuberculose?
tuberculose_protocolo_3.txt,"Brasília. 2001 Capítulo 5 – Amostras Clínicas A grande maioria das amostras é de origem respiratória: escarro (espontâneo ou induzido), lavado bronco-alveolar (LBA), escovado brônquico, fragmentos de tecido pulmonar, aspirado transtraqueal e lavado gástrico.",483,question: What country is lavado gástrico?
tuberculose_protocolo_3.txt,"Amostras de sítios não respiratórios são: urina, lesões, secreções, abscessos, lí- quidos cavitários (líquido céfalo-raquidiano – LCR, pleural, pericáridico, sinovial, as- cítico) e outros.",484,question: What are the symptoms of urina?
tuberculose_protocolo_3.txt,"Especial atenção deve ser dada quando há suspeita de micobactérias disseminadas, pois nesse caso as amostras serão provenientes de sítios estéreis, como sangue, aspirado de medula óssea, biópsias de gânglios linfáticos, baço e fígado.",485,question: What is the sensitivity of micobactérias?
tuberculose_protocolo_3.txt,"Nes- estéril, pois a semeadura será feita diretamente em meio de cultura, não passando pela etapa de descontaminação. 5 .3 Amostras de origem pulmonar As amostras a seguir são as mais freqüentemente solicitadas para o diagnóstico de tuberculose pulmonar5,6,7: • Escarro espontâneo – é a amostra clínica mais utilizada para o isolamento de micobactérias, principalmente para o diagnóstico da tuberculose pulmonar, por ser o material de maior riqueza bacilar e de fácil obtenção.",486,question: What is the main reason for the use of escarro espontâneo?
tuberculose_protocolo_3.txt,"Uma boa amostra de escarro é a que provém da árvore brônquica, obtida após esforço de tosse (expectoração espontânea) e não a que se obtém da faringe ou por aspiração de secreções nasais e nem tampouco a que contém somente saliva.",487,"question: A boa amostra de escarro é a que provem da árvore brônquica, obtida após esforço de tosse?"
tuberculose_protocolo_3.txt,O volume ideal é de 5 a 10 ml.,488,question: What is the ideal volume for a bottle?
tuberculose_protocolo_3.txt,"O escarro contém fragmentos de necrose (caseum), secreções bronco-pulmonares e secreções orofaríngeas, pois, embora a árvore brônquica seja estéril, a expectoração contamina-se ao passar pela parte superior do trato respiratório, assim o escarro é um produto contaminado e viscoso por conter grande quantidade de muco.",489,question: O escarro é um produto contaminado e viscoso por conter grande quantidade de muco?
tuberculose_protocolo_3.txt,"O escarro deve ser coletado em pote de plástico transparente, de boca larga e com tampa de rosca.",490,question: What is the advantage of a transparent escarro?
tuberculose_protocolo_3.txt,As recomendações para a coleta devem ser feitas pelo pessoal da Unidade de Saúde.,491,question: What do the Unidade de Sade do with regards to coletas?
tuberculose_protocolo_3.txt,"Por ser um material de maior riqueza bacilar, pode ser conservado em refrigeração (2ºC – 8ºC), por 5 a 7 dias, sem perder sua viabilidade para a cultura e suas características para a baciloscopia.",492,question: What is the main reason for a baciloscopia to be kept in the refrigerator?
tuberculose_protocolo_3.txt,"Transportar para o laboratório, ao abrigo da luz solar e acondicionar de maneira adequada para que não haja risco de derramamento (tampa bem fechada). características de: ser descartável, capacidade de 35 a 50 ml, altura mínima de 40 mm, boca larga e tampa de rosca, como mostra a Figura 1. 128 Secretaria de Vigilância em Saúde/MS Figura 1 Características do pote de coleta de escarro.",493,question: What is the purpose of the solar panel?
tuberculose_protocolo_3.txt,Fonte: CGLAB/DEVEP/SVS/MS. • Escarro induzido – Esse procedimento é recomendado e orientado pelo médico escarro.,494,question: What is the name of the fonts used in escarro induzido?
